,questions,contexts,ground_truths,answers,answer_relevancy,faithfulness,context_precision,context_recall
0,Thủ tục cấp giấy chứng nhận tên định danh có thể được thực hiện theo những cách thức nào?,"['Chi tiết thủ tục hành chính:\nMã thủ tục:\n1.005160\nSố quyết định:\n1647/QĐ-BVHTTDL\nTên thủ tục:\nThủ tục cấp giấy chứng nhận đăng ký quyền tác giả\nCấp thực hiện:\nCấp Bộ\nLoại thủ tục:\nTTHC được luật giao quy định chi tiết\nLĩnh vực:\nBản quyền tác giả\nTrình tự thực hiện:\n- Tác giả, chủ sở hữu quyền tác giả, có thể trực tiếp hoặc uỷ quyền cho tổ chức, cá nhân khác nộp hồ sơ cấp Giấy chứng nhận đăng ký quyền tác giả đến Cục Bản quyền tác giả, hoặc Điểm tiếp nhận hồ của Cục Bản quyền tác giả tại thành phố Hồ Chí Minh, Điểm tiếp nhận hồ sơ Cục Bản quyền tác giả tại thành phố Đà Nẵng hoặc qua Cổng dịch vụ công trực tuyến Bộ Văn hóa, Thể thao và Du lịch về lĩnh vực quyền tác giả, quyền liên quan (hồ sơ bản gốc (bản giấy) được gửi tới Cục Bản quyền tác giả theo cách thức trực tiếp hoặc qua dịch vụ bưu chính).\n- Tác giả, chủ sở hữu quyền tác giả là cá nhân, tổ chức Việt Nam, cá nhân nước ngoài thường trú tại Việt Nam, tổ chức nước ngoài có trụ sở, văn phòng đại diện hoặc chi nhánh tại Việt Nam nộp hồ sơ cấp Giấy chứng nhận đăng ký quyền tác giả trực tiếp hoặc thông qua đại diện hợp pháp tại Việt Nam.\n- Tác giả, chủ sở hữu quyền tác giả là cá nhân nước ngoài không thường trú tại Việt Nam, tổ chức nước ngoài không có trụ sở, văn phòng đại diện hoặc chi nhánh tại Việt Nam nộp hồ sơ cấp Giấy chứng nhận đăng ký quyền tác giả trực tiếp qua Cổng dịch vụ công trực tuyến hoặc thông qua ủy quyền cho tổ chức tư vấn, dịch vụ quyền tác giả, quyền liên quan tại Việt Nam.\nCách thức thực hiện:\n|Hình thức nộp|Thời hạn giải quyết|Phí, lệ phí|Mô tả|\n|--|--|--|-|\n|Trực tiếp|15 Ngày làm việc|Phí : 100.000 Đồng Phí cấp Giấy chứng nhận quyền tác giả: Mức thu trên áp dụng đối với các loại hình tác phẩm: a) Tác phẩm văn học, khoa học, sách giáo khoa, giáo trình và tác phẩm khác được thể hiện dưới dạng chữ viết hoặc ký tự khác (gọi chung là loại hình tác phẩm viết); b) Bài giảng, bài phát biểu và bài nói khác; c) Tác phẩm báo chí; d) Tác phẩm âm nhạc; đ) Tác phẩm nhiếp ảnh.  Phí : 300.000 Đồng Phí cấp Giấy chứng nhận quyền tác giả: Mức thu trên áp dụng đối với các loại hình tác phẩm: a) Tác phẩm kiến trúc; b) Bản họa đồ, sơ đồ, bản đồ, bản vẽ liên quan đến địa hình, công trình khoa học.  Phí : 400.000 Đồng Phí cấp Giấy chứng nhận quyền tác giả: 400.000 đồng/Giấy chứng nhận. Mức thu trên áp dụng đối với các loại hình tác phẩm: a) Tác phẩm tạo hình; b) Tác phẩm mỹ thuật ứng dụng  Phí : 500.000 Đồng Phí cấp Giấy chứng nhận quyền tác giả: Mức thu trên áp dụng đối với các loại hình tác phẩm: a) Tác phẩm điện ảnh; b) Tác phẩm sân khấu được định hình trên băng, đĩa.  Phí : 600.000 Đồng Phí cấp Giấy chứng nhận quyền tác giả đối với chương trình máy tính, sưu tập dữ liệu hoặc các chương trình chạy trên máy tính|- Rà soát, phân loại, xem xét tính hợp lệ của hồ sơ: 01 tháng kể từ ngày nhận được hồ sơ; - 15 ngày làm việc, kể từ ngày hồ sơ hợp lệ.|\n|Trực tuyến|15 Ngày làm việc|Phí : 100.000 Đồng Phí cấp Giấy chứng nhận quyền tác giả: Mức thu trên áp dụng đối với các loại hình tác phẩm: a) Tác phẩm văn học, khoa học, sách giáo khoa, giáo trình và tác phẩm khác được thể hiện dưới dạng chữ viết hoặc ký tự khác (gọi chung là loại hình tác phẩm viết); b) Bài giảng, bài phát biểu và bài nói khác; c) Tác phẩm báo chí; d) Tác phẩm âm nhạc; đ) Tác phẩm nhiếp ảnh.  Phí : 300.000 Đồng Phí cấp Giấy chứng nhận quyền tác giả: Mức thu trên áp dụng đối với các loại hình tác phẩm: a) Tác phẩm kiến trúc; b) Bản họa đồ, sơ đồ, bản đồ, bản vẽ liên quan đến địa hình, công trình khoa học  Phí : 400.000 Đồng Phí cấp Giấy chứng nhận quyền tác giả: 400.000 đồng/Giấy chứng nhận. Mức thu trên áp dụng đối với các loại hình tác phẩm: a) Tác phẩm tạo hình; b) Tác phẩm mỹ thuật ứng dụng  Phí : 500.000 Đồng Phí cấp Giấy chứng nhận quyền tác giả: Mức thu trên áp dụng đối với các loại hình tác phẩm: a) Tác phẩm điện ảnh; b) Tác phẩm sân khấu được định hình trên băng, đĩa  Phí : 600.000 Đồng Phí cấp Giấy chứng nhận quyền tác giả đối với chương trình máy tính, sưu tập dữ liệu hoặc các chương trình chạy trên máy tính|- Rà soát, phân loại, xem xét tính hợp lệ của hồ sơ: 01 tháng kể từ ngày nhận được hồ sơ; - 15 ngày làm việc, kể từ ngày hồ sơ hợp lệ.|\n|Dịch vụ bưu chính|15 Ngày làm việc|Phí : 100.000 Đồng Phí cấp Giấy chứng nhận quyền tác giả: Mức thu trên áp dụng đối với các loại hình tác phẩm: a) Tác phẩm văn học, khoa học, sách giáo khoa, giáo trình và tác phẩm khác được thể hiện dưới dạng chữ viết hoặc ký tự khác (gọi chung là loại hình tác phẩm viết); b) Bài giảng, bài phát biểu và bài nói khác; c) Tác phẩm báo chí; d) Tác phẩm âm nhạc; đ) Tác phẩm nhiếp ảnh.  Phí : 300.000 Đồng Phí cấp Giấy chứng nhận quyền tác giả: Mức thu trên áp dụng đối với các loại hình tác phẩm: a) Tác phẩm kiến trúc; b) Bản họa đồ, sơ đồ, bản đồ, bản vẽ liên quan đến địa hình, công trình khoa học.  Phí : 400.000 Đồng Phí cấp Giấy chứng nhận quyền tác giả: 400.000 đồng/Giấy chứng nhận. Mức thu trên áp dụng đối với các loại hình tác phẩm: a) Tác phẩm tạo hình; b) Tác phẩm mỹ thuật ứng dụng  Phí : 500.000 Đồng Phí cấp Giấy chứng nhận quyền tác giả: Mức thu trên áp dụng đối với các loại hình tác phẩm: a) Tác phẩm điện ảnh; b) Tác phẩm sân khấu được định hình trên băng, đĩa.  Phí : 600.000 Đồng Phí cấp Giấy chứng nhận quyền tác giả đối với chương trình máy tính, sưu tập dữ liệu hoặc các chương trình chạy trên máy tính|- Rà soát, phân loại, xem xét tính hợp lệ của hồ sơ: 01 tháng kể từ ngày nhận được hồ sơ; - 15 ngày làm việc, kể từ ngày hồ sơ hợp lệ.|\n\nThành phần hồ sơ:\n\nBao gồm\n|Tên giấy tờ|Mẫu đơn, tờ khai|Số lượng|\n|--|--|-|\n|(1) Tờ khai đăng ký quyền tác giả (Mẫu số 01, 02, 03, 04, 05, 06, 07, 08 ban hành kèm theo Thông tư số 08/2023/QĐ-BVHTT ngày 02 tháng 6 năm 2023 quy định các mẫu trong hoạt động đăng ký quyền tác giả, quyền liên quan). Tờ khai phải được làm bằng tiếng Việt có đầy đủ thông tin về người nộp hồ sơ, tác giả, chủ sở hữu quyền tác giả; thời gian hoàn thành; tóm tắt nội dung tác phẩm; tên tác giả, chủ sở hữu quyền tác giả, tác phẩm được sử dụng làm tác phẩm phái sinh nếu tác phẩm đăng ký là tác phẩm phái sinh; thời gian, địa điểm, hình thức công bố; thông tin về cấp lại, cấp đổi (nếu có), cam đoan về trách nhiệm đối với các thông tin ghi trong tờ khai. Tờ khai do chính tác giả, chủ sở hữu quyền tác giả ký tên hoặc điểm chỉ, trừ trường hợp không có khả năng về thể chất để ký tên hoặc điểm chỉ;|<a href=""https://csdl.dichvucong.gov.vn/web/jsp/download_file.jsp?ma=\'3fea5df7b849003c\'"">To khai dang ky quyen tac gia.docx</a>|Bản chính: 1Bản sao: 0|\n|(2) Hai bản sao tác phẩm đăng ký quyền tác giả (bao gồm cả bản điện tử);||Bản chính: 0Bản sao: 2|\n|(3) Văn bản ủy quyền, nếu người nộp hồ sơ là người được ủy quyền. Văn bản ủy quyền phải ghi cụ thể thông tin liên hệ của bên ủy quyền và bên nhận ủy quyền; tên tác phẩm; phạm vi ủy quyền, thời hạn ủy quyền;||Bản chính: 1Bản sao: 0|\n|(4) Tài liệu chứng minh là chủ sở hữu quyền do tự sáng tạo hoặc do giao nhiệm vụ sáng tạo, giao kết hợp đồng sáng tạo, được thừa kế, được chuyển giao quyền: - Tài liệu chứng minh nhân thân đối với cá nhân: 01 bản sao Chứng minh nhân dân hoặc Căn cước công dân hoặc Hộ chiếu; - Tài liệu chứng minh tư cách pháp lý đối với tổ chức: 01 bản sao Giấy chứng nhận đăng ký doanh nghiệp hoặc Giấy phép thành lập hoặc Quyết định thành lập; - Tài liệu chứng minh chủ sở hữu quyền do giao nhiệm vụ sáng tạo là quyết định giao nhiệm vụ hoặc xác nhận giao nhiệm vụ cho cá nhân thuộc đơn vị, tổ chức đó; - Tài liệu chứng minh chủ sở hữu quyền do giao kết hợp đồng sáng tạo là hợp đồng, thể lệ, quy chế tổ chức cuộc thi; - Tài liệu chứng minh chủ sở hữu quyền do được thừa kế là văn bản xác định quyền thừa kế có công chứng, chứng thực theo quy định của pháp luật; - Tài liệu chứng minh chủ sở hữu quyền do được chuyển giao quyền là hợp đồng chuyển nhượng, tặng cho, mua bán, góp vốn bằng văn bản có công chứng, chứng thực theo quy định của pháp luật; - Trong trường hợp tác giả không đồng thời là chủ sở hữu quyền tác giả phải có văn bản cam đoan về việc tự sáng tạo và sáng tạo theo quyết định hoặc xác nhận giao việc; hợp đồng; tham gia cuộc thi và chịu trách nhiệm trước pháp luật về nội dung cam đoan. - Tài liệu chứng minh chủ sở hữu quyền do giao nhiệm vụ sáng tạo, giao kết hợp đồng sáng tạo quy định tại khoản này phải là bản gốc hoặc bản sao có công chứng, chứng thực.||Bản chính: 1Bản sao: 0|\n|(5) Văn bản đồng ý của các đồng tác giả, nếu tác phẩm có đồng tác giả.||Bản chính: 1Bản sao: 0|\n|(6) Văn bản đồng ý của các đồng chủ sở hữu, nếu quyền tác giả thuộc sở hữu chung||Bản chính: 1Bản sao: 0|\n|(7) Trường hợp trong tác phẩm có sử dụng hình ảnh cá nhân của người khác thì phải được sự đồng ý bằng văn bản của người đó theo quy định của pháp luật. Tài liệu quy định tại các điểm 3, 4, 5, 6 và 7 trên đây phải được làm bằng tiếng Việt; trường hợp làm bằng ngôn ngữ khác thì phải được dịch ra tiếng Việt (có công chứng hoặc hợp pháp hóa lãnh sự); phải được đánh máy hoặc in bằng loại mực khó phai mờ, rõ ràng, sạch sẽ, không tẩy xóa, không sửa chữa; trường hợp phát hiện có sai sót không đáng kể thuộc về lỗi chính tả trong tài liệu đã nộp thì cá nhân, tổ chức nộp hồ sơ có thể sửa chữa các lỗi đó, nhưng tại chỗ bị sửa chữa phải có chữ ký xác nhận (và đóng dấu, nếu có) của cá nhân, tổ chức nộp hồ sơ.||Bản chính: 1Bản sao: 0|', 'Bao gồm\n|Tên giấy tờ|Mẫu đơn, tờ khai|Số lượng|\n|--|--|-|\n|* Lưu ý: Việc nộp hồ sơ đăng ký cư trú - Trường hợp nộp hồ sơ trực tiếp tại cơ quan đăng ký cư trú thì người yêu cầu đăng ký cư trú có thể nộp bản sao giấy tờ, tài liệu được chứng thực từ bản chính hoặc bản sao giấy tờ được cấp từ sổ gốc (sau đây gọi là bản sao) hoặc bản quét, bản chụp kèm theo bản chính giấy tờ, tài liệu để đối chiếu. Trường hợp người yêu cầu đăng ký cư trú nộp bản quét hoặc bản chụp kèm theo bản chính giấy tờ để đối chiếu thì người tiếp nhận có trách nhiệm kiểm tra, đối chiếu bản quét, bản chụp với bản chính và ký xác nhận, không được yêu cầu nộp bản sao giấy tờ đó. - Trường hợp thực hiện đăng ký cư trú trực tuyến, người yêu cầu đăng ký cư trú khai báo thông tin theo biểu mẫu điện tử được cung cấp sẵn, đăng tải bản quét hoặc bản chụp giấy tờ, tài liệu hợp lệ (không bắt buộc phải công chứng, chứng thực, ký số hoặc xác thực bằng hình thức khác) hoặc dẫn nguồn tài liệu từ Kho quản lý dữ liệu điện tử của tổ chức, cá nhân. Trường hợp công dân đăng tải bản quét, bản chụp giấy tờ, tài liệu mà không được ký số hoặc xác thực bằng hình thức khác thì khi cơ quan đăng ký cư trú tiến hành kiểm tra, xác minh để giải quyết thủ tục về cư trú; công dân có trách nhiệm xuất trình giấy tờ, tài liệu đã đăng tải để cơ quan đăng ký cư trú kiểm tra, đối chiếu và ghi nhận tính chính xác vào biên bản xác minh. Cơ quan đăng ký cư trú không yêu cầu công dân nộp để lưu giữ giấy tờ đó. - Bản quét hoặc bản chụp giấy tờ bằng thiết bị điện tử từ giấy tờ được cấp hợp lệ, còn giá trị sử dụng phải bảo đảm rõ nét, đầy đủ, toàn vẹn về nội dung; đã được hợp pháp hóa lãnh sự, dịch sang tiếng Việt theo quy định nếu là giấy tờ do cơ quan có thẩm quyền nước ngoài cấp trừ trường hợp được miễn hợp pháp hóa lãnh sự. - Trường hợp thông tin giấy tờ chứng minh điều kiện đăng ký cư trú đã được chia sẻ và khai thác từ cơ sở dữ liệu quốc gia, cơ sở dữ liệu chuyên ngành thì cơ quan đăng ký cư trú không được yêu cầu công dân nộp, xuất trình giấy tờ đó để giải quyết đăng ký cư trú.|         |Bản chính: 0Bản sao: 0|', 'Chi tiết thủ tục hành chính:\nMã thủ tục:\n2.002184\nSố quyết định:\n2770/QĐ-BTC\nTên thủ tục:\nThủ tục khai bổ sung hồ sơ hải quan\nCấp thực hiện:\nCấp Huyện\nLoại thủ tục:\nTTHC không được luật giao cho địa phương quy định hoặc quy định chi tiết\nLĩnh vực:\nHải quan\nTrình tự thực hiện:\n+ Bước 1: Người khai hải quan khai bổ sung các chỉ tiêu trên tờ khai hải quan.\n+ Bước 2: Cơ quan hải quan xem xét, chấp nhận nội dung khai bổ sung của người khai hải quan.\nCách thức thực hiện:\n|Hình thức nộp|Thời hạn giải quyết|Phí, lệ phí|Mô tả|\n|--|--|--|-|\n|Trực tuyến|02 Giờ||Trong thời hạn 02 giờ làm việc kể từ thời điểm tiếp nhận đủ hồ sơ khai bổ sung, công chức hải quan hoàn thành việc kiểm tra hồ sơ khai bổ sung, thời gian kiểm tra thực tế hàng hoá (nếu có) thực hiện theo quy đingh tại khoản 2 Điều 23 Luật Hải quan và thông báo kết quả kiểm tra thông qua Hệ thống, trường hợp không chấp nhận nội dung khai bổ sung thì phải nêu rõ lý do từ chối|\n\nThành phần hồ sơ:\n\nTrường hợp khai bổ sung hồ sơ hải quan sau thông quan trong trường hợp gửi thiếu hàng và hàng hóa chưa đưa hoặc đưa một phần ra khỏi khu vực giám sát hải quan\n|Tên giấy tờ|Mẫu đơn, tờ khai|Số lượng|\n|--|--|-|\n|Văn bản xác nhận gửi thiếu hàng của người gửi hàng||Bản chính: Bản sao: 1|\n|Hợp đồng và Phụ lục hợp đồng ghi nhận việc sửa đổi các thông tin về hàng hóa và giá trị hàng hóa hoặc các chứng từ khác có giá trị tương đương theo quy định của pháp luật||Bản chính: Bản sao: 1|\n|Hóa đơn thương mại ghi nhận việc sửa đổi các thông tin về hàng hóa và giá trị hàng hóa||Bản chính: Bản sao: 1|\n|Vận đơn hoặc chứng từ vận tải tương đương (trường hợp việc khai bổ sung có liên quan đến các tiêu chí số lượng container, số lượng kiện hoặc trọng lượng đối với hàng rời và hàng hóa chưa đưa ra khỏi khu vực giám sát hải quan)||Bản chính: Bản sao: 1|\n|Chứng từ thanh toán (nếu có)||Bản chính: Bản sao: 1|\n|Kết quả giám định về số lượng hàng nhập khẩu thực tế của thương nhân kinh doanh dịch vụ giám định||Bản chính: Bản sao: 1|\n\n\nTrường hợp khai bổ sung hồ sơ hải quan trong trường hợp gửi thừa hàng, nhầm hàng\n|Tên giấy tờ|Mẫu đơn, tờ khai|Số lượng|\n|--|--|-|\n|Văn bản xác nhận gửi thừa hàng, nhầm hàng của người gửi hàng||Bản chính: Bản sao: 1|\n|Hợp đồng và Phụ lục hợp đồng ghi nhận việc sửa đổi các thông tin về hàng hóa và giá trị hàng hóa hoặc các chứng từ khác có giá trị tương đương theo quy định của pháp luật||Bản chính: Bản sao: 1|\n|Hóa đơn thương mại ghi nhận việc sửa đổi các thông tin về hàng hóa và giá trị hàng hóa||Bản chính: Bản sao: 1|\n|Vận đơn hoặc chứng từ vận tải tương đương (trường hợp việc khai bổ sung có liên quan đến các tiêu chí số lượng container, số lượng kiện hoặc trọng lượng đối với hàng rời và hàng hóa chưa đưa ra khỏi khu vực giám sát hải quan)||Bản chính: Bản sao: 1|\n|Chứng từ thanh toán (nếu có)||Bản chính: Bản sao: 1|\n|Giấy phép đã điều chỉnh về số lượng đối với những hàng hóa phải có giấy phép và thực hiện khai bổ sung trong thông quan||Bản chính: 1Bản sao:|\n|Giấy chứng nhận kiểm tra chuyên ngành đã điều chỉnh về số lượng nếu trên Giấy chứng nhận kiểm tra chuyên ngành có ghi nhận số lượng||Bản chính: 1Bản sao:|\n\n\nTrường hợp khai bổ sung trong trường hợp xuất khẩu, nhập khẩu được thỏa thuận mua, bán nguyên lô, nguyên tàu và có thỏa thuận về dung sai về số lượng và cấp độ thương mại của hàng hóa\n|Tên giấy tờ|Mẫu đơn, tờ khai|Số lượng|\n|--|--|-|\n|Phiếu cân hàng của cảng (đối với hàng rời, hàng xá) hoặc Chứng từ kiểm kiện của cảng hoặc Biên bản ghi nhận tại hiện trường giám định về số lượng, trọng lượng của thương nhân kinh doanh dịch vụ giám định hoặc Kết quả giám định số lượng, chủng loại của thương nhân kinh doanh dịch vụ giám định||Bản chính: Bản sao: 1|\n|Phiếu nhập kho của người nhập khẩu đối với tờ khai hải quan nhập khẩu hoặc Phiếu xuất kho của người xuất khẩu đối với tờ khai hải quan xuất khẩu||Bản chính: Bản sao: 1|\n|Biên bản nhận hàng có đại diện người bán ký xác nhận hoặc Bảng quyết toán có xác nhận của người mua và người bán về số lượng, kết quả phân loại cấp độ thương mại của hàng hóa và số tiền thanh toán theo thực tế. Trường hợp Bảng quyết toán không có đủ xác nhận của người mua và người bán thì phải có xác nhận của người khai hải quan trên chứng từ||Bản chính: Bản sao: 1|\n|Hợp đồng mua bán hàng hóa có thể hiện nội dung thỏa thuận về việc chấp nhận sự sai lệch về số lượng, chủng loại và cách thức quyết toán số tiền thanh toán theo thực tế tương ứng và hình thức thanh toán||Bản chính: Bản sao: 1|\n|Chứng từ thanh toán (nếu có)||Bản chính: Bản sao: 1|\n|Giấy phép đã điều chỉnh về số lượng đối với những hàng hóa phải có giấy phép: 01 bản chính. Trường hợp cơ quan quản lý nhà nước chuyên ngành gửi giấy phép dưới dạng điện tử thông qua Cổng thông tin một cửa quốc gia theo quy định pháp luật về một cửa quốc gia, người khai hải quan không phải nộp chứng từ này||Bản chính: 1Bản sao:|\n\n\nBao gồm\n|Tên giấy tờ|Mẫu đơn, tờ khai|Số lượng|\n|--|--|-|\n|+ Tờ khai điện tủ theo mẫu số 01, mẫu số 02, mẫu số 04 hoặc mẫu số 05 phụ lục I Thông tư 39/2018/TT-BTC trong trường hợp khai báo điện tử. Trường hợp khai báo tờ khai giấy, văn bản đề nghị khai bổ sung theo mẫu số 03/KBS/GSQL Phụ lục V ban hành kèm theo Thông tư số 38/2015/TT-BTC ngày 25/3/2015 của Bộ trưởng Bộ Tài chính được sửa đổi, bổ sung tại Phụ lục II Thông tư số 39/2018/TT-BTC ngày 20/4/2018 của Bộ trưởng Bộ Tài chính: 02 bản chính.||Bản chính: 1Bản sao:|\n|+ Các chứng từ liên quan đến việc khai bổ sung||Bản chính: 0Bản sao: 1|\n\nĐối tượng thực hiện:\nCông dân Việt Nam, Doanh nghiệp\nCơ quan thực hiện:\nChi cục Hải quan\nCơ quan có thẩm quyền:\nKhông có thông tin\nĐịa chỉ tiếp nhận HS:\nKhông có thông tin\nCơ quan được ủy quyền:\nKhông có thông tin\nCơ quan phối hợp:\nKhông có thông tin\nKết quả thực hiện:\nChấp nhận/ Không chấp nhận cho sửa đổi, bổ sung.\nCăn cứ pháp lý:\n|Số ký hiệu|Trích yếu|Ngày ban hành|Cơ quan ban hành|\n|--|--|--|-|\n|54/2014/QH13|Luật 54/2014/QH13|23-06-2014|Bộ Tài chính|\n|27/2007/NĐ-CP|Nghị định 27/2007/NĐ-CP|23-02-2007|Chính phủ|\n|08/2015/NĐ-CP|Nghị định 08/2015/NĐ-CP|21-01-2015|Chính phủ|\n|38/2015/TT-BTC|Thông tư 38/2015/TT-BTC|25-03-2015|Bộ Tài chính|\n|51/2005/QH11|Luật 51/2005/QH11|29-11-2005|Quốc Hội|\n|59/2018/NĐ-CP|Nghị định 59/2018/NĐ-CP|20-04-2018||\n|39/2018/TT-BTC|Thông tư 39/2018/TT-BTC|20-04-2018||']","|Hình thức nộp|Thời hạn giải quyết|Phí, lệ phí|Mô tả|
|Trực tiếp|01 Ngày làm việc|Lệ phí: 200,000 Đồng|01 ngày kể từ ngày nhận đủ hồ sơ theo quy định (Theo quy định của Bộ Tài chính)|
|Trực tuyến|01 Ngày làm việc|Lệ phí: 200,000 Đồng|01 ngày kể từ ngày nhận đủ hồ sơ theo quy định (Theo quy định của Bộ Tài chính)|
|Dịch vụ bưu chính|01 Ngày làm việc|Lệ phí: 200,000 Đồng|01 ngày kể từ ngày nhận đủ hồ sơ theo quy định (Theo quy định của Bộ Tài chính)|",Tôi không biết trả lời câu hỏi này.,0.0,0.0,0.0,0.0
1,"Đối với thủ tục nộp đơn khởi kiện, có thể thực hiện trực tuyến hay không?","['Chi tiết thủ tục hành chính:\nMã thủ tục:\n3.000163\nSố quyết định:\n01/QĐCB\nTên thủ tục:\nNộp đơn khởi kiện, tài liệu, chứng cứ và nhận các văn bản, thông báo tố tụng\nCấp thực hiện:\nCấp Bộ, Cấp Tỉnh, Cấp Huyện\nLoại thủ tục:\nLoại khác\nLĩnh vực:\nTòa án\nTrình tự thực hiện:\nBước 1. Cá nhân, tổ chức nộp đơn khởi kiện, tài liệu chứng cứ và nhận các văn bản, thông báo tố tụng. \nTrường hợp thực hiện trực tuyến, Cá nhân, tổ chức đăng nhập Cổng Dịch vụ công Quốc gia/Cổng Dịch vụ công của Tòa án nhân dân, lựa chọn và tiến hành thực hiện nộp trực tuyến hoặc đăng ký nhận thông báo, văn bản tố tụng.\nBước 2. Cơ quan Tòa án thông báo kết quả giải quyết đơn khởi kiện. Nếu đơn đủ điều kiện thụ lý thì cơ quan Tòa án ra thông báo nộp tiền tạm ứng án phí đối với đơn khởi kiện. Căn cứ thông báo, cá nhân, tổ chức đến Cơ quan Thi hành án nộp tiền tạm ứng án phí, lệ phí tòa án.\nTrường hợp thực hiện trực tuyến, căn cứ trên thông báo tống đạt hoặc tin nhắn SMS (nếu có) về việc Tòa án gửi thông báo nộp tiền tạm ứng án phí, cá nhân, tổ chức chọn mục thanh toán trực tuyến án phí và thực hiện thanh toán trực tuyến.\nBước 3. Cá nhân, tổ chức nộp biên lai thu tiền tạm ứng đến Cơ quan Tòa án. Cơ quan Tòa án tiến hành thụ lý vụ án.\nTrường hợp thực hiện trực tuyến, hệ thống thanh toán trực tuyến sẽ tự động chuyển biên lai thu tạm ứng án phí, lệ phí Tòa án đến Cơ quan Tòa án để thụ lý vụ án và có thông báo đến cá nhân, tổ chức.\nBước 4. Nhận tài liệu, thông báo văn bản tố tụng trực tuyến trên hệ thống hoặc theo địa chỉ đã đăng ký.\nCách thức thực hiện:\n|Hình thức nộp|Thời hạn giải quyết|Phí, lệ phí|Mô tả|\n|--|--|--|-|\n|Trực tiếp|Theo quy định của Bộ luật Tố tụng dân sự, Bộ Luật tố tụng hành chính|||\n|Trực tuyến|Theo quy định của Bộ luật Tố tụng dân sự, Bộ Luật tố tụng hành chính|||\n\nThành phần hồ sơ:\n\nGiấy tờ phải nộp\n|Tên giấy tờ|Mẫu đơn, tờ khai|Số lượng|\n|--|--|-|\n|Đơn khởi kiện||Bản chính: 1Bản sao:|\n|Tài liệu, chứng cứ kèm theo (nếu có)||Bản chính: Bản sao: 1|\n\n\nBao gồm\n|Tên giấy tờ|Mẫu đơn, tờ khai|Số lượng|\n|--|--|-|\n|Tài liệu, chứng cứ kèm theo (nếu có)||Bản chính: 1Bản sao: 1|\n\nĐối tượng thực hiện:\nCông dân Việt Nam, Doanh nghiệp, Tổ chức nước ngoài\nCơ quan thực hiện:\nTòa án nhân dân tối cao, Tòa án nhân dân cấp cao, Tòa án nhân dân tỉnh, thành phố trực thuộc trung ương, Tòa án nhân dân cấp huyện, quận, thị xã, thành phố thuộc tỉnh và tương đương\nCơ quan có thẩm quyền:\nKhông có thông tin\nĐịa chỉ tiếp nhận HS:\nKhông có thông tin\nCơ quan được ủy quyền:\nKhông có thông tin\nCơ quan phối hợp:\nKhông có thông tin\nKết quả thực hiện:\nĐơn khởi kiện được thụ lý\nCăn cứ pháp lý:\n|Số ký hiệu|Trích yếu|Ngày ban hành|Cơ quan ban hành|\n|--|--|--|-|\n|21/2014/L-CTN|Lệnh 21/2014/L-CTN|04-12-2014||\n|02/2014/TTLT-TANDTC-VKSNDTC-BTP-BTC|Thông tư liên tịch 02/2014/TTLT-TANDTC-VKSNDTC-BTP-BTC|28-03-2014||\n|110/2015/QH13|Nghị quyết 110/2015/QH13|27-11-2015||\n|56/2010/QH12|Nghị quyết 56/2010/QH12|24-11-2010||\n\nYêu cầu, điều kiện thực hiện:\nKhông có thông tin\nTừ khóa:\nKhông có thông tin\nMô tả:\nKhông có thông tin', 'Chi tiết thủ tục hành chính:\nMã thủ tục:\n2.002029\nSố quyết định:\n885/QĐ-BKHĐT\nTên thủ tục:\nThông báo tạm ngừng kinh doanh, tiếp tục kinh doanh trước thời hạn đã thông báo (doanh nghiệp, chi nhánh, văn phòng đại diện, địa điểm kinh doanh)\nCấp thực hiện:\nCấp Bộ, Cấp Tỉnh\nLoại thủ tục:\nTTHC không được luật giao cho địa phương quy định hoặc quy định chi tiết\nLĩnh vực:\nThành lập và hoạt động của doanh nghiệp\nTrình tự thực hiện:\nTrường hợp đăng ký trực tiếp hoặc qua dịch vụ bưu chính\n- Trường hợp doanh nghiệp, chi nhánh, văn phòng đại diện, địa điểm kinh doanh tạm ngừng kinh doanh hoặc tiếp tục kinh doanh trước thời hạn đã thông báo, doanh nghiệp gửi thông báo đến Phòng Đăng ký kinh doanh nơi doanh nghiệp, chi nhánh, văn phòng đại diện, địa điểm kinh doanh đặt trụ sở chậm nhất 03 ngày làm việc trước ngày tạm ngừng kinh doanh hoặc tiếp tục kinh doanh trước thời hạn đã thông báo. Trường hợp doanh nghiệp, chi nhánh, văn phòng đại diện, địa điểm kinh doanh có nhu cầu tiếp tục tạm ngừng kinh doanh sau khi hết thời hạn đã thông báo thì phải thông báo cho Phòng Đăng ký kinh doanh chậm nhất 03 ngày làm việc trước ngày tiếp tục tạm ngừng kinh doanh.\n- Sau khi nhận hồ sơ đăng ký doanh nghiệp, Phòng Đăng ký kinh doanh trao Giấy biên nhận, kiểm tra tính hợp lệ của hồ sơ và cấp giấy xác nhận về việc doanh nghiệp, chi nhánh, văn phòng đại diện, địa điểm kinh doanh đăng ký tạm ngừng kinh doanh, giấy xác nhận về việc doanh nghiệp, chi nhánh, văn phòng đại diện, địa điểm kinh doanh đăng ký tiếp tục kinh doanh trước thời hạn đã thông báo trong thời hạn 03 ngày làm việc kể từ ngày nhận được hồ sơ hợp lệ.\n- Doanh nghiệp có thể đề nghị đăng ký tiếp tục kinh doanh trước thời hạn đã thông báo đồng thời với đăng ký tiếp tục kinh doanh trước thời hạn đã thông báo đối với chi nhánh, văn phòng đại diện, địa điểm kinh doanh của doanh nghiệp.\nTrường hợp đăng ký qua mạng điện tử sử dụng chữ ký số công cộng\n- Người nộp hồ sơ kê khai thông tin, tải văn bản điện tử, ký xác thực hồ sơ đăng ký doanh nghiệp qua mạng thông tin điện tử và thanh toán phí, lệ phí đăng ký doanh nghiệp theo quy trình trên cổng thông tin quốc gia về đăng ký doanh nghiệp (https://dangkykinhdoanh.gov.vn).\n- Sau khi hoàn thành việc gửi hồ sơ đăng ký doanh nghiệp, người nộp hồ sơ sẽ nhận được Giấy biên nhận hồ sơ đăng ký doanh nghiệp qua mạng thông tin điện tử.\n- Trường hợp hồ sơ đủ điều kiện cấp đăng ký doanh nghiệp, Phòng Đăng ký kinh doanh thực hiện cấp đăng ký doanh nghiệp và thông báo cho doanh nghiệp về việc cấp đăng ký doanh nghiệp. Trường hợp hồ sơ chưa đủ điều kiện cấp đăng ký doanh nghiệp, Phòng Đăng ký kinh doanh gửi thông báo qua mạng thông tin điện tử cho doanh nghiệp để yêu cầu sửa đổi, bổ sung hồ sơ.\nTrường hợp đăng ký qua mạng điện tử sử dụng Tài khoản đăng ký kinh doanh\n- Người nộp hồ sơ sử dụng Tài khoản đăng ký kinh doanh để kê khai thông tin, tải văn bản điện tử và ký xác thực hồ sơ đăng ký doanh nghiệp qua mạng thông tin điện tử và thanh toán phí, lệ phí đăng ký doanh nghiệp theo quy trình trên cổng thông tin quốc gia về đăng ký doanh nghiệp (https://dangkykinhdoanh.gov.vn) . Trường hợp ủy quyền thực hiện thủ tục đăng ký doanh nghiệp qua mạng thông tin điện tử sử dụng Tài khoản đăng ký kinh doanh, văn bản ủy quyền phải có thông tin liên hệ của người ủy quyền để xác thực việc nộp hồ sơ đăng ký doanh nghiệp qua mạng thông tin điện tử.\n- Sau khi hoàn thành việc gửi hồ sơ đăng ký, người nộp hồ sơ sẽ nhận được Giấy biên nhận hồ sơ đăng ký doanh nghiệp qua mạng thông tin điện tử.\n- Phòng Đăng ký kinh doanh cấp đăng ký doanh nghiệp cho doanh nghiệp trong trường hợp hồ sơ đủ điều kiện và thông báo cho doanh nghiệp về việc cấp đăng ký doanh nghiệp. Trường hợp hồ sơ chưa đủ điều kiện, Phòng Đăng ký kinh doanh gửi thông báo qua mạng thông tin điện tử cho doanh nghiệp để yêu cầu sửa đổi, bổ sung hồ sơ.\nCách thức thực hiện:\n|Hình thức nộp|Thời hạn giải quyết|Phí, lệ phí|Mô tả|\n|--|--|--|-|\n|Trực tiếp|- Sau khi nhận hồ sơ đăng ký doanh nghiệp, Phòng Đăng ký kinh doanh trao Giấy biên nhận, kiểm tra tính hợp lệ của hồ sơ và cấp giấy xác nhận về việc doanh nghiệp, chi nhánh, văn phòng đại diện, địa điểm kinh doanh đăng ký tạm ngừng kinh doanh, giấy xác nhận về việc doanh nghiệp, chi nhánh, văn phòng đại diện, địa điểm kinh doanh đăng ký tiếp tục kinh doanh trước thời hạn đã thông báo trong thời hạn 03 ngày làm việc kể từ ngày nhận được hồ sơ hợp lệ.|Lệ phí : 0 Đồng - Tiếp tục kinh doanh trước thời hạn đã thông báo: Không được quy định tại Biểu phí, lệ phí đăng ký doanh nghiệp ban hành kèm theo Thông tư số 47/2019/TT-BTC. - Tạm ngừng kinh doanh được miễn lệ phí đăng ký doanh nghiệp (Thông tư số 47/2019/TT-BTC).|- Đăng ký doanh nghiệp trực tiếp tại Cơ quan đăng ký kinh doanh - Người nộp hồ sơ đăng ký doanh nghiệp nộp lệ phí đăng ký doanh nghiệp tại thời điểm nộp hồ sơ đăng ký doanh nghiệp. Lệ phí đăng ký doanh nghiệp có thể được nộp trực tiếp tại Phòng Đăng ký kinh doanh hoặc chuyển vào tài khoản của Phòng Đăng ký kinh doanh hoặc sử dụng dịch vụ thanh toán điện tử. Lệ phí đăng ký doanh nghiệp không được hoàn trả cho doanh nghiệp trong trường hợp doanh nghiệp không được cấp đăng ký doanh nghiệp.|\n|Trực tuyến|- Sau khi nhận hồ sơ đăng ký doanh nghiệp, Phòng Đăng ký kinh doanh trao Giấy biên nhận, kiểm tra tính hợp lệ của hồ sơ và cấp giấy xác nhận về việc doanh nghiệp, chi nhánh, văn phòng đại diện, địa điểm kinh doanh đăng ký tạm ngừng kinh doanh, giấy xác nhận về việc doanh nghiệp, chi nhánh, văn phòng đại diện, địa điểm kinh doanh đăng ký tiếp tục kinh doanh trước thời hạn đã thông báo trong thời hạn 03 ngày làm việc kể từ ngày nhận được hồ sơ hợp lệ.|Lệ phí : 0 Đồng - Miễn lệ phí (Thông tư số 47/2019/TT-BTC);|- Đăng ký doanh nghiệp qua mạng thông tin điện tử|\n|Dịch vụ bưu chính|- Sau khi nhận hồ sơ đăng ký doanh nghiệp, Phòng Đăng ký kinh doanh trao Giấy biên nhận, kiểm tra tính hợp lệ của hồ sơ và cấp giấy xác nhận về việc doanh nghiệp, chi nhánh, văn phòng đại diện, địa điểm kinh doanh đăng ký tạm ngừng kinh doanh, giấy xác nhận về việc doanh nghiệp, chi nhánh, văn phòng đại diện, địa điểm kinh doanh đăng ký tiếp tục kinh doanh trước thời hạn đã thông báo trong thời hạn 03 ngày làm việc kể từ ngày nhận được hồ sơ hợp lệ.|Lệ phí : 0 Đồng - Tiếp tục kinh doanh trước thời hạn đã thông báo: Không được quy định tại Biểu phí, lệ phí đăng ký doanh nghiệp ban hành kèm theo Thông tư số 47/2019/TT-BTC. - Tạm ngừng kinh doanh được miễn lệ phí đăng ký doanh nghiệp (Thông tư số 47/2019/TT-BTC).|- Đăng ký doanh nghiệp qua dịch vụ bưu chính - Người nộp hồ sơ đăng ký doanh nghiệp nộp lệ phí đăng ký doanh nghiệp tại thời điểm nộp hồ sơ đăng ký doanh nghiệp. Lệ phí đăng ký doanh nghiệp có thể được nộp trực tiếp tại Phòng Đăng ký kinh doanh hoặc chuyển vào tài khoản của Phòng Đăng ký kinh doanh hoặc sử dụng dịch vụ thanh toán điện tử. Lệ phí đăng ký doanh nghiệp không được hoàn trả cho doanh nghiệp trong trường hợp doanh nghiệp không được cấp đăng ký doanh nghiệp.|\n\nThành phần hồ sơ:\n\nNgười có thẩm quyền ký văn bản đề nghị đăng ký doanh nghiệp có thể ủy quyền cho tổ chức, cá nhân khác thực hiện thủ tục đăng ký doanh nghiệp theo quy định sau đây: - Trường hợp ủy quyền cho cá nhân thực hiện thủ tục đăng ký doanh nghiệp, kèm theo hồ sơ đăng ký doanh nghiệp phải có\n|Tên giấy tờ|Mẫu đơn, tờ khai|Số lượng|\n|--|--|-|\n|Văn bản ủy quyền cho cá nhân thực hiện thủ tục liên quan đến đăng ký doanh nghiệp. Văn bản ủy quyền này không bắt buộc phải công chứng, chứng thực||Bản chính: 1Bản sao: 0|\n|Bản sao giấy tờ pháp lý của cá nhân được ủy quyền||Bản chính: 0Bản sao: 1|\n\n\nTrường hợp ủy quyền cho tổ chức hoặc đơn vị cung cấp dịch vụ bưu chính không phải là bưu chính công ích thực hiện thủ tục đăng ký doanh nghiệp, kèm theo hồ sơ đăng ký doanh nghiệp phải có\n|Tên giấy tờ|Mẫu đơn, tờ khai|Số lượng|\n|--|--|-|\n|Bản sao hợp đồng cung cấp dịch vụ với tổ chức làm dịch vụ thực hiện thủ tục liên quan đến đăng ký doanh nghiệp||Bản chính: 0Bản sao: 1|\n|Giấy giới thiệu của tổ chức đó cho cá nhân trực tiếp thực hiện thủ tục liên quan đến đăng ký doanh nghiệp||Bản chính: 1Bản sao: 0|\n|Bản sao giấy tờ pháp lý của cá nhân người được giới thiệu||Bản chính: 0Bản sao: 1|\n\n\nTrường hợp ủy quyền cho đơn vị cung cấp dịch vụ bưu chính công ích thực hiện thủ tục đăng ký doanh nghiệp thì khi thực hiện thủ tục đăng ký doanh nghiệp, nhân viên bưu chính phải nộp\n|Tên giấy tờ|Mẫu đơn, tờ khai|Số lượng|\n|--|--|-|\n|Bản sao phiếu gửi hồ sơ theo mẫu do doanh nghiệp cung ứng dịch vụ bưu chính công ích phát hành có chữ ký xác nhận của nhân viên bưu chính và người có thẩm quyền ký văn bản đề nghị đăng ký doanh nghiệp||Bản chính: 0Bản sao: 1|\n\n\nBao gồm\n|Tên giấy tờ|Mẫu đơn, tờ khai|Số lượng|\n|--|--|-|\n|(i) Thông báo về việc tạm ngừng kinh doanh hoặc tiếp tục kinh doanh trước thời hạn đã thông báo của doanh nghiệp, chi nhánh, văn phòng đại diện, địa điểm kinh doanh;|<a href=""https://csdl.dichvucong.gov.vn/web/jsp/download_file.jsp?ma=\'3fd559796f8e2be2\'"">Phụ lục II-19.docx</a>|Bản chính: 1Bản sao: 0|\n|(ii) Trường hợp doanh nghiệp tạm ngừng kinh doanh, kèm theo Thông báo phải có nghị quyết, quyết định và bản sao biên bản họp của Hội đồng thành viên đối với công ty trách nhiệm hữu hạn hai thành viên trở lên, công ty hợp danh, của Hội đồng quản trị đối với công ty cổ phần; nghị quyết, quyết định của chủ sở hữu công ty đối với công ty trách nhiệm hữu hạn một thành viên về việc tạm ngừng kinh doanh.||Bản chính: 1Bản sao: 0|', 'Chi tiết thủ tục hành chính:\nMã thủ tục:\n2.001610\nSố quyết định:\n885/QĐ-BKHĐT\nTên thủ tục:\nĐăng ký thành lập doanh nghiệp tư nhân\nCấp thực hiện:\nCấp Bộ, Cấp Tỉnh\nLoại thủ tục:\nTTHC không được luật giao cho địa phương quy định hoặc quy định chi tiết\nLĩnh vực:\nThành lập và hoạt động của doanh nghiệp\nTrình tự thực hiện:\n+ Trường hợp đăng ký trực tiếp hoặc qua dịch vụ bưu chính:\n- Người nộp hồ sơ đăng ký doanh nghiệp theo quy định tại Nghị định số 01/2021/NĐ-CP nộp hồ sơ tại Phòng Đăng ký kinh doanh nơi doanh nghiệp đặt trụ sở chính.\n- Sau khi tiếp nhận hồ sơ đăng ký doanh nghiệp, Phòng Đăng ký kinh doanh trao Giấy biên nhận về việc nhận hồ sơ cho người nộp hồ sơ. Phòng Đăng ký kinh doanh cấp Giấy chứng nhận đăng ký doanh nghiệp trong thời hạn 03 ngày làm việc kể từ ngày nhận được hồ sơ hợp lệ.\n- Trường hợp hồ sơ chưa hợp lệ hoặc tên doanh nghiệp yêu cầu đăng ký không đúng theo quy định, Phòng Đăng ký kinh doanh sẽ thông báo bằng văn bản nội dung cần sửa đổi, bổ sung cho người thành lập doanh nghiệp hoặc doanh nghiệp trong thời hạn 03 ngày làm việc kể từ ngày tiếp nhận hồ sơ.\n+ Trường hợp đăng ký qua mạng điện tử sử dụng chữ ký số công cộng:\n- Người nộp hồ sơ kê khai thông tin, tải văn bản điện tử, ký xác thực hồ sơ đăng ký doanh nghiệp qua mạng thông tin điện tử và thanh toán phí, lệ phí đăng ký doanh nghiệp theo quy trình trên cổng thông tin quốc gia về đăng ký doanh nghiệp (https://dangkykinhdoanh.gov.vn).\n- Sau khi hoàn thành việc gửi hồ sơ đăng ký doanh nghiệp, người nộp hồ sơ sẽ nhận được Giấy biên nhận hồ sơ đăng ký doanh nghiệp qua mạng thông tin điện tử.\n- Trường hợp hồ sơ đủ điều kiện cấp đăng ký doanh nghiệp, Phòng Đăng ký kinh doanh thực hiện cấp đăng ký doanh nghiệp và thông báo cho doanh nghiệp về việc cấp đăng ký doanh nghiệp. Trường hợp hồ sơ chưa đủ điều kiện cấp đăng ký doanh nghiệp, Phòng Đăng ký kinh doanh gửi thông báo qua mạng thông tin điện tử cho doanh nghiệp để yêu cầu sửa đổi, bổ sung hồ sơ.\n+ Trường hợp đăng ký qua mạng điện tử sử dụng Tài khoản đăng ký kinh doanh:\n- Người nộp hồ sơ sử dụng Tài khoản đăng ký kinh doanh để kê khai thông tin, tải văn bản điện tử và ký xác thực hồ sơ đăng ký doanh nghiệp qua mạng thông tin điện tử và thanh toán phí, lệ phí đăng ký doanh nghiệp theo quy trình trên cổng thông tin quốc gia về đăng ký doanh nghiệp (https://dangkykinhdoanh.gov.vn) . Trường hợp ủy quyền thực hiện thủ tục đăng ký doanh nghiệp qua mạng thông tin điện tử sử dụng Tài khoản đăng ký kinh doanh, văn bản ủy quyền phải có thông tin liên hệ của người ủy quyền để xác thực việc nộp hồ sơ đăng ký doanh nghiệp qua mạng thông tin điện tử.\n- Sau khi hoàn thành việc gửi hồ sơ đăng ký, người nộp hồ sơ sẽ nhận được Giấy biên nhận hồ sơ đăng ký doanh nghiệp qua mạng thông tin điện tử.\n- Phòng Đăng ký kinh doanh cấp đăng ký doanh nghiệp cho doanh nghiệp trong trường hợp hồ sơ đủ điều kiện và thông báo cho doanh nghiệp về việc cấp đăng ký doanh nghiệp. Trường hợp hồ sơ chưa đủ điều kiện, Phòng Đăng ký kinh doanh gửi thông báo qua mạng thông tin điện tử cho doanh nghiệp để yêu cầu sửa đổi, bổ sung hồ sơ.\n+ Công bố nội dung đăng ký doanh nghiệp\n- Việc đề nghị công bố nội dung đăng ký doanh nghiệp được thực hiện tại thời điểm doanh nghiệp nộp hồ sơ đăng ký doanh nghiệp. Nội dung công bố bao gồm các nội dung Giấy chứng nhận đăng ký doanh nghiệp và thông tin về ngành, nghề kinh doanh.\nCách thức thực hiện:\n|Hình thức nộp|Thời hạn giải quyết|Phí, lệ phí|Mô tả|\n|--|--|--|-|\n|Trực tiếp|03 Ngày làm việc|Phí : 100000 Đồng Phí công bố nội dung đăng ký doanh nghiệp: 100.000 đồng/lần (Thông tư số 47/2019/TT-BTC)  Lệ phí : 50000 Đồng Lệ phí đăng ký doanh nghiệp: 50.000 đồng/lần (Thông tư số 47/2019/TT-BTC)|- Đăng ký doanh nghiệp trực tiếp tại Cơ quan đăng ký kinh doanh - Người nộp hồ sơ đăng ký doanh nghiệp nộp phí công bố nội dung đăng ký doanh nghiệp, lệ phí đăng ký doanh nghiệp tại thời điểm nộp hồ sơ đăng ký doanh nghiệp. Phí, lệ phí đăng ký doanh nghiệp có thể được nộp trực tiếp tại Phòng Đăng ký kinh doanh hoặc chuyển vào tài khoản của Phòng Đăng ký kinh doanh hoặc sử dụng dịch vụ thanh toán điện tử. Lệ phí đăng ký doanh nghiệp không được hoàn trả cho doanh nghiệp trong trường hợp doanh nghiệp không được cấp đăng ký doanh nghiệp. Trường hợp doanh nghiệp không được cấp đăng ký doanh nghiệp, doanh nghiệp sẽ được hoàn trả phí công bố nội dung đăng ký doanh nghiệp.|\n|Trực tuyến|03 Ngày làm việc|Phí : 100000 Đồng Phí công bố nội dung đăng ký doanh nghiệp: 100.000 đồng/lần (Thông tư số 47/2019/TT-BTC)  Lệ phí : 0 Đồng Lệ phí đăng ký doanh nghiệp (Thông tư số 47/2019/TT-BTC)|- Đăng ký doanh nghiệp qua mạng thông tin điện tử - Người nộp hồ sơ đăng ký doanh nghiệp nộp phí công bố nội dung đăng ký doanh nghiệp tại thời điểm nộp hồ sơ đăng ký doanh nghiệp. Phí công bố nội dung đăng ký doanh nghiệp có thể được nộp trực tiếp tại Phòng Đăng ký kinh doanh hoặc chuyển vào tài khoản của Phòng Đăng ký kinh doanh hoặc sử dụng dịch vụ thanh toán điện tử. Trường hợp doanh nghiệp không được cấp đăng ký doanh nghiệp, doanh nghiệp sẽ được hoàn trả phí công bố nội dung đăng ký doanh nghiệp.|\n|Dịch vụ bưu chính|03 Ngày làm việc|Phí : 100000 Đồng Phí công bố nội dung đăng ký doanh nghiệp: 100.000 đồng/lần (Thông tư số 47/2019/TT-BTC)  Lệ phí : 50000 Đồng Lệ phí đăng ký doanh nghiệp: 50.000 đồng/lần (Thông tư số 47/2019/TT-BTC)|- Đăng ký doanh nghiệp qua dịch vụ bưu chính - Người nộp hồ sơ đăng ký doanh nghiệp nộp phí công bố nội dung đăng ký doanh nghiệp, lệ phí đăng ký doanh nghiệp tại thời điểm nộp hồ sơ đăng ký doanh nghiệp. Phí, lệ phí đăng ký doanh nghiệp có thể được nộp trực tiếp tại Phòng Đăng ký kinh doanh hoặc chuyển vào tài khoản của Phòng Đăng ký kinh doanh hoặc sử dụng dịch vụ thanh toán điện tử. Lệ phí đăng ký doanh nghiệp không được hoàn trả cho doanh nghiệp trong trường hợp doanh nghiệp không được cấp đăng ký doanh nghiệp. Trường hợp doanh nghiệp không được cấp đăng ký doanh nghiệp, doanh nghiệp sẽ được hoàn trả phí công bố nội dung đăng ký doanh nghiệp.|\n\nThành phần hồ sơ:\n\nTrường hợp đăng ký doanh nghiệp xã hội\n|Tên giấy tờ|Mẫu đơn, tờ khai|Số lượng|\n|--|--|-|\n|Giấy đề nghị đăng ký doanh nghiệp|<a href=""https://csdl.dichvucong.gov.vn/web/jsp/download_file.jsp?ma=\'3fe10b148c48e570\'"">Phụ lục I-1.docx</a>|Bản chính: 1Bản sao: 0|\n|Bản sao giấy tờ pháp lý của cá nhân đối với chủ doanh nghiệp tư nhân||Bản chính: 0Bản sao: 1|\n|Cam kết thực hiện mục tiêu xã hội, môi trường của chủ doanh nghiệp tư nhân (phải có chữ ký của chủ doanh nghiệp tư nhân)|<a href=""https://csdl.dichvucong.gov.vn/web/jsp/download_file.jsp?ma=\'3fd5ce26045967dc\'"">Phụ lục II-26.docx</a>|Bản chính: 1Bản sao: 0|\n\n\nTrường hợp đăng ký thành lập doanh nghiệp trên cơ sở chuyển đổi từ hộ kinh doanh\n|Tên giấy tờ|Mẫu đơn, tờ khai|Số lượng|\n|--|--|-|\n|Giấy đề nghị đăng ký doanh nghiệp|<a href=""https://csdl.dichvucong.gov.vn/web/jsp/download_file.jsp?ma=\'3fe670b0f2727150\'"">Phụ lục I-1.docx</a>|Bản chính: 1Bản sao: 0|\n|Bản sao giấy tờ pháp lý của cá nhân đối với chủ doanh nghiệp tư nhân||Bản chính: 0Bản sao: 1|\n|Bản chính Giấy chứng nhận đăng ký hộ kinh doanh||Bản chính: 1Bản sao: 0|\n|Bản sao Giấy chứng nhận đăng ký thuế||Bản chính: 0Bản sao: 1|\n\n\nTrường hợp đăng ký thành lập doanh nghiệp xã hội trên cơ sở chuyển đổi từ cơ sở bảo trợ xã hội, quỹ xã hội, quỹ từ thiện\n|Tên giấy tờ|Mẫu đơn, tờ khai|Số lượng|\n|--|--|-|\n|Giấy đề nghị đăng ký doanh nghiệp|<a href=""https://csdl.dichvucong.gov.vn/web/jsp/download_file.jsp?ma=\'3fe15e610dcff6af\'"">Phụ lục I-1.docx</a>|Bản chính: 1Bản sao: 0|\n|Bản sao giấy tờ pháp lý của cá nhân đối với chủ doanh nghiệp tư nhân||Bản chính: 0Bản sao: 1|\n|Cam kết thực hiện mục tiêu xã hội, môi trường của chủ doanh nghiệp tư nhân (phải có chữ ký của chủ doanh nghiệp tư nhân)|<a href=""https://csdl.dichvucong.gov.vn/web/jsp/download_file.jsp?ma=\'3fea95765e6f8927\'"">Phụ lục II-26.docx</a>|Bản chính: 1Bản sao: 0|\n|Quyết định cho phép chuyển đổi thành doanh nghiệp xã hội bằng văn bản của cơ quan có thẩm quyền đã cấp giấy phép thành lập cơ sở bảo trợ xã hội, quỹ xã hội, quỹ từ thiện||Bản chính: 1Bản sao: 0|\n|Giấy chứng nhận đăng ký thành lập đối với cơ sở bảo trợ xã hội, giấy phép thành lập và công nhận điều lệ quỹ đối với quỹ xã hội, quỹ từ thiện||Bản chính: 1Bản sao: 0|\n|Bản sao Giấy chứng nhận đăng ký thuế||Bản chính: 0Bản sao: 1|\n|Văn bản của Cơ quan đăng ký đầu tư chấp thuận về việc góp vốn, mua cổ phần, mua phần vốn góp của nhà đầu tư nước ngoài, tổ chức kinh tế có vốn đầu tư nước ngoài đối với trường hợp phải thực hiện thủ tục đăng ký góp vốn, mua cổ phần, mua phần vốn góp theo quy định của Luật Đầu tư||Bản chính: 1Bản sao: 0|\n\n\nTrường hợp ủy quyền cho cá nhân thực hiện thủ tục đăng ký doanh nghiệp, kèm theo hồ sơ đăng ký doanh nghiệp phải có\n|Tên giấy tờ|Mẫu đơn, tờ khai|Số lượng|\n|--|--|-|\n|Văn bản ủy quyền cho cá nhân thực hiện thủ tục liên quan đến đăng ký doanh nghiệp. Văn bản ủy quyền này không bắt buộc phải công chứng, chứng thực||Bản chính: 1Bản sao: 0|\n|Bản sao giấy tờ pháp lý của cá nhân được ủy quyền||Bản chính: 0Bản sao: 1|\n\n\nTrường hợp ủy quyền cho tổ chức hoặc đơn vị cung cấp dịch vụ bưu chính không phải là bưu chính công ích thực hiện thủ tục đăng ký doanh nghiệp, kèm theo hồ sơ đăng ký doanh nghiệp phải có\n|Tên giấy tờ|Mẫu đơn, tờ khai|Số lượng|\n|--|--|-|\n|Bản sao hợp đồng cung cấp dịch vụ với tổ chức làm dịch vụ thực hiện thủ tục liên quan đến đăng ký doanh nghiệp||Bản chính: 0Bản sao: 1|\n|Giấy giới thiệu của tổ chức đó cho cá nhân trực tiếp thực hiện thủ tục liên quan đến đăng ký doanh nghiệp||Bản chính: 1Bản sao: 0|\n|Bản sao giấy tờ pháp lý của cá nhân người được giới thiệu||Bản chính: 0Bản sao: 1|']","Có thể nộp trực tuyến theo quy định của Bộ luật Tố tụng dân sự, Bộ Luật tố tụng hành chính.","| Hình thức nộp | Thời hạn giải quyết | Phí, lệ phí | Mô tả |
|---|---|---|---|
| Trực tiếp | Theo quy định của Bộ luật Tố tụng dân sự, Bộ Luật tố tụng hành chính | | |
| Trực tuyến | Theo quy định của Bộ luật Tố tụng dân sự, Bộ Luật tố tụng hành chính | | |",1.0,0.0,0.0,0.0
2,Thủ tục gia hạn hợp đồng mua bán điện có thể được thực hiện bằng hình thức nào?,"['Chi tiết thủ tục hành chính:\nMã thủ tục:\n3.000101\nSố quyết định:\n505\nTên thủ tục:\nGia hạn hợp đồng mua bán điện\nCấp thực hiện:\nCấp Bộ, Cơ quan khác\nLoại thủ tục:\nLoại khác\nLĩnh vực:\nDịch vụ trong quá trình thực hiện HĐMBĐ\nTrình tự thực hiện:\nTiếp nhận yêu cầu\nKý Phụ lục Hợp đồng mua bán điện hoặc Biên bản chấm dứt HĐMBĐ cũ và Hợp đồng mua bán điện mới\nCách thức thực hiện:\n|Hình thức nộp|Thời hạn giải quyết|Phí, lệ phí|Mô tả|\n|--|--|--|-|\n|Trực tiếp|1 Ngày làm việc|Mức giá : Miên phí||\n|Trực tuyến|1 Ngày làm việc|Mức giá : Miên phí||\n|Dịch vụ bưu chính|1 Ngày làm việc|Mức giá : Miên phí||\n\nThành phần hồ sơ:\n\nBao gồm\n|Tên giấy tờ|Mẫu đơn, tờ khai|Số lượng|\n|--|--|-|\n|Giấy đề nghị|<a href=""https://csdl.dichvucong.gov.vn/web/jsp/download_file.jsp?ma=\'3fedcde9076b2fb2\'"">02.PhieuDeNghiDichVuDienDungChung.docx</a>|Bản chính: 1Bản sao: 0|\n\nĐối tượng thực hiện:\nCông dân Việt Nam, Người nước ngoài, Doanh nghiệp, Doanh nghiệp có vốn đầu tư nước ngoài, Tổ chức (không bao gồm doanh nghiệp, HTX), Tổ chức nước ngoài, Hợp tác xã\nCơ quan thực hiện:\nTập đoàn Điện lực Việt Nam\nCơ quan có thẩm quyền:\nTập đoàn Điện lực Việt Nam\nĐịa chỉ tiếp nhận HS:\nKhông có thông tin\nCơ quan được ủy quyền:\nKhông có thông tin\nCơ quan phối hợp:\nKhông có thông tin\nKết quả thực hiện:\nHợp đồng mua bán điện, Biên bản chấm dứt HĐMBĐ, Phụ lục hợp đồng mua bán điện 25, Phụ lục hợp đồng mua bán điện 24\nCăn cứ pháp lý:\n|Số ký hiệu|Trích yếu|Ngày ban hành|Cơ quan ban hành|\n|--|--|--|-|\n|137/2013/NĐ-CP|Quy định chi tiết thi hành một số điều của Luật Điện lực và Luật sửa đổi, bổ sung một số điều của Luật Điện lực|21-10-2013|Chính phủ|\n|24/2012/QH13|Sửa đổi, bổ sung một số điều của Luật Điện lực|20-11-2012|Quốc Hội|\n|Luật số 28/2004/QH11|Luật Điện lực|03-12-2004|Quốc Hội|\n\nYêu cầu, điều kiện thực hiện:\nKhông có yêu cầu điều kiện\nTừ khóa:\nKhông có thông tin\nMô tả:\nKhông có thông tin', 'Chi tiết thủ tục hành chính:\nMã thủ tục:\n3.000100\nSố quyết định:\n505\nTên thủ tục:\nThay đổi thông tin đã đăng ký\nCấp thực hiện:\nCấp Bộ, Cơ quan khác\nLoại thủ tục:\nLoại khác\nLĩnh vực:\nDịch vụ trong quá trình thực hiện HĐMBĐ\nTrình tự thực hiện:\nTiếp nhận yêu cầu\nKý Phụ lục Hợp đồng mua bán điện\nCách thức thực hiện:\n|Hình thức nộp|Thời hạn giải quyết|Phí, lệ phí|Mô tả|\n|--|--|--|-|\n|Trực tiếp|2 Ngày làm việc|Mức giá : Miễn phí||\n|Trực tuyến|2 Ngày làm việc|Mức giá : Miễn phí||\n|Dịch vụ bưu chính|2 Ngày làm việc|Mức giá : Miễn phí||\n\nThành phần hồ sơ:\n\nBao gồm\n|Tên giấy tờ|Mẫu đơn, tờ khai|Số lượng|\n|--|--|-|\n|Giấy đề nghị|<a href=""https://csdl.dichvucong.gov.vn/web/jsp/download_file.jsp?ma=\'3fe19e2808a8d5ee\'"">02.PhieuDeNghiDichVuDienDungChung.docx</a>|Bản chính: 1Bản sao: 0|\n\nĐối tượng thực hiện:\nCông dân Việt Nam, Người nước ngoài, Doanh nghiệp, Doanh nghiệp có vốn đầu tư nước ngoài, Tổ chức (không bao gồm doanh nghiệp, HTX), Tổ chức nước ngoài, Hợp tác xã\nCơ quan thực hiện:\nTập đoàn Điện lực Việt Nam\nCơ quan có thẩm quyền:\nTập đoàn Điện lực Việt Nam\nĐịa chỉ tiếp nhận HS:\nKhông có thông tin\nCơ quan được ủy quyền:\nKhông có thông tin\nCơ quan phối hợp:\nKhông có thông tin\nKết quả thực hiện:\nPhụ lục Hợp đồng mua bán điện 22, Phụ lục Hợp đồng mua bán điện 23\nCăn cứ pháp lý:\n|Số ký hiệu|Trích yếu|Ngày ban hành|Cơ quan ban hành|\n|--|--|--|-|\n|137/2013/NĐ-CP|Quy định chi tiết thi hành một số điều của Luật Điện lực và Luật sửa đổi, bổ sung một số điều của Luật Điện lực|21-10-2013|Chính phủ|\n|24/2012/QH13|Sửa đổi, bổ sung một số điều của Luật Điện lực|20-11-2012|Quốc Hội|\n|Luật số 28/2004/QH11|Luật Điện lực|03-12-2004|Quốc Hội|\n\nYêu cầu, điều kiện thực hiện:\nKhông có yêu cầu điều kiện\nTừ khóa:\nKhông có thông tin\nMô tả:\nKhông có thông tin', 'Chi tiết thủ tục hành chính:\nMã thủ tục:\n3.000099\nSố quyết định:\n505\nTên thủ tục:\nThay đổi chủ thể hợp đồng mua bán điện\nCấp thực hiện:\nCấp Bộ, Cơ quan khác\nLoại thủ tục:\nLoại khác\nLĩnh vực:\nDịch vụ trong quá trình thực hiện HĐMBĐ\nTrình tự thực hiện:\nTiếp nhận yêu cầu\nKhảo sát\nKý Biên bản chấm dứt HĐMBĐ cũ và Hợp đồng mua bán điện mới\nCách thức thực hiện:\n|Hình thức nộp|Thời hạn giải quyết|Phí, lệ phí|Mô tả|\n|--|--|--|-|\n|Trực tiếp|2 Ngày làm việc|Mức giá : Miễn phí|Với khách hàng mua điện sinh hoạt|\n|Trực tiếp|3 Ngày làm việc|Mức giá : Miễn Phí|Với khách hàng mua điện ngoài sinh hoạt|\n|Trực tuyến|2 Ngày làm việc|Mức giá : Miễn phí|Với khách hàng mua điện sinh hoạt|\n|Trực tuyến|3 Ngày làm việc|Mức giá : Miễn Phí|Với khách hàng mua điện ngoài sinh hoạt|\n|Dịch vụ bưu chính|2 Ngày làm việc|Mức giá : Miễn phí|Với khách hàng mua điện sinh hoạt|\n|Dịch vụ bưu chính|3 Ngày làm việc|Mức giá : Miễn Phí|Với khách hàng mua điện ngoài sinh hoạt|\n\nThành phần hồ sơ:\n\nBao gồm\n|Tên giấy tờ|Mẫu đơn, tờ khai|Số lượng|\n|--|--|-|\n|Giấy đề nghị|<a href=""https://csdl.dichvucong.gov.vn/web/jsp/download_file.jsp?ma=\'3fd8d08451306676\'"">02.PhieuDeNghiDichVuDienDungChung.docx</a>|Bản chính: 1Bản sao: 0|\n|Giấy tờ xác định chủ thể HĐMBĐ mới: là một trong các loại giấy tờ có tên của Tổ chức/cá nhân tại địa điểm mua điện sau: Hộ khẩu thường trú; Sổ tạm trú; Giấy chứng nhận quyền sở hữu nhà; Quyết định phân nhà; Hợp đồng mua bán nhà; Hợp đồng thuê nhà có thời hạn từ 01 năm trở lên và đồng ý của chủ sở hữu; Giấy chứng nhận quyền sử dụng đất; Hợp đồng ủy quyền quản lý và sử dụng nhà/đất; Hợp đồng thuê địa điểm và đồng ý của chủ sở hữu; Giấy chứng nhận đăng ký doanh nghiệp; Giấy chứng nhận đăng ký kinh doanh; Giấy chứng nhận đăng ký hộ kinh doanh; Giấy chứng nhận đăng ký hoạt động chi nhánh, văn phòng đại diện; Giấy phép đầu tư; Quyết định thành lập đơn vị.||Bản chính: 0Bản sao: 1|\n\nĐối tượng thực hiện:\nCông dân Việt Nam, Người nước ngoài, Doanh nghiệp, Doanh nghiệp có vốn đầu tư nước ngoài, Tổ chức (không bao gồm doanh nghiệp, HTX), Tổ chức nước ngoài, Hợp tác xã\nCơ quan thực hiện:\nTập đoàn Điện lực Việt Nam\nCơ quan có thẩm quyền:\nTập đoàn Điện lực Việt Nam\nĐịa chỉ tiếp nhận HS:\nKhông có thông tin\nCơ quan được ủy quyền:\nKhông có thông tin\nCơ quan phối hợp:\nKhông có thông tin\nKết quả thực hiện:\nHợp đồng mua bán điện, Biên bản chấm dứt HĐMBĐ\nCăn cứ pháp lý:\n|Số ký hiệu|Trích yếu|Ngày ban hành|Cơ quan ban hành|\n|--|--|--|-|\n|137/2013/NĐ-CP|Quy định chi tiết thi hành một số điều của Luật Điện lực và Luật sửa đổi, bổ sung một số điều của Luật Điện lực|21-10-2013|Chính phủ|\n|24/2012/QH13|Sửa đổi, bổ sung một số điều của Luật Điện lực|20-11-2012|Quốc Hội|\n|Luật số 28/2004/QH11|Luật Điện lực|03-12-2004|Quốc Hội|\n\nYêu cầu, điều kiện thực hiện:\nKhông có yêu cầu điều kiện\nTừ khóa:\nKhông có thông tin\nMô tả:\nKhông có thông tin']","|Hình thức nộp|Thời hạn giải quyết|Phí, lệ phí|Mô tả|
|Trực tiếp|1 Ngày làm việc|Mức giá: Miễn phí| |
|Trực tuyến|1 Ngày làm việc|Mức giá: Miễn phí| |
|Dịch vụ bưu chính|1 Ngày làm việc|Mức giá: Miễn phí| |","| Hình thức nộp | Thời hạn giải quyết | Phí, lệ phí | Mô tả |
|---|---|---|---|
| Trực tiếp | 1 Ngày làm việc | Miễn phí |  |
| Trực tuyến | 1 Ngày làm việc | Miễn phí |  |
| Dịch vụ bưu chính | 1 Ngày làm việc | Miễn phí |  |",0.0,1.0,0.0,1.0
3,Hồ sơ cấp giấy chứng nhận tên định danh bao gồm những giấy tờ nào?,"['Bao gồm\n|Tên giấy tờ|Mẫu đơn, tờ khai|Số lượng|\n|--|--|-|\n|* Lưu ý: Việc nộp hồ sơ đăng ký cư trú - Trường hợp nộp hồ sơ trực tiếp tại cơ quan đăng ký cư trú thì người yêu cầu đăng ký cư trú có thể nộp bản sao giấy tờ, tài liệu được chứng thực từ bản chính hoặc bản sao giấy tờ được cấp từ sổ gốc (sau đây gọi là bản sao) hoặc bản quét, bản chụp kèm theo bản chính giấy tờ, tài liệu để đối chiếu. Trường hợp người yêu cầu đăng ký cư trú nộp bản quét hoặc bản chụp kèm theo bản chính giấy tờ để đối chiếu thì người tiếp nhận có trách nhiệm kiểm tra, đối chiếu bản quét, bản chụp với bản chính và ký xác nhận, không được yêu cầu nộp bản sao giấy tờ đó. - Trường hợp thực hiện đăng ký cư trú trực tuyến, người yêu cầu đăng ký cư trú khai báo thông tin theo biểu mẫu điện tử được cung cấp sẵn, đăng tải bản quét hoặc bản chụp giấy tờ, tài liệu hợp lệ (không bắt buộc phải công chứng, chứng thực, ký số hoặc xác thực bằng hình thức khác) hoặc dẫn nguồn tài liệu từ Kho quản lý dữ liệu điện tử của tổ chức, cá nhân. Trường hợp công dân đăng tải bản quét, bản chụp giấy tờ, tài liệu mà không được ký số hoặc xác thực bằng hình thức khác thì khi cơ quan đăng ký cư trú tiến hành kiểm tra, xác minh để giải quyết thủ tục về cư trú; công dân có trách nhiệm xuất trình giấy tờ, tài liệu đã đăng tải để cơ quan đăng ký cư trú kiểm tra, đối chiếu và ghi nhận tính chính xác vào biên bản xác minh. Cơ quan đăng ký cư trú không yêu cầu công dân nộp để lưu giữ giấy tờ đó. - Bản quét hoặc bản chụp giấy tờ bằng thiết bị điện tử từ giấy tờ được cấp hợp lệ, còn giá trị sử dụng phải bảo đảm rõ nét, đầy đủ, toàn vẹn về nội dung; đã được hợp pháp hóa lãnh sự, dịch sang tiếng Việt theo quy định nếu là giấy tờ do cơ quan có thẩm quyền nước ngoài cấp trừ trường hợp được miễn hợp pháp hóa lãnh sự. - Trường hợp thông tin giấy tờ chứng minh điều kiện đăng ký cư trú đã được chia sẻ và khai thác từ cơ sở dữ liệu quốc gia, cơ sở dữ liệu chuyên ngành thì cơ quan đăng ký cư trú không được yêu cầu công dân nộp, xuất trình giấy tờ đó để giải quyết đăng ký cư trú.|         |Bản chính: 0Bản sao: 0|', '** Hồ sơ gia hạn tạm trú gồm: **\n|Tên giấy tờ|Mẫu đơn, tờ khai|Số lượng|\n|--|--|-|\n|- Giấy tờ, tài liệu chứng minh chỗ ở hợp pháp. Trừ trường hợp thông tin chứng minh về chỗ ở hợp pháp của công dân đã có trong cơ sở dữ liệu chuyên ngành đã được kết nối, chia sẻ với cơ quan đăng ký cư trú và trường hợp, giấy tờ chứng minh về chỗ ở hợp pháp đã có bản điện tử trên dịch vụ công qua giải quyết thủ tục hành chính khác thì cơ quan đăng ký cư trú tự kiểm tra, xác minh không yêu cầu công dân xuất trình giấy tờ chứng minh.|         |Bản chính: 1Bản sao: 0|\n|- Tờ khai thay đổi thông tin cư trú (Mẫu CT01 ban hành kèm theo Thông tư số 66/2023/TT-BCA); đối với người gia hạn tạm trú là người chưa thành niên thì trong tờ khai phải ghi rõ ý kiến đồng ý của cha, mẹ hoặc người giám hộ, trừ trường hợp đã có ý kiến đồng ý bằng văn bản;|<a href=""https://csdl.dichvucong.gov.vn/web/jsp/download_file.jsp?ma=\'3fd31b11e367704e\'"">Mẫu CT01 _66.doc</a>|Bản chính: 1Bản sao: 0|', '** Hồ sơ gia hạn tạm trú gồm: **\n|Tên giấy tờ|Mẫu đơn, tờ khai|Số lượng|\n|--|--|-|\n|- Giấy tờ, tài liệu chứng minh chỗ ở hợp pháp. Trừ trường hợp thông tin chứng minh về chỗ ở hợp pháp của công dân đã có trong cơ sở dữ liệu chuyên ngành đã được kết nối, chia sẻ với cơ quan đăng ký cư trú và trường hợp, giấy tờ chứng minh về chỗ ở hợp pháp đã có bản điện tử trên dịch vụ công qua giải quyết thủ tục hành chính khác thì cơ quan đăng ký cư trú tự kiểm tra, xác minh không yêu cầu công dân xuất trình giấy tờ chứng minh.|         |Bản chính: 1Bản sao: 0|\n|- Tờ khai thay đổi thông tin cư trú (Mẫu CT01 ban hành kèm theo Thông tư số 66/2023/TT-BCA); đối với người gia hạn tạm trú là người chưa thành niên thì trong tờ khai phải ghi rõ ý kiến đồng ý của cha, mẹ hoặc người giám hộ, trừ trường hợp đã có ý kiến đồng ý bằng văn bản;|<a href=""https://csdl.dichvucong.gov.vn/web/jsp/download_file.jsp?ma=\'3fd31b11e367704e\'"">Mẫu CT01 _66.doc</a>|Bản chính: 1Bản sao: 0|\n\n\nBao gồm']","|Tên giấy tờ|Mẫu đơn, tờ khai|Số lượng|
|Bản khai Cấp tên định danh|Bản khai đăng ký tên định danh.docx|Bản chính: 1, Bản sao: 1|
|Bản sao có chứng thực Quyết định thành lập của tổ chức hoặc giấy chứng nhận đăng ký doanh nghiệp||Bản chính: 1, Bản sao: 1|
|Bản sao có chứng thực chứng minh nhân dân hoặc căn cước công dân hoặc hộ chiếu||Bản chính: 1, Bản sao: 1|
|Các giấy tờ khác có liên quan tới quyền sở hữu trí tuệ, đăng ký thương hiệu|Giấy ủy quyền.docx|Bản chính: 1, Bản sao: 1|",Tôi không biết trả lời câu hỏi này.,0.0,0.0,0.0,0.0
4,Tôi có thể nộp hồ sơ đăng ký biến động quyền sử dụng đất trực tiếp ở đâu?,"['Chi tiết thủ tục hành chính:\nMã thủ tục:\n2.000410\nSố quyết định:\n3873/QĐ-BTNMT\nTên thủ tục:\nĐăng ký biến động quyền sử dụng đất, quyền sở hữu tài sản gắn liền với đất trong các trường hợp chuyển nhượng, cho thuê, cho thuê lại, thừa kế, tặng cho, góp vốn bằng quyền sử dụng đất, quyền sở hữu tài sản gắn liền với đất; chuyển quyền sử dụng đất, quyền sở hữu tài sản gắn liền với đất của vợ hoặc chồng thành của chung vợ và chồng; tăng thêm diện tích do nhận chuyển nhượng, thừa kế, tặng cho quyền sử dụng đất đã có Giấy chứng nhận\nCấp thực hiện:\nCấp Huyện\nLoại thủ tục:\nTTHC không được luật giao cho địa phương quy định hoặc quy định chi tiết\nLĩnh vực:\nĐất đai\nTrình tự thực hiện:\nTrực tiếp\n(1) Người sử dụng đất nộp hồ sơ tại Văn phòng đăng ký quyền sử dụng đất thuộc Phòng Tài nguyên và Môi trường hoặc cơ quan tiếp nhận hồ sơ theo quy định của Ủy ban nhân dân tỉnh, thành phố trực thuộc Trung ương. \nHộ gia đình, cá nhân, cộng đồng dân cư nộp hồ sơ tại Ủy ban nhân dân cấp xã nếu có nhu cầu.\nTrường hợp thực hiện quyền của người sử dụng đất đối với một phần thửa đất thì người sử dụng đất đề nghị Văn phòng đăng ký quyền sử dụng đất thực hiện đo đạc tách thửa đối với phần diện tích cần thực hiện quyền của người sử dụng đất trước khi nộp hồ sơ thực hiện quyền của người sử dụng đất.\nTrường hợp nhận hồ sơ chưa đầy đủ, chưa hợp lệ thì trong thời gian tối đa 03 ngày, cơ quan tiếp nhận, xử lý hồ sơ phải thông báo và hướng dẫn người nộp hồ sơ bổ sung, hoàn chỉnh hồ sơ theo quy định. \n(2) Cơ quan tiếp nhận hồ sơ ghi đầy đủ thông tin vào Sổ tiếp nhận hồ sơ và trả kết quả, trao Phiếu tiếp nhận hồ sơ và trả kết quả cho người nộp hồ sơ.\nTrường hợp nộp hồ sơ tại Ủy ban nhân dân cấp xã thì trong thời hạn 03 ngày làm việc kể từ ngày nhận đủ hồ sơ, Ủy ban nhân dân cấp xã phải chuyển hồ sơ đến Văn phòng đăng ký quyền sử dụng đất. \n(3) Văn phòng đăng ký quyền sử dụng đất có trách nhiệm kiểm tra hồ sơ, nếu đủ điều kiện thực hiện các quyền theo quy định thì thực hiện các công việc sau đây:\n- Thông báo cho bên chuyển quyền sử dụng đất và niêm yết tại Ủy ban nhân dân cấp xã về việc làm thủ tục cấp Giấy chứng nhận cho người nhận chuyển quyền đối với trường hợp bên nhận chuyển quyền chỉ có Giấy chứng nhận của bên chuyển quyền; gửi văn bản đề nghị xác nhận hộ gia đình, cá nhân trực tiếp sản xuất nông nghiệp đến Ủy ban nhân dân cấp xã nơi đăng ký thường trú, Ủy ban nhân dân cấp xã nơi có đất đối với trường hợp nhận chuyển nhượng, nhận tặng cho quyền sử dụng đất trồng lúa của hộ gia đình, cá nhân;\n- Gửi thông tin địa chính đến cơ quan thuế để xác định và thông báo thu nghĩa vụ tài chính đối với trường hợp phải thực hiện nghĩa vụ tài chính theo quy định;\n- Xác nhận nội dung biến động vào Giấy chứng nhận đã cấp theo quy định của Bộ Tài nguyên và Môi trường.\nTrường hợp phải cấp Giấy chứng nhận thì lập hồ sơ trình cơ quan có thẩm quyền cấp Giấy chứng nhận cho người sử dụng đất.\n- Chỉnh lý, cập nhật biến động vào hồ sơ địa chính, cơ sở dữ liệu đất đai.\n- Trao Giấy chứng nhận cho người sử dụng đất hoặc gửi Ủy ban nhân dân cấp xã để trao đối với trường hợp nộp hồ sơ tại cấp xã.\nTrường hợp người đề nghị cấp Giấy chứng nhận đã chết trước khi được trao Giấy chứng nhận thì người được thừa kế quyền sử dụng đất theo quy định của pháp luật thừa kế nộp bổ sung giấy tờ về thừa kế theo quy định. Văn phòng đăng ký quyền sử dụng đất xác nhận thừa kế vào Giấy chứng nhận đã ký hoặc lập hồ sơ để trình cơ quan có thẩm quyền cấp Giấy chứng nhận quyền sử dụng đất, quyền sở hữu nhà ở và tài sản khác gắn liền với đất cho người được thừa kế theo quy định của Bộ Tài nguyên và Môi trường. Người được thừa kế có trách nhiệm thực hiện nghĩa vụ tài chính về quyền sử dụng đất, tài sản gắn liền với đất trong trường hợp người được cấp Giấy chứng nhận đã chết phải thực hiện theo quy định của pháp luật.\n- Xác nhận vào bản chính giấy tờ việc đã cấp Giấy chứng nhận theo quy định.\n(4) Người được cấp Giấy chứng nhận nhận lại bản chính giấy tờ đã được xác nhận cấp Giấy chứng nhận và Giấy chứng nhận.\n* Trường hợp người sử dụng đất tặng cho quyền sử dụng đất để xây dựng công trình công cộng thì phải lập văn bản tặng cho quyền sử dụng đất theo quy định.\nSau khi hoàn thành xây dựng công trình công cộng trên đất được tặng cho, Văn phòng đăng ký quyền sử dụng đất căn cứ vào văn bản tặng cho quyền sử dụng đất đã được Ủy ban nhân dân cấp xã xác nhận và hiện trạng sử dụng đất để đo đạc, chỉnh lý biến động vào hồ sơ địa chính, cơ sở dữ liệu đất đai và thông báo cho người sử dụng đất nộp Giấy chứng nhận đã cấp để xác nhận thay đổi. Trường hợp người sử dụng đất tặng cho toàn bộ diện tích đất đã cấp Giấy chứng nhận thì thu hồi Giấy chứng nhận để quản lý.\nThực hiện thủ tục trên môi trường điện tử\nCơ quan tiếp nhận, giải quyết hồ sơ có trách nhiệm thực hiện các trình tự, thủ tục hành chính về đất đai theo quy định của pháp luật về đất đai; trường hợp cần phải kiểm tra, xác minh làm rõ hoặc do nguyên nhân khác mà không trả kết quả giải quyết hồ sơ theo đúng quy định về thời gian giải quyết thủ tục hành chính về đất đai thì cơ quan tiếp nhận hồ sơ, giải quyết thủ tục gửi thông báo bằng văn bản hoặc qua Cổng dịch vụ công hoặc qua tin nhắn SMS cho người yêu cầu, trong đó nêu rõ lý do.\nNgười sử dụng đất, chủ sở hữu tài sản gắn liền với đất có trách nhiệm hoàn thành nghĩa vụ tài chính theo quy định của pháp luật bằng hình thức trực tiếp hoặc trực tuyến thông qua chức năng thanh toán của Cổng dịch vụ công.\nCơ quan tiếp nhận hoặc cơ quan giải quyết hồ sơ thông báo cho người yêu cầu thực hiện thủ tục hành chính nộp bản chính Giấy chứng nhận đã cấp, các giấy tờ theo quy định sau khi người sử dụng đất hoàn thành nghĩa vụ tài chính.\n\tViệc trả kết quả giải quyết thủ tục hành chính được thực hiện tại cơ quan tiếp nhận hồ sơ hoặc qua dịch vụ bưu chính công ích hoặc tại địa điểm theo yêu cầu đối với trường hợp tiếp nhận hồ sơ và trả kết quả giải quyết thủ tục đăng ký đất đai, tài sản khác gắn liền với đất.\nCách thức thực hiện:\n|Hình thức nộp|Thời hạn giải quyết|Phí, lệ phí|Mô tả|\n|--|--|--|-|\n|Trực tiếp|10 Ngày làm việc|Phí : Thực hiện theo quy định của Luật Phí, lệ phí.|Cách thức thực hiện: Người sử dụng đất nộp hồ sơ tại Văn phòng đăng ký quyền sử dụng đất thuộc Phòng Tài nguyên và Môi trường hoặc cơ quan tiếp nhận hồ sơ theo quy định của Ủy ban nhân dân cấp tỉnh hoặc trên môi trường điện tử. Hộ gia đình, cá nhân, cộng đồng dân cư nộp hồ sơ tại Ủy ban nhân dân cấp xã nếu có nhu cầu. Thời hạn giải quyết: Do Ủy ban nhân dân cấp tỉnh quy định. Cụ thể: - Thời gian thực hiện thủ tục đăng ký biến động quyền sử dụng đất, quyền sở hữu tài sản gắn liền với đất trong trường hợp chuyển đổi, chuyển nhượng, thừa kế, tặng cho, đăng ký góp vốn bằng quyền sử dụng đất, quyền sở hữu tài sản gắn liền với đất là không quá 10 ngày kể từ ngày nhận được hồ sơ hợp lệ; - Thời gian thực hiện thủ tục đăng ký biến động quyền sử dụng đất, quyền sở hữu tài sản gắn liền với đất trong trường hợp cho thuê, cho thuê lại quyền sử dụng đất là không quá 03 ngày kể từ ngày nhận được hồ sơ hợp lệ; - Thời gian thực hiện thủ tục đăng ký biến động quyền sử dụng đất, quyền sở hữu tài sản gắn liền với đất trong trường hợp chuyển quyền sử dụng đất, quyền sở hữu tài sản gắn liền với đất của vợ hoặc chồng thành của chung vợ và chồng là không quá 05 ngày kể từ ngày nhận được hồ sơ hợp lệ; Thời gian này không tính thời gian các ngày nghỉ, ngày lễ theo quy định của pháp luật; không tính thời gian tiếp nhận hồ sơ tại xã, thời gian thực hiện nghĩa vụ tài chính của người sử dụng đất; không tính thời gian xem xét xử lý đối với trường hợp sử dụng đất có vi phạm pháp luật, thời gian trưng cầu giám định. Đối với các xã miền núi, hải đảo, vùng sâu, vùng xa, vùng có điều kiện kinh tế - xã hội khó khăn, vùng có điều kiện kinh tế - xã hội đặc biệt khó khăn thì thời gian thực hiện được tăng thêm 10 ngày. - Kết quả giải quyết thủ tục hành chính phải trả cho người sử dụng đất, chủ sở hữu tài sản gắn liền với đất trong thời hạn không quá 03 ngày làm việc kể từ ngày có kết quả giải quyết.|\n\nThành phần hồ sơ:', 'Chi tiết thủ tục hành chính:\nMã thủ tục:\n1.003877\nSố quyết định:\n3873/QĐ-BTNMT\nTên thủ tục:\nThủ tục đăng ký biến động về sử dụng đất, tài sản gắn liền với đất do thay đổi thông tin về người được cấp Giấy chứng nhận (đổi tên hoặc giấy tờ pháp nhân, giấy tờ nhân thân, địa chỉ); giảm diện tích thửa đất do sạt lở tự nhiên; thay đổi về hạn chế quyền sử dụng đất; thay đổi về nghĩa vụ tài chính; thay đổi về tài sản gắn liền với đất so với nội dung đã đăng ký, cấp Giấy chứng nhận\nCấp thực hiện:\nCấp Huyện\nLoại thủ tục:\nTTHC được luật giao quy định chi tiết\nLĩnh vực:\nĐất đai\nTrình tự thực hiện:\nTrực tiếp:\na) Người sử dụng đất nộp hồ sơ tại Văn phòng đăng ký quyền sử dụng đất thuộc Phòng Tài nguyên và Môi trường hoặc cơ quan tiếp nhận hồ sơ theo quy định của Ủy ban nhân dân tỉnh, thành phố trực thuộc Trung ương.\nHộ gia đình, cá nhân, cộng đồng dân cư nộp hồ sơ tại Ủy ban nhân dân cấp xã nếu có nhu cầu.\nTrường hợp nhận hồ sơ chưa đầy đủ, chưa hợp lệ thì trong thời gian tối đa 03 ngày, cơ quan tiếp nhận, xử lý hồ sơ phải thông báo và hướng dẫn người nộp hồ sơ bổ sung, hoàn chỉnh hồ sơ theo quy định.\nTrường hợp người sử dụng đất có nhu cầu chuyển mục đích sử dụng đất kết hợp với đăng ký biến động về các nội dung của thủ tục này thì thực hiện thủ tục này đồng thời với thủ tục chuyển mục đích sử dụng đất.\nb) Cơ quan tiếp nhận hồ sơ ghi đầy đủ thông tin vào Sổ tiếp nhận hồ sơ và trả kết quả, trao Phiếu tiếp nhận hồ sơ và trả kết quả cho người nộp hồ sơ.\nTrường hợp nộp hồ sơ tại Ủy ban nhân dân cấp xã thì trong thời hạn 03 ngày làm việc kể từ ngày nhận đủ hồ sơ, Ủy ban nhân dân cấp xã phải chuyển hồ sơ đến Văn phòng đăng ký quyền sử dụng đất.\nc) Văn phòng đăng ký quyền sử dụng đất có trách nhiệm kiểm tra hồ sơ, nếu đủ điều kiện thực hiện các quyền theo quy định thì thực hiện các công việc sau đây:\n- Trích đo địa chính thửa đất đối với trường hợp có thay đổi về diện tích thửa đất, tài sản gắn liền với đất hoặc trường hợp đã cấp Giấy chứng nhận nhưng chưa có bản đồ địa chính, chưa trích đo địa chính thửa đất;\n- Trường hợp đăng ký thay đổi diện tích xây dựng, diện tích sử dụng, tầng cao, kết cấu, cấp (hạng) nhà hoặc công trình xây dựng mà không phù hợp với giấy phép xây dựng hoặc không có giấy phép xây dựng đối với trường hợp phải xin phép thì gửi phiếu lấy ý kiến của cơ quan quản lý, cấp phép xây dựng theo quy định của pháp luật về xây dựng;\n- Gửi thông tin địa chính cho cơ quan thuế để xác định và thông báo thu nghĩa vụ tài chính đối với trường hợp phải nộp tiền sử dụng đất, tiền thuê đất theo quy định của pháp luật;\n- Xác nhận thay đổi vào Giấy chứng nhận đã cấp hoặc lập hồ sơ trình cơ quan có thẩm quyền cấp Giấy chứng nhận quyền sử dụng đất, quyền sở hữu nhà ở và tài sản khác gắn liền với đất đối với trường hợp phải cấp lại Giấy chứng nhận theo quy định của Bộ Tài nguyên và Môi trường; thông báo cho người sử dụng đất ký hoặc ký lại hợp đồng thuê đất với cơ quan tài nguyên và môi trường đối với trường hợp phải thuê đất;\n- Chỉnh lý, cập nhật biến động vào hồ sơ địa chính, cơ sở dữ liệu đất đai.\nd) Văn phòng đăng ký quyền sử dụng đất trao Giấy chứng nhận cho người được cấp hoặc gửi Ủy ban nhân dân cấp xã để trao đối với trường hợp nộp hồ sơ tại cấp xã.\nThực hiện thủ tục trên môi trường điện tử:\nCơ quan tiếp nhận, giải quyết hồ sơ có trách nhiệm thực hiện các trình tự, thủ tục hành chính về đất đai theo quy định của pháp luật về đất đai; trường hợp cần phải kiểm tra, xác minh làm rõ hoặc do nguyên nhân khác mà không trả kết quả giải quyết hồ sơ theo đúng quy định về thời gian giải quyết thủ tục hành chính về đất đai thì cơ quan tiếp nhận hồ sơ, giải quyết thủ tục gửi thông báo bằng văn bản hoặc qua Cổng dịch vụ công hoặc qua tin nhắn SMS cho người yêu cầu, trong đó nêu rõ lý do.\nNgười sử dụng đất, chủ sở hữu tài sản gắn liền với đất có trách nhiệm hoàn thành nghĩa vụ tài chính theo quy định của pháp luật bằng hình thức trực tiếp hoặc trực tuyến thông qua chức năng thanh toán của Cổng dịch vụ công.\nCơ quan tiếp nhận hoặc cơ quan giải quyết hồ sơ thông báo cho người yêu cầu thực hiện thủ tục hành chính nộp bản chính Giấy chứng nhận đã cấp, các giấy tờ theo quy định sau khi người sử dụng đất hoàn thành nghĩa vụ tài chính.\nViệc trả kết quả giải quyết thủ tục hành chính được thực hiện tại cơ quan tiếp nhận hồ sơ hoặc qua dịch vụ bưu chính công ích hoặc tại địa điểm theo yêu cầu đối với trường hợp tiếp nhận hồ sơ và trả kết quả giải quyết thủ tục đăng ký đất đai, tài sản khác gắn liền với đất.\nCách thức thực hiện:\n|Hình thức nộp|Thời hạn giải quyết|Phí, lệ phí|Mô tả|\n|--|--|--|-|\n|Trực tiếp|10 Ngày làm việc|Lệ phí : Đồng Thực hiện theo quy định của Luật Phí, lệ phí.|Cách thức thực hiện: Người sử dụng đất nộp hồ sơ tại Văn phòng đăng ký quyền sử dụng đất thuộc Phòng Tài nguyên và Môi trường hoặc cơ quan tiếp nhận hồ sơ theo quy định của Ủy ban nhân dân cấp tỉnh. Hộ gia đình, cá nhân, cộng đồng dân cư nộp hồ sơ tại Ủy ban nhân dân cấp xã nếu có nhu cầu. Thời hạn giải quyết: Do Ủy ban nhân dân cấp tỉnh quy định nhưng không quá 10 ngày kể từ ngày nhận được hồ sơ hợp lệ. Thời gian này không tính thời gian các ngày nghỉ, ngày lễ theo quy định của pháp luật; không tính thời gian tiếp nhận hồ sơ tại xã, thời gian thực hiện nghĩa vụ tài chính của người sử dụng đất; không tính thời gian xem xét xử lý đối với trường hợp sử dụng đất có vi phạm pháp luật, thời gian trưng cầu giám định. Đối với các xã miền núi, hải đảo, vùng sâu, vùng xa, vùng có điều kiện kinh tế - xã hội khó khăn, vùng có điều kiện kinh tế - xã hội đặc biệt khó khăn thì thời gian thực hiện được tăng thêm 10 ngày. Kết quả giải quyết thủ tục hành chính phải trả cho người sử dụng đất, chủ sở hữu tài sản gắn liền với đất trong thời hạn không quá 03 ngày làm việc kể từ ngày có kết quả giải quyết.|\n\nThành phần hồ sơ:\n\n(*) Trường hợp xác nhận thay đổi thông tin về số Giấy chứng minh nhân dân, số thẻ Căn cước công dân, địa chỉ trên Giấy chứng nhận đã cấp theo nhu cầu của người sử dụng đất, chủ sở hữu tài sản gắn liền với đất, gồm có:\n|Tên giấy tờ|Mẫu đơn, tờ khai|Số lượng|\n|--|--|-|\n|a) Đơn đăng ký biến động đất đai, tài sản gắn liền với đất theo Mẫu số 09/ĐK;|<a href=""https://csdl.dichvucong.gov.vn/web/jsp/download_file.jsp?ma=\'3fca097995cb2bac\'"">mau so 09.doc</a>|Bản chính: 1Bản sao: 0|\n|b) Bản gốc Giấy chứng nhận đã cấp;||Bản chính: 1Bản sao: 0|\n|c) Bản sao Giấy CMND/thẻ căn cước công dân/số định danh cá nhân, hộ chiếu mới hoặc Giấy chứng minh quân đội mới hoặc thẻ Căn cước công dân mới hoặc sổ hộ khẩu, giấy tờ khác chứng minh thay đổi nhân thân đối với trường hợp thay đổi thông tin về nhân thân của người có tên trên Giấy chứng nhận; Trường hợp dữ liệu quốc gia về dân cư được chia sẻ và kết nối với dữ liệu của các ngành, các lĩnh vực (trong đó có lĩnh vực đất đai) thì cơ quan tiếp nhận hồ sơ sử dụng dữ liệu từ cơ sở dữ liệu quốc gia về dân cư mà không yêu cầu người nộp hồ sơ phải nộp bản sao CMND/thẻ căn cước công dân/số định danh cá nhân, hộ chiếu hoặc Giấy chứng minh quân đội hoặc sổ hộ khẩu hoặc giấy tờ khác để chứng minh nhân thân.||Bản chính: 0Bản sao: 1|\n\n\n(*) Trường hợp đăng ký biến động về sử dụng đất, tài sản gắn liền với đất do người sử dụng đất, chủ sở hữu tài sản gắn liền với đất được đổi tên; giảm diện tích thửa đất do sạt lở tự nhiên; thay đổi về hạn chế quyền sử dụng đất; thay đổi về nghĩa vụ tài chính; thay đổi về tài sản gắn liền với đất so với nội dung đã đăng ký, cấp Giấy chứng nhận gồm có:\n|Tên giấy tờ|Mẫu đơn, tờ khai|Số lượng|\n|--|--|-|\n|1. Đơn đăng ký biến động đất đai, tài sản gắn liền với đất theo Mẫu số 09/ĐK;|<a href=""https://csdl.dichvucong.gov.vn/web/jsp/download_file.jsp?ma=\'3fe7518ba157a40a\'"">mau so 09.doc</a>|Bản chính: 1Bản sao: 0|\n|2. Bản gốc Giấy chứng nhậnđã cấp;||Bản chính: 1Bản sao: 0|\n|3. Một trong các giấy tờ liên quan đến nội dung biến động:||Bản chính: Bản sao:|\n|- Văn bản công nhận của cơ quan nhà nước có thẩm quyền theo quy định của pháp luật đối với trường hợp cá nhân hoặc người đại diện hộ gia đình thay đổi họ, tên;||Bản chính: 1Bản sao: 0|\n|- Văn bản thỏa thuận của cộng đồng dân cư được Ủy ban nhân dân cấp xã xác nhận đối với trường hợp cộng đồng dân cư đổi tên;||Bản chính: 1Bản sao: 0|\n|- Văn bản xác nhận của Ủy ban nhân dân cấp xã về tình trạng sạt lở tự nhiên đối với trường hợp giảm diện tích thửa đất, tài sản gắn liền với đất do sạt lở tự nhiên;||Bản chính: 1Bản sao: 0|\n|- Chứng từ về việc nộp nghĩa vụ tài chính đối với trường hợp Giấy chứng nhận đã cấp có ghi nợ hoặc chậm nộp nghĩa vụ tài chính, trừ trường hợp người sử dụng đất được miễn giảm hoặc không phải nộp do thay đổi quy định của pháp luật;||Bản chính: 1Bản sao: 0|\n|- Quyết định của cơ quan nhà nước có thẩm quyền về việc thay đổi hạn chế về quyềnsử dụng đất, quyền sở hữu tài sản gắn liền với đất ghi trên Giấy chứng nhận đối với trường hợp có hạn chế theo quyết định giao đất, cho thuê đất, công nhận quyền sử dụng đất; trường hợp có thay đổi hạn chế theo văn bản chuyển quyền sử dụng đất thì phải có văn bản chấp thuận thay đổi hạn chế của người có quyền lợi liên quan, được Ủy ban nhân dân cấp xã xác nhận;||Bản chính: 1Bản sao: 0|\n|- Bản sao một trong các giấy tờ về quyền sở hữu tài sản gắn liền với đất thể hiện nội dung thay đổi đối với trường hợp thay đổi thông tin về tài sản gắn liền với đất đã ghi trên Giấy chứng nhận.||Bản chính: 0Bản sao: 1|\n|- Văn bản thỏa thuận của hộ gia đình được Ủy ban nhân dân cấp xã xác nhận đối với trường hợp thay đổi người đại diện là thành viên trong hộ gia đình mà không phải là chủ hộ; trường hợp thay đổi người đại diện hộ gia đình là chủ hộ thì cơ quan giải quyết thủ tục có trách nhiệm khai thác, sử dụng thông tin trong Cơ sở dữ liệu quốc gia về dân cư theo quy định tại Điều 14 Nghị định số 104/2022/NĐ-CP ngày 21 tháng 12 năm 2022 của Chính phủ sửa đổi, bổ sung một số điều của các nghị định liên quan đến việc nộp, xuất trình sổ hộ khẩu, sổ tạm trú giấy khi thực hiện thủ tục hành chính, cung cấp dịch vụ công.||Bản chính: 1Bản sao: 0|', 'Thành phần hồ sơ:\n\nc.1) Hồ sơ nộp khi thực hiện đăng ký biến động quyền sử dụng đất, quyền sở hữu tài sản gắn liền với đất trong các trường hợp chuyển đổi quyền sử dụng đất nông nghiệp mà không thuộc trường hợp “dồn điền đổi thửa”, chuyển nhượng, cho thuê, cho thuê lại, thừa kế, tặng cho, góp vốn bằng quyền sử dụng đất, quyền sở hữu tài sản gắn liền với đất; chuyển quyền sử dụng đất, quyền sở hữu tài sản gắn liền với đất của vợ hoặc chồng thành của chung vợ và chồng\n|Tên giấy tờ|Mẫu đơn, tờ khai|Số lượng|\n|--|--|-|\n|(1) Đơn đăng ký biến động đất đai, tài sản gắn liền với đất theo Mẫu số 09/ĐK. Đối với trường hợp hộ gia đình, cá nhân nhận chuyển quyền sử dụng đất nông nghiệp thì phải thể hiện tổng diện tích nhận chuyển quyền tại điểm 4 Mục I của Mẫu số 09/ĐK ban hành kèm theo Thông tư số 33/2017/TT-BTNMT (được sửa đổi, bổ sung tại Thông tư số 14/2023/TT-BTNMT ngày 16 tháng 10 năm 2023) (Lý do biến động) như sau: “Nhận … (ghi hình thức chuyển quyền sử dụng đất) …m2 đất (ghi diện tích đất nhận chuyển quyền); tổng diện tích đất nông nghiệp đang sử dụng do nhận chuyển quyền và đã đăng ký chuyển quyền sử dụng đất từ ngày 01/7/2007 đến trước ngày 01/7/2014 là … m2 và từ ngày 01/7/2014 đến nay là … m2 (ghi cụ thể diện tích nhận chuyển quyền theo từng loại đất, từng địa bàn tỉnh, thành phố trực thuộc Trung ương)”;|<a href=""https://csdl.dichvucong.gov.vn/web/jsp/download_file.jsp?ma=\'3fe998b4cf4ed90a\'"">Mau so 09-DK.pdf</a>|Bản chính: 1Bản sao: 0|\n|(2) Hợp đồng, văn bản về việc chuyển đổi, chuyển nhượng, cho thuê, cho thuê lại, thừa kế, tặng cho quyền sử dụng đất, quyền sở hữu tài sản gắn liền với đất; góp vốn bằng quyền sử dụng đất, quyền sở hữu tài sản gắn liền với đất; chuyển quyền sử dụng đất, quyền sở hữu tài sản gắn liền với đất của vợ hoặc chồng thành của chung vợ và chồng theo quy định. Trường hợp người thừa kế quyền sử dụng đất, quyền sở hữu tài sản gắn liền với đất là người duy nhất thì phải có đơn đề nghị được đăng ký thừa kế quyền sử dụng đất, quyền sở hữu tài sản gắn liền với đất của người thừa kế;||Bản chính: 1Bản sao: 0|\n|(3) Bản gốc Giấy chứng nhận đã cấp;||Bản chính: 1Bản sao: 0|\n|(4) Văn bản của người sử dụng đất đồng ý cho chủ sở hữu tài sản gắn liền với đất được chuyển nhượng, tặng cho, cho thuê, góp vốn tài sản gắn liền với đất đối với trường hợp chuyển nhượng, tặng cho, cho thuê, góp vốn bằng tài sản gắn liền với đất mà chủ sở hữu tài sản gắn liền với đất không đồng thời là người sử dụng đất.||Bản chính: 1Bản sao: 0|\n|(5) Trường hợp người đề nghị cấp Giấy chứng nhận đã chết trước khi được trao Giấy chứng nhận thì người được thừa kế quyền sử dụng đất theo quy định của pháp luật thừa kế nộp bổ sung giấy tờ về thừa kế theo quy định.||Bản chính: 1Bản sao: 0|\n|(6) Văn bản của các thành viên trong hộ gia đình sử dụng đất đồng ý chuyển quyền sử dụng đất của hộ gia đình đã được công chứng hoặc chứng thực theo quy định của pháp luật.||Bản chính: 1Bản sao: 0|\n|(7) Văn bản xác nhận trực tiếp sản xuất nông nghiệp đối với trường hợp nhận chuyển nhượng, tặng cho quyền sử dụng đất trồng lúa.||Bản chính: 1Bản sao: 0|\n\n\nc.2) Hồ sơ nộp khi cấp Giấy chứng nhận đối với trường hợp diện tích đất tăng thêm do nhận chuyển nhượng, thừa kế, tặng cho quyền sử dụng đất đã có Giấy chứng nhận trong trường hợp thửa đất gốc đã được cấp Giấy chứng nhận:\n|Tên giấy tờ|Mẫu đơn, tờ khai|Số lượng|\n|--|--|-|\n|(1) Đơn đề nghị cấp lại, cấp đổi Giấy chứng nhận quyền sử dụng đất, quyền sở hữu nhà ở và tài sản khác gắn liền với đất theo Mẫu số 10/ĐK|<a href=""https://csdl.dichvucong.gov.vn/web/jsp/download_file.jsp?ma=\'3fe2f78f7bc72401\'"">Mau so 10-DK.pdf</a>|Bản chính: 1Bản sao: 0|\n|(2) Bản gốc Giấy chứng nhận của thửa đất gốc;||Bản chính: 1Bản sao: 0|\n|(3) Bản gốc Giấy chứng nhận và hợp đồng, văn bản về việc chuyển nhượng, thừa kế, tặng cho quyền sử dụng đất được lập theo quy định của diện tích đất tăng thêm. Trường hợp nhận chuyển nhượng, thừa kế, tặng cho phần diện tích đất tăng thêm theo quy định tại Khoản 2 Điều 82 của Nghị định số 43/2014/NĐ-CP thì nộp bản gốc Giấy chứng nhận của bên chuyển quyền sử dụng đất hoặc hợp đồng, văn bản về việc chuyển nhượng, thừa kế, tặng cho quyền sử dụng đất của diện tích đất tăng thêm.||Bản chính: 1Bản sao: 0|\n\n\nc.3) Hồ sơ nộp khi thực hiện thủ tục xác định lại diện tích đất ở cho hộ gia đình, cá nhân đã được cấp Giấy chứng nhận bao gồm:\n|Tên giấy tờ|Mẫu đơn, tờ khai|Số lượng|\n|--|--|-|\n|(1) Đơn đăng ký biến động đất đai, tài sản gắn liền với đất theo Mẫu số 09/ĐK|<a href=""https://csdl.dichvucong.gov.vn/web/jsp/download_file.jsp?ma=\'3fcb0da797e44608\'"">Mau so 09-DK.pdf</a>|Bản chính: 1Bản sao: 0|\n|(2) Bản gốc Giấy chứng nhận đã cấp.||Bản chính: 1Bản sao: 0|\n\n\nc.4) Đối với trường hợp thực hiện thủ tục đăng ký biến động đất đai, tài sản gắn liền với đất tại các khoản c.1, c.2 và c.3 mà có thay đổi thông tin về pháp nhân, số Giấy chứng minh nhân dân, số thẻ Căn cước công dân, số định danh cá nhân, địa chỉ trên Giấy chứng nhận đã cấp thì thực hiện như sau:\n|Tên giấy tờ|Mẫu đơn, tờ khai|Số lượng|\n|--|--|-|\n|+ Đối với cá nhân thì cơ quan giải quyết thủ tục có trách nhiệm khai thác, sử dụng thông tin trong Cơ sở dữ liệu quốc gia về dân cư theo quy định tại Điều 14 Nghị định số 104/2022/NĐ-CP ngày 21 tháng 12 năm 2022 của Chính phủ sửa đổi, bổ sung một số điều của các nghị định liên quan đến việc nộp, xuất trình sổ hộ khẩu, sổ tạm trú giấy khi thực hiện thủ tục hành chính, cung cấp dịch vụ công;||Bản chính: 1Bản sao: 1|\n|+ Đối với tổ chức, cộng đồng dân cư, cơ sở tôn giáo thì nộp bổ sung văn bản của cơ quan có thẩm quyền cho phép hoặc công nhận việc thay đổi thông tin pháp nhân đối với trường hợp thay đổi thông tin về pháp nhân của tổ chức, cơ sở tôn giáo đã ghi trên Giấy chứng nhận.||Bản chính: 1Bản sao: 1|\n\nĐối tượng thực hiện:\nCông dân Việt Nam, Người Việt Nam định cư ở nước ngoài\nCơ quan thực hiện:\nVăn phòng đăng ký quyền sử dụng đất cấp huyện\nCơ quan có thẩm quyền:\nVăn phòng đăng ký quyền sử dụng đất cấp huyện, Ủy ban nhân dân cấp Huyện\nĐịa chỉ tiếp nhận HS:\nKhông có thông tin\nCơ quan được ủy quyền:\nKhông có thông tin\nCơ quan phối hợp:\nCơ quan thuế, Kho bạc nhà nước các cấp, Ủy ban nhân dân cấp xã\nKết quả thực hiện:\nGiấy chứng nhận quyền sử dụng đất quyền sở hữu nhà ở và tài sản khác gắn liền với đất tài sản khác gắn liền với đất, Ghi vào sổ địa chính và lập hồ sơ để Nhà nước quản lý.\nCăn cứ pháp lý:\n|Số ký hiệu|Trích yếu|Ngày ban hành|Cơ quan ban hành|\n|--|--|--|-|\n|45/2013/QH13|Luật 45/2013/QH13|29-11-2013|Quốc Hội|\n|23/2014/TT-BTNMT|Thông tư 23/2014/TT-BTNMT|19-05-2014|Bộ Tài nguyên và Môi trường|\n|24/2014/TT-BTNMT|Thông tư 24/2014/TT-BTNMT|19-05-2014|Bộ Tài nguyên và Môi trường|\n|02/2015/TT-BTNMT|Thông tư 02/2015/TT-BTNMT|27-01-2015|Bộ Tài nguyên và Môi trường|\n|01/2017/NĐ-CP|Nghị định 01/2017/NĐ-CP|06-01-2017|Chính phủ|\n|09/2021/TT-BTNMT|Thông tư 09/2021/TT-BTNMT|30-06-2021||\n|33/2017/TT-BTNMT|Thông tư 33/2017/TT-BTNMT|29-09-2017||\n|43/2014/NĐ-CP|Nghị định 43/2014/NĐ-CP|15-05-2014||\n|10/2023/NĐ-CP|Nghị định 10/2023/NĐ-CP|03-04-2023||\n|85/2019/TT-BTC|Thông tư 85/2019/TT-BTC|29-11-2019||\n|14/2023/TT- BTNMT|Thông tư số|16-10-2023|Bộ Tài nguyên và Môi trường|']","Người sử dụng đất nộp hồ sơ tại Văn phòng đăng ký quyền sử dụng đất thuộc Phòng Tài nguyên và Môi trường hoặc cơ quan tiếp nhận hồ sơ theo quy định của Ủy ban nhân dân cấp tỉnh.
Hộ gia đình, cá nhân, cộng đồng dân cư nộp hồ sơ tại Ủy ban nhân dân cấp xã nếu có nhu cầu.","|Hình thức nộp|Địa điểm nộp|
|--|--|
|Trực tiếp|Văn phòng đăng ký quyền sử dụng đất thuộc Phòng Tài nguyên và Môi trường hoặc cơ quan tiếp nhận hồ sơ theo quy định của Ủy ban nhân dân cấp tỉnh hoặc trên môi trường điện tử.|",0.8,0.8,0.0,0.7
5,Thời hạn giải quyết hồ sơ đăng ký biến động quyền sử dụng đất là bao lâu?,"['Chi tiết thủ tục hành chính:\nMã thủ tục:\n1.003877\nSố quyết định:\n3873/QĐ-BTNMT\nTên thủ tục:\nThủ tục đăng ký biến động về sử dụng đất, tài sản gắn liền với đất do thay đổi thông tin về người được cấp Giấy chứng nhận (đổi tên hoặc giấy tờ pháp nhân, giấy tờ nhân thân, địa chỉ); giảm diện tích thửa đất do sạt lở tự nhiên; thay đổi về hạn chế quyền sử dụng đất; thay đổi về nghĩa vụ tài chính; thay đổi về tài sản gắn liền với đất so với nội dung đã đăng ký, cấp Giấy chứng nhận\nCấp thực hiện:\nCấp Huyện\nLoại thủ tục:\nTTHC được luật giao quy định chi tiết\nLĩnh vực:\nĐất đai\nTrình tự thực hiện:\nTrực tiếp:\na) Người sử dụng đất nộp hồ sơ tại Văn phòng đăng ký quyền sử dụng đất thuộc Phòng Tài nguyên và Môi trường hoặc cơ quan tiếp nhận hồ sơ theo quy định của Ủy ban nhân dân tỉnh, thành phố trực thuộc Trung ương.\nHộ gia đình, cá nhân, cộng đồng dân cư nộp hồ sơ tại Ủy ban nhân dân cấp xã nếu có nhu cầu.\nTrường hợp nhận hồ sơ chưa đầy đủ, chưa hợp lệ thì trong thời gian tối đa 03 ngày, cơ quan tiếp nhận, xử lý hồ sơ phải thông báo và hướng dẫn người nộp hồ sơ bổ sung, hoàn chỉnh hồ sơ theo quy định.\nTrường hợp người sử dụng đất có nhu cầu chuyển mục đích sử dụng đất kết hợp với đăng ký biến động về các nội dung của thủ tục này thì thực hiện thủ tục này đồng thời với thủ tục chuyển mục đích sử dụng đất.\nb) Cơ quan tiếp nhận hồ sơ ghi đầy đủ thông tin vào Sổ tiếp nhận hồ sơ và trả kết quả, trao Phiếu tiếp nhận hồ sơ và trả kết quả cho người nộp hồ sơ.\nTrường hợp nộp hồ sơ tại Ủy ban nhân dân cấp xã thì trong thời hạn 03 ngày làm việc kể từ ngày nhận đủ hồ sơ, Ủy ban nhân dân cấp xã phải chuyển hồ sơ đến Văn phòng đăng ký quyền sử dụng đất.\nc) Văn phòng đăng ký quyền sử dụng đất có trách nhiệm kiểm tra hồ sơ, nếu đủ điều kiện thực hiện các quyền theo quy định thì thực hiện các công việc sau đây:\n- Trích đo địa chính thửa đất đối với trường hợp có thay đổi về diện tích thửa đất, tài sản gắn liền với đất hoặc trường hợp đã cấp Giấy chứng nhận nhưng chưa có bản đồ địa chính, chưa trích đo địa chính thửa đất;\n- Trường hợp đăng ký thay đổi diện tích xây dựng, diện tích sử dụng, tầng cao, kết cấu, cấp (hạng) nhà hoặc công trình xây dựng mà không phù hợp với giấy phép xây dựng hoặc không có giấy phép xây dựng đối với trường hợp phải xin phép thì gửi phiếu lấy ý kiến của cơ quan quản lý, cấp phép xây dựng theo quy định của pháp luật về xây dựng;\n- Gửi thông tin địa chính cho cơ quan thuế để xác định và thông báo thu nghĩa vụ tài chính đối với trường hợp phải nộp tiền sử dụng đất, tiền thuê đất theo quy định của pháp luật;\n- Xác nhận thay đổi vào Giấy chứng nhận đã cấp hoặc lập hồ sơ trình cơ quan có thẩm quyền cấp Giấy chứng nhận quyền sử dụng đất, quyền sở hữu nhà ở và tài sản khác gắn liền với đất đối với trường hợp phải cấp lại Giấy chứng nhận theo quy định của Bộ Tài nguyên và Môi trường; thông báo cho người sử dụng đất ký hoặc ký lại hợp đồng thuê đất với cơ quan tài nguyên và môi trường đối với trường hợp phải thuê đất;\n- Chỉnh lý, cập nhật biến động vào hồ sơ địa chính, cơ sở dữ liệu đất đai.\nd) Văn phòng đăng ký quyền sử dụng đất trao Giấy chứng nhận cho người được cấp hoặc gửi Ủy ban nhân dân cấp xã để trao đối với trường hợp nộp hồ sơ tại cấp xã.\nThực hiện thủ tục trên môi trường điện tử:\nCơ quan tiếp nhận, giải quyết hồ sơ có trách nhiệm thực hiện các trình tự, thủ tục hành chính về đất đai theo quy định của pháp luật về đất đai; trường hợp cần phải kiểm tra, xác minh làm rõ hoặc do nguyên nhân khác mà không trả kết quả giải quyết hồ sơ theo đúng quy định về thời gian giải quyết thủ tục hành chính về đất đai thì cơ quan tiếp nhận hồ sơ, giải quyết thủ tục gửi thông báo bằng văn bản hoặc qua Cổng dịch vụ công hoặc qua tin nhắn SMS cho người yêu cầu, trong đó nêu rõ lý do.\nNgười sử dụng đất, chủ sở hữu tài sản gắn liền với đất có trách nhiệm hoàn thành nghĩa vụ tài chính theo quy định của pháp luật bằng hình thức trực tiếp hoặc trực tuyến thông qua chức năng thanh toán của Cổng dịch vụ công.\nCơ quan tiếp nhận hoặc cơ quan giải quyết hồ sơ thông báo cho người yêu cầu thực hiện thủ tục hành chính nộp bản chính Giấy chứng nhận đã cấp, các giấy tờ theo quy định sau khi người sử dụng đất hoàn thành nghĩa vụ tài chính.\nViệc trả kết quả giải quyết thủ tục hành chính được thực hiện tại cơ quan tiếp nhận hồ sơ hoặc qua dịch vụ bưu chính công ích hoặc tại địa điểm theo yêu cầu đối với trường hợp tiếp nhận hồ sơ và trả kết quả giải quyết thủ tục đăng ký đất đai, tài sản khác gắn liền với đất.\nCách thức thực hiện:\n|Hình thức nộp|Thời hạn giải quyết|Phí, lệ phí|Mô tả|\n|--|--|--|-|\n|Trực tiếp|10 Ngày làm việc|Lệ phí : Đồng Thực hiện theo quy định của Luật Phí, lệ phí.|Cách thức thực hiện: Người sử dụng đất nộp hồ sơ tại Văn phòng đăng ký quyền sử dụng đất thuộc Phòng Tài nguyên và Môi trường hoặc cơ quan tiếp nhận hồ sơ theo quy định của Ủy ban nhân dân cấp tỉnh. Hộ gia đình, cá nhân, cộng đồng dân cư nộp hồ sơ tại Ủy ban nhân dân cấp xã nếu có nhu cầu. Thời hạn giải quyết: Do Ủy ban nhân dân cấp tỉnh quy định nhưng không quá 10 ngày kể từ ngày nhận được hồ sơ hợp lệ. Thời gian này không tính thời gian các ngày nghỉ, ngày lễ theo quy định của pháp luật; không tính thời gian tiếp nhận hồ sơ tại xã, thời gian thực hiện nghĩa vụ tài chính của người sử dụng đất; không tính thời gian xem xét xử lý đối với trường hợp sử dụng đất có vi phạm pháp luật, thời gian trưng cầu giám định. Đối với các xã miền núi, hải đảo, vùng sâu, vùng xa, vùng có điều kiện kinh tế - xã hội khó khăn, vùng có điều kiện kinh tế - xã hội đặc biệt khó khăn thì thời gian thực hiện được tăng thêm 10 ngày. Kết quả giải quyết thủ tục hành chính phải trả cho người sử dụng đất, chủ sở hữu tài sản gắn liền với đất trong thời hạn không quá 03 ngày làm việc kể từ ngày có kết quả giải quyết.|\n\nThành phần hồ sơ:\n\n(*) Trường hợp xác nhận thay đổi thông tin về số Giấy chứng minh nhân dân, số thẻ Căn cước công dân, địa chỉ trên Giấy chứng nhận đã cấp theo nhu cầu của người sử dụng đất, chủ sở hữu tài sản gắn liền với đất, gồm có:\n|Tên giấy tờ|Mẫu đơn, tờ khai|Số lượng|\n|--|--|-|\n|a) Đơn đăng ký biến động đất đai, tài sản gắn liền với đất theo Mẫu số 09/ĐK;|<a href=""https://csdl.dichvucong.gov.vn/web/jsp/download_file.jsp?ma=\'3fca097995cb2bac\'"">mau so 09.doc</a>|Bản chính: 1Bản sao: 0|\n|b) Bản gốc Giấy chứng nhận đã cấp;||Bản chính: 1Bản sao: 0|\n|c) Bản sao Giấy CMND/thẻ căn cước công dân/số định danh cá nhân, hộ chiếu mới hoặc Giấy chứng minh quân đội mới hoặc thẻ Căn cước công dân mới hoặc sổ hộ khẩu, giấy tờ khác chứng minh thay đổi nhân thân đối với trường hợp thay đổi thông tin về nhân thân của người có tên trên Giấy chứng nhận; Trường hợp dữ liệu quốc gia về dân cư được chia sẻ và kết nối với dữ liệu của các ngành, các lĩnh vực (trong đó có lĩnh vực đất đai) thì cơ quan tiếp nhận hồ sơ sử dụng dữ liệu từ cơ sở dữ liệu quốc gia về dân cư mà không yêu cầu người nộp hồ sơ phải nộp bản sao CMND/thẻ căn cước công dân/số định danh cá nhân, hộ chiếu hoặc Giấy chứng minh quân đội hoặc sổ hộ khẩu hoặc giấy tờ khác để chứng minh nhân thân.||Bản chính: 0Bản sao: 1|\n\n\n(*) Trường hợp đăng ký biến động về sử dụng đất, tài sản gắn liền với đất do người sử dụng đất, chủ sở hữu tài sản gắn liền với đất được đổi tên; giảm diện tích thửa đất do sạt lở tự nhiên; thay đổi về hạn chế quyền sử dụng đất; thay đổi về nghĩa vụ tài chính; thay đổi về tài sản gắn liền với đất so với nội dung đã đăng ký, cấp Giấy chứng nhận gồm có:\n|Tên giấy tờ|Mẫu đơn, tờ khai|Số lượng|\n|--|--|-|\n|1. Đơn đăng ký biến động đất đai, tài sản gắn liền với đất theo Mẫu số 09/ĐK;|<a href=""https://csdl.dichvucong.gov.vn/web/jsp/download_file.jsp?ma=\'3fe7518ba157a40a\'"">mau so 09.doc</a>|Bản chính: 1Bản sao: 0|\n|2. Bản gốc Giấy chứng nhậnđã cấp;||Bản chính: 1Bản sao: 0|\n|3. Một trong các giấy tờ liên quan đến nội dung biến động:||Bản chính: Bản sao:|\n|- Văn bản công nhận của cơ quan nhà nước có thẩm quyền theo quy định của pháp luật đối với trường hợp cá nhân hoặc người đại diện hộ gia đình thay đổi họ, tên;||Bản chính: 1Bản sao: 0|\n|- Văn bản thỏa thuận của cộng đồng dân cư được Ủy ban nhân dân cấp xã xác nhận đối với trường hợp cộng đồng dân cư đổi tên;||Bản chính: 1Bản sao: 0|\n|- Văn bản xác nhận của Ủy ban nhân dân cấp xã về tình trạng sạt lở tự nhiên đối với trường hợp giảm diện tích thửa đất, tài sản gắn liền với đất do sạt lở tự nhiên;||Bản chính: 1Bản sao: 0|\n|- Chứng từ về việc nộp nghĩa vụ tài chính đối với trường hợp Giấy chứng nhận đã cấp có ghi nợ hoặc chậm nộp nghĩa vụ tài chính, trừ trường hợp người sử dụng đất được miễn giảm hoặc không phải nộp do thay đổi quy định của pháp luật;||Bản chính: 1Bản sao: 0|\n|- Quyết định của cơ quan nhà nước có thẩm quyền về việc thay đổi hạn chế về quyềnsử dụng đất, quyền sở hữu tài sản gắn liền với đất ghi trên Giấy chứng nhận đối với trường hợp có hạn chế theo quyết định giao đất, cho thuê đất, công nhận quyền sử dụng đất; trường hợp có thay đổi hạn chế theo văn bản chuyển quyền sử dụng đất thì phải có văn bản chấp thuận thay đổi hạn chế của người có quyền lợi liên quan, được Ủy ban nhân dân cấp xã xác nhận;||Bản chính: 1Bản sao: 0|\n|- Bản sao một trong các giấy tờ về quyền sở hữu tài sản gắn liền với đất thể hiện nội dung thay đổi đối với trường hợp thay đổi thông tin về tài sản gắn liền với đất đã ghi trên Giấy chứng nhận.||Bản chính: 0Bản sao: 1|\n|- Văn bản thỏa thuận của hộ gia đình được Ủy ban nhân dân cấp xã xác nhận đối với trường hợp thay đổi người đại diện là thành viên trong hộ gia đình mà không phải là chủ hộ; trường hợp thay đổi người đại diện hộ gia đình là chủ hộ thì cơ quan giải quyết thủ tục có trách nhiệm khai thác, sử dụng thông tin trong Cơ sở dữ liệu quốc gia về dân cư theo quy định tại Điều 14 Nghị định số 104/2022/NĐ-CP ngày 21 tháng 12 năm 2022 của Chính phủ sửa đổi, bổ sung một số điều của các nghị định liên quan đến việc nộp, xuất trình sổ hộ khẩu, sổ tạm trú giấy khi thực hiện thủ tục hành chính, cung cấp dịch vụ công.||Bản chính: 1Bản sao: 0|', 'Chi tiết thủ tục hành chính:\nMã thủ tục:\n2.000410\nSố quyết định:\n3873/QĐ-BTNMT\nTên thủ tục:\nĐăng ký biến động quyền sử dụng đất, quyền sở hữu tài sản gắn liền với đất trong các trường hợp chuyển nhượng, cho thuê, cho thuê lại, thừa kế, tặng cho, góp vốn bằng quyền sử dụng đất, quyền sở hữu tài sản gắn liền với đất; chuyển quyền sử dụng đất, quyền sở hữu tài sản gắn liền với đất của vợ hoặc chồng thành của chung vợ và chồng; tăng thêm diện tích do nhận chuyển nhượng, thừa kế, tặng cho quyền sử dụng đất đã có Giấy chứng nhận\nCấp thực hiện:\nCấp Huyện\nLoại thủ tục:\nTTHC không được luật giao cho địa phương quy định hoặc quy định chi tiết\nLĩnh vực:\nĐất đai\nTrình tự thực hiện:\nTrực tiếp\n(1) Người sử dụng đất nộp hồ sơ tại Văn phòng đăng ký quyền sử dụng đất thuộc Phòng Tài nguyên và Môi trường hoặc cơ quan tiếp nhận hồ sơ theo quy định của Ủy ban nhân dân tỉnh, thành phố trực thuộc Trung ương. \nHộ gia đình, cá nhân, cộng đồng dân cư nộp hồ sơ tại Ủy ban nhân dân cấp xã nếu có nhu cầu.\nTrường hợp thực hiện quyền của người sử dụng đất đối với một phần thửa đất thì người sử dụng đất đề nghị Văn phòng đăng ký quyền sử dụng đất thực hiện đo đạc tách thửa đối với phần diện tích cần thực hiện quyền của người sử dụng đất trước khi nộp hồ sơ thực hiện quyền của người sử dụng đất.\nTrường hợp nhận hồ sơ chưa đầy đủ, chưa hợp lệ thì trong thời gian tối đa 03 ngày, cơ quan tiếp nhận, xử lý hồ sơ phải thông báo và hướng dẫn người nộp hồ sơ bổ sung, hoàn chỉnh hồ sơ theo quy định. \n(2) Cơ quan tiếp nhận hồ sơ ghi đầy đủ thông tin vào Sổ tiếp nhận hồ sơ và trả kết quả, trao Phiếu tiếp nhận hồ sơ và trả kết quả cho người nộp hồ sơ.\nTrường hợp nộp hồ sơ tại Ủy ban nhân dân cấp xã thì trong thời hạn 03 ngày làm việc kể từ ngày nhận đủ hồ sơ, Ủy ban nhân dân cấp xã phải chuyển hồ sơ đến Văn phòng đăng ký quyền sử dụng đất. \n(3) Văn phòng đăng ký quyền sử dụng đất có trách nhiệm kiểm tra hồ sơ, nếu đủ điều kiện thực hiện các quyền theo quy định thì thực hiện các công việc sau đây:\n- Thông báo cho bên chuyển quyền sử dụng đất và niêm yết tại Ủy ban nhân dân cấp xã về việc làm thủ tục cấp Giấy chứng nhận cho người nhận chuyển quyền đối với trường hợp bên nhận chuyển quyền chỉ có Giấy chứng nhận của bên chuyển quyền; gửi văn bản đề nghị xác nhận hộ gia đình, cá nhân trực tiếp sản xuất nông nghiệp đến Ủy ban nhân dân cấp xã nơi đăng ký thường trú, Ủy ban nhân dân cấp xã nơi có đất đối với trường hợp nhận chuyển nhượng, nhận tặng cho quyền sử dụng đất trồng lúa của hộ gia đình, cá nhân;\n- Gửi thông tin địa chính đến cơ quan thuế để xác định và thông báo thu nghĩa vụ tài chính đối với trường hợp phải thực hiện nghĩa vụ tài chính theo quy định;\n- Xác nhận nội dung biến động vào Giấy chứng nhận đã cấp theo quy định của Bộ Tài nguyên và Môi trường.\nTrường hợp phải cấp Giấy chứng nhận thì lập hồ sơ trình cơ quan có thẩm quyền cấp Giấy chứng nhận cho người sử dụng đất.\n- Chỉnh lý, cập nhật biến động vào hồ sơ địa chính, cơ sở dữ liệu đất đai.\n- Trao Giấy chứng nhận cho người sử dụng đất hoặc gửi Ủy ban nhân dân cấp xã để trao đối với trường hợp nộp hồ sơ tại cấp xã.\nTrường hợp người đề nghị cấp Giấy chứng nhận đã chết trước khi được trao Giấy chứng nhận thì người được thừa kế quyền sử dụng đất theo quy định của pháp luật thừa kế nộp bổ sung giấy tờ về thừa kế theo quy định. Văn phòng đăng ký quyền sử dụng đất xác nhận thừa kế vào Giấy chứng nhận đã ký hoặc lập hồ sơ để trình cơ quan có thẩm quyền cấp Giấy chứng nhận quyền sử dụng đất, quyền sở hữu nhà ở và tài sản khác gắn liền với đất cho người được thừa kế theo quy định của Bộ Tài nguyên và Môi trường. Người được thừa kế có trách nhiệm thực hiện nghĩa vụ tài chính về quyền sử dụng đất, tài sản gắn liền với đất trong trường hợp người được cấp Giấy chứng nhận đã chết phải thực hiện theo quy định của pháp luật.\n- Xác nhận vào bản chính giấy tờ việc đã cấp Giấy chứng nhận theo quy định.\n(4) Người được cấp Giấy chứng nhận nhận lại bản chính giấy tờ đã được xác nhận cấp Giấy chứng nhận và Giấy chứng nhận.\n* Trường hợp người sử dụng đất tặng cho quyền sử dụng đất để xây dựng công trình công cộng thì phải lập văn bản tặng cho quyền sử dụng đất theo quy định.\nSau khi hoàn thành xây dựng công trình công cộng trên đất được tặng cho, Văn phòng đăng ký quyền sử dụng đất căn cứ vào văn bản tặng cho quyền sử dụng đất đã được Ủy ban nhân dân cấp xã xác nhận và hiện trạng sử dụng đất để đo đạc, chỉnh lý biến động vào hồ sơ địa chính, cơ sở dữ liệu đất đai và thông báo cho người sử dụng đất nộp Giấy chứng nhận đã cấp để xác nhận thay đổi. Trường hợp người sử dụng đất tặng cho toàn bộ diện tích đất đã cấp Giấy chứng nhận thì thu hồi Giấy chứng nhận để quản lý.\nThực hiện thủ tục trên môi trường điện tử\nCơ quan tiếp nhận, giải quyết hồ sơ có trách nhiệm thực hiện các trình tự, thủ tục hành chính về đất đai theo quy định của pháp luật về đất đai; trường hợp cần phải kiểm tra, xác minh làm rõ hoặc do nguyên nhân khác mà không trả kết quả giải quyết hồ sơ theo đúng quy định về thời gian giải quyết thủ tục hành chính về đất đai thì cơ quan tiếp nhận hồ sơ, giải quyết thủ tục gửi thông báo bằng văn bản hoặc qua Cổng dịch vụ công hoặc qua tin nhắn SMS cho người yêu cầu, trong đó nêu rõ lý do.\nNgười sử dụng đất, chủ sở hữu tài sản gắn liền với đất có trách nhiệm hoàn thành nghĩa vụ tài chính theo quy định của pháp luật bằng hình thức trực tiếp hoặc trực tuyến thông qua chức năng thanh toán của Cổng dịch vụ công.\nCơ quan tiếp nhận hoặc cơ quan giải quyết hồ sơ thông báo cho người yêu cầu thực hiện thủ tục hành chính nộp bản chính Giấy chứng nhận đã cấp, các giấy tờ theo quy định sau khi người sử dụng đất hoàn thành nghĩa vụ tài chính.\n\tViệc trả kết quả giải quyết thủ tục hành chính được thực hiện tại cơ quan tiếp nhận hồ sơ hoặc qua dịch vụ bưu chính công ích hoặc tại địa điểm theo yêu cầu đối với trường hợp tiếp nhận hồ sơ và trả kết quả giải quyết thủ tục đăng ký đất đai, tài sản khác gắn liền với đất.\nCách thức thực hiện:\n|Hình thức nộp|Thời hạn giải quyết|Phí, lệ phí|Mô tả|\n|--|--|--|-|\n|Trực tiếp|10 Ngày làm việc|Phí : Thực hiện theo quy định của Luật Phí, lệ phí.|Cách thức thực hiện: Người sử dụng đất nộp hồ sơ tại Văn phòng đăng ký quyền sử dụng đất thuộc Phòng Tài nguyên và Môi trường hoặc cơ quan tiếp nhận hồ sơ theo quy định của Ủy ban nhân dân cấp tỉnh hoặc trên môi trường điện tử. Hộ gia đình, cá nhân, cộng đồng dân cư nộp hồ sơ tại Ủy ban nhân dân cấp xã nếu có nhu cầu. Thời hạn giải quyết: Do Ủy ban nhân dân cấp tỉnh quy định. Cụ thể: - Thời gian thực hiện thủ tục đăng ký biến động quyền sử dụng đất, quyền sở hữu tài sản gắn liền với đất trong trường hợp chuyển đổi, chuyển nhượng, thừa kế, tặng cho, đăng ký góp vốn bằng quyền sử dụng đất, quyền sở hữu tài sản gắn liền với đất là không quá 10 ngày kể từ ngày nhận được hồ sơ hợp lệ; - Thời gian thực hiện thủ tục đăng ký biến động quyền sử dụng đất, quyền sở hữu tài sản gắn liền với đất trong trường hợp cho thuê, cho thuê lại quyền sử dụng đất là không quá 03 ngày kể từ ngày nhận được hồ sơ hợp lệ; - Thời gian thực hiện thủ tục đăng ký biến động quyền sử dụng đất, quyền sở hữu tài sản gắn liền với đất trong trường hợp chuyển quyền sử dụng đất, quyền sở hữu tài sản gắn liền với đất của vợ hoặc chồng thành của chung vợ và chồng là không quá 05 ngày kể từ ngày nhận được hồ sơ hợp lệ; Thời gian này không tính thời gian các ngày nghỉ, ngày lễ theo quy định của pháp luật; không tính thời gian tiếp nhận hồ sơ tại xã, thời gian thực hiện nghĩa vụ tài chính của người sử dụng đất; không tính thời gian xem xét xử lý đối với trường hợp sử dụng đất có vi phạm pháp luật, thời gian trưng cầu giám định. Đối với các xã miền núi, hải đảo, vùng sâu, vùng xa, vùng có điều kiện kinh tế - xã hội khó khăn, vùng có điều kiện kinh tế - xã hội đặc biệt khó khăn thì thời gian thực hiện được tăng thêm 10 ngày. - Kết quả giải quyết thủ tục hành chính phải trả cho người sử dụng đất, chủ sở hữu tài sản gắn liền với đất trong thời hạn không quá 03 ngày làm việc kể từ ngày có kết quả giải quyết.|\n\nThành phần hồ sơ:', 'Thành phần hồ sơ:\n\nc.1) Hồ sơ nộp khi thực hiện đăng ký biến động quyền sử dụng đất, quyền sở hữu tài sản gắn liền với đất trong các trường hợp chuyển đổi quyền sử dụng đất nông nghiệp mà không thuộc trường hợp “dồn điền đổi thửa”, chuyển nhượng, cho thuê, cho thuê lại, thừa kế, tặng cho, góp vốn bằng quyền sử dụng đất, quyền sở hữu tài sản gắn liền với đất; chuyển quyền sử dụng đất, quyền sở hữu tài sản gắn liền với đất của vợ hoặc chồng thành của chung vợ và chồng\n|Tên giấy tờ|Mẫu đơn, tờ khai|Số lượng|\n|--|--|-|\n|(1) Đơn đăng ký biến động đất đai, tài sản gắn liền với đất theo Mẫu số 09/ĐK. Đối với trường hợp hộ gia đình, cá nhân nhận chuyển quyền sử dụng đất nông nghiệp thì phải thể hiện tổng diện tích nhận chuyển quyền tại điểm 4 Mục I của Mẫu số 09/ĐK ban hành kèm theo Thông tư số 33/2017/TT-BTNMT (được sửa đổi, bổ sung tại Thông tư số 14/2023/TT-BTNMT ngày 16 tháng 10 năm 2023) (Lý do biến động) như sau: “Nhận … (ghi hình thức chuyển quyền sử dụng đất) …m2 đất (ghi diện tích đất nhận chuyển quyền); tổng diện tích đất nông nghiệp đang sử dụng do nhận chuyển quyền và đã đăng ký chuyển quyền sử dụng đất từ ngày 01/7/2007 đến trước ngày 01/7/2014 là … m2 và từ ngày 01/7/2014 đến nay là … m2 (ghi cụ thể diện tích nhận chuyển quyền theo từng loại đất, từng địa bàn tỉnh, thành phố trực thuộc Trung ương)”;|<a href=""https://csdl.dichvucong.gov.vn/web/jsp/download_file.jsp?ma=\'3fe998b4cf4ed90a\'"">Mau so 09-DK.pdf</a>|Bản chính: 1Bản sao: 0|\n|(2) Hợp đồng, văn bản về việc chuyển đổi, chuyển nhượng, cho thuê, cho thuê lại, thừa kế, tặng cho quyền sử dụng đất, quyền sở hữu tài sản gắn liền với đất; góp vốn bằng quyền sử dụng đất, quyền sở hữu tài sản gắn liền với đất; chuyển quyền sử dụng đất, quyền sở hữu tài sản gắn liền với đất của vợ hoặc chồng thành của chung vợ và chồng theo quy định. Trường hợp người thừa kế quyền sử dụng đất, quyền sở hữu tài sản gắn liền với đất là người duy nhất thì phải có đơn đề nghị được đăng ký thừa kế quyền sử dụng đất, quyền sở hữu tài sản gắn liền với đất của người thừa kế;||Bản chính: 1Bản sao: 0|\n|(3) Bản gốc Giấy chứng nhận đã cấp;||Bản chính: 1Bản sao: 0|\n|(4) Văn bản của người sử dụng đất đồng ý cho chủ sở hữu tài sản gắn liền với đất được chuyển nhượng, tặng cho, cho thuê, góp vốn tài sản gắn liền với đất đối với trường hợp chuyển nhượng, tặng cho, cho thuê, góp vốn bằng tài sản gắn liền với đất mà chủ sở hữu tài sản gắn liền với đất không đồng thời là người sử dụng đất.||Bản chính: 1Bản sao: 0|\n|(5) Trường hợp người đề nghị cấp Giấy chứng nhận đã chết trước khi được trao Giấy chứng nhận thì người được thừa kế quyền sử dụng đất theo quy định của pháp luật thừa kế nộp bổ sung giấy tờ về thừa kế theo quy định.||Bản chính: 1Bản sao: 0|\n|(6) Văn bản của các thành viên trong hộ gia đình sử dụng đất đồng ý chuyển quyền sử dụng đất của hộ gia đình đã được công chứng hoặc chứng thực theo quy định của pháp luật.||Bản chính: 1Bản sao: 0|\n|(7) Văn bản xác nhận trực tiếp sản xuất nông nghiệp đối với trường hợp nhận chuyển nhượng, tặng cho quyền sử dụng đất trồng lúa.||Bản chính: 1Bản sao: 0|\n\n\nc.2) Hồ sơ nộp khi cấp Giấy chứng nhận đối với trường hợp diện tích đất tăng thêm do nhận chuyển nhượng, thừa kế, tặng cho quyền sử dụng đất đã có Giấy chứng nhận trong trường hợp thửa đất gốc đã được cấp Giấy chứng nhận:\n|Tên giấy tờ|Mẫu đơn, tờ khai|Số lượng|\n|--|--|-|\n|(1) Đơn đề nghị cấp lại, cấp đổi Giấy chứng nhận quyền sử dụng đất, quyền sở hữu nhà ở và tài sản khác gắn liền với đất theo Mẫu số 10/ĐK|<a href=""https://csdl.dichvucong.gov.vn/web/jsp/download_file.jsp?ma=\'3fe2f78f7bc72401\'"">Mau so 10-DK.pdf</a>|Bản chính: 1Bản sao: 0|\n|(2) Bản gốc Giấy chứng nhận của thửa đất gốc;||Bản chính: 1Bản sao: 0|\n|(3) Bản gốc Giấy chứng nhận và hợp đồng, văn bản về việc chuyển nhượng, thừa kế, tặng cho quyền sử dụng đất được lập theo quy định của diện tích đất tăng thêm. Trường hợp nhận chuyển nhượng, thừa kế, tặng cho phần diện tích đất tăng thêm theo quy định tại Khoản 2 Điều 82 của Nghị định số 43/2014/NĐ-CP thì nộp bản gốc Giấy chứng nhận của bên chuyển quyền sử dụng đất hoặc hợp đồng, văn bản về việc chuyển nhượng, thừa kế, tặng cho quyền sử dụng đất của diện tích đất tăng thêm.||Bản chính: 1Bản sao: 0|\n\n\nc.3) Hồ sơ nộp khi thực hiện thủ tục xác định lại diện tích đất ở cho hộ gia đình, cá nhân đã được cấp Giấy chứng nhận bao gồm:\n|Tên giấy tờ|Mẫu đơn, tờ khai|Số lượng|\n|--|--|-|\n|(1) Đơn đăng ký biến động đất đai, tài sản gắn liền với đất theo Mẫu số 09/ĐK|<a href=""https://csdl.dichvucong.gov.vn/web/jsp/download_file.jsp?ma=\'3fcb0da797e44608\'"">Mau so 09-DK.pdf</a>|Bản chính: 1Bản sao: 0|\n|(2) Bản gốc Giấy chứng nhận đã cấp.||Bản chính: 1Bản sao: 0|\n\n\nc.4) Đối với trường hợp thực hiện thủ tục đăng ký biến động đất đai, tài sản gắn liền với đất tại các khoản c.1, c.2 và c.3 mà có thay đổi thông tin về pháp nhân, số Giấy chứng minh nhân dân, số thẻ Căn cước công dân, số định danh cá nhân, địa chỉ trên Giấy chứng nhận đã cấp thì thực hiện như sau:\n|Tên giấy tờ|Mẫu đơn, tờ khai|Số lượng|\n|--|--|-|\n|+ Đối với cá nhân thì cơ quan giải quyết thủ tục có trách nhiệm khai thác, sử dụng thông tin trong Cơ sở dữ liệu quốc gia về dân cư theo quy định tại Điều 14 Nghị định số 104/2022/NĐ-CP ngày 21 tháng 12 năm 2022 của Chính phủ sửa đổi, bổ sung một số điều của các nghị định liên quan đến việc nộp, xuất trình sổ hộ khẩu, sổ tạm trú giấy khi thực hiện thủ tục hành chính, cung cấp dịch vụ công;||Bản chính: 1Bản sao: 1|\n|+ Đối với tổ chức, cộng đồng dân cư, cơ sở tôn giáo thì nộp bổ sung văn bản của cơ quan có thẩm quyền cho phép hoặc công nhận việc thay đổi thông tin pháp nhân đối với trường hợp thay đổi thông tin về pháp nhân của tổ chức, cơ sở tôn giáo đã ghi trên Giấy chứng nhận.||Bản chính: 1Bản sao: 1|\n\nĐối tượng thực hiện:\nCông dân Việt Nam, Người Việt Nam định cư ở nước ngoài\nCơ quan thực hiện:\nVăn phòng đăng ký quyền sử dụng đất cấp huyện\nCơ quan có thẩm quyền:\nVăn phòng đăng ký quyền sử dụng đất cấp huyện, Ủy ban nhân dân cấp Huyện\nĐịa chỉ tiếp nhận HS:\nKhông có thông tin\nCơ quan được ủy quyền:\nKhông có thông tin\nCơ quan phối hợp:\nCơ quan thuế, Kho bạc nhà nước các cấp, Ủy ban nhân dân cấp xã\nKết quả thực hiện:\nGiấy chứng nhận quyền sử dụng đất quyền sở hữu nhà ở và tài sản khác gắn liền với đất tài sản khác gắn liền với đất, Ghi vào sổ địa chính và lập hồ sơ để Nhà nước quản lý.\nCăn cứ pháp lý:\n|Số ký hiệu|Trích yếu|Ngày ban hành|Cơ quan ban hành|\n|--|--|--|-|\n|45/2013/QH13|Luật 45/2013/QH13|29-11-2013|Quốc Hội|\n|23/2014/TT-BTNMT|Thông tư 23/2014/TT-BTNMT|19-05-2014|Bộ Tài nguyên và Môi trường|\n|24/2014/TT-BTNMT|Thông tư 24/2014/TT-BTNMT|19-05-2014|Bộ Tài nguyên và Môi trường|\n|02/2015/TT-BTNMT|Thông tư 02/2015/TT-BTNMT|27-01-2015|Bộ Tài nguyên và Môi trường|\n|01/2017/NĐ-CP|Nghị định 01/2017/NĐ-CP|06-01-2017|Chính phủ|\n|09/2021/TT-BTNMT|Thông tư 09/2021/TT-BTNMT|30-06-2021||\n|33/2017/TT-BTNMT|Thông tư 33/2017/TT-BTNMT|29-09-2017||\n|43/2014/NĐ-CP|Nghị định 43/2014/NĐ-CP|15-05-2014||\n|10/2023/NĐ-CP|Nghị định 10/2023/NĐ-CP|03-04-2023||\n|85/2019/TT-BTC|Thông tư 85/2019/TT-BTC|29-11-2019||\n|14/2023/TT- BTNMT|Thông tư số|16-10-2023|Bộ Tài nguyên và Môi trường|']","Do Ủy ban nhân dân cấp tỉnh quy định nhưng không quá 10 ngày kể từ ngày nhận được hồ sơ hợp lệ.
Thời gian này không tính thời gian các ngày nghỉ, ngày lễ theo quy định của pháp luật; không tính thời gian tiếp nhận hồ sơ tại xã, thời gian thực hiện nghĩa vụ tài chính của người sử dụng đất; không tính thời gian xem xét xử lý đối với trường hợp sử dụng đất có vi phạm pháp luật, thời gian trưng cầu giám định.
Đối với các xã miền núi, hải đảo, vùng sâu, vùng xa, vùng có điều kiện kinh tế - xã hội khó khăn, vùng có điều kiện kinh tế - xã hội đặc biệt khó khăn thì thời gian thực hiện được tăng thêm 10 ngày.
Kết quả giải quyết thủ tục hành chính phải trả cho người sử dụng đất, chủ sở hữu tài sản gắn liền với đất trong thời hạn không quá 03 ngày làm việc kể từ ngày có kết quả giải quyết.","|Hình thức nộp|Thời hạn giải quyết|
|--|--|
|Trực tiếp|10 Ngày làm việc|",0.8,0.7,0.7,0.7
6,Tôi có thể nộp hồ sơ xin cấp hộ chiếu trực tiếp ở đâu?,"['\n|* Lưu ý: Việc nộp hồ sơ đăng ký cư trú - Trường hợp nộp hồ sơ trực tiếp tại cơ quan đăng ký cư trú thì người yêu cầu đăng ký cư trú có thể nộp bản sao giấy tờ, tài liệu được chứng thực từ bản chính hoặc bản sao giấy tờ được cấp từ sổ gốc (sau đây gọi là bản sao) hoặc bản quét, bản chụp kèm theo bản chính giấy tờ, tài liệu để đối chiếu. Trường hợp người yêu cầu đăng ký cư trú nộp bản quét hoặc bản chụp kèm theo bản chính giấy tờ để đối chiếu thì người tiếp nhận có trách nhiệm kiểm tra, đối chiếu bản quét, bản chụp với bản chính và ký xác nhận, không được yêu cầu nộp bản sao giấy tờ đó. - Trường hợp thực hiện đăng ký cư trú trực tuyến, người yêu cầu đăng ký cư trú khai báo thông tin theo biểu mẫu điện tử được cung cấp sẵn, đăng tải bản quét hoặc bản chụp giấy tờ, tài liệu hợp lệ (không bắt buộc phải công chứng, chứng thực, ký số hoặc xác thực bằng hình thức khác) hoặc dẫn nguồn tài liệu từ Kho quản lý dữ liệu điện tử của tổ chức, cá nhân. Trường hợp công dân đăng tải bản quét, bản chụp giấy tờ, tài liệu mà không được ký số hoặc xác thực bằng hình thức khác thì khi cơ quan đăng ký cư trú tiến hành kiểm tra, xác minh để giải quyết thủ tục về cư trú; công dân có trách nhiệm xuất trình giấy tờ, tài liệu đã đăng tải để cơ quan đăng ký cư trú kiểm tra, đối chiếu và ghi nhận tính chính xác vào biên bản xác minh. Cơ quan đăng ký cư trú không yêu cầu công dân nộp để lưu giữ giấy tờ đó. - Bản quét hoặc bản chụp giấy tờ bằng thiết bị điện tử từ giấy tờ được cấp hợp lệ, còn giá trị sử dụng phải bảo đảm rõ nét, đầy đủ, toàn vẹn về nội dung; đã được hợp pháp hóa lãnh sự, dịch sang tiếng Việt theo quy định nếu là giấy tờ do cơ quan có thẩm quyền nước ngoài cấp trừ trường hợp được miễn hợp pháp hóa lãnh sự. - Trường hợp thông tin giấy tờ chứng minh điều kiện đăng ký cư trú đã được chia sẻ và khai thác từ cơ sở dữ liệu quốc gia, cơ sở dữ liệu chuyên ngành thì cơ quan đăng ký cư trú không được yêu cầu công dân nộp, xuất trình giấy tờ đó để giải quyết đăng ký cư trú.|         |Bản chính: 0Bản sao: 0|', '\n|* Lưu ý: Việc nộp hồ sơ đăng ký cư trú - Trường hợp nộp hồ sơ trực tiếp tại cơ quan đăng ký cư trú thì người yêu cầu đăng ký cư trú có thể nộp bản sao giấy tờ, tài liệu được chứng thực từ bản chính hoặc bản sao giấy tờ được cấp từ sổ gốc (sau đây gọi là bản sao) hoặc bản quét, bản chụp kèm theo bản chính giấy tờ, tài liệu để đối chiếu. Trường hợp người yêu cầu đăng ký cư trú nộp bản quét hoặc bản chụp kèm theo bản chính giấy tờ để đối chiếu thì người tiếp nhận có trách nhiệm kiểm tra, đối chiếu bản quét, bản chụp với bản chính và ký xác nhận, không được yêu cầu nộp bản sao giấy tờ đó. - Trường hợp thực hiện đăng ký cư trú trực tuyến, người yêu cầu đăng ký cư trú khai báo thông tin theo biểu mẫu điện tử được cung cấp sẵn, đăng tải bản quét hoặc bản chụp giấy tờ, tài liệu hợp lệ (không bắt buộc phải công chứng, chứng thực, ký số hoặc xác thực bằng hình thức khác) hoặc dẫn nguồn tài liệu từ Kho quản lý dữ liệu điện tử của tổ chức, cá nhân. Trường hợp công dân đăng tải bản quét, bản chụp giấy tờ, tài liệu mà không được ký số hoặc xác thực bằng hình thức khác thì khi cơ quan đăng ký cư trú tiến hành kiểm tra, xác minh để giải quyết thủ tục về cư trú; công dân có trách nhiệm xuất trình giấy tờ, tài liệu đã đăng tải để cơ quan đăng ký cư trú kiểm tra, đối chiếu và ghi nhận tính chính xác vào biên bản xác minh. Cơ quan đăng ký cư trú không yêu cầu công dân nộp để lưu giữ giấy tờ đó. - Bản quét hoặc bản chụp giấy tờ bằng thiết bị điện tử từ giấy tờ được cấp hợp lệ, còn giá trị sử dụng phải bảo đảm rõ nét, đầy đủ, toàn vẹn về nội dung; đã được hợp pháp hóa lãnh sự, dịch sang tiếng Việt theo quy định nếu là giấy tờ do cơ quan có thẩm quyền nước ngoài cấp trừ trường hợp được miễn hợp pháp hóa lãnh sự. - Trường hợp thông tin giấy tờ chứng minh điều kiện đăng ký cư trú đã được chia sẻ và khai thác từ cơ sở dữ liệu quốc gia, cơ sở dữ liệu chuyên ngành thì cơ quan đăng ký cư trú không được yêu cầu công dân nộp, xuất trình giấy tờ đó để giải quyết đăng ký cư trú.|NULL|Bản chính: 0Bản sao: 0|', '|* Lưu ý: Việc nộp hồ sơ đăng ký cư trú - Trường hợp nộp hồ sơ trực tiếp tại cơ quan đăng ký cư trú thì người yêu cầu đăng ký cư trú có thể nộp bản sao giấy tờ, tài liệu được chứng thực từ bản chính hoặc bản sao giấy tờ được cấp từ sổ gốc (sau đây gọi là bản sao) hoặc bản quét, bản chụp kèm theo bản chính giấy tờ, tài liệu để đối chiếu. Trường hợp người yêu cầu đăng ký cư trú nộp bản quét hoặc bản chụp kèm theo bản chính giấy tờ để đối chiếu thì người tiếp nhận có trách nhiệm kiểm tra, đối chiếu bản quét, bản chụp với bản chính và ký xác nhận, không được yêu cầu nộp bản sao giấy tờ đó. - Trường hợp thực hiện đăng ký cư trú trực tuyến, người yêu cầu đăng ký cư trú khai báo thông tin theo biểu mẫu điện tử được cung cấp sẵn, đăng tải bản quét hoặc bản chụp giấy tờ, tài liệu hợp lệ (không bắt buộc phải công chứng, chứng thực, ký số hoặc xác thực bằng hình thức khác) hoặc dẫn nguồn tài liệu từ Kho quản lý dữ liệu điện tử của tổ chức, cá nhân. Trường hợp công dân đăng tải bản quét, bản chụp']",Nộp hồ sơ trực tiếp tại trụ sở Cơ quan Quản lý xuất nhập cảnh Công an cấp tỉnh (có thể khai tờ khai đề nghị cấp hộ chiếu phổ thông ở trong nước qua các cổng cung cấp dịch vụ công trực tuyến trước khi đến nộp hồ sơ trực tuyến).,Tôi không biết trả lời câu hỏi này.,0.0,0.0,0.0,0.0
7,Tôi cần nộp những giấy tờ gì khi làm thủ tục cấp bản sao trích lục hộ tịch?,"['Bao gồm\n|Tên giấy tờ|Mẫu đơn, tờ khai|Số lượng|\n|--|--|-|\n|* Lưu ý: Việc nộp hồ sơ đăng ký cư trú - Trường hợp nộp hồ sơ trực tiếp tại cơ quan đăng ký cư trú thì người yêu cầu đăng ký cư trú có thể nộp bản sao giấy tờ, tài liệu được chứng thực từ bản chính hoặc bản sao giấy tờ được cấp từ sổ gốc (sau đây gọi là bản sao) hoặc bản quét, bản chụp kèm theo bản chính giấy tờ, tài liệu để đối chiếu. Trường hợp người yêu cầu đăng ký cư trú nộp bản quét hoặc bản chụp kèm theo bản chính giấy tờ để đối chiếu thì người tiếp nhận có trách nhiệm kiểm tra, đối chiếu bản quét, bản chụp với bản chính và ký xác nhận, không được yêu cầu nộp bản sao giấy tờ đó. - Trường hợp thực hiện đăng ký cư trú trực tuyến, người yêu cầu đăng ký cư trú khai báo thông tin theo biểu mẫu điện tử được cung cấp sẵn, đăng tải bản quét hoặc bản chụp giấy tờ, tài liệu hợp lệ (không bắt buộc phải công chứng, chứng thực, ký số hoặc xác thực bằng hình thức khác) hoặc dẫn nguồn tài liệu từ Kho quản lý dữ liệu điện tử của tổ chức, cá nhân. Trường hợp công dân đăng tải bản quét, bản chụp giấy tờ, tài liệu mà không được ký số hoặc xác thực bằng hình thức khác thì khi cơ quan đăng ký cư trú tiến hành kiểm tra, xác minh để giải quyết thủ tục về cư trú; công dân có trách nhiệm xuất trình giấy tờ, tài liệu đã đăng tải để cơ quan đăng ký cư trú kiểm tra, đối chiếu và ghi nhận tính chính xác vào biên bản xác minh. Cơ quan đăng ký cư trú không yêu cầu công dân nộp để lưu giữ giấy tờ đó. - Bản quét hoặc bản chụp giấy tờ bằng thiết bị điện tử từ giấy tờ được cấp hợp lệ, còn giá trị sử dụng phải bảo đảm rõ nét, đầy đủ, toàn vẹn về nội dung; đã được hợp pháp hóa lãnh sự, dịch sang tiếng Việt theo quy định nếu là giấy tờ do cơ quan có thẩm quyền nước ngoài cấp trừ trường hợp được miễn hợp pháp hóa lãnh sự. - Trường hợp thông tin giấy tờ chứng minh điều kiện đăng ký cư trú đã được chia sẻ và khai thác từ cơ sở dữ liệu quốc gia, cơ sở dữ liệu chuyên ngành thì cơ quan đăng ký cư trú không được yêu cầu công dân nộp, xuất trình giấy tờ đó để giải quyết đăng ký cư trú.|         |Bản chính: 0Bản sao: 0|', 'Chi tiết thủ tục hành chính:\nMã thủ tục:\n2.000635\nSố quyết định:\n2466/QĐ-BTP\nTên thủ tục:\nCấp bản sao Trích lục hộ tịch\nCấp thực hiện:\nCấp Bộ, Cấp Tỉnh, Cấp Huyện, Cấp Xã, Cơ quan khác\nLoại thủ tục:\nTTHC không được luật giao cho địa phương quy định hoặc quy định chi tiết\nLĩnh vực:\nHộ tịch\nTrình tự thực hiện:\n- Nếu lựa chọn hình thức nộp hồ sơ trực tiếp, người có yêu cầu cấp bản sao Trích lục hộ tịch nộp hồ sơ đề nghị cấp bản sao Trích lục hộ tịch tại Bộ phận một cửa/Trung tâm hành chính công của Cơ quan quản lý Cơ sở dữ liệu hộ tịch điện tử có thẩm quyền; nộp phí, lệ phí theo quy định pháp luật.\nTrường hợp cơ quan, tổ chức có thẩm quyền đề nghị cấp bản sao Trích lục hộ tịch của cá nhân thì gửi văn bản yêu cầu nêu rõ lý do cho Cơ quan quản lý Cơ sở dữ liệu hộ tịch điện tử.\n- Nếu lựa chọn hình thức nộp hồ sơ trực tuyến, người có yêu cầu cấp bản sao Trích lục hộ tịch truy cập Cổng dịch vụ công quốc gia hoặc Cổng dịch vụ công cấp tỉnh, đăng ký tài khoản (nếu chưa có tài khoản), xác thực người dùng theo hướng dẫn, đăng nhập vào hệ thống, xác định đúng Cơ quan quản lý Cơ sở dữ liệu hộ tịch điện tử có thẩm quyền.\nNgười có yêu cầu cấp bản sao Trích lục hộ tịch trực tuyến cung cấp thông tin theo biểu mẫu điện tử tương tác cấp bản sao Giấy khai sinh, bản sao Trích lục hộ tịch (cung cấp trên Cổng dịch vụ công), đính kèm bản chụp hoặc bản sao điện tử các giấy tờ, tài liệu liên quan đến nội dung đề nghị cấp bản sao Trích lục hộ tịch; nộp phí, lệ phí thông qua chức năng thanh toán trực tuyến hoặc bằng cách thức khác theo quy định pháp luật, hoàn tất việc nộp hồ sơ.\n- Cán bộ tiếp nhận hồ sơ tại Bộ phận một cửa có trách nhiệm kiểm tra tính chính xác, đầy đủ, thống nhất, hợp lệ của hồ sơ.\n(i) Trường hợp hồ sơ đầy đủ, hợp lệ thì tiếp nhận hồ sơ; nếu tiếp nhận hồ sơ sau 15 giờ thì có Phiếu hẹn, trả kết quả cho người có yêu cầu trong ngày làm việc tiếp theo (nếu người có yêu cầu lựa chọn hình thức nộp hồ sơ trực tiếp) hoặc gửi ngay Phiếu hẹn, trả kết quả qua thư điện tử hoặc gửi tin nhắn hẹn trả kết quả qua điện thoại di động cho người có yêu cầu (nếu người có yêu cầu lựa chọn hình thức nộp hồ sơ trực tuyến); chuyển hồ sơ để công chức làm công tác hộ tịch xử lý.\n- Sau khi tiếp nhận hồ sơ theo hình thức nộp trực tiếp, cán bộ tiếp nhận hồ sơ tại Bộ phận một cửa thực hiện số hóa (sao chụp, chuyển thành tài liệu điện tử trên hệ thống thông tin, cơ sở dữ liệu) và ký số vào tài liệu, hồ sơ giải quyết thủ tục hành chính đã được số hóa theo quy định.\n(ii) Trường hợp hồ sơ chưa đầy đủ, hợp lệ thì có thông báo cho người yêu cầu bổ sung, hoàn thiện hồ sơ, nêu rõ loại giấy tờ, nội dung cần bổ sung để người có yêu cầu bổ sung, hoàn thiện. Sau khi hồ sơ được bổ sung, thực hiện lại bước (i);\n(iii) Trường hợp người có yêu cầu cấp bản sao Trích lục hộ tịch không bổ sung, hoàn thiện được hồ sơ thì báo cáo Trưởng bộ phận một cửa có thông báo từ chối giải quyết yêu cầu cấp bản sao Trích lục hộ tịch.\n- Công chức làm công tác hộ tịch thẩm tra hồ sơ (thẩm tra tính thống nhất, hợp lệ của các thông tin trong hồ sơ, giấy tờ, tài liệu do người yêu cầu nộp, xuất trình hoặc đính kèm).\n+ Trường hợp hồ sơ cần bổ sung, hoàn thiện hoặc không đủ điều kiện giải quyết, phải từ chối thì gửi thông báo về tình trạng hồ sơ tới Bộ phận một cửa để thông báo cho người nộp hồ sơ – thực hiện lại bước (ii) hoặc (iii);\n+ Trường hợp cần phải kiểm tra, xác minh làm rõ hoặc do nguyên nhân khác mà không thể trả kết quả đúng thời gian đã hẹn thì công chức làm công tác hộ tịch lập Phiếu xin lỗi và hẹn lại ngày trả kết quả, trong đó nêu rõ lý do chậm trả kết quả và thời gian hẹn trả kết quả, chuyển Bộ phận một cửa để trả cho người có yêu cầu (nếu người có yêu cầu lựa chọn hình thức nộp hồ sơ trực tiếp), hoặc gửi Phiếu xin lỗi và hẹn lại ngày trả kết quả qua thư điện tử hoặc gửi tin nhắn qua điện thoại di động cho người có yêu cầu (nếu người có yêu cầu lựa chọn hình thức nộp hồ sơ trực tuyến).\n+ Nếu thấy hồ sơ đầy đủ, hợp lệ, đúng quy định, trường hợp tiếp nhận hồ sơ cấp bản sao Trích lục hộ tịch theo hình thức trực tiếp, thì công chức làm công tác hộ tịch in bản sao Trích lục hộ tịch trình Thủ trưởng Cơ quan quản lý Cơ sở dữ liệu hộ tịch điện tử ký, chuyển tới Bộ phận một cửa để trả kết quả cho người có yêu cầu.\nTrường hợp tiếp nhận hồ sơ xin cấp bản sao Trích lục hộ tịch theo hình thức trực tuyến, công chức làm công tác hộ tịch gửi lại nội dung biểu mẫu Trích lục hộ tịch điện tử tương ứng với thông tin đầy đủ cho người yêu cầu qua thư điện tử hoặc thiết bị số.\nNgười yêu cầu có trách nhiệm kiểm tra tính chính xác, đầy đủ của các thông tin trên biểu mẫu Trích lục hộ tịch điện tử và xác nhận (tối đa một ngày).\nNếu người có yêu cấp bản sao Trích lục hộ tịch đã thống nhất, đầy đủ hoặc không có phản hồi sau thời hạn yêu cầu thì công chức làm công tác hộ tịch in bản sao Trích lục hộ tịch, trình Thủ trưởng Cơ quan quản lý Cơ sở dữ liệu hộ tịch điện tử ký, chuyển tới Bộ phận một cửa để trả kết quả cho người có yêu cầu.\n- Người có yêu cầu cấp bản sao Trích lục hộ tịch được nhận kết quả theo một trong các phương thức sau đây:\n+ Nhận bản điện tử bản sao Trích lục hộ tịch gửi qua thư điện tử, Kho quản lý dữ liệu điện tử của tổ chức, cá nhân đó;\n+ Nhận bản điện tử bản sao Trích lục hộ tịch gửi vào thiết bị số, thông qua phương pháp truyền số liệu phù hợp, đảm bảo an toàn, bảo mật thông tin;\n+ Nhận kết quả là bản sao Trích lục hộ tịch thông qua hệ thống bưu chính;\n+ Nhận kết quả là bản sao Trích lục hộ tịch tại cơ quan đăng ký hộ tịch.\nCách thức thực hiện:\n|Hình thức nộp|Thời hạn giải quyết|Phí, lệ phí|Mô tả|\n|--|--|--|-|\n|Trực tiếp|Ngay trong ngày tiếp nhận hồ sơ; trường hợp nhận hồ sơ sau 15 giờ mà không giải quyết được ngay thì trả kết quả trong ngày làm việc tiếp theo.|Lệ phí : 8.000 đồng/bản sao Trích lục/sự kiện hộ tịch đã đăng ký Miễn lệ phí cho người thuộc gia đình có công với cách mạng; người thuộc hộ nghèo; người khuyết tật.|Người có yêu cầu cấp bản sao Trích lục hộ tịch trực tiếp thực hiện hoặc ủy quyền cho người khác thực hiện nộp hồ sơ trực tiếp tại Bộ phận một cửa/Trung tâm hành chính công của Cơ quan quản lý Cơ sở dữ liệu hộ tịch điện tử hoặc gửi hồ sơ qua hệ thống bưu chính hoặc nộp hồ sơ trực tuyến trên Cổng dịch vụ công quốc gia (https://dichvucong.gov.vn) hoặc Cổng dịch vụ công cấp tỉnh (https://dichvucong.---.gov.vn).|\n|Trực tuyến|Ngay trong ngày tiếp nhận hồ sơ; trường hợp nhận hồ sơ sau 15 giờ mà không giải quyết được ngay thì trả kết quả trong ngày làm việc tiếp theo.|Lệ phí : 8.000 đồng/bản sao Trích lục/sự kiện hộ tịch đã đăng ký Miễn lệ phí cho người thuộc gia đình có công với cách mạng; người thuộc hộ nghèo; người khuyết tật.|Người có yêu cầu cấp bản sao Trích lục hộ tịch trực tiếp thực hiện hoặc ủy quyền cho người khác thực hiện nộp hồ sơ trực tiếp tại Bộ phận một cửa/Trung tâm hành chính công của Cơ quan quản lý Cơ sở dữ liệu hộ tịch điện tử hoặc gửi hồ sơ qua hệ thống bưu chính hoặc nộp hồ sơ trực tuyến trên Cổng dịch vụ công quốc gia (https://dichvucong.gov.vn) hoặc Cổng dịch vụ công cấp tỉnh (https://dichvucong.---.gov.vn).|\n|Dịch vụ bưu chính|Ngay trong ngày tiếp nhận hồ sơ; trường hợp nhận hồ sơ sau 15 giờ mà không giải quyết được ngay thì trả kết quả trong ngày làm việc tiếp theo.|Lệ phí : 8.000 đồng/bản sao Trích lục/sự kiện hộ tịch đã đăng ký. Miễn lệ phí cho người thuộc gia đình có công với cách mạng; người thuộc hộ nghèo; người khuyết tật.|Người có yêu cầu cấp bản sao Trích lục hộ tịch trực tiếp thực hiện hoặc ủy quyền cho người khác thực hiện nộp hồ sơ trực tiếp tại Bộ phận một cửa/Trung tâm hành chính công của Cơ quan quản lý Cơ sở dữ liệu hộ tịch điện tử hoặc gửi hồ sơ qua hệ thống bưu chính hoặc nộp hồ sơ trực tuyến trên Cổng dịch vụ công quốc gia (https://dichvucong.gov.vn) hoặc Cổng dịch vụ công cấp tỉnh (https://dichvucong.---.gov.vn).|\n\nThành phần hồ sơ:\n\n* Giấy tờ phải nộp:\n|Tên giấy tờ|Mẫu đơn, tờ khai|Số lượng|\n|--|--|-|\n|Văn bản ủy quyền theo quy định của pháp luật trong trường hợp ủy quyền thực hiện yêu cầu cấp bản sao Trích lục hộ tịch. Trường hợp người được ủy quyền là ông, bà, cha, mẹ, con, vợ, chồng, anh, chị, em ruột của người ủy quyền thì văn bản ủy quyền không phải chứng thực.||Bản chính: 1Bản sao: 0|\n\n\n* Giấy tờ phải xuất trình:\n|Tên giấy tờ|Mẫu đơn, tờ khai|Số lượng|\n|--|--|-|\n|Hộ chiếu hoặc chứng minh nhân dân hoặc thẻ căn cước công dân hoặc các giấy tờ khác có dán ảnh và thông tin cá nhân do cơ quan có thẩm quyền cấp, còn giá trị sử dụng để chứng minh về nhân thân của người có yêu cầu cấp xác nhận thông tin hộ tịch. Trường hợp các thông tin cá nhân trong các giấy tờ này đã có trong Cơ sở dữ liệu quốc gia về dân cư (CSDLQGVDC), Cơ sở dữ liệu hộ tịch điện tử (CSDLHTĐT), được hệ thống điền tự động thì không phải xuất trình (theo hình thức trực tiếp) hoặc tải lên (theo hình thức trực tuyến);||Bản chính: 1Bản sao: 0|\n|Trường hợp gửi hồ sơ qua hệ thống bưu chính thì phải gửi kèm theo bản sao có chứng thực các giấy tờ phải xuất trình nêu trên.||Bản chính: 0Bản sao: 0|', '* Lưu ý :\n|Tên giấy tờ|Mẫu đơn, tờ khai|Số lượng|\n|--|--|-|\n|- Đối với giấy tờ nộp, xuất trình nếu người yêu cầu nộp hồ sơ theo hình thức trực tiếp:||Bản chính: 0Bản sao: 0|\n|+ Đối với giấy tờ xuất trình khi đăng ký hộ tịch, người tiếp nhận có trách nhiệm kiểm tra, đối chiếu với thông tin trong tờ khai, chụp lại hoặc ghi lại thông tin để lưu trong hồ sơ và trả lại cho người xuất trình, không được yêu cầu nộp bản sao hoặc bản chụp giấy tờ đó.||Bản chính: 0Bản sao: 0|\n|+ Người yêu cầu đăng ký hộ tịch có thể nộp bản sao chứng thực từ bản chính hoặc bản sao được cấp từ sổ gốc hoặc bản chụp kèm theo bản chính giấy tờ để đối chiếu. Trường hợp người yêu cầu nộp bản chụp kèm theo bản chính giấy tờ thì người tiếp nhận có trách nhiệm kiểm tra, đối chiếu bản chụp với bản chính và ký xác nhận, không được yêu cầu người đi đăng ký nộp bản sao giấy tờ đó.||Bản chính: 0Bản sao: 0|\n|+ Người tiếp nhận có trách nhiệm tiếp nhận đúng, đủ hồ sơ đăng ký hộ tịch theo quy định của pháp luật hộ tịch, không được yêu cầu người đăng ký hộ tịch nộp thêm giấy tờ mà pháp luật hộ tịch không quy định phải nộp.||Bản chính: 0Bản sao: 0|\n|- Đối với giấy tờ gửi kèm theo nếu người yêu cầu nộp hồ sơ theo hình thức trực tuyến:||Bản chính: 0Bản sao: 0|\n|+ Bản chụp các giấy tờ gửi kèm theo hồ sơ đăng ký kết hôn trực tuyến phải bảo đảm rõ nét, đầy đủ, toàn vẹn về nội dung, là bản chụp bằng máy ảnh, điện thoại hoặc được chụp, được quét bằng thiết bị điện tử, từ giấy tờ được cấp hợp lệ, còn giá trị sử dụng; nếu là giấy tờ do cơ quan có thẩm quyền nước ngoài cấp thì phải được hợp pháp hóa lãnh sự, dịch sang tiếng Việt theo quy định, trừ trường hợp được miễn hợp pháp hóa lãnh sự.||Bản chính: 0Bản sao: 0|\n|+ Trường hợp giấy tờ, tài liệu phải gửi kèm trong hồ sơ đăng ký kết hôn trực tuyến đã có bản sao điện tử hoặc đã có bản điện tử giấy tờ hộ tịch thì người yêu cầu được sử dụng bản điện tử này.||Bản chính: 0Bản sao: 0|\n|+ Khi đến cơ quan đăng ký hộ tịch nhận kết quả (bản chính Giấy chứng nhận kết hôn/bản sao Trích lục kết hôn), người có yêu cầu đăng ký kết hôn phải nộp bản chính Giấy xác nhận tình trạng hôn nhân (nếu thông tin về tình trạng hôn nhân chưa có trong CSDLQGVDC, CSDLHTĐT).||Bản chính: 0Bản sao: 0|\n|Trường hợp người yêu cầu đăng ký kết hôn không cung cấp được giấy tờ nêu trên theo quy định hoặc giấy tờ nộp, xuất trình bị tẩy xóa, sửa chữa, làm giả thì cơ quan đăng ký hộ tịch có thẩm quyền hủy bỏ kết quả đăng ký kết hôn.||Bản chính: 0Bản sao: 0|\n\n\nBao gồm\n|Tên giấy tờ|Mẫu đơn, tờ khai|Số lượng|\n|--|--|-|\n|- Tờ khai đăng ký kết hôn theo mẫu, có đủ thông tin của hai bên nam, nữ. Hai bên nam, nữ có thể khai chung vào một Tờ khai đăng ký kết hôn (nếu người có yêu cầu lựa chọn nộp hồ sơ theo hình thức trực tiếp);|<a href=""https://csdl.dichvucong.gov.vn/web/jsp/download_file.jsp?ma=\'3fea7799ad82d751\'"">2. TK đăng ký kết hôn.doc</a>|Bản chính: 1Bản sao: 0|\n|- Mẫu hộ tịch điện tử tương tác đăng ký kết hôn (do người yêu cầu cung cấp thông tin theo hướng dẫn trên Cổng dịch vụ công, nếu người có yêu cầu lựa chọn nộp hồ sơ theo hình thức trực tuyến)|<a href=""https://csdl.dichvucong.gov.vn/web/jsp/download_file.jsp?ma=\'3fbbf664c62d1ca0\'"">2 Đăng ký kết hôn.docx</a>|Bản chính: 1Bản sao: 0|\n|- Người có yêu cầu đăng ký kết hôn thực hiện việc nộp/xuất trình (theo hình thức trực tiếp) hoặc tải lên (theo hình thức trực tuyến) các giấy tờ sau:||Bản chính: 0Bản sao: 0|\n\nĐối tượng thực hiện:\nCông dân Việt Nam\nCơ quan thực hiện:\nỦy ban Nhân dân\xa0xã,\xa0phường,\xa0thị trấn.\nCơ quan có thẩm quyền:\nỦy ban Nhân dân\xa0xã,\xa0phường,\xa0thị trấn.\nĐịa chỉ tiếp nhận HS:\nKhông có thông tin\nCơ quan được ủy quyền:\nKhông có thông tin\nCơ quan phối hợp:\nKhông có thông tin\nKết quả thực hiện:\nGiấy chứng nhận kết hôn, Bản sao Trích lục ghi chú kết hôn, Bản điện tử Trích lục kết hôn\nCăn cứ pháp lý:\n|Số ký hiệu|Trích yếu|Ngày ban hành|Cơ quan ban hành|\n|--|--|--|-|\n|52/2014/QH13|Luật 52/2014/QH13 Hôn nhân và gia đình|19-06-2014|Quốc Hội|\n|60/2014/QH13|Luật 60/2014/QH13-Hộ tịch|20-11-2014||\n|123/2015/NĐ-CP|Nghị định 123/2015/NĐ-CP - Quy định chi tiết một số điều và biện pháp thi hành Luật Hộ tịch|15-11-2015||\n|Thông tư số 281/2016/TT-BTC|quy định mức thu, chế độ thu, nộp, quản lý và sử dụng phí khai thác, sử dụng thông tin trong cơ sở dữ liệu hộ tịch, phí xác nhận có quốc tịch Việt Nam, phí xác nhận là người gốc Việt Nam, lệ phí quốc tịch|14-11-2016|Bộ Tài chính|\n|04/2020/TT-BTP|Thông tư 04/2020/TT-BTP|28-05-2020||\n|85/2019/TT-BTC|Thông tư 85/2019/TT-BTC|29-11-2019||\n|01/2022/TT-BTP|Thông tư sửa đổi|04-01-2022||\n|106/2021/TT-BTC|Thông tư 106/2021/TT-BTC|26-11-2021||\n|87/2020/NĐ-CP|Nghị định 87/2020/NĐ-CP|28-07-2020||\n|104/2022/NĐ-CP|Nghị định sửa đổi, bổ sung một số điều của các nghị định liên quan đến việc nộp, xuất trình sổ hộ khẩu, sổ tạm trú giấy khi thực hiện thủ tục hành chính, cung cấp dịch vụ công|21-12-2022|Chính phủ|\n|Thông tư số 03/2023/TT-BTP|Thông tư số 03/2023/TT-BTP ngày 02/8/2023 của Bộ trưởng Bộ Tư pháp|02-08-2023|Bộ trưởng Bộ Tư pháp|\n\nYêu cầu, điều kiện thực hiện:\n- Nam từ đủ 20 tuổi trở lên, nữ từ đủ 18 tuổi trở lên;\n- Việc kết hôn do nam và nữ tự nguyện quyết định;\n- Các bên không bị mất năng lực hành vi dân sự;\n- Việc kết hôn không thuộc một trong các trường hợp cấm kết hôn, gồm:\n+ Kết hôn giả tạo;\n+ Tảo hôn, cưỡng ép kết hôn, lừa dối kết hôn, cản trở kết hôn;\n+ Người đang có vợ, có chồng mà kết hôn với người khác hoặc chưa có vợ, chưa có chồng mà kết hôn với người đang có chồng, có vợ;\n+ Kết hôn giữa những người cùng dòng máu về trực hệ; giữa những người có họ trong phạm vi ba đời; giữa cha, mẹ nuôi với con nuôi; giữa người đã từng là cha, mẹ nuôi với con nuôi, cha chồng với con dâu, mẹ vợ với con rể, cha dượng với con riêng của vợ, mẹ kế với con riêng của chồng.\n* Nhà nước không thừa nhận hôn nhân giữa những người cùng giới tính.\n- Nam từ đủ 20 tuổi trở lên, nữ từ đủ 18 tuổi trở lên;\n- Việc kết hôn do nam và nữ tự nguyện quyết định;\n- Các bên không bị mất năng lực hành vi dân sự;\n- Việc kết hôn không thuộc một trong các trường hợp cấm kết hôn, gồm:\n+ Kết hôn giả tạo;\n+ Tảo hôn, cưỡng ép kết hôn, lừa dối kết hôn, cản trở kết hôn;\n+ Người đang có vợ, có chồng mà kết hôn với người khác hoặc chưa có vợ, chưa có chồng mà kết hôn với người đang có chồng, có vợ;\n+ Kết hôn giữa những người cùng dòng máu về trực hệ; giữa những người có họ trong phạm vi ba đời; giữa cha, mẹ nuôi với con nuôi; giữa người đã từng là cha, mẹ nuôi với con nuôi, cha chồng với con dâu, mẹ vợ với con rể, cha dượng với con riêng của vợ, mẹ kế với con riêng của chồng.\n* Nhà nước không thừa nhận hôn nhân giữa những người cùng giới tính.\nTừ khóa:\nKhông có thông tin\nMô tả:\nKhông có thông tin']","|Tên giấy tờ|Mẫu đơn, tờ khai|Số lượng|
|1. Tờ khai cấp bản sao trích lục hộ tịch theo mẫu đối với trường hợp người yêu cầu là cá nhân.|Tờ khai cấp bản sao trích lục hộ tịch.docx|Bản chính: 1 Bản sao: 0|
|2. Văn bản yêu cầu cấp bản sao trích lục hộ tịch nêu rõ lý do trong trường hợp người yêu cầu là cơ quan, tổ chức.| |Bản chính: 1 Bản sao: 0|
|3. Văn bản ủy quyền theo quy định của pháp luật trong trường hợp ủy quyền thực hiện yêu cầu cấp bản sao trích lục hộ tịch. Trường hợp người được ủy quyền là ông, bà, cha, mẹ, con, vợ, chồng, anh, chị, em ruột của người ủy quyền thì văn bản ủy quyền không phải công chứng, chứng thực.| |Bản chính: 1 Bản sao: 0|
|4. Giấy tờ phải xuất trình: • Hộ chiếu hoặc chứng minh nhân dân hoặc chứng minh quân nhân chuyên nghiệp, công nhân và viên chức quốc phòng hoặc thẻ căn cước công dân hoặc các giấy tờ khác có dán ảnh và thông tin cá nhân do cơ quan có thẩm quyền cấp, còn giá trị sử dụng để chứng minh về nhân thân của người có yêu cầu cấp bản sao trích lục hộ tịch.| |Bản chính: 1 Bản sao: 0|
|5. Trường hợp gửi hồ sơ qua hệ thống bưu chính thì phải gửi kèm theo bản sao có chứng thực giấy tờ phải xuất trình nêu trên.| |Bản chính: 0 Bản sao: 1|","| Tên giấy tờ | Mẫu đơn, tờ khai | Số lượng |
|---|---|---|
| Văn bản ủy quyền theo quy định của pháp luật trong trường hợp ủy quyền thực hiện yêu cầu cấp bản sao Trích lục hộ tịch. Trường hợp người được ủy quyền là ông, bà, cha, mẹ, con, vợ, chồng, anh, chị, em ruột của người ủy quyền thì văn bản ủy quyền không phải chứng thực. | | Bản chính: 1 |
| Hộ chiếu hoặc chứng minh nhân dân hoặc thẻ căn cước công dân hoặc các giấy tờ khác có dán ảnh và thông tin cá nhân do cơ quan có thẩm quyền cấp, còn giá trị sử dụng để chứng minh về nhân thân của người có yêu cầu cấp xác nhận thông tin hộ tịch. Trường hợp các thông tin cá nhân trong các giấy tờ này đã có trong Cơ sở dữ liệu quốc gia về dân cư (CSDLQGVDC), Cơ sở dữ liệu hộ tịch điện tử (CSDLHTĐT), được hệ thống điền tự động thì không phải xuất trình (theo hình thức trực tiếp) hoặc tải lên (theo hình thức trực tuyến); | | Bản chính: 1 |",0.0,0.5,0.7,0.5
8,Thời hạn giải quyết hồ sơ cấp bản sao trích lục hộ tịch là bao lâu?,"['Chi tiết thủ tục hành chính:\nMã thủ tục:\n2.000635\nSố quyết định:\n2466/QĐ-BTP\nTên thủ tục:\nCấp bản sao Trích lục hộ tịch\nCấp thực hiện:\nCấp Bộ, Cấp Tỉnh, Cấp Huyện, Cấp Xã, Cơ quan khác\nLoại thủ tục:\nTTHC không được luật giao cho địa phương quy định hoặc quy định chi tiết\nLĩnh vực:\nHộ tịch\nTrình tự thực hiện:\n- Nếu lựa chọn hình thức nộp hồ sơ trực tiếp, người có yêu cầu cấp bản sao Trích lục hộ tịch nộp hồ sơ đề nghị cấp bản sao Trích lục hộ tịch tại Bộ phận một cửa/Trung tâm hành chính công của Cơ quan quản lý Cơ sở dữ liệu hộ tịch điện tử có thẩm quyền; nộp phí, lệ phí theo quy định pháp luật.\nTrường hợp cơ quan, tổ chức có thẩm quyền đề nghị cấp bản sao Trích lục hộ tịch của cá nhân thì gửi văn bản yêu cầu nêu rõ lý do cho Cơ quan quản lý Cơ sở dữ liệu hộ tịch điện tử.\n- Nếu lựa chọn hình thức nộp hồ sơ trực tuyến, người có yêu cầu cấp bản sao Trích lục hộ tịch truy cập Cổng dịch vụ công quốc gia hoặc Cổng dịch vụ công cấp tỉnh, đăng ký tài khoản (nếu chưa có tài khoản), xác thực người dùng theo hướng dẫn, đăng nhập vào hệ thống, xác định đúng Cơ quan quản lý Cơ sở dữ liệu hộ tịch điện tử có thẩm quyền.\nNgười có yêu cầu cấp bản sao Trích lục hộ tịch trực tuyến cung cấp thông tin theo biểu mẫu điện tử tương tác cấp bản sao Giấy khai sinh, bản sao Trích lục hộ tịch (cung cấp trên Cổng dịch vụ công), đính kèm bản chụp hoặc bản sao điện tử các giấy tờ, tài liệu liên quan đến nội dung đề nghị cấp bản sao Trích lục hộ tịch; nộp phí, lệ phí thông qua chức năng thanh toán trực tuyến hoặc bằng cách thức khác theo quy định pháp luật, hoàn tất việc nộp hồ sơ.\n- Cán bộ tiếp nhận hồ sơ tại Bộ phận một cửa có trách nhiệm kiểm tra tính chính xác, đầy đủ, thống nhất, hợp lệ của hồ sơ.\n(i) Trường hợp hồ sơ đầy đủ, hợp lệ thì tiếp nhận hồ sơ; nếu tiếp nhận hồ sơ sau 15 giờ thì có Phiếu hẹn, trả kết quả cho người có yêu cầu trong ngày làm việc tiếp theo (nếu người có yêu cầu lựa chọn hình thức nộp hồ sơ trực tiếp) hoặc gửi ngay Phiếu hẹn, trả kết quả qua thư điện tử hoặc gửi tin nhắn hẹn trả kết quả qua điện thoại di động cho người có yêu cầu (nếu người có yêu cầu lựa chọn hình thức nộp hồ sơ trực tuyến); chuyển hồ sơ để công chức làm công tác hộ tịch xử lý.\n- Sau khi tiếp nhận hồ sơ theo hình thức nộp trực tiếp, cán bộ tiếp nhận hồ sơ tại Bộ phận một cửa thực hiện số hóa (sao chụp, chuyển thành tài liệu điện tử trên hệ thống thông tin, cơ sở dữ liệu) và ký số vào tài liệu, hồ sơ giải quyết thủ tục hành chính đã được số hóa theo quy định.\n(ii) Trường hợp hồ sơ chưa đầy đủ, hợp lệ thì có thông báo cho người yêu cầu bổ sung, hoàn thiện hồ sơ, nêu rõ loại giấy tờ, nội dung cần bổ sung để người có yêu cầu bổ sung, hoàn thiện. Sau khi hồ sơ được bổ sung, thực hiện lại bước (i);\n(iii) Trường hợp người có yêu cầu cấp bản sao Trích lục hộ tịch không bổ sung, hoàn thiện được hồ sơ thì báo cáo Trưởng bộ phận một cửa có thông báo từ chối giải quyết yêu cầu cấp bản sao Trích lục hộ tịch.\n- Công chức làm công tác hộ tịch thẩm tra hồ sơ (thẩm tra tính thống nhất, hợp lệ của các thông tin trong hồ sơ, giấy tờ, tài liệu do người yêu cầu nộp, xuất trình hoặc đính kèm).\n+ Trường hợp hồ sơ cần bổ sung, hoàn thiện hoặc không đủ điều kiện giải quyết, phải từ chối thì gửi thông báo về tình trạng hồ sơ tới Bộ phận một cửa để thông báo cho người nộp hồ sơ – thực hiện lại bước (ii) hoặc (iii);\n+ Trường hợp cần phải kiểm tra, xác minh làm rõ hoặc do nguyên nhân khác mà không thể trả kết quả đúng thời gian đã hẹn thì công chức làm công tác hộ tịch lập Phiếu xin lỗi và hẹn lại ngày trả kết quả, trong đó nêu rõ lý do chậm trả kết quả và thời gian hẹn trả kết quả, chuyển Bộ phận một cửa để trả cho người có yêu cầu (nếu người có yêu cầu lựa chọn hình thức nộp hồ sơ trực tiếp), hoặc gửi Phiếu xin lỗi và hẹn lại ngày trả kết quả qua thư điện tử hoặc gửi tin nhắn qua điện thoại di động cho người có yêu cầu (nếu người có yêu cầu lựa chọn hình thức nộp hồ sơ trực tuyến).\n+ Nếu thấy hồ sơ đầy đủ, hợp lệ, đúng quy định, trường hợp tiếp nhận hồ sơ cấp bản sao Trích lục hộ tịch theo hình thức trực tiếp, thì công chức làm công tác hộ tịch in bản sao Trích lục hộ tịch trình Thủ trưởng Cơ quan quản lý Cơ sở dữ liệu hộ tịch điện tử ký, chuyển tới Bộ phận một cửa để trả kết quả cho người có yêu cầu.\nTrường hợp tiếp nhận hồ sơ xin cấp bản sao Trích lục hộ tịch theo hình thức trực tuyến, công chức làm công tác hộ tịch gửi lại nội dung biểu mẫu Trích lục hộ tịch điện tử tương ứng với thông tin đầy đủ cho người yêu cầu qua thư điện tử hoặc thiết bị số.\nNgười yêu cầu có trách nhiệm kiểm tra tính chính xác, đầy đủ của các thông tin trên biểu mẫu Trích lục hộ tịch điện tử và xác nhận (tối đa một ngày).\nNếu người có yêu cấp bản sao Trích lục hộ tịch đã thống nhất, đầy đủ hoặc không có phản hồi sau thời hạn yêu cầu thì công chức làm công tác hộ tịch in bản sao Trích lục hộ tịch, trình Thủ trưởng Cơ quan quản lý Cơ sở dữ liệu hộ tịch điện tử ký, chuyển tới Bộ phận một cửa để trả kết quả cho người có yêu cầu.\n- Người có yêu cầu cấp bản sao Trích lục hộ tịch được nhận kết quả theo một trong các phương thức sau đây:\n+ Nhận bản điện tử bản sao Trích lục hộ tịch gửi qua thư điện tử, Kho quản lý dữ liệu điện tử của tổ chức, cá nhân đó;\n+ Nhận bản điện tử bản sao Trích lục hộ tịch gửi vào thiết bị số, thông qua phương pháp truyền số liệu phù hợp, đảm bảo an toàn, bảo mật thông tin;\n+ Nhận kết quả là bản sao Trích lục hộ tịch thông qua hệ thống bưu chính;\n+ Nhận kết quả là bản sao Trích lục hộ tịch tại cơ quan đăng ký hộ tịch.\nCách thức thực hiện:\n|Hình thức nộp|Thời hạn giải quyết|Phí, lệ phí|Mô tả|\n|--|--|--|-|\n|Trực tiếp|Ngay trong ngày tiếp nhận hồ sơ; trường hợp nhận hồ sơ sau 15 giờ mà không giải quyết được ngay thì trả kết quả trong ngày làm việc tiếp theo.|Lệ phí : 8.000 đồng/bản sao Trích lục/sự kiện hộ tịch đã đăng ký Miễn lệ phí cho người thuộc gia đình có công với cách mạng; người thuộc hộ nghèo; người khuyết tật.|Người có yêu cầu cấp bản sao Trích lục hộ tịch trực tiếp thực hiện hoặc ủy quyền cho người khác thực hiện nộp hồ sơ trực tiếp tại Bộ phận một cửa/Trung tâm hành chính công của Cơ quan quản lý Cơ sở dữ liệu hộ tịch điện tử hoặc gửi hồ sơ qua hệ thống bưu chính hoặc nộp hồ sơ trực tuyến trên Cổng dịch vụ công quốc gia (https://dichvucong.gov.vn) hoặc Cổng dịch vụ công cấp tỉnh (https://dichvucong.---.gov.vn).|\n|Trực tuyến|Ngay trong ngày tiếp nhận hồ sơ; trường hợp nhận hồ sơ sau 15 giờ mà không giải quyết được ngay thì trả kết quả trong ngày làm việc tiếp theo.|Lệ phí : 8.000 đồng/bản sao Trích lục/sự kiện hộ tịch đã đăng ký Miễn lệ phí cho người thuộc gia đình có công với cách mạng; người thuộc hộ nghèo; người khuyết tật.|Người có yêu cầu cấp bản sao Trích lục hộ tịch trực tiếp thực hiện hoặc ủy quyền cho người khác thực hiện nộp hồ sơ trực tiếp tại Bộ phận một cửa/Trung tâm hành chính công của Cơ quan quản lý Cơ sở dữ liệu hộ tịch điện tử hoặc gửi hồ sơ qua hệ thống bưu chính hoặc nộp hồ sơ trực tuyến trên Cổng dịch vụ công quốc gia (https://dichvucong.gov.vn) hoặc Cổng dịch vụ công cấp tỉnh (https://dichvucong.---.gov.vn).|\n|Dịch vụ bưu chính|Ngay trong ngày tiếp nhận hồ sơ; trường hợp nhận hồ sơ sau 15 giờ mà không giải quyết được ngay thì trả kết quả trong ngày làm việc tiếp theo.|Lệ phí : 8.000 đồng/bản sao Trích lục/sự kiện hộ tịch đã đăng ký. Miễn lệ phí cho người thuộc gia đình có công với cách mạng; người thuộc hộ nghèo; người khuyết tật.|Người có yêu cầu cấp bản sao Trích lục hộ tịch trực tiếp thực hiện hoặc ủy quyền cho người khác thực hiện nộp hồ sơ trực tiếp tại Bộ phận một cửa/Trung tâm hành chính công của Cơ quan quản lý Cơ sở dữ liệu hộ tịch điện tử hoặc gửi hồ sơ qua hệ thống bưu chính hoặc nộp hồ sơ trực tuyến trên Cổng dịch vụ công quốc gia (https://dichvucong.gov.vn) hoặc Cổng dịch vụ công cấp tỉnh (https://dichvucong.---.gov.vn).|\n\nThành phần hồ sơ:\n\n* Giấy tờ phải nộp:\n|Tên giấy tờ|Mẫu đơn, tờ khai|Số lượng|\n|--|--|-|\n|Văn bản ủy quyền theo quy định của pháp luật trong trường hợp ủy quyền thực hiện yêu cầu cấp bản sao Trích lục hộ tịch. Trường hợp người được ủy quyền là ông, bà, cha, mẹ, con, vợ, chồng, anh, chị, em ruột của người ủy quyền thì văn bản ủy quyền không phải chứng thực.||Bản chính: 1Bản sao: 0|\n\n\n* Giấy tờ phải xuất trình:\n|Tên giấy tờ|Mẫu đơn, tờ khai|Số lượng|\n|--|--|-|\n|Hộ chiếu hoặc chứng minh nhân dân hoặc thẻ căn cước công dân hoặc các giấy tờ khác có dán ảnh và thông tin cá nhân do cơ quan có thẩm quyền cấp, còn giá trị sử dụng để chứng minh về nhân thân của người có yêu cầu cấp xác nhận thông tin hộ tịch. Trường hợp các thông tin cá nhân trong các giấy tờ này đã có trong Cơ sở dữ liệu quốc gia về dân cư (CSDLQGVDC), Cơ sở dữ liệu hộ tịch điện tử (CSDLHTĐT), được hệ thống điền tự động thì không phải xuất trình (theo hình thức trực tiếp) hoặc tải lên (theo hình thức trực tuyến);||Bản chính: 1Bản sao: 0|\n|Trường hợp gửi hồ sơ qua hệ thống bưu chính thì phải gửi kèm theo bản sao có chứng thực các giấy tờ phải xuất trình nêu trên.||Bản chính: 0Bản sao: 0|', 'Chi tiết thủ tục hành chính:\nMã thủ tục:\n1.009073\nSố quyết định:\n1402/QĐ-UBND_ĐT\nTên thủ tục:\nCấp bản sao trích lục hộ tịch\nCấp thực hiện:\nCấp Xã\nLoại thủ tục:\nTTHC được luật giao quy định chi tiết\nLĩnh vực:\nHộ tịch\nTrình tự thực hiện:\nBước 1: Cá nhân, tổ chức có yêu cầu cấp bản sao trích lục hộ tịch nộp hồ sơ tại UBND cấp xã có thẩm quyền.\nBước 2: Bộ phận Tiếp nhận và trả kết quả có trách nhiệm tiếp nhận, kiểm tra ngay toàn bộ hồ sơ, đối chiếu thông tin trong Tờ khai và tính hợp lệ của giấy tờ trong hồ sơ do người yêu cầu nộp, xuất trình. \nNếu hồ sơ đầy đủ, hợp lệ thì tiếp nhận hồ sơ và viết giấy tiếp nhận; nếu hồ sơ chưa đầy đủ, hoàn thiện thì hướng dẫn người nộp hồ sơ bổ sung, hoàn thiện theo quy định.\nBước 3: Công chức Tư pháp - hộ tịch căn cứ vào Cơ sở dữ liệu hộ tịch, ghi nội dung bản sao trích lục hộ tịch, báo cáo Chủ tịch/Phó Chủ tịch UBND cấp xã ký cấp bản sao trích lục hộ tịch cho người yêu cầu; chuyển kết quả cho Bộ phận tiếp nhận trả kết quả. \nBước 4: Bộ phận tiếp nhận trả kết quả trả kết quả cho cá nhân, tổ chức.\nCách thức thực hiện:\n|Hình thức nộp|Thời hạn giải quyết|Phí, lệ phí|Mô tả|\n|--|--|--|-|\n|Trực tiếp|Ngay trong ngày tiếp nhận hồ sơ; trường hợp nhận hồ sơ sau 15 giờ mà không giải quyết được ngay thì trả kết quả vào 09 giờ ngày làm việc tiếp theo.|Lệ phí : Phí khai thác, sử dụng thông tin trong cơ sở dữ liệu hộ tịch: 8.000 đồng/bản sao trích lục/sự kiện hộ tịch đã đăng ký.|- Người có yêu cầu cấp bản sao trích lục hộ tịch trực tiếp thực hiện hoặc ủy quyền cho người khác thực hiện yêu cầu cấp bản sao trích lục hộ tịch; - Người thực hiện yêu cầu cấp bản sao trích lục hộ tịch có thể trực tiếp nộp hồ sơ tại Bộ phận Tiếp nhận và trả kết quả của UBND cấp xã có thẩm quyền hoặc gửi hồ sơ, văn bản yêu cầu qua hệ thống bưu chính.|\n|Dịch vụ bưu chính|Ngay trong ngày tiếp nhận hồ sơ; trường hợp nhận hồ sơ sau 15 giờ mà không giải quyết được ngay thì trả kết quả vào 09 giờ ngày làm việc tiếp theo.|Lệ phí : Phí khai thác, sử dụng thông tin trong cơ sở dữ liệu hộ tịch: 8.000 đồng/bản sao trích lục/sự kiện hộ tịch đã đăng ký.|- Người có yêu cầu cấp bản sao trích lục hộ tịch trực tiếp thực hiện hoặc ủy quyền cho người khác thực hiện yêu cầu cấp bản sao trích lục hộ tịch; - Người thực hiện yêu cầu cấp bản sao trích lục hộ tịch có thể trực tiếp nộp hồ sơ tại Bộ phận Tiếp nhận và trả kết quả của UBND cấp xã có thẩm quyền hoặc gửi hồ sơ, văn bản yêu cầu qua hệ thống bưu chính.|\n\nThành phần hồ sơ:\n\nBao gồm\n|Tên giấy tờ|Mẫu đơn, tờ khai|Số lượng|\n|--|--|-|\n|1. Tờ khai cấp bản sao trích lục hộ tịch theo mẫu đối với trường hợp người yêu cầu là cá nhân.|<a href=""https://csdl.dichvucong.gov.vn/web/jsp/download_file.jsp?ma=\'3feafd8e3a82ecca\'"">Tờ khai cấp bản sao trích lục hộ tịch.docx</a>|Bản chính: 1Bản sao: 0|\n|2. Văn bản yêu cầu cấp bản sao trích lục hộ tịch nêu rõ lý do trong trường hợp người yêu cầu là cơ quan, tổ chức.||Bản chính: 1Bản sao: 0|\n|3. Văn bản ủy quyền theo quy định của pháp luật trong trường hợp ủy quyền thực hiện yêu cầu cấp bản sao trích lục hộ tịch. Trường hợp người được ủy quyền là ông, bà, cha, mẹ, con, vợ, chồng, anh, chị, em ruột của người ủy quyền thì văn bản ủy quyền không phải công chứng, chứng thực.||Bản chính: 1Bản sao: 0|\n|4. Giấy tờ phải xuất trình: • Hộ chiếu hoặc chứng minh nhân dân hoặc chứng minh quân nhân chuyên nghiệp, công nhân và viên chức quốc phòng hoặc thẻ căn cước công dân hoặc các giấy tờ khác có dán ảnh và thông tin cá nhân do cơ quan có thẩm quyền cấp, còn giá trị sử dụng để chứng minh về nhân thân của người có yêu cầu cấp bản sao trích lục hộ tịch.||Bản chính: 1Bản sao: 0|\n|5. Trường hợp gửi hồ sơ qua hệ thống bưu chính thì phải gửi kèm theo bản sao có chứng thực giấy tờ phải xuất trình nêu trên.||Bản chính: 0Bản sao: 1|\n\nĐối tượng thực hiện:\nCông dân Việt Nam, Doanh nghiệp, Tổ chức (không bao gồm doanh nghiệp, HTX)\nCơ quan thực hiện:\nỦy ban nhân dân cấp xã\nCơ quan có thẩm quyền:\nKhông có thông tin\nĐịa chỉ tiếp nhận HS:\nBộ phận Tiếp nhận và trả kết quả của UBND cấp xã\nCơ quan được ủy quyền:\nKhông có thông tin\nCơ quan phối hợp:\nKhông có thông tin\nKết quả thực hiện:\nBản sao trích lục hộ tịch\nCăn cứ pháp lý:\n|Số ký hiệu|Trích yếu|Ngày ban hành|Cơ quan ban hành|\n|--|--|--|-|\n|60/2014/QH13|Luật 60/2014/QH13|20-11-2014||\n|123/2015/NĐ-CP|Nghị định 123/2015/NĐ-CP|15-11-2015||\n|04/2020/TT-BTP|Thông tư 04/2020/TT-BTP|28-05-2020||\n|281/2016/TT-BTC|Thông tư 281/2016/TT-BTC|14-11-2016||\n\nYêu cầu, điều kiện thực hiện:\nKhông có thông tin\nTừ khóa:\nKhông có thông tin\nMô tả:\nKhông có thông tin', '* Giấy tờ phải xuất trình:\n|Tên giấy tờ|Mẫu đơn, tờ khai|Số lượng|\n|--|--|-|\n|Hộ chiếu hoặc chứng minh nhân dân hoặc thẻ căn cước công dân hoặc các giấy tờ khác có dán ảnh và thông tin cá nhân do cơ quan có thẩm quyền cấp, còn giá trị sử dụng để chứng minh về nhân thân của người có yêu cầu cấp xác nhận thông tin hộ tịch. Trường hợp các thông tin cá nhân trong các giấy tờ này đã có trong Cơ sở dữ liệu quốc gia về dân cư (CSDLQGVDC), Cơ sở dữ liệu hộ tịch điện tử (CSDLHTĐT), được hệ thống điền tự động thì không phải xuất trình (theo hình thức trực tiếp) hoặc tải lên (theo hình thức trực tuyến);||Bản chính: 1Bản sao: 0|\n|Trường hợp gửi hồ sơ qua hệ thống bưu chính thì phải gửi kèm theo bản sao có chứng thực các giấy tờ phải xuất trình nêu trên.||Bản chính: 0Bản sao: 0|\n\n\n* Lưu ý:\n|Tên giấy tờ|Mẫu đơn, tờ khai|Số lượng|\n|--|--|-|\n|- Đối với giấy tờ nộp, xuất trình nếu người yêu cầu nộp hồ sơ theo hình thức trực tiếp:||Bản chính: 0Bản sao: 0|\n|+ Đối với giấy tờ xuất trình khi đăng ký hộ tịch, người tiếp nhận có trách nhiệm kiểm tra, đối chiếu với thông tin trong tờ khai, chụp lại hoặc ghi lại thông tin để lưu trong hồ sơ và trả lại cho người xuất trình, không được yêu cầu nộp bản sao hoặc bản chụp giấy tờ đó.||Bản chính: 0Bản sao: 0|\n|+ Người yêu cầu đăng ký hộ tịch có thể nộp bản sao chứng thực từ bản chính hoặc bản sao được cấp từ sổ gốc hoặc bản chụp kèm theo bản chính giấy tờ để đối chiếu. Trường hợp người yêu cầu nộp bản chụp kèm theo bản chính giấy tờ thì người tiếp nhận có trách nhiệm kiểm tra, đối chiếu bản chụp với bản chính và ký xác nhận, không được yêu cầu người đi đăng ký nộp bản sao giấy tờ đó.||Bản chính: 0Bản sao: 0|\n|+ Người tiếp nhận có trách nhiệm tiếp nhận đúng, đủ hồ sơ đăng ký hộ tịch theo quy định của pháp luật hộ tịch, không được yêu cầu người đăng ký hộ tịch nộp thêm giấy tờ mà pháp luật hộ tịch không quy định phải nộp.||Bản chính: 0Bản sao: 0|\n|- Đối với giấy tờ gửi kèm theo nếu người yêu cầu nộp hồ sơ theo hình thức trực tuyến:||Bản chính: 0Bản sao: 0|\n|+ Bản chụp các giấy tờ gửi kèm theo hồ sơ cấp bản sao Trích lục hộ tịch trực tuyến phải bảo đảm rõ nét, đầy đủ, toàn vẹn về nội dung, là bản chụp bằng máy ảnh, điện thoại hoặc được chụp, được quét bằng thiết bị điện tử, từ giấy tờ được cấp hợp lệ, còn giá trị sử dụng; nếu là giấy tờ do cơ quan có thẩm quyền nước ngoài cấp thì phải được hợp pháp hóa lãnh sự, dịch sang tiếng Việt theo quy định, trừ trường hợp được miễn hợp pháp hóa lãnh sự.||Bản chính: 0Bản sao: 0|\n|+ Trường hợp nhận kết quả (bản sao Trích lục hộ tịch) tại cơ quan đăng ký hộ tịch, người có yêu cầu cấp bản sao Trích lục hộ tịch phải xuất trình giấy tờ tuỳ thân; nộp các giấy tờ, tài liệu là thành phần hồ sơ cấp bản sao Trích lục hộ tịch theo quy định pháp luật hộ tịch. Trường hợp giấy tờ, tài liệu phải gửi kèm trong hồ sơ cấp bản sao Trích lục hộ tịch trực tiếp hoặc trực tuyến đã có bản sao điện tử hoặc đã có bản điện tử giấy tờ hộ tịch thì người yêu cầu được sử dụng bản điện tử này.||Bản chính: 0Bản sao: 0|\n\n\nBao gồm\n|Tên giấy tờ|Mẫu đơn, tờ khai|Số lượng|\n|--|--|-|\n|- Tờ khai đề nghị bản sao Trích lục hộ tịch theo mẫu trong trường hợp người yêu cầu là cá nhân hoặc Văn bản yêu cầu cấp bản sao Trích lục hộ tịch nêu rõ lý do trong trường hợp người yêu cầu là cơ quan, tổ chức (nếu người có yêu cầu lựa chọn nộp hồ sơ theo hình thức trực tiếp);|<a href=""https://csdl.dichvucong.gov.vn/web/jsp/download_file.jsp?ma=\'3fef5b74de7fb2ba\'"">18. TK yeu cau ban sao trich luc ho tich.doc</a>|Bản chính: 1Bản sao: 0|\n|- Mẫu điện tử tương tác yêu cầu cấp bản sao Giấy khai sinh, bản sao Trích lục hộ tịch (do người yêu cầu cung cấp thông tin theo hướng dẫn trên Cổng dịch vụ công, nếu người có yêu cầu lựa chọn nộp hồ sơ theo hình thức trực tuyến)|<a href=""https://csdl.dichvucong.gov.vn/web/jsp/download_file.jsp?ma=\'3fd25fa9678d1b3c\'"">18 cấp bản sao giấy khai sinh và trích lục hộ tịch.docx</a>|Bản chính: 1Bản sao: 1|\n|- Người có yêu cầu cấp bản sao Trích lục hộ tịch thực hiện việc nộp/xuất trình (theo hình thức trực tiếp) hoặc tải lên (theo hình thức trực tuyến) các giấy tờ sau:||Bản chính: 0Bản sao: 0|\n\nĐối tượng thực hiện:\nCông dân Việt Nam, Tổ chức (không bao gồm doanh nghiệp, HTX)\nCơ quan thực hiện:\nCơ quan quản lý cơ sở dữ liệu hộ tịch điện tử\nCơ quan có thẩm quyền:\nKhông có thông tin\nĐịa chỉ tiếp nhận HS:\nCấp Bộ: Trụ sở Bộ Tư pháp, 60 Trần Phú, Ba Đình, Hà Nội\nCơ quan được ủy quyền:\nKhông có thông tin\nCơ quan phối hợp:\nKhông có thông tin\nKết quả thực hiện:\nBản sao Trích lục hộ tịch\nCăn cứ pháp lý:\n|Số ký hiệu|Trích yếu|Ngày ban hành|Cơ quan ban hành|\n|--|--|--|-|\n|60/2014/QH13|Luật 60/2014/QH13|20-11-2014|Quốc Hội|\n|123/2015/NĐ-CP|Nghị định 123/2015/NĐ-CP|15-11-2015|Chính phủ|\n|Thông tư số 281/2016/TT-BTC|quy định mức thu, chế độ thu, nộp, quản lý và sử dụng phí khai thác, sử dụng thông tin trong cơ sở dữ liệu hộ tịch, phí xác nhận có quốc tịch Việt Nam, phí xác nhận là người gốc Việt Nam, lệ phí quốc tịch|14-11-2016|Bộ Tài chính|\n|04/2020/TT-BTP|Thông tư 04/2020/TT-BTP|28-05-2020||\n|281/2016/TT-BTC|Thông tư 281/2016/TT-BTC|14-11-2016||\n|85/2019/TT-BTC|Thông tư số 85/2019/TT-BTC ngày 29 tháng 11 năm 2019 của Bộ trưởng Bộ Tài chính hướng dẫn về phí và lệ phí thuộc thẩm quyền quyết định của HĐND tỉnh, thành phố trực thuộc Trung ương (được sửa đổi bổ sung tại Thông tư số 106/2021/TT-BTC ngày 26 tháng 11 năm 2021 và Thông tư số 75/2022/TT-BTC ngày 22 tháng 12 năm 2022 của Bộ trưởng Bộ Tài chính)|29-11-2019||\n|01/2022/TT-BTP|Thông tư sửa đổi|04-01-2022||\n|106/2021/TT-BTC|Thông tư 106/2021/TT-BTC|26-11-2021||\n|87/2020/NĐ-CP|Nghị định 87/2020/NĐ-CP|28-07-2020||\n|Thông tư số 03/2023/TT-BTP|Thông tư số 03/2023/TT-BTP ngày 02/8/2023 của Bộ trưởng Bộ Tư pháp|02-08-2023|Bộ trưởng Bộ Tư pháp|\n\nYêu cầu, điều kiện thực hiện:\nKhông có thông tin\nTừ khóa:\nKhông có thông tin\nMô tả:\nKhông có thông tin']",Ngay trong ngày tiếp nhận hồ sơ; trường hợp nhận hồ sơ sau 15 giờ mà không giải quyết được ngay thì trả kết quả vào 09 giờ ngày làm việc tiếp theo.,"|Hình thức nộp|Thời hạn giải quyết|
|--|--|
|Trực tiếp|Ngay trong ngày tiếp nhận hồ sơ; trường hợp nhận hồ sơ sau 15 giờ mà không giải quyết được ngay thì trả kết quả trong ngày làm việc tiếp theo.|
|Trực tuyến|Ngay trong ngày tiếp nhận hồ sơ; trường hợp nhận hồ sơ sau 15 giờ mà không giải quyết được ngay thì trả kết quả trong ngày làm việc tiếp theo.|
|Dịch vụ bưu chính|Ngay trong ngày tiếp nhận hồ sơ; trường hợp nhận hồ sơ sau 15 giờ mà không giải quyết được ngay thì trả kết quả trong ngày làm việc tiếp theo.|",0.5,0.0,0.0,0.0
9,Tôi có thể nộp hồ sơ xin cấp giấy phép xây dựng trực tiếp ở đâu?,"['\n|*Lưu ý: Việc nộp hồ sơ đăng ký cư trú - Trường hợp nộp hồ sơ trực tiếp tại cơ quan đăng ký cư trú thì người yêu cầu đăng ký cư trú có thể nộp bản sao giấy tờ, tài liệu được chứng thực từ bản chính hoặc bản sao giấy tờ được cấp từ sổ gốc (sau đây gọi là bản sao) hoặc bản quét, bản chụp kèm theo bản chính giấy tờ, tài liệu để đối chiếu. Trường hợp người yêu cầu đăng ký cư trú nộp bản quét hoặc bản chụp kèm theo bản chính giấy tờ để đối chiếu thì người tiếp nhận có trách nhiệm kiểm tra, đối chiếu bản quét, bản chụp với bản chính và ký xác nhận, không được yêu cầu nộp bản sao giấy tờ đó. - Trường hợp thực hiện đăng ký cư trú trực tuyến, người yêu cầu đăng ký cư trú khai báo thông tin theo biểu mẫu điện tử được cung cấp sẵn, đăng tải bản quét hoặc bản chụp giấy tờ, tài liệu hợp lệ (không bắt buộc phải công chứng, chứng thực, ký số hoặc xác thực bằng hình thức khác) hoặc dẫn nguồn tài liệu từ Kho quản lý dữ liệu điện tử của tổ chức, cá nhân. Trường hợp công dân đăng tải bản quét, bản chụp giấy tờ, tài liệu mà không được ký số hoặc xác thực bằng hình thức khác thì khi cơ quan đăng ký cư trú tiến hành kiểm tra, xác minh để giải quyết thủ tục về cư trú; công dân có trách nhiệm xuất trình giấy tờ, tài liệu đã đăng tải để cơ quan đăng ký cư trú kiểm tra, đối chiếu và ghi nhận tính chính xác vào biên bản xác minh. Cơ quan đăng ký cư trú không yêu cầu công dân nộp để lưu giữ giấy tờ đó. - Bản quét hoặc bản chụp giấy tờ bằng thiết bị điện tử từ giấy tờ được cấp hợp lệ, còn giá trị sử dụng phải bảo đảm rõ nét, đầy đủ, toàn vẹn về nội dung; đã được hợp pháp hóa lãnh sự, dịch sang tiếng Việt theo quy định nếu là giấy tờ do cơ quan có thẩm quyền nước ngoài cấp trừ trường hợp được miễn hợp pháp hóa lãnh sự. - Trường hợp thông tin giấy tờ chứng minh điều kiện đăng ký cư trú đã được chia sẻ và khai thác từ cơ sở dữ liệu quốc gia, cơ sở dữ liệu chuyên ngành thì cơ quan đăng ký cư trú không được yêu cầu công dân nộp, xuất trình giấy tờ đó để giải quyết đăng ký cư trú.||Bản chính: 0Bản sao: 0|', '|*Lưu ý: Việc nộp hồ sơ đăng ký cư trú - Trường hợp nộp hồ sơ trực tiếp tại cơ quan đăng ký cư trú thì người yêu cầu đăng ký cư trú có thể nộp bản sao giấy tờ, tài liệu được chứng thực từ bản chính hoặc bản sao giấy tờ được cấp từ sổ gốc (sau đây gọi là bản sao) hoặc bản quét, bản chụp kèm theo bản chính giấy tờ, tài liệu để đối chiếu. Trường hợp người yêu cầu đăng ký cư trú nộp bản quét hoặc bản chụp kèm theo bản chính giấy tờ để đối chiếu thì người tiếp nhận có trách nhiệm kiểm tra, đối chiếu bản quét, bản chụp với bản chính và ký xác nhận, không được yêu cầu nộp bản sao giấy tờ đó. - Trường hợp thực hiện đăng ký cư trú trực tuyến, người yêu cầu đăng ký cư trú khai báo thông tin theo biểu mẫu điện tử được cung cấp sẵn, đăng tải bản quét hoặc bản chụp giấy tờ, tài liệu hợp lệ (không bắt buộc phải công chứng, chứng thực, ký số hoặc xác thực bằng hình thức khác) hoặc dẫn nguồn tài liệu từ Kho quản lý dữ liệu điện tử của tổ chức, cá nhân. Trường hợp công dân đăng tải bản quét, bản chụp', '\n|* Lưu ý: Việc nộp hồ sơ đăng ký cư trú - Trường hợp nộp hồ sơ trực tiếp tại cơ quan đăng ký cư trú thì người yêu cầu đăng ký cư trú có thể nộp bản sao giấy tờ, tài liệu được chứng thực từ bản chính hoặc bản sao giấy tờ được cấp từ sổ gốc (sau đây gọi là bản sao) hoặc bản quét, bản chụp kèm theo bản chính giấy tờ, tài liệu để đối chiếu. Trường hợp người yêu cầu đăng ký cư trú nộp bản quét hoặc bản chụp kèm theo bản chính giấy tờ để đối chiếu thì người tiếp nhận có trách nhiệm kiểm tra, đối chiếu bản quét, bản chụp với bản chính và ký xác nhận, không được yêu cầu nộp bản sao giấy tờ đó. - Trường hợp thực hiện đăng ký cư trú trực tuyến, người yêu cầu đăng ký cư trú khai báo thông tin theo biểu mẫu điện tử được cung cấp sẵn, đăng tải bản quét hoặc bản chụp giấy tờ, tài liệu hợp lệ (không bắt buộc phải công chứng, chứng thực, ký số hoặc xác thực bằng hình thức khác) hoặc dẫn nguồn tài liệu từ Kho quản lý dữ liệu điện tử của tổ chức, cá nhân. Trường hợp công dân đăng tải bản quét, bản chụp giấy tờ, tài liệu mà không được ký số hoặc xác thực bằng hình thức khác thì khi cơ quan đăng ký cư trú tiến hành kiểm tra, xác minh để giải quyết thủ tục về cư trú; công dân có trách nhiệm xuất trình giấy tờ, tài liệu đã đăng tải để cơ quan đăng ký cư trú kiểm tra, đối chiếu và ghi nhận tính chính xác vào biên bản xác minh. Cơ quan đăng ký cư trú không yêu cầu công dân nộp để lưu giữ giấy tờ đó. - Bản quét hoặc bản chụp giấy tờ bằng thiết bị điện tử từ giấy tờ được cấp hợp lệ, còn giá trị sử dụng phải bảo đảm rõ nét, đầy đủ, toàn vẹn về nội dung; đã được hợp pháp hóa lãnh sự, dịch sang tiếng Việt theo quy định nếu là giấy tờ do cơ quan có thẩm quyền nước ngoài cấp trừ trường hợp được miễn hợp pháp hóa lãnh sự. - Trường hợp thông tin giấy tờ chứng minh điều kiện đăng ký cư trú đã được chia sẻ và khai thác từ cơ sở dữ liệu quốc gia, cơ sở dữ liệu chuyên ngành thì cơ quan đăng ký cư trú không được yêu cầu công dân nộp, xuất trình giấy tờ đó để giải quyết đăng ký cư trú.|         |Bản chính: 0Bản sao: 0|']",Ủy ban nhân dân cấp huyện.,Tôi không biết trả lời câu hỏi này.,0.0,0.0,0.0,0.0
10,Tôi cần nộp những giấy tờ gì khi đăng ký biến động quyền sử dụng đất?,"['Thành phần hồ sơ:\n\nc.1) Hồ sơ nộp khi thực hiện đăng ký biến động quyền sử dụng đất, quyền sở hữu tài sản gắn liền với đất trong các trường hợp chuyển đổi quyền sử dụng đất nông nghiệp mà không thuộc trường hợp “dồn điền đổi thửa”, chuyển nhượng, cho thuê, cho thuê lại, thừa kế, tặng cho, góp vốn bằng quyền sử dụng đất, quyền sở hữu tài sản gắn liền với đất; chuyển quyền sử dụng đất, quyền sở hữu tài sản gắn liền với đất của vợ hoặc chồng thành của chung vợ và chồng\n|Tên giấy tờ|Mẫu đơn, tờ khai|Số lượng|\n|--|--|-|\n|(1) Đơn đăng ký biến động đất đai, tài sản gắn liền với đất theo Mẫu số 09/ĐK. Đối với trường hợp hộ gia đình, cá nhân nhận chuyển quyền sử dụng đất nông nghiệp thì phải thể hiện tổng diện tích nhận chuyển quyền tại điểm 4 Mục I của Mẫu số 09/ĐK ban hành kèm theo Thông tư số 33/2017/TT-BTNMT (được sửa đổi, bổ sung tại Thông tư số 14/2023/TT-BTNMT ngày 16 tháng 10 năm 2023) (Lý do biến động) như sau: “Nhận … (ghi hình thức chuyển quyền sử dụng đất) …m2 đất (ghi diện tích đất nhận chuyển quyền); tổng diện tích đất nông nghiệp đang sử dụng do nhận chuyển quyền và đã đăng ký chuyển quyền sử dụng đất từ ngày 01/7/2007 đến trước ngày 01/7/2014 là … m2 và từ ngày 01/7/2014 đến nay là … m2 (ghi cụ thể diện tích nhận chuyển quyền theo từng loại đất, từng địa bàn tỉnh, thành phố trực thuộc Trung ương)”;|<a href=""https://csdl.dichvucong.gov.vn/web/jsp/download_file.jsp?ma=\'3fe998b4cf4ed90a\'"">Mau so 09-DK.pdf</a>|Bản chính: 1Bản sao: 0|\n|(2) Hợp đồng, văn bản về việc chuyển đổi, chuyển nhượng, cho thuê, cho thuê lại, thừa kế, tặng cho quyền sử dụng đất, quyền sở hữu tài sản gắn liền với đất; góp vốn bằng quyền sử dụng đất, quyền sở hữu tài sản gắn liền với đất; chuyển quyền sử dụng đất, quyền sở hữu tài sản gắn liền với đất của vợ hoặc chồng thành của chung vợ và chồng theo quy định. Trường hợp người thừa kế quyền sử dụng đất, quyền sở hữu tài sản gắn liền với đất là người duy nhất thì phải có đơn đề nghị được đăng ký thừa kế quyền sử dụng đất, quyền sở hữu tài sản gắn liền với đất của người thừa kế;||Bản chính: 1Bản sao: 0|\n|(3) Bản gốc Giấy chứng nhận đã cấp;||Bản chính: 1Bản sao: 0|\n|(4) Văn bản của người sử dụng đất đồng ý cho chủ sở hữu tài sản gắn liền với đất được chuyển nhượng, tặng cho, cho thuê, góp vốn tài sản gắn liền với đất đối với trường hợp chuyển nhượng, tặng cho, cho thuê, góp vốn bằng tài sản gắn liền với đất mà chủ sở hữu tài sản gắn liền với đất không đồng thời là người sử dụng đất.||Bản chính: 1Bản sao: 0|\n|(5) Trường hợp người đề nghị cấp Giấy chứng nhận đã chết trước khi được trao Giấy chứng nhận thì người được thừa kế quyền sử dụng đất theo quy định của pháp luật thừa kế nộp bổ sung giấy tờ về thừa kế theo quy định.||Bản chính: 1Bản sao: 0|\n|(6) Văn bản của các thành viên trong hộ gia đình sử dụng đất đồng ý chuyển quyền sử dụng đất của hộ gia đình đã được công chứng hoặc chứng thực theo quy định của pháp luật.||Bản chính: 1Bản sao: 0|\n|(7) Văn bản xác nhận trực tiếp sản xuất nông nghiệp đối với trường hợp nhận chuyển nhượng, tặng cho quyền sử dụng đất trồng lúa.||Bản chính: 1Bản sao: 0|\n\n\nc.2) Hồ sơ nộp khi cấp Giấy chứng nhận đối với trường hợp diện tích đất tăng thêm do nhận chuyển nhượng, thừa kế, tặng cho quyền sử dụng đất đã có Giấy chứng nhận trong trường hợp thửa đất gốc đã được cấp Giấy chứng nhận:\n|Tên giấy tờ|Mẫu đơn, tờ khai|Số lượng|\n|--|--|-|\n|(1) Đơn đề nghị cấp lại, cấp đổi Giấy chứng nhận quyền sử dụng đất, quyền sở hữu nhà ở và tài sản khác gắn liền với đất theo Mẫu số 10/ĐK|<a href=""https://csdl.dichvucong.gov.vn/web/jsp/download_file.jsp?ma=\'3fe2f78f7bc72401\'"">Mau so 10-DK.pdf</a>|Bản chính: 1Bản sao: 0|\n|(2) Bản gốc Giấy chứng nhận của thửa đất gốc;||Bản chính: 1Bản sao: 0|\n|(3) Bản gốc Giấy chứng nhận và hợp đồng, văn bản về việc chuyển nhượng, thừa kế, tặng cho quyền sử dụng đất được lập theo quy định của diện tích đất tăng thêm. Trường hợp nhận chuyển nhượng, thừa kế, tặng cho phần diện tích đất tăng thêm theo quy định tại Khoản 2 Điều 82 của Nghị định số 43/2014/NĐ-CP thì nộp bản gốc Giấy chứng nhận của bên chuyển quyền sử dụng đất hoặc hợp đồng, văn bản về việc chuyển nhượng, thừa kế, tặng cho quyền sử dụng đất của diện tích đất tăng thêm.||Bản chính: 1Bản sao: 0|\n\n\nc.3) Hồ sơ nộp khi thực hiện thủ tục xác định lại diện tích đất ở cho hộ gia đình, cá nhân đã được cấp Giấy chứng nhận bao gồm:\n|Tên giấy tờ|Mẫu đơn, tờ khai|Số lượng|\n|--|--|-|\n|(1) Đơn đăng ký biến động đất đai, tài sản gắn liền với đất theo Mẫu số 09/ĐK|<a href=""https://csdl.dichvucong.gov.vn/web/jsp/download_file.jsp?ma=\'3fcb0da797e44608\'"">Mau so 09-DK.pdf</a>|Bản chính: 1Bản sao: 0|\n|(2) Bản gốc Giấy chứng nhận đã cấp.||Bản chính: 1Bản sao: 0|\n\n\nc.4) Đối với trường hợp thực hiện thủ tục đăng ký biến động đất đai, tài sản gắn liền với đất tại các khoản c.1, c.2 và c.3 mà có thay đổi thông tin về pháp nhân, số Giấy chứng minh nhân dân, số thẻ Căn cước công dân, số định danh cá nhân, địa chỉ trên Giấy chứng nhận đã cấp thì thực hiện như sau:\n|Tên giấy tờ|Mẫu đơn, tờ khai|Số lượng|\n|--|--|-|\n|+ Đối với cá nhân thì cơ quan giải quyết thủ tục có trách nhiệm khai thác, sử dụng thông tin trong Cơ sở dữ liệu quốc gia về dân cư theo quy định tại Điều 14 Nghị định số 104/2022/NĐ-CP ngày 21 tháng 12 năm 2022 của Chính phủ sửa đổi, bổ sung một số điều của các nghị định liên quan đến việc nộp, xuất trình sổ hộ khẩu, sổ tạm trú giấy khi thực hiện thủ tục hành chính, cung cấp dịch vụ công;||Bản chính: 1Bản sao: 1|\n|+ Đối với tổ chức, cộng đồng dân cư, cơ sở tôn giáo thì nộp bổ sung văn bản của cơ quan có thẩm quyền cho phép hoặc công nhận việc thay đổi thông tin pháp nhân đối với trường hợp thay đổi thông tin về pháp nhân của tổ chức, cơ sở tôn giáo đã ghi trên Giấy chứng nhận.||Bản chính: 1Bản sao: 1|\n\nĐối tượng thực hiện:\nCông dân Việt Nam, Người Việt Nam định cư ở nước ngoài\nCơ quan thực hiện:\nVăn phòng đăng ký quyền sử dụng đất cấp huyện\nCơ quan có thẩm quyền:\nVăn phòng đăng ký quyền sử dụng đất cấp huyện, Ủy ban nhân dân cấp Huyện\nĐịa chỉ tiếp nhận HS:\nKhông có thông tin\nCơ quan được ủy quyền:\nKhông có thông tin\nCơ quan phối hợp:\nCơ quan thuế, Kho bạc nhà nước các cấp, Ủy ban nhân dân cấp xã\nKết quả thực hiện:\nGiấy chứng nhận quyền sử dụng đất quyền sở hữu nhà ở và tài sản khác gắn liền với đất tài sản khác gắn liền với đất, Ghi vào sổ địa chính và lập hồ sơ để Nhà nước quản lý.\nCăn cứ pháp lý:\n|Số ký hiệu|Trích yếu|Ngày ban hành|Cơ quan ban hành|\n|--|--|--|-|\n|45/2013/QH13|Luật 45/2013/QH13|29-11-2013|Quốc Hội|\n|23/2014/TT-BTNMT|Thông tư 23/2014/TT-BTNMT|19-05-2014|Bộ Tài nguyên và Môi trường|\n|24/2014/TT-BTNMT|Thông tư 24/2014/TT-BTNMT|19-05-2014|Bộ Tài nguyên và Môi trường|\n|02/2015/TT-BTNMT|Thông tư 02/2015/TT-BTNMT|27-01-2015|Bộ Tài nguyên và Môi trường|\n|01/2017/NĐ-CP|Nghị định 01/2017/NĐ-CP|06-01-2017|Chính phủ|\n|09/2021/TT-BTNMT|Thông tư 09/2021/TT-BTNMT|30-06-2021||\n|33/2017/TT-BTNMT|Thông tư 33/2017/TT-BTNMT|29-09-2017||\n|43/2014/NĐ-CP|Nghị định 43/2014/NĐ-CP|15-05-2014||\n|10/2023/NĐ-CP|Nghị định 10/2023/NĐ-CP|03-04-2023||\n|85/2019/TT-BTC|Thông tư 85/2019/TT-BTC|29-11-2019||\n|14/2023/TT- BTNMT|Thông tư số|16-10-2023|Bộ Tài nguyên và Môi trường|', 'Chi tiết thủ tục hành chính:\nMã thủ tục:\n2.000410\nSố quyết định:\n3873/QĐ-BTNMT\nTên thủ tục:\nĐăng ký biến động quyền sử dụng đất, quyền sở hữu tài sản gắn liền với đất trong các trường hợp chuyển nhượng, cho thuê, cho thuê lại, thừa kế, tặng cho, góp vốn bằng quyền sử dụng đất, quyền sở hữu tài sản gắn liền với đất; chuyển quyền sử dụng đất, quyền sở hữu tài sản gắn liền với đất của vợ hoặc chồng thành của chung vợ và chồng; tăng thêm diện tích do nhận chuyển nhượng, thừa kế, tặng cho quyền sử dụng đất đã có Giấy chứng nhận\nCấp thực hiện:\nCấp Huyện\nLoại thủ tục:\nTTHC không được luật giao cho địa phương quy định hoặc quy định chi tiết\nLĩnh vực:\nĐất đai\nTrình tự thực hiện:\nTrực tiếp\n(1) Người sử dụng đất nộp hồ sơ tại Văn phòng đăng ký quyền sử dụng đất thuộc Phòng Tài nguyên và Môi trường hoặc cơ quan tiếp nhận hồ sơ theo quy định của Ủy ban nhân dân tỉnh, thành phố trực thuộc Trung ương. \nHộ gia đình, cá nhân, cộng đồng dân cư nộp hồ sơ tại Ủy ban nhân dân cấp xã nếu có nhu cầu.\nTrường hợp thực hiện quyền của người sử dụng đất đối với một phần thửa đất thì người sử dụng đất đề nghị Văn phòng đăng ký quyền sử dụng đất thực hiện đo đạc tách thửa đối với phần diện tích cần thực hiện quyền của người sử dụng đất trước khi nộp hồ sơ thực hiện quyền của người sử dụng đất.\nTrường hợp nhận hồ sơ chưa đầy đủ, chưa hợp lệ thì trong thời gian tối đa 03 ngày, cơ quan tiếp nhận, xử lý hồ sơ phải thông báo và hướng dẫn người nộp hồ sơ bổ sung, hoàn chỉnh hồ sơ theo quy định. \n(2) Cơ quan tiếp nhận hồ sơ ghi đầy đủ thông tin vào Sổ tiếp nhận hồ sơ và trả kết quả, trao Phiếu tiếp nhận hồ sơ và trả kết quả cho người nộp hồ sơ.\nTrường hợp nộp hồ sơ tại Ủy ban nhân dân cấp xã thì trong thời hạn 03 ngày làm việc kể từ ngày nhận đủ hồ sơ, Ủy ban nhân dân cấp xã phải chuyển hồ sơ đến Văn phòng đăng ký quyền sử dụng đất. \n(3) Văn phòng đăng ký quyền sử dụng đất có trách nhiệm kiểm tra hồ sơ, nếu đủ điều kiện thực hiện các quyền theo quy định thì thực hiện các công việc sau đây:\n- Thông báo cho bên chuyển quyền sử dụng đất và niêm yết tại Ủy ban nhân dân cấp xã về việc làm thủ tục cấp Giấy chứng nhận cho người nhận chuyển quyền đối với trường hợp bên nhận chuyển quyền chỉ có Giấy chứng nhận của bên chuyển quyền; gửi văn bản đề nghị xác nhận hộ gia đình, cá nhân trực tiếp sản xuất nông nghiệp đến Ủy ban nhân dân cấp xã nơi đăng ký thường trú, Ủy ban nhân dân cấp xã nơi có đất đối với trường hợp nhận chuyển nhượng, nhận tặng cho quyền sử dụng đất trồng lúa của hộ gia đình, cá nhân;\n- Gửi thông tin địa chính đến cơ quan thuế để xác định và thông báo thu nghĩa vụ tài chính đối với trường hợp phải thực hiện nghĩa vụ tài chính theo quy định;\n- Xác nhận nội dung biến động vào Giấy chứng nhận đã cấp theo quy định của Bộ Tài nguyên và Môi trường.\nTrường hợp phải cấp Giấy chứng nhận thì lập hồ sơ trình cơ quan có thẩm quyền cấp Giấy chứng nhận cho người sử dụng đất.\n- Chỉnh lý, cập nhật biến động vào hồ sơ địa chính, cơ sở dữ liệu đất đai.\n- Trao Giấy chứng nhận cho người sử dụng đất hoặc gửi Ủy ban nhân dân cấp xã để trao đối với trường hợp nộp hồ sơ tại cấp xã.\nTrường hợp người đề nghị cấp Giấy chứng nhận đã chết trước khi được trao Giấy chứng nhận thì người được thừa kế quyền sử dụng đất theo quy định của pháp luật thừa kế nộp bổ sung giấy tờ về thừa kế theo quy định. Văn phòng đăng ký quyền sử dụng đất xác nhận thừa kế vào Giấy chứng nhận đã ký hoặc lập hồ sơ để trình cơ quan có thẩm quyền cấp Giấy chứng nhận quyền sử dụng đất, quyền sở hữu nhà ở và tài sản khác gắn liền với đất cho người được thừa kế theo quy định của Bộ Tài nguyên và Môi trường. Người được thừa kế có trách nhiệm thực hiện nghĩa vụ tài chính về quyền sử dụng đất, tài sản gắn liền với đất trong trường hợp người được cấp Giấy chứng nhận đã chết phải thực hiện theo quy định của pháp luật.\n- Xác nhận vào bản chính giấy tờ việc đã cấp Giấy chứng nhận theo quy định.\n(4) Người được cấp Giấy chứng nhận nhận lại bản chính giấy tờ đã được xác nhận cấp Giấy chứng nhận và Giấy chứng nhận.\n* Trường hợp người sử dụng đất tặng cho quyền sử dụng đất để xây dựng công trình công cộng thì phải lập văn bản tặng cho quyền sử dụng đất theo quy định.\nSau khi hoàn thành xây dựng công trình công cộng trên đất được tặng cho, Văn phòng đăng ký quyền sử dụng đất căn cứ vào văn bản tặng cho quyền sử dụng đất đã được Ủy ban nhân dân cấp xã xác nhận và hiện trạng sử dụng đất để đo đạc, chỉnh lý biến động vào hồ sơ địa chính, cơ sở dữ liệu đất đai và thông báo cho người sử dụng đất nộp Giấy chứng nhận đã cấp để xác nhận thay đổi. Trường hợp người sử dụng đất tặng cho toàn bộ diện tích đất đã cấp Giấy chứng nhận thì thu hồi Giấy chứng nhận để quản lý.\nThực hiện thủ tục trên môi trường điện tử\nCơ quan tiếp nhận, giải quyết hồ sơ có trách nhiệm thực hiện các trình tự, thủ tục hành chính về đất đai theo quy định của pháp luật về đất đai; trường hợp cần phải kiểm tra, xác minh làm rõ hoặc do nguyên nhân khác mà không trả kết quả giải quyết hồ sơ theo đúng quy định về thời gian giải quyết thủ tục hành chính về đất đai thì cơ quan tiếp nhận hồ sơ, giải quyết thủ tục gửi thông báo bằng văn bản hoặc qua Cổng dịch vụ công hoặc qua tin nhắn SMS cho người yêu cầu, trong đó nêu rõ lý do.\nNgười sử dụng đất, chủ sở hữu tài sản gắn liền với đất có trách nhiệm hoàn thành nghĩa vụ tài chính theo quy định của pháp luật bằng hình thức trực tiếp hoặc trực tuyến thông qua chức năng thanh toán của Cổng dịch vụ công.\nCơ quan tiếp nhận hoặc cơ quan giải quyết hồ sơ thông báo cho người yêu cầu thực hiện thủ tục hành chính nộp bản chính Giấy chứng nhận đã cấp, các giấy tờ theo quy định sau khi người sử dụng đất hoàn thành nghĩa vụ tài chính.\n\tViệc trả kết quả giải quyết thủ tục hành chính được thực hiện tại cơ quan tiếp nhận hồ sơ hoặc qua dịch vụ bưu chính công ích hoặc tại địa điểm theo yêu cầu đối với trường hợp tiếp nhận hồ sơ và trả kết quả giải quyết thủ tục đăng ký đất đai, tài sản khác gắn liền với đất.\nCách thức thực hiện:\n|Hình thức nộp|Thời hạn giải quyết|Phí, lệ phí|Mô tả|\n|--|--|--|-|\n|Trực tiếp|10 Ngày làm việc|Phí : Thực hiện theo quy định của Luật Phí, lệ phí.|Cách thức thực hiện: Người sử dụng đất nộp hồ sơ tại Văn phòng đăng ký quyền sử dụng đất thuộc Phòng Tài nguyên và Môi trường hoặc cơ quan tiếp nhận hồ sơ theo quy định của Ủy ban nhân dân cấp tỉnh hoặc trên môi trường điện tử. Hộ gia đình, cá nhân, cộng đồng dân cư nộp hồ sơ tại Ủy ban nhân dân cấp xã nếu có nhu cầu. Thời hạn giải quyết: Do Ủy ban nhân dân cấp tỉnh quy định. Cụ thể: - Thời gian thực hiện thủ tục đăng ký biến động quyền sử dụng đất, quyền sở hữu tài sản gắn liền với đất trong trường hợp chuyển đổi, chuyển nhượng, thừa kế, tặng cho, đăng ký góp vốn bằng quyền sử dụng đất, quyền sở hữu tài sản gắn liền với đất là không quá 10 ngày kể từ ngày nhận được hồ sơ hợp lệ; - Thời gian thực hiện thủ tục đăng ký biến động quyền sử dụng đất, quyền sở hữu tài sản gắn liền với đất trong trường hợp cho thuê, cho thuê lại quyền sử dụng đất là không quá 03 ngày kể từ ngày nhận được hồ sơ hợp lệ; - Thời gian thực hiện thủ tục đăng ký biến động quyền sử dụng đất, quyền sở hữu tài sản gắn liền với đất trong trường hợp chuyển quyền sử dụng đất, quyền sở hữu tài sản gắn liền với đất của vợ hoặc chồng thành của chung vợ và chồng là không quá 05 ngày kể từ ngày nhận được hồ sơ hợp lệ; Thời gian này không tính thời gian các ngày nghỉ, ngày lễ theo quy định của pháp luật; không tính thời gian tiếp nhận hồ sơ tại xã, thời gian thực hiện nghĩa vụ tài chính của người sử dụng đất; không tính thời gian xem xét xử lý đối với trường hợp sử dụng đất có vi phạm pháp luật, thời gian trưng cầu giám định. Đối với các xã miền núi, hải đảo, vùng sâu, vùng xa, vùng có điều kiện kinh tế - xã hội khó khăn, vùng có điều kiện kinh tế - xã hội đặc biệt khó khăn thì thời gian thực hiện được tăng thêm 10 ngày. - Kết quả giải quyết thủ tục hành chính phải trả cho người sử dụng đất, chủ sở hữu tài sản gắn liền với đất trong thời hạn không quá 03 ngày làm việc kể từ ngày có kết quả giải quyết.|\n\nThành phần hồ sơ:', 'Bao gồm\n|Tên giấy tờ|Mẫu đơn, tờ khai|Số lượng|\n|--|--|-|\n|* Lưu ý: Việc nộp hồ sơ đăng ký cư trú - Trường hợp nộp hồ sơ trực tiếp tại cơ quan đăng ký cư trú thì người yêu cầu đăng ký cư trú có thể nộp bản sao giấy tờ, tài liệu được chứng thực từ bản chính hoặc bản sao giấy tờ được cấp từ sổ gốc (sau đây gọi là bản sao) hoặc bản quét, bản chụp kèm theo bản chính giấy tờ, tài liệu để đối chiếu. Trường hợp người yêu cầu đăng ký cư trú nộp bản quét hoặc bản chụp kèm theo bản chính giấy tờ để đối chiếu thì người tiếp nhận có trách nhiệm kiểm tra, đối chiếu bản quét, bản chụp với bản chính và ký xác nhận, không được yêu cầu nộp bản sao giấy tờ đó. - Trường hợp thực hiện đăng ký cư trú trực tuyến, người yêu cầu đăng ký cư trú khai báo thông tin theo biểu mẫu điện tử được cung cấp sẵn, đăng tải bản quét hoặc bản chụp giấy tờ, tài liệu hợp lệ (không bắt buộc phải công chứng, chứng thực, ký số hoặc xác thực bằng hình thức khác) hoặc dẫn nguồn tài liệu từ Kho quản lý dữ liệu điện tử của tổ chức, cá nhân. Trường hợp công dân đăng tải bản quét, bản chụp giấy tờ, tài liệu mà không được ký số hoặc xác thực bằng hình thức khác thì khi cơ quan đăng ký cư trú tiến hành kiểm tra, xác minh để giải quyết thủ tục về cư trú; công dân có trách nhiệm xuất trình giấy tờ, tài liệu đã đăng tải để cơ quan đăng ký cư trú kiểm tra, đối chiếu và ghi nhận tính chính xác vào biên bản xác minh. Cơ quan đăng ký cư trú không yêu cầu công dân nộp để lưu giữ giấy tờ đó. - Bản quét hoặc bản chụp giấy tờ bằng thiết bị điện tử từ giấy tờ được cấp hợp lệ, còn giá trị sử dụng phải bảo đảm rõ nét, đầy đủ, toàn vẹn về nội dung; đã được hợp pháp hóa lãnh sự, dịch sang tiếng Việt theo quy định nếu là giấy tờ do cơ quan có thẩm quyền nước ngoài cấp trừ trường hợp được miễn hợp pháp hóa lãnh sự. - Trường hợp thông tin giấy tờ chứng minh điều kiện đăng ký cư trú đã được chia sẻ và khai thác từ cơ sở dữ liệu quốc gia, cơ sở dữ liệu chuyên ngành thì cơ quan đăng ký cư trú không được yêu cầu công dân nộp, xuất trình giấy tờ đó để giải quyết đăng ký cư trú.|         |Bản chính: 0Bản sao: 0|']","|Tên giấy tờ| Mẫu đơn, tờ khai| Số lượng|
|1. Đơn đăng ký biến động đất đai, tài sản gắn liền với đất theo Mẫu số 09/ĐK;|mau so 09.doc|Bản chính: 1 - Bản sao: 0|
|2. Bản gốc Giấy chứng nhận đã cấp;| |Bản chính: 1 - Bản sao: 0|
|3. Một trong các giấy tờ liên quan đến nội dung biến động:| | |
|   - Văn bản công nhận của cơ quan nhà nước có thẩm quyền theo quy định của pháp luật đối với trường hợp cá nhân hoặc người đại diện hộ gia đình thay đổi họ, tên;| |Bản chính: 1 - Bản sao: 0|
|   - Văn bản thỏa thuận của cộng đồng dân cư được Ủy ban nhân dân cấp xã xác nhận đối với trường hợp cộng đồng dân cư đổi tên;| |Bản chính: 1 - Bản sao: 0|
|   - Văn bản xác nhận của Ủy ban nhân dân cấp xã về tình trạng sạt lở tự nhiên đối với trường hợp giảm diện tích thửa đất, tài sản gắn liền với đất do sạt lở tự nhiên;| |Bản chính: 1 - Bản sao: 0|
|   - Chứng từ về việc nộp nghĩa vụ tài chính đối với trường hợp Giấy chứng nhận đã cấp có ghi nợ hoặc chậm nộp nghĩa vụ tài chính, trừ trường hợp người sử dụng đất được miễn giảm hoặc không phải nộp do thay đổi quy định của pháp luật;| |Bản chính: 1 - Bản sao: 0|
|   - Quyết định của cơ quan nhà nước có thẩm quyền về việc thay đổi hạn chế về quyền sử dụng đất, quyền sở hữu tài sản gắn liền với đất ghi trên Giấy chứng nhận đối với trường hợp có hạn chế theo quyết định giao đất, cho thuê đất, công nhận quyền sử dụng đất; trường hợp có thay đổi hạn chế theo văn bản chuyển quyền sử dụng đất thì phải có văn bản chấp thuận thay đổi hạn chế của người có quyền lợi liên quan, được Ủy ban nhân dân cấp xã xác nhận;| |Bản chính: 1 - Bản sao: 0|
|   - Bản sao một trong các giấy tờ về quyền sở hữu tài sản gắn liền với đất thể hiện nội dung thay đổi đối với trường hợp thay đổi thông tin về tài sản gắn liền với đất đã ghi trên Giấy chứng nhận.| |Bản chính: 0 - Bản sao: 1|
|   - Văn bản thỏa thuận của hộ gia đình được Ủy ban nhân dân cấp xã xác nhận đối với trường hợp thay đổi người đại diện là thành viên trong hộ gia đình mà không phải là chủ hộ; trường hợp thay đổi người đại diện hộ gia đình là chủ hộ thì cơ quan giải quyết thủ tục có trách nhiệm khai thác, sử dụng thông tin trong Cơ sở dữ liệu quốc gia về dân cư theo quy định tại Điều 14 Nghị định số 104/2022/NĐ-CP ngày 21 tháng 12 năm 2022 của Chính phủ sửa đổi, bổ sung một số điều của các nghị định liên quan đến việc nộp, xuất trình sổ hộ khẩu, sổ tạm trú giấy khi thực hiện thủ tục hành chính, cung cấp dịch vụ công.| | |","| Tên giấy tờ | Mẫu đơn, tờ khai | Số lượng |
|---|---|---|
| (1) Đơn đăng ký biến động đất đai, tài sản gắn liền với đất theo Mẫu số 09/ĐK | [Mẫu số 09/ĐK](https://csdl.dichvucong.gov.vn/web/jsp/download_file.jsp?ma='3fe998b4cf4ed90a') | Bản chính: 1<br>Bản sao: 0 |
| (2) Hợp đồng, văn bản về việc chuyển đổi, chuyển nhượng, cho thuê, cho thuê lại, thừa kế, tặng cho quyền sử dụng đất, quyền sở hữu tài sản gắn liền với đất; góp vốn bằng quyền sử dụng đất, quyền sở hữu tài sản gắn liền với đất; chuyển quyền sử dụng đất, quyền sở hữu tài sản gắn liền với đất của vợ hoặc chồng thành của chung vợ và chồng theo quy định. Trường hợp người thừa kế quyền sử dụng đất, quyền sở hữu tài sản gắn liền với đất là người duy nhất thì phải có đơn đề nghị được đăng ký thừa kế quyền sử dụng đất, quyền sở hữu tài sản gắn liền với đất của người thừa kế; | | Bản chính: 1<br>Bản sao: 0 |
| (3) Bản gốc Giấy chứng nhận đã cấp; | | Bản chính: 1<br>Bản sao: 0 |
| (4) Văn bản của người sử dụng đất đồng ý cho chủ sở hữu tài sản gắn liền với đất được chuyển nhượng, tặng cho, cho thuê, góp vốn tài sản gắn liền với đất đối với trường hợp chuyển nhượng, tặng cho, cho thuê, góp vốn bằng tài sản gắn liền với đất mà chủ sở hữu tài sản gắn liền với đất không đồng thời là người sử dụng đất. | | Bản chính: 1<br>Bản sao: 0 |
| (5) Trường hợp người đề nghị cấp Giấy chứng nhận đã chết trước khi được trao Giấy chứng nhận thì người được thừa kế quyền sử dụng đất theo quy định của pháp luật thừa kế nộp bổ sung giấy tờ về thừa kế theo quy định. | | Bản chính: 1<br>Bản sao: 0 |
| (6) Văn bản của các thành viên trong hộ gia đình sử dụng đất đồng ý chuyển quyền sử dụng đất của hộ gia đình đã được công chứng hoặc chứng thực theo quy định của pháp luật. | | Bản chính: 1<br>Bản sao: 0 |
| (7) Văn bản xác nhận trực tiếp sản xuất nông nghiệp đối với trường hợp nhận chuyển nhượng, tặng cho quyền sử dụng đất trồng lúa. | | Bản chính: 1<br>Bản sao: 0 |",0.8,0.7,0.0,0.7
11,"Tôi có thể thực hiện thủ tụcc thu hồi giấy chứng nhận đăng ký xe, biển số xe (thực hiện tại cấp huyện) trực tuyến không?","['Chi tiết thủ tục hành chính:\nMã thủ tục:\n1.004084\nSố quyết định:\n3191/QĐ-BCA\nTên thủ tục:\nThu hồi giấy chứng nhận đăng ký xe, biển số xe (thực hiện tại cấp huyện)\nCấp thực hiện:\nCấp Huyện\nLoại thủ tục:\nTTHC được luật giao quy định chi tiết\nLĩnh vực:\nĐăng ký, quản lý phương tiện giao thông đường bộ\nTrình tự thực hiện:\nBước 1: Chuẩn bị hồ sơ theo quy định của pháp luật.\nBước 2: Nộp hồ sơ đề nghị trực tiếp tại bộ phận tiếp nhận và trả kết quả trụ sở Công an cấp huyện hoặc qua dịch vụ bưu chính công ích hoặc khai báo thông tin qua Cổng dịch vụ công trực tuyến.\nBước 3: Cán bộ tiếp nhận hồ sơ: Tiếp nhận thông tin (biển số xe và chủ xe) do chủ xe hoặc tổ chức, cá nhân được ủy quyền cung cấp hoặc thông tin khai báo trên Cổng dịch vụ công trực tuyến; nhận giấy chứng nhận đăng ký và biển số xe.\nĐối với xe sang tên chuyển quyền sở hữu: Kiểm tra, đối chiếu chứng từ chuyển quyền sở hữu xe đối với trường hợp thu hồi đăng ký, biển số xe để làm thủ tục đăng ký sang tên xe. \nBước 4: Thu hồi giấy chứng nhận đăng ký, biển số xe. \nTrường hợp xe bị mất giấy chứng nhận đăng ký xe hoặc biển số xe hoặc mất cả giấy chứng nhận đăng ký xe và biển số xe, chủ xe phải có: Đơn trình bày rõ lý do bị mất. Lập 02 bản thông báo mất giấy chứng nhận đăng ký, biển số xe, ghi rõ họ tên, địa chỉ chủ xe, số máy, số khung, nhãn hiệu, loại xe (01 bản niêm yết công khai tại trụ sở, 01 bản lưu trong hồ sơ xe); thông báo trên hệ thống đăng ký, quản lý xe. Sau 30 ngày nếu không có khiếu nại, tố cáo thì giải quyết thu hồi giấy chứng nhận đăng ký, biển số xe. \nBước 5: Nhập thông tin trên hệ thống và in giấy chứng nhận thu hồi đăng ký, biển số xe \nBước 6: Trả giấy chứng nhận thu hồi đăng ký, biển số xe cho chủ xe.\nCách thức thực hiện:\n|Hình thức nộp|Thời hạn giải quyết|Phí, lệ phí|Mô tả|\n|--|--|--|-|\n|Trực tiếp|02 Ngày làm việc||Trực tiếp tại trụ sở Công an cấp huyện. Thời gian: Từ thứ 2 đến thứ 7 (theo quy định của Thủ tướng Chính phủ). - Thời hạn giải quyết: Không quá 2 ngày làm việc kể từ ngày nhận hồ sơ hợp lệ. Trường hợp giấy chứng nhận đăng ký xe, biển số xe bị mất thì niêm yết công khai, thông báo việc mất giấy chứng nhận đăng ký xe, biển số xe, sau 30 ngày nếu không có khiếu nại, tố cáo thì giải quyết thu hồi giấy chứng nhận đăng ký, biển số xe.|\n|Trực tuyến|02 Ngày làm việc||+ Nộp hồ sơ trực tuyến trên Cổng Dịch vụ công quốc gia hoặc Cổng dịch vụ công Bộ Công an. Không quá 2 ngày làm việc kể từ ngày nhận hồ sơ hợp lệ. Trường hợp giấy chứng nhận đăng ký xe, biển số xe bị mất thì niêm yết công khai, thông báo việc mất giấy chứng nhận đăng ký xe, biển số xe, sau 30 ngày nếu không có khiếu nại, tố cáo thì giải quyết thu hồi giấy chứng nhận đăng ký, biển số xe.|\n|Dịch vụ bưu chính|02 Ngày làm việc||Nộp hồ sơ qua dịch vụ bưu chính về Công an cấp huyện. Không quá 2 ngày làm việc kể từ ngày nhận hồ sơ hợp lệ. Trường hợp giấy chứng nhận đăng ký xe, biển số xe bị mất thì niêm yết công khai, thông báo việc mất giấy chứng nhận đăng ký xe, biển số xe, sau 30 ngày nếu không có khiếu nại, tố cáo thì giải quyết thu hồi giấy chứng nhận đăng ký, biển số xe.|\n\nThành phần hồ sơ:\n\nBao gồm\n|Tên giấy tờ|Mẫu đơn, tờ khai|Số lượng|\n|--|--|-|\n|a) Giấy chứng nhận đăng ký xe, biển số xe. Trường hợp xe bị mất giấy chứng nhận đăng ký xe hoặc biển số xe hoặc mất cả giấy chứng nhận đăng ký xe và biển số xe, chủ xe phải có: Đơn trình bày rõ lý do bị mất.||Bản chính: 1Bản sao: 0|\n|b) Giấy tờ của người làm thủ tục.||Bản chính: 1Bản sao: 0|\n\nĐối tượng thực hiện:\nCông dân Việt Nam, Người Việt Nam định cư ở nước ngoài, Người nước ngoài, Doanh nghiệp, Doanh nghiệp có vốn đầu tư nước ngoài, Tổ chức (không bao gồm doanh nghiệp, HTX), Tổ chức nước ngoài, Hợp tác xã\nCơ quan thực hiện:\nCông an huyện\nCơ quan có thẩm quyền:\nCông an huyện\nĐịa chỉ tiếp nhận HS:\nCông an cấp huyện; Cổng Dịch vụ công quốc gia; Cổng dịch vụ công Bộ Công an.\nCơ quan được ủy quyền:\nKhông có thông tin\nCơ quan phối hợp:\nKhông có thông tin\nKết quả thực hiện:\nGiấy chứng nhận thu hồi đăng ký, biển số xe\nCăn cứ pháp lý:\n|Số ký hiệu|Trích yếu|Ngày ban hành|Cơ quan ban hành|\n|--|--|--|-|\n|23/2008/QH12|Luật 23/2008/QH12 - Giao thông đường bộ|13-11-2008|Quốc Hội|\n|Thông tư số 229/2016/TT-BTC|Quy định mức thu, chế độ thu, nộp, quản lý lệ phí đăng ký, cấp biển số phương tiện giao thông cơ giới đường bộ|11-11-2016||\n|58/2020/TT-BCA|Thông tư 58/2020/TT-BCA|16-06-2020||\n|15/2022/TT-BCA|Thông tư 15/2022/TT-BCA|06-04-2022||\n\nYêu cầu, điều kiện thực hiện:\nKhông\nTừ khóa:\nKhông có thông tin\nMô tả:\nKhông có thông tin', 'Chi tiết thủ tục hành chính:\nMã thủ tục:\n2.001485\nSố quyết định:\n3191/QĐ-BCA\nTên thủ tục:\nThu hồi giấy chứng nhận đăng ký xe, biển số xe (thực hiện tại cấp tỉnh)\nCấp thực hiện:\nCấp Tỉnh\nLoại thủ tục:\nTTHC không được luật giao cho địa phương quy định hoặc quy định chi tiết\nLĩnh vực:\nĐăng ký, quản lý phương tiện giao thông đường bộ\nTrình tự thực hiện:\nBước 1: Chuẩn bị hồ sơ theo quy định của pháp luật.\nBước 2: Nộp hồ sơ đề nghị trực tiếp tại bộ phận tiếp nhận và trả kết quả trụ sở Phòng Cảnh sát giao thông Công an tỉnh, thành phố trực thuộc Trung ương hoặc các điểm đăng ký xe của Phòng Cảnh sát giao thông hoặc qua dịch vụ bưu chính công ích hoặc khai báo thông tin qua Cổng dịch vụ công trực tuyến.\nBước 3: Cán bộ tiếp nhận hồ sơ: Tiếp nhận thông tin (biển số xe và chủ xe) do chủ xe hoặc tổ chức, cá nhân được ủy quyền cung cấp hoặc thông tin khai báo trên Cổng dịch vụ công trực tuyến; nhận giấy chứng nhận đăng ký và biển số xe.\nĐối với xe sang tên chuyển quyền sở hữu: Kiểm tra, đối chiếu chứng từ chuyển quyền sở hữu xe đối với trường hợp thu hồi đăng ký, biển số xe để làm thủ tục đăng ký sang tên xe. \nBước 4: Thu hồi giấy chứng nhận đăng ký, biển số xe. \nTrường hợp xe bị mất giấy chứng nhận đăng ký xe hoặc biển số xe hoặc mất cả giấy chứng nhận đăng ký xe và biển số xe, chủ xe phải có: Đơn trình bày rõ lý do bị mất. Lập 02 bản thông báo mất giấy chứng nhận đăng ký, biển số xe, ghi rõ họ tên, địa chỉ chủ xe, số máy, số khung, nhãn hiệu, loại xe (01 bản niêm yết công khai tại trụ sở, 01 bản lưu trong hồ sơ xe); thông báo trên hệ thống đăng ký, quản lý xe. Sau 30 ngày nếu không có khiếu nại, tố cáo thì giải quyết thu hồi giấy chứng nhận đăng ký, biển số xe. \nBước 5: Nhập thông tin trên hệ thống và in giấy chứng nhận thu hồi đăng ký, biển số xe \nBước 6: Trả giấy chứng nhận thu hồi đăng ký, biển số xe cho chủ xe.\nCách thức thực hiện:\n|Hình thức nộp|Thời hạn giải quyết|Phí, lệ phí|Mô tả|\n|--|--|--|-|\n|Trực tiếp|2 Ngày làm việc||Trực tiếp tại trụ sở Phòng Cảnh sát giao thông Công an tỉnh, thành phố trực thuộc Trung ương hoặc các điểm đăng ký xe của Phòng Cảnh sát giao thông. - Thời hạn giải quyết: Không quá 2 ngày làm việc kể từ ngày nhận hồ sơ hợp lệ. Trường hợp giấy chứng nhận đăng ký xe, biển số xe bị mất thì niêm yết công khai, thông báo việc mất giấy chứng nhận đăng ký xe, biển số xe, sau 30 ngày nếu không có khiếu nại, tố cáo thì giải quyết thu hồi giấy chứng nhận đăng ký, biển số xe.|\n|Trực tuyến|02 Ngày làm việc||+ Nộp hồ sơ trực tuyến trên Cổng Dịch vụ công quốc gia hoặc Cổng dịch vụ công Bộ Công an. Không quá 2 ngày làm việc kể từ ngày nhận hồ sơ hợp lệ. Trường hợp giấy chứng nhận đăng ký xe, biển số xe bị mất thì niêm yết công khai, thông báo việc mất giấy chứng nhận đăng ký xe, biển số xe, sau 30 ngày nếu không có khiếu nại, tố cáo thì giải quyết thu hồi giấy chứng nhận đăng ký, biển số xe.|\n|Dịch vụ bưu chính|02 Ngày làm việc||+ Nộp hồ sơ và nhận kết quả qua dịch vụ bưu chính.|\n\nThành phần hồ sơ:\n\nBao gồm\n|Tên giấy tờ|Mẫu đơn, tờ khai|Số lượng|\n|--|--|-|\n|a) Giấy chứng nhận đăng ký xe, biển số xe. Trường hợp xe bị mất giấy chứng nhận đăng ký xe hoặc biển số xe hoặc mất cả giấy chứng nhận đăng ký xe và biển số xe, chủ xe phải có: Đơn trình bày rõ lý do bị mất.||Bản chính: 1Bản sao: 0|\n|b) Giấy tờ của người làm thủ tục.||Bản chính: 1Bản sao: 0|\n\nĐối tượng thực hiện:\nCông dân Việt Nam, Người Việt Nam định cư ở nước ngoài, Người nước ngoài, Cán bộ, công chức, viên chức, Doanh nghiệp, Doanh nghiệp có vốn đầu tư nước ngoài, Tổ chức (không bao gồm doanh nghiệp, HTX), Tổ chức nước ngoài, Hợp tác xã\nCơ quan thực hiện:\nPhòng Cảnh sát giao thông\nCơ quan có thẩm quyền:\nPhòng Cảnh sát giao thông\nĐịa chỉ tiếp nhận HS:\ntại trụ sở Phòng Cảnh sát giao thông Công an tỉnh, thành phố trực thuộc Trung ương hoặc các điểm đăng ký xe của Phòng.\nCơ quan được ủy quyền:\nKhông có thông tin\nCơ quan phối hợp:\nKhông có thông tin\nKết quả thực hiện:\nGiấy chứng nhận thu hồi đăng ký, biển số xe\nCăn cứ pháp lý:\n|Số ký hiệu|Trích yếu|Ngày ban hành|Cơ quan ban hành|\n|--|--|--|-|\n|23/2008/QH12|Luật 23/2008/QH12|13-11-2008|Quốc Hội|\n|58/2020/TT-BCA|Thông tư 58/2020/TT-BCA|16-06-2020||\n|15/2022/TT-BCA|Thông tư 15/2022/TT-BCA|06-04-2022||\n\nYêu cầu, điều kiện thực hiện:\nkhông\nTừ khóa:\nThu hồi giấy chứng nhận đăng ký xe, biển số xe (thực hiện tại cấp tỉnh)\nMô tả:\nKhông có thông tin', 'Chi tiết thủ tục hành chính:\nMã thủ tục:\n2.000076\nSố quyết định:\n3191/QĐ-BCA\nTên thủ tục:\nĐăng ký sang tên, di chuyển xe tại Phòng Cảnh sát giao thông (thực hiện tại cấp tỉnh)\nCấp thực hiện:\nCấp Tỉnh\nLoại thủ tục:\nTTHC không được luật giao cho địa phương quy định hoặc quy định chi tiết\nLĩnh vực:\nĐăng ký, quản lý phương tiện giao thông đường bộ\nTrình tự thực hiện:\n+ Khi chuyển quyền sở hữu xe, chủ xe phải giữ lại chứng nhận đăng ký xe, biển số xe (không giao cho tổ chức, cá nhân nhận chuyển quyền sở hữu xe) và nộp cho cơ quan đăng ký xe chứng nhận đăng ký xe, biển số xe để làm thủ tục thu hồi; trong thời hạn 30 ngày, kể từ ngày làm giấy tờ chuyển quyền sở hữu xe, chủ xe phải làm thủ tục thu hồi, trường hợp quá thời hạn trên mà chủ xe không làm thủ tục thu hồi hoặc giao chứng nhận đăng ký xe, biển số xe cho tổ chức, cá nhân nhận chuyển quyền sở hữu xe làm thủ tục thu hồi thì trước khi giải quyết cơ quan đăng ký xe ra quyết định xử phạt đối với chủ xe về hành vi không làm thủ tục thu hồi theo quy định; \nKhi chuyển trụ sở, nơi cư trú từ tỉnh, thành phố trực thuộc Trung ương này sang tỉnh, thành phố trực thuộc Trung ương khác (di chuyển nguyên chủ), chủ xe phải làm thủ tục thu hồi tại cơ quan đang quản lý hồ sơ xe đó. \n+ Tổ chức, cá nhân nhận chuyển quyền sở hữu xe, chủ xe (đối với trường hợp di chuyển nguyên chủ) làm thủ tục đăng ký sang tên, di chuyển xe tại cơ quan đăng ký xe theo quy định.\nBước 1: Chủ xe kê khai giấy khai thu hồi đăng ký, biển số xe trên cổng dịch vụ công; cung cấp mã hồ sơ đăng ký xe trực tuyến; nộp hồ sơ thu hồi quy định tại khoản 1 Điều 14 Thông tư số 24//2023/TT-BCA và nhận giấy hẹn trả kết quả đăng ký xe theo quy định;\nBước 2: Sau khi kiểm tra hồ sơ xe hợp lệ, cơ quan đăng ký xe cấp chứng nhận thu hồi đăng ký, biển số xe theo quy định (có dán bản chà số máy, số khung và đóng dấu giáp lai của cơ quan đăng ký xe trên bản chà số máy, số khung xe): 01 bản trả cho chủ xe; 01 bản lưu hồ sơ xe; trường hợp mất chứng nhận đăng ký xe thì thực hiện xác minh theo quy định.\nBước 3: Tổ chức, cá nhân nhận chuyển quyền sở hữu xe, chủ xe (đối với trường hợp di chuyển nguyên chủ): Kê khai giấy khai đăng ký xe theo quy định tại Điều 9 Thông tư số 24/2023/TT-BCA; đưa xe đến để kiểm tra, cung cấp mã hồ sơ đăng ký xe trực tuyến và nộp hồ sơ quy định tại khoản 2 Điều 14 Thông tư số 24/2023/TT-BCA;\nBước 4: Sau khi kiểm tra hồ sơ xe, thực tế xe đảm bảo hợp lệ thì được cơ quan đăng ký xe cấp biển số theo quy định tại khoản 2 Điều 12 Thông tư số 24/2023/TT-BCA; cáp giấy hẹn trả kết quả đăng ký và xác định mức thu lệ phí đăng ký xe;\nBước 5: Chủ xe nộp lệ phí đăng ký xe trên cổng dịch vụ công Bộ Công an và nhận biển số xe (trường hợp được cấp biển số theo quy định tại điểm a khoản 2 Điều 12 Thông tư số 24/2023/TT-BCA); trường hợp chủ xe có nhu cầu nhận trả kết quả đăng ký xe qua dịch vụ bưu chính công ích thì đăng ký với đơn vị dịch vụ bưu chính công ích;\nBước 6: Chủ xe nhận chứng nhận đăng ký xe, biển số xe (trường hợp được cấp biển số theo quy định tại điểm b khoản 2 Điều 12, Điều 28 Thông tư số 24/2023/TT-BCA) tại cơ quan đăng ký xe hoặc từ đơn vị dịch vụ bưu chính công ích.\nTrường hợp đăng ký xe di chuyển nguyên chủ thì được giữ nguyên biển số định danh (biển 05 số); trường hợp biển số cũ là biển 3 hoặc 4 số thì cấp đổi sang biển số định danh theo quy định tại Thông tư số 24/2023/TT-BCA.\nTổ chức, cá nhân đã nhận chuyển quyền sở hữu xe kèm theo biển số xe trúng đấu giá, không được tiếp tục chuyển quyền sở hữu xe kèm theo biển số xe trúng đấu giá cho tổ chức, cá nhân khác; được chuyển quyền sở hữu xe theo quy định của pháp luật.\nCách thức thực hiện:\n|Hình thức nộp|Thời hạn giải quyết|Phí, lệ phí|Mô tả|\n|--|--|--|-|\n|Trực tiếp|02 Ngày làm việc|Lệ phí : Thu theo Thông tư số 229/2016/TT-BTC ngày 11/11/2016 của Bộ Tài chính quy định mức thu, chế độ thu, nộp, quản lý lệ phí đăng ký, cấp biển số phương tiện giao thông cơ giới đường bộ.  Lệ phí : Đồng Thu theo Thông tư số 60/2023/TT-BTC ngày 07/9/2023 của Bộ Tài chính quy định mức thu, chế độ thu, nộp, quản lý lệ phí đăng ký, cấp biển số phương tiện giao thông cơ giới đường bộ (có hiệu lực từ ngày 22/10/2023)|+ Cấp chứng nhận thu hồi đăng ký, biển số xe: Không quá 02 ngày làm việc (trường hợp cấp chứng nhận thu hồi đăng ký, biển số), kể từ ngày nhận đủ hồ sơ hợp lệ. + Cấp chứng nhận đăng ký xe: Không quá 02 ngày làm việc, kể từ ngày nhận đủ hồ sơ hợp lệ + Cấp biển số định danh lần đầu: Cấp ngay sau khi tiếp nhận hồ sơ đăng ký xe hợp lệ. + Cấp lại biển số định danh: Không quá 07 ngày làm việc, kể từ ngày nhận đủ hồ sơ hợp lệ. + Thời gian trả kết quả đăng ký xe theo quy định được tính từ ngày nhận đủ hồ sơ hợp lệ và hệ thống đăng ký, quản lý xe đã nhận được kết quả xác thực về việc hoàn thành nộp lệ phí đăng ký xe từ cổng dịch vụ công. + Trường hợp mất chứng nhận đăng ký xe khi làm thủ tục thu hồi thì thời hạn xác minh là 30 ngày.|\n|Trực tuyến|02 Ngày làm việc|Lệ phí : Đồng Thu theo Thông tư số 229/2016/TT-BTC ngày 11/11/2016 của Bộ Tài chính quy định mức thu, chế độ thu, nộp, quản lý lệ phí đăng ký, cấp biển số phương tiện giao thông cơ giới đường bộ.  Lệ phí : Đồng Thu theo Thông tư số 60/2023/TT-BTC ngày 07/9/2023 của Bộ Tài chính quy định mức thu, chế độ thu, nộp, quản lý lệ phí đăng ký, cấp biển số phương tiện giao thông cơ giới đường bộ (có hiệu lực từ ngày 22/10/2023)|+ Cấp chứng nhận thu hồi đăng ký, biển số xe: Không quá 02 ngày làm việc (trường hợp cấp chứng nhận thu hồi đăng ký, biển số), kể từ ngày nhận đủ hồ sơ hợp lệ. + Cấp chứng nhận đăng ký xe: Không quá 02 ngày làm việc, kể từ ngày nhận đủ hồ sơ hợp lệ + Cấp biển số định danh lần đầu: Cấp ngay sau khi tiếp nhận hồ sơ đăng ký xe hợp lệ. + Cấp lại biển số định danh: Không quá 07 ngày làm việc, kể từ ngày nhận đủ hồ sơ hợp lệ. + Thời gian trả kết quả đăng ký xe theo quy định được tính từ ngày nhận đủ hồ sơ hợp lệ và hệ thống đăng ký, quản lý xe đã nhận được kết quả xác thực về việc hoàn thành nộp lệ phí đăng ký xe từ cổng dịch vụ công. + Trường hợp mất chứng nhận đăng ký xe khi làm thủ tục thu hồi thì thời hạn xác minh là 30 ngày.|\n|Dịch vụ bưu chính|02 Ngày làm việc||+ Trả kết quả qua dịch vụ bưu chính.|\n\nThành phần hồ sơ:\n\nBao gồm\n|Tên giấy tờ|Mẫu đơn, tờ khai|Số lượng|\n|--|--|-|\n|Giấy khai đăng ký xe (Mẫu số 01 ban hành kèm theo Thông tư số 58/2020/TT-BCA)|<a href=""https://csdl.dichvucong.gov.vn/web/jsp/download_file.jsp?ma=\'3fd5e0f72270996c\'"">Mẫu số 1 Giay khai đăng ký xe.doc</a>|Bản chính: 1Bản sao: 0|\n|Giấy tờ lệ phí trước bạ.||Bản chính: 1Bản sao: 0|\n|Giấy tờ chuyển quyền sở hữu xe.||Bản chính: 1Bản sao: 0|\n|Giấy tờ của chủ xe theo quy định||Bản chính: 1Bản sao: 0|\n|Giấy chứng nhận thu hồi đăng ký, biển số xe (nếu có).||Bản chính: 1Bản sao: 0|\n|Khi cơ sở dữ liệu cơ quan đăng ký xe kết nối với cơ sở dữ liệu của các Bộ, ngành thì các giấy tờ nêu trên được thay thế bằng dữ liệu điện tử là căn cứ để cấp đăng ký, biển số xe.||Bản chính: 1Bản sao: 0|\n\nĐối tượng thực hiện:\nCông dân Việt Nam, Người Việt Nam định cư ở nước ngoài, Người nước ngoài, Cán bộ, công chức, viên chức, Doanh nghiệp, Doanh nghiệp có vốn đầu tư nước ngoài, Tổ chức (không bao gồm doanh nghiệp, HTX), Tổ chức nước ngoài, Hợp tác xã\nCơ quan thực hiện:\nPhòng Cảnh sát giao thông\nCơ quan có thẩm quyền:\nPhòng Cảnh sát giao thông\nĐịa chỉ tiếp nhận HS:\nTrụ sở Phòng Cảnh sát giao thông Công an tỉnh, thành phố trực thuộc Trung ương hoặc các điểm đăng ký xe của Phòng; Cổng Dịch công quốc gia; Cổng Dịch vụ công Bộ Công an\nCơ quan được ủy quyền:\nKhông có thông tin\nCơ quan phối hợp:\nKhông có thông tin\nKết quả thực hiện:\nGiấy chứng nhận đăng ký xe, Biển số xe\nCăn cứ pháp lý:\n|Số ký hiệu|Trích yếu|Ngày ban hành|Cơ quan ban hành|\n|--|--|--|-|\n|23/2008/QH12|Giao thông đường bộ|13-11-2008|Quốc Hội|\n|Thông tư số 229/2016/TT-BTC|Quy định mức thu, chế độ thu, nộp, quản lý lệ phí đăng ký, cấp biển số phương tiện giao thông cơ giới đường bộ|11-11-2016||\n|24/2023/TT-BCA|Thông tư số 24/2023/TT-BCA ngày 01/07/2023 của Bộ trưởng Bộ Công an quy định về cấp, thu hồi đăng ký, biển số xe cơ giới|01-07-2023|Bộ trưởng Bộ Công an|\n|60/2023/TT-BTC|Thông tư số 60/2023/TT-BTC ngày 07/9/2023 của Bộ Tài chính quy định mức thu, chế độ thu, nộp, quản lý lệ phí đăng ký, cấp biển số phương tiện giao thông cơ giới đường bộ|07-09-2023|Bộ Tài chính|\n\nYêu cầu, điều kiện thực hiện:\nkhông\nTừ khóa:\nĐăng ký sang tên, di chuyển xe tại Phòng Cảnh sát giao thông\nMô tả:\nKhông có thông tin']","Có thể nộp hồ sơ trực tuyến trên Cổng Dịch vụ công quốc gia hoặc Cổng dịch vụ công Bộ Công an. Không quá 2 ngày làm việc kể từ ngày nhận hồ sơ hợp lệ. Trường hợp giấy chứng nhận đăng ký xe, biển số xe bị mất thì niêm yết công khai, thông báo việc mất giấy chứng nhận đăng ký xe, biển số xe, sau 30 ngày nếu không có khiếu nại, tố cáo thì giải quyết thu hồi giấy chứng nhận đăng ký, biển số xe.","| Hình thức nộp | Thời hạn giải quyết | Phí, lệ phí | Mô tả |
|---|---|---|---|
| Trực tuyến | 02 Ngày làm việc | Không có thông tin | + Nộp hồ sơ trực tuyến trên Cổng Dịch vụ công quốc gia hoặc Cổng dịch vụ công Bộ Công an. Không quá 2 ngày làm việc kể từ ngày nhận hồ sơ hợp lệ. Trường hợp giấy chứng nhận đăng ký xe, biển số xe bị mất thì niêm yết công khai, thông báo việc mất giấy chứng nhận đăng ký xe, biển số xe, sau 30 ngày nếu không có khiếu nại, tố cáo thì giải quyết thu hồi giấy chứng nhận đăng ký, biển số xe. |",1.0,1.0,1.0,1.0
12,Trình tự thực hiện xin cấp lại thẻ Căn cước công dân (thực hiện tại trung ương),"['Chi tiết thủ tục hành chính:\nMã thủ tục:\n1.000757\nSố quyết định:\n5947/QĐ-BCA-C06\nTên thủ tục:\nCấp lại thẻ Căn cước công dân (thực hiện tại cấp trung ương)\nCấp thực hiện:\nCấp Bộ\nLoại thủ tục:\nTTHC được luật giao quy định chi tiết\nLĩnh vực:\nCấp, quản lý căn cước công dân\nTrình tự thực hiện:\n- Bước 1: Công dân đến địa điểm làm thủ tục cấp Căn cước công dân của Trung tâm Dữ liệu quốc gia về dân cư, Cục Cảnh sát quản lý hành chính về trật tự xã hội, Bộ Công an hoặc thông qua Cổng dịch vụ công quốc gia, Cổng dịch vụ công Bộ Công an để đăng ký thời gian, địa điểm làm thủ tục đề nghị cấp lại thẻ Căn cước công dân.\nTrường hợp công dân không đủ điều kiện cấp lại thẻ Căn cước công dân thì từ chối tiếp nhận và nêu rõ lý do. Trường hợp công dân đủ điều kiện cấp lại thẻ Căn cước công dân thì thực hiện các bước sau.\n- Bước 2: Cán bộ thu nhận thông tin công dân tìm kiếm thông tin trong Cơ sở dữ liệu quốc gia về dân cư để lập hồ sơ cấp lại thẻ Căn cước công dân.\n- Trường hợp thông tin công dân không có sự thay đổi, điều chỉnh thì sử dụng thông tin của công dân trong cơ sở dữ liệu quốc gia về dân cư để lập hồ sơ cấp lại thẻ Căn cước công dân.\n- Trường hợp thông tin công dân có sự thay đổi, điều chỉnh thì đề nghị công dân xuất trình giấy tờ pháp lý chứng minh nội dung thay đổi để cập nhật, bổ sung thông tin trong hồ sơ cấp lại thẻ Căn cước công dân.\n- Bước 3: Tiến hành thu nhận vân tay, chụp ảnh chân dung của công dân. \n- Bước 4: In Phiếu thu nhận thông tin Căn cước công dân chuyển cho công dân kiểm tra, ký xác nhận; in Phiếu cập nhật, chỉnh sửa thông tin dân cư (nếu có) cho công dân kiểm tra, ký xác nhận.\n- Bước 5: Thu lệ phí (nếu có), cấp giấy hẹn trả thẻ Căn cước công dân cho công dân (mẫu CC03 ban hành kèm theo Thông tư số 66/2015/TT-BCA ngày 15/12/2015 của Bộ trưởng Bộ Công an).\n- Thời gian tiếp nhận hồ sơ và thời gian trả kết quả: Từ thứ 2 đến thứ 6 hàng tuần (trừ ngày lễ, tết).\n- Bước 6: Nhận kết quả trực tiếp tại cơ quan Công an nơi tiếp nhận hồ sơ hoặc trả qua đường chuyển phát đến địa chỉ theo yêu cầu.\nCách thức thực hiện:\n|Hình thức nộp|Thời hạn giải quyết|Phí, lệ phí|Mô tả|\n|--|--|--|-|\n|Trực tiếp|07 Ngày làm việc|Lệ phí : 0 Đồng - Cấp lại thẻ Căn cước công dân cho công dân là bố, mẹ, vợ, chồng, con dưới 18 tuổi của liệt sỹ; thương binh, người hưởng chính sách như thương binh; con dưới 18 tuổi của thương binh và người hưởng chính sách như thương binh; bệnh binh; công dân thường trú tại các xã biên giới; các huyện đảo; đồng bào dân tộc thiểu số ở các xã có điều kiện kinh tế - xã hội đặc biệt khó khăn; công dân thuộc hộ nghèo theo quy định của pháp luật; - Cấp lại thẻ Căn cước công dân cho công dân dưới 18 tuổi, mồ côi cả cha lẫn mẹ, không nơi nương tựa.  Lệ phí : 70.000 Đồng - Cấp lại thẻ Căn cước công dân khi bị mất thẻ Căn cước công dân, được trở lại quốc tịch Việt Nam theo quy định của Luật quốc tịch Việt Nam: 70.000 đồng/thẻ Căn cước công dân.|+ Trực tiếp tại trụ sở Trung tâm Dữ liệu quốc gia về dân cư, Cục Cảnh sát quản lý hành chính về trật tự xã hội, Bộ Công an. + Cấp lưu động tại các địa điểm cần thiết.|\n|Trực tuyến|07 Ngày làm việc||+ Thông qua Cổng dịch vụ công quốc gia, Cổng dịch vụ công Bộ Công an để đăng ký thời gian, địa điểm làm thủ tục đề nghị cấp thẻ Căn cước công dân.|\n\nThành phần hồ sơ:\n\nTrường hợp thông tin công dân có sự thay đổi, điều chỉnh so với thông tin trong cơ sở dữ liệu quốc gia về dân cư thì hồ sơ còn có:\n|Tên giấy tờ|Mẫu đơn, tờ khai|Số lượng|\n|--|--|-|\n|Phiếu cập nhật, chỉnh sửa thông tin dân cư (Mẫu DC02 ban hành kèm theo Thông tư số 104/2020/TT-BCA ngày 30/9/2020 của Bộ trưởng Bộ Công an)||Bản chính: 1Bản sao: 0|\n|Giấy tờ pháp lý chứng minh nội dung thay đổi thông tin công dân||Bản chính: 1Bản sao: 0|\n\n\nBao gồm\n|Tên giấy tờ|Mẫu đơn, tờ khai|Số lượng|\n|--|--|-|\n|Phiếu thu nhận thông tin Căn cước công dân (Mẫu CC02 ban hành kèm theo Thông tư số 66/2015/TT-BCA ngày 15/12/2015 của Bộ trưởng Bộ Công an)||Bản chính: 1Bản sao: 0|\n\nĐối tượng thực hiện:\nCông dân Việt Nam\nCơ quan thực hiện:\nCục cảnh sát quản lý hành chính về trật tự, xã hội\nCơ quan có thẩm quyền:\nCục cảnh sát quản lý hành chính về trật tự, xã hội\nĐịa chỉ tiếp nhận HS:\nTrung tâm dữ liệu quốc gia về dân cư, Cục Cảnh sát quản lý hành chính về trật tự xã hội, Bộ Công an.\nCơ quan được ủy quyền:\nKhông có thông tin\nCơ quan phối hợp:\nKhông có thông tin\nKết quả thực hiện:\nThẻ căn cước công dân, Giấy xác nhận số Chứng minh nhân dân, số Căn cước công dân (Mẫu CC07 ban hành kèm theo Thông tư số 41/2019/TT-BCA ngày 01/10/2019 của Bộ trưởng Bộ Công an).\nCăn cứ pháp lý:\n|Số ký hiệu|Trích yếu|Ngày ban hành|Cơ quan ban hành|\n|--|--|--|-|\n|66/2015/TT-BCA|Quy định về biểu mẫu sử dụng trong công tác cấp, quản lý thẻ Căn cước công dân, tàng thư căn cước công dân và Cơ sở dữ liệu quốc gia về dân cư|15-12-2015|Bộ Công an|\n|137/2015/NĐ-CP|Quy định chi tiết một số điều và biện pháp thi hành Luật Căn cước công dân|31-12-2015|Chính phủ|\n|59/2014/QH13|Luật 59/2014/QH13|20-11-2014|Quốc Hội|\n|Thông tư 59/2019/TT-BTC|Quy định mức thu, chế độ thu, nộp và quản lý lệ phí cấp Căn cước công dân|30-08-2019|Bộ Tài chính|\n|Thông tư số 41/2019/TT-BCA|Sửa đổi, bổ sung một số điều của Thông tư số 66/2015/TT-BCA ngày 15/12/2015 của Bộ Công an quy định về biểu mẫu sử dụng trong công tác cấp, quản lý thẻ Căn cước công dân, tàng thư căn cước công dân và Cơ sở dữ liệu quốc gia về dân cư|01-10-2019|Bộ Công an|\n|37/2021/NĐ-CP|Nghị định 37/2021/NĐ-CP|29-03-2021||\n|59/2021/TT-BCA|Thông tư 59/2021/TT-BCA|15-05-2021||\n|60/2021/TT-BCA|Thông tư 60/2021/TT-BCA|15-05-2021||\n\nYêu cầu, điều kiện thực hiện:\nKhông.\nTừ khóa:\nCấp lại thẻ Căn cước công dân\nMô tả:\nKhông có thông tin', 'Chi tiết thủ tục hành chính:\nMã thủ tục:\n2.000377\nSố quyết định:\n5947/QĐ-BCA-C06\nTên thủ tục:\nCấp lại thẻ Căn cước công dân (thực hiện tại cấp huyện)\nCấp thực hiện:\nCấp Huyện\nLoại thủ tục:\nTTHC không được luật giao cho địa phương quy định hoặc quy định chi tiết\nLĩnh vực:\nCấp, quản lý căn cước công dân\nTrình tự thực hiện:\n- Bước 1: Công dân đến địa điểm làm thủ tục cấp Căn cước công dân hoặc thông qua Cổng dịch vụ công quốc gia, Cổng dịch vụ công Bộ Công an để đăng ký thời gian, địa điểm làm thủ tục đề nghị cấp lại thẻ Căn cước công dân.\nTrường hợp công dân không đủ điều kiện cấp lại thẻ Căn cước công dân thì từ chối tiếp nhận và nêu rõ lý do. Trường hợp công dân đủ điều kiện cấp lại thì thực hiện các bước sau.\n- Bước 2: Cán bộ thu nhận thông tin công dân tìm kiếm thông tin trong Cơ sở dữ liệu quốc gia về dân cư để lập hồ sơ cấp lại thẻ Căn cước công dân.\n- Trường hợp thông tin công dân không có sự thay đổi, điều chỉnh thì sử dụng thông tin của công dân trong cơ sở dữ liệu quốc gia về dân cư để lập hồ sơ cấp lại thẻ Căn cước công dân.\n- Trường hợp thông tin công dân có sự thay đổi, điều chỉnh thì đề nghị công dân xuất trình giấy tờ pháp lý chứng minh nội dung thay đổi để cập nhật, bổ sung thông tin trong hồ sơ cấp lại thẻ Căn cước công dân.\n- Bước 3: Tiến hành thu nhận vân tay, chụp ảnh chân dung của công dân. \n- Bước 4: In Phiếu thu nhận thông tin Căn cước công dân chuyển cho công dân kiểm tra, ký xác nhận; in Phiếu cập nhật, chỉnh sửa thông tin dân cư (nếu có) cho công dân kiểm tra, ký xác nhận.\n- Bước 5: Thu lệ phí (nếu có), cấp giấy hẹn trả thẻ Căn cước công dân cho công dân (Mẫu CC03 ban hành kèm theo Thông tư số 66/2015/TT-BCA ngày 15/5/2021 của Bộ trưởng Bộ Công an). \n- Thời gian tiếp nhận hồ sơ và thời gian trả kết quả: Từ thứ 2 đến thứ 6 hàng tuần (trừ ngày lễ, tết).\n- Bước 6: Nhận kết quả trực tiếp tại cơ quan Công an nơi tiếp nhận hồ sơ hoặc trả qua đường chuyển phát đến địa chỉ theo yêu cầu.\nCách thức thực hiện:\n|Hình thức nộp|Thời hạn giải quyết|Phí, lệ phí|Mô tả|\n|--|--|--|-|\n|Trực tiếp|07 Ngày làm việc|Lệ phí : 0 Đồng Các trường hợp miễn lệ phí: - Cấp lại thẻ Căn cước công dân cho công dân là bố, mẹ, vợ, chồng, con dưới 18 tuổi của liệt sỹ; thương binh, người hưởng chính sách như thương binh; con dưới 18 tuổi của thương binh và người hưởng chính sách như thương binh; bệnh binh; công dân thường trú tại các xã biên giới; các huyện đảo; đồng bào dân tộc thiểu số ở các xã có điều kiện kinh tế - xã hội đặc biệt khó khăn; công dân thuộc hộ nghèo theo quy định của pháp luật; - Cấp lại thẻ Căn cước công dân cho công dân dưới 18 tuổi, mồ côi cả cha lẫn mẹ, không nơi nương tựa.  Lệ phí : 70.000 Đồng Cấp lại thẻ Căn cước công dân khi bị mất thẻ Căn cước công dân, được trở lại quốc tịch Việt Nam theo quy định của Luật quốc tịch Việt Nam: 70.000 đồng/ thẻ Căn cước công dân|+ Trực tiếp tại trụ sở Công an hoặc Bộ phận Một cửa cấp huyện. + Cấp lưu động tại các địa điểm cần thiết.|\n|Trực tuyến|07 Ngày làm việc||+ Khai Tờ khai điện tử trên trang thông tin điện tử dịch vụ công trực tuyến;|\n\nThành phần hồ sơ:\n\nTrường hợp thông tin công dân có sự thay đổi, điều chỉnh so với thông tin trong cơ sở dữ liệu quốc gia về dân cư thì hồ sơ còn có:\n|Tên giấy tờ|Mẫu đơn, tờ khai|Số lượng|\n|--|--|-|\n|Phiếu cập nhật, chỉnh sửa thông tin dân cư (Mẫu DC02 ban hành kèm theo Thông tư số 104/2020/TT-BCA ngày 30/9/2020 của Bộ trưởng Bộ Công an).|<a href=""https://csdl.dichvucong.gov.vn/web/jsp/download_file.jsp?ma=\'3fc3637d2fc93434\'"">Mẫu DC02 kèm theo TT104.docx</a>|Bản chính: 1Bản sao: 0|\n|Giấy tờ pháp lý chứng minh nội dung thay đổi thông tin công dân||Bản chính: 1Bản sao: 0|\n\n\nBao gồm\n|Tên giấy tờ|Mẫu đơn, tờ khai|Số lượng|\n|--|--|-|\n|Phiếu thu nhận thông tin Căn cước công dân (Mẫu CC02 ban hành kèm theo Thông tư số 66/2015/TT-BCA ngày 15/12/2015 của Bộ trưởng Bộ Công an).|<a href=""https://csdl.dichvucong.gov.vn/web/jsp/download_file.jsp?ma=\'3fd24be392f2409c\'"">Mẫu CC02 kèm theo TT66.doc</a>|Bản chính: 1Bản sao: 0|\n\nĐối tượng thực hiện:\nCông dân Việt Nam\nCơ quan thực hiện:\nCông an huyện\nCơ quan có thẩm quyền:\nCục cảnh sát quản lý hành chính về trật tự, xã hội\nĐịa chỉ tiếp nhận HS:\nCông an huyện, quận, thị xã, thành phố thuộc tỉnh, thành phố thuộc thành phố trực thuộc trung ương.\nCơ quan được ủy quyền:\nKhông có thông tin\nCơ quan phối hợp:\nKhông có thông tin\nKết quả thực hiện:\nThẻ căn cước công dân, Giấy xác nhận số Chứng minh nhân dân, số Căn cước công dân (Mẫu CC07 ban hành kèm theo Thông tư số 41/2019/TT-BCA ngày 01/10/2019 của Bộ trưởng Bộ Công an).\nCăn cứ pháp lý:\n|Số ký hiệu|Trích yếu|Ngày ban hành|Cơ quan ban hành|\n|--|--|--|-|\n|66/2015/TT-BCA|Quy định về biểu mẫu sử dụng trong công tác cấp, quản lý thẻ Căn cước công dân, tàng thư căn cước công dân và Cơ sở dữ liệu quốc gia về dân cư|15-12-2015|Bộ Công an|\n|137/2015/NĐ-CP|Quy định chi tiết một số điều và biện pháp thi hành Luật Căn cước công dân|31-12-2015|Chính phủ|\n|59/2014/QH13|Luật 59/2014/QH13|20-11-2014|Quốc Hội|\n|Thông tư 59/2019/TT-BTC|Quy định mức thu, chế độ thu, nộp và quản lý lệ phí cấp Căn cước công dân|30-08-2019|Bộ Tài chính|\n|Thông tư số 41/2019/TT-BCA|Sửa đổi, bổ sung một số điều của Thông tư số 66/2015/TT-BCA ngày 15/12/2015 của Bộ Công an quy định về biểu mẫu sử dụng trong công tác cấp, quản lý thẻ Căn cước công dân, tàng thư căn cước công dân và Cơ sở dữ liệu quốc gia về dân cư|01-10-2019|Bộ Công an|\n|37/2021/NĐ-CP|Nghị định 37/2021/NĐ-CP|29-03-2021||\n|59/2021/TT-BCA|Thông tư 59/2021/TT-BCA|15-05-2021||\n|60/2021/TT-BCA|Thông tư 60/2021/TT-BCA|15-05-2021||\n\nYêu cầu, điều kiện thực hiện:\nKhông.\nTừ khóa:\nCấp lại thẻ Căn cước công dân\nMô tả:\nKhông có thông tin', 'Chi tiết thủ tục hành chính:\nMã thủ tục:\n1.000466\nSố quyết định:\n5947/QĐ-BCA-C06\nTên thủ tục:\nXác nhận số Chứng minh nhân dân, Căn cước công dân (thực hiện tại cấp trung ương)\nCấp thực hiện:\nCấp Bộ\nLoại thủ tục:\nTTHC được luật giao quy định chi tiết\nLĩnh vực:\nCấp, quản lý căn cước công dân\nTrình tự thực hiện:\n- Bước 1: Công dân đã được cấp thẻ Căn cước công dân có nhu cầu được xác nhận số Chứng minh nhân dân, số Căn cước công dân chuẩn bị hồ sơ theo quy định.\n- Bước 2: Nộp hồ sơ tại Trung tâm dữ liệu quốc gia về dân cư, Cục Cảnh sát quản lý hành chính về trật tự xã hội, Bộ Công an hoặc đăng ký cấp giấy xác nhận số Chứng minh nhân dân, số Căn cước công dân trên Cổng dịch vụ công quốc gia, Cổng dịch vụ công Bộ Công an khi công dân có thông tin số Chứng minh nhân dân, số Căn cước công dân trong Cơ sở dữ liệu quốc gia về dân cư.\n- Bước 3: Nhận kết quả tại Trung tâm dữ liệu quốc gia về dân cư, Cục Cảnh sát quản lý hành chính về trật tự xã hội, Bộ Công an hoặc trả qua đường chuyển phát đến địa chỉ theo yêu cầu.\nCách thức thực hiện:\n|Hình thức nộp|Thời hạn giải quyết|Phí, lệ phí|Mô tả|\n|--|--|--|-|\n|Trực tiếp|07 Ngày làm việc||+ Trực tiếp tại Trung tâm dữ liệu quốc gia về dân cư, Cục Cảnh sát quản lý hành chính về trật tự xã hội, Bộ Công an.|\n|Trực tuyến|07 Ngày làm việc||Đăng ký cấp giấy xác nhận số Chứng minh nhân dân, số Căn cước công dân trên Cổng dịch vụ công quốc gia, Cổng dịch vụ công Bộ Công an khi công dân có thông tin số Chứng minh nhân dân, số Căn cước công dân trong Cơ sở dữ liệu quốc gia về dân cư.|\n\nThành phần hồ sơ:\n\nBao gồm\n|Tên giấy tờ|Mẫu đơn, tờ khai|Số lượng|\n|--|--|-|\n|Giấy đề nghị xác nhận số Chứng minh nhân dân (Mẫu CC13 ban hành kèm theo Thông tư số 41/2019/TT-BCA ngày 01/10/2019 của Bộ trưởng Bộ Công an) hoặc thực hiện các yêu cầu trên cổng Dịch vụ công quốc gia, Cổng dịch vụ công Bộ Công an.|<a href=""https://csdl.dichvucong.gov.vn/web/jsp/download_file.jsp?ma=\'3fe33c3a5e88b6fc\'"">Mẫu CC13 kèm theo TT41.doc</a>|Bản chính: 1Bản sao: 0|\n|Trường hợp thông tin về số Chứng minh nhân dân, số Căn cước công dân chưa có trong Cơ sở dữ liệu quốc gia về dân cư thì đề nghị công dân cung cấp bản chính hoặc bản sao thẻ Căn cước công dân, bản sao Chứng minh nhân dân (nếu có).||Bản chính: 1Bản sao: 0|\n\nĐối tượng thực hiện:\nCông dân Việt Nam\nCơ quan thực hiện:\nCục cảnh sát quản lý hành chính về trật tự, xã hội\nCơ quan có thẩm quyền:\nCục cảnh sát quản lý hành chính về trật tự, xã hội\nĐịa chỉ tiếp nhận HS:\nTrung tâm dữ liệu quốc gia về dân cư, Cục Cảnh sát quản lý hành chính về trật tự xã hội, Bộ Công an.\nCơ quan được ủy quyền:\nKhông có thông tin\nCơ quan phối hợp:\nKhông có thông tin\nKết quả thực hiện:\nGiấy xác nhận số Chứng minh nhân dân, số Căn cước công dân (Mẫu CC07 ban hành kèm theo Thông tư số 41/2019/TT-BCA ngày 01/10/2019 của Bộ trưởng Bộ Công an).\nCăn cứ pháp lý:\n|Số ký hiệu|Trích yếu|Ngày ban hành|Cơ quan ban hành|\n|--|--|--|-|\n|Thông tư 66/2015/TT-BCA|Quy định về biểu mẫu sử dụng trong công tác cấp, quản lý thẻ Căn cước công dân, tàng thư căn cước công dân và Cơ sở dữ liệu quốc gia về dân cư|15-12-2015|Bộ Công an|\n|59/2014/QH13|Luật 59/2014/QH13|20-11-2014|Quốc Hội|\n|Thông tư số 41/2019/TT-BCA|Sửa đổi, bổ sung một số điều của Thông tư số 66/2015/TT-BCA ngày 15/12/2015 của Bộ Công an quy định về biểu mẫu sử dụng trong công tác cấp, quản lý thẻ Căn cước công dân, tàng thư căn cước công dân và Cơ sở dữ liệu quốc gia về dân cư|01-10-2019|Bộ Công an|\n|37/2021/NĐ-CP|Nghị định 37/2021/NĐ-CP|29-03-2021||\n|59/2021/TT-BCA|Thông tư 59/2021/TT-BCA|15-05-2021||\n|137/2015/NĐ-CP|Nghị định 137/2015/NĐ-CP|31-12-2015||\n\nYêu cầu, điều kiện thực hiện:\nKhông\nTừ khóa:\nXác nhận số Chứng minh nhân dân, Căn cước công dân\nMô tả:\nKhông có thông tin']","Trình tự thực hiện:
- Bước 1: Công dân đến địa điểm làm thủ tục cấp Căn cước công dân của Trung tâm Dữ liệu quốc gia về dân cư, Cục Cảnh sát quản lý hành chính về trật tự xã hội, Bộ Công an hoặc thông qua Cổng dịch vụ công quốc gia, Cổng dịch vụ công Bộ Công an để đăng ký thời gian, địa điểm làm thủ tục đề nghị cấp lại thẻ Căn cước công dân.
Trường hợp công dân không đủ điều kiện cấp lại thẻ Căn cước công dân thì từ chối tiếp nhận và nêu rõ lý do. Trường hợp công dân đủ điều kiện cấp lại thẻ Căn cước công dân thì thực hiện các bước sau.
- Bước 2: Cán bộ thu nhận thông tin công dân tìm kiếm thông tin trong Cơ sở dữ liệu quốc gia về dân cư để lập hồ sơ cấp lại thẻ Căn cước công dân.
- Trường hợp thông tin công dân không có sự thay đổi, điều chỉnh thì sử dụng thông tin của công dân trong cơ sở dữ liệu quốc gia về dân cư để lập hồ sơ cấp lại thẻ Căn cước công dân.
- Trường hợp thông tin công dân có sự thay đổi, điều chỉnh thì đề nghị công dân xuất trình giấy tờ pháp lý chứng minh nội dung thay đổi để cập nhật, bổ sung thông tin trong hồ sơ cấp lại thẻ Căn cước công dân.
- Bước 3: Tiến hành thu nhận vân tay, chụp ảnh chân dung của công dân. 
- Bước 4: In Phiếu thu nhận thông tin Căn cước công dân chuyển cho công dân kiểm tra, ký xác nhận; in Phiếu cập nhật, chỉnh sửa thông tin dân cư (nếu có) cho công dân kiểm tra, ký xác nhận.
- Bước 5: Thu lệ phí (nếu có), cấp giấy hẹn trả thẻ Căn cước công dân cho công dân (mẫu CC03 ban hành kèm theo Thông tư số 66/2015/TT-BCA ngày 15/12/2015 của Bộ trưởng Bộ Công an).
- Thời gian tiếp nhận hồ sơ và thời gian trả kết quả: Từ thứ 2 đến thứ 6 hàng tuần (trừ ngày lễ, tết).
- Bước 6: Nhận kết quả trực tiếp tại cơ quan Công an nơi tiếp nhận hồ sơ hoặc trả qua đường chuyển phát đến địa chỉ theo yêu cầu.","**Trình tự thực hiện xin cấp lại thẻ Căn cước công dân (thực hiện tại trung ương)**

| Bước | Hành động |
|---|---|
| 1 | Công dân đến địa điểm làm thủ tục cấp Căn cước công dân của Trung tâm Dữ liệu quốc gia về dân cư, Cục Cảnh sát quản lý hành chính về trật tự xã hội, Bộ Công an hoặc thông qua Cổng dịch vụ công quốc gia, Cổng dịch vụ công Bộ Công an để đăng ký thời gian, địa điểm làm thủ tục đề nghị cấp lại thẻ Căn cước công dân. |
| 2 | Cán bộ thu nhận thông tin công dân tìm kiếm thông tin trong Cơ sở dữ liệu quốc gia về dân cư để lập hồ sơ cấp lại thẻ Căn cước công dân. |
| 3 | Trường hợp thông tin công dân không có sự thay đổi, điều chỉnh thì sử dụng thông tin của công dân trong cơ sở dữ liệu quốc gia về dân cư để lập hồ sơ cấp lại thẻ Căn cước công dân. |
| 4 | Trường hợp thông tin công dân có sự thay đổi, điều chỉnh thì đề nghị công dân xuất trình giấy tờ pháp lý chứng minh nội dung thay đổi để cập nhật, bổ sung thông tin trong hồ sơ cấp lại thẻ Căn cước công dân. |
| 5 | Tiến hành thu nhận vân tay, chụp ảnh chân dung của công dân. |
| 6 | In Phiếu thu nhận thông tin Căn cước công dân chuyển cho công dân kiểm tra, ký xác nhận; in Phiếu cập nhật, chỉnh sửa thông tin dân cư (nếu có) cho công dân kiểm tra, ký xác nhận. |
| 7 | Thu lệ phí (nếu có), cấp giấy hẹn trả thẻ Căn cước công dân cho công dân (Mẫu CC03 ban hành kèm theo Thông tư số 66/2015/TT-BCA ngày 15/12/2015 của Bộ trưởng Bộ Công an). |
| 8 | Nhận kết quả trực tiếp tại cơ quan Công an nơi tiếp nhận hồ sơ hoặc trả qua đường chuyển phát đến địa chỉ theo yêu cầu. |",1.0,1.0,1.0,0.8
13,Đối tượng thực hiện thủ tục gia hạn hợp đồng mua bán điện là ai?,"['Chi tiết thủ tục hành chính:\nMã thủ tục:\n3.000101\nSố quyết định:\n505\nTên thủ tục:\nGia hạn hợp đồng mua bán điện\nCấp thực hiện:\nCấp Bộ, Cơ quan khác\nLoại thủ tục:\nLoại khác\nLĩnh vực:\nDịch vụ trong quá trình thực hiện HĐMBĐ\nTrình tự thực hiện:\nTiếp nhận yêu cầu\nKý Phụ lục Hợp đồng mua bán điện hoặc Biên bản chấm dứt HĐMBĐ cũ và Hợp đồng mua bán điện mới\nCách thức thực hiện:\n|Hình thức nộp|Thời hạn giải quyết|Phí, lệ phí|Mô tả|\n|--|--|--|-|\n|Trực tiếp|1 Ngày làm việc|Mức giá : Miên phí||\n|Trực tuyến|1 Ngày làm việc|Mức giá : Miên phí||\n|Dịch vụ bưu chính|1 Ngày làm việc|Mức giá : Miên phí||\n\nThành phần hồ sơ:\n\nBao gồm\n|Tên giấy tờ|Mẫu đơn, tờ khai|Số lượng|\n|--|--|-|\n|Giấy đề nghị|<a href=""https://csdl.dichvucong.gov.vn/web/jsp/download_file.jsp?ma=\'3fedcde9076b2fb2\'"">02.PhieuDeNghiDichVuDienDungChung.docx</a>|Bản chính: 1Bản sao: 0|\n\nĐối tượng thực hiện:\nCông dân Việt Nam, Người nước ngoài, Doanh nghiệp, Doanh nghiệp có vốn đầu tư nước ngoài, Tổ chức (không bao gồm doanh nghiệp, HTX), Tổ chức nước ngoài, Hợp tác xã\nCơ quan thực hiện:\nTập đoàn Điện lực Việt Nam\nCơ quan có thẩm quyền:\nTập đoàn Điện lực Việt Nam\nĐịa chỉ tiếp nhận HS:\nKhông có thông tin\nCơ quan được ủy quyền:\nKhông có thông tin\nCơ quan phối hợp:\nKhông có thông tin\nKết quả thực hiện:\nHợp đồng mua bán điện, Biên bản chấm dứt HĐMBĐ, Phụ lục hợp đồng mua bán điện 25, Phụ lục hợp đồng mua bán điện 24\nCăn cứ pháp lý:\n|Số ký hiệu|Trích yếu|Ngày ban hành|Cơ quan ban hành|\n|--|--|--|-|\n|137/2013/NĐ-CP|Quy định chi tiết thi hành một số điều của Luật Điện lực và Luật sửa đổi, bổ sung một số điều của Luật Điện lực|21-10-2013|Chính phủ|\n|24/2012/QH13|Sửa đổi, bổ sung một số điều của Luật Điện lực|20-11-2012|Quốc Hội|\n|Luật số 28/2004/QH11|Luật Điện lực|03-12-2004|Quốc Hội|\n\nYêu cầu, điều kiện thực hiện:\nKhông có yêu cầu điều kiện\nTừ khóa:\nKhông có thông tin\nMô tả:\nKhông có thông tin', 'Chi tiết thủ tục hành chính:\nMã thủ tục:\n3.000099\nSố quyết định:\n505\nTên thủ tục:\nThay đổi chủ thể hợp đồng mua bán điện\nCấp thực hiện:\nCấp Bộ, Cơ quan khác\nLoại thủ tục:\nLoại khác\nLĩnh vực:\nDịch vụ trong quá trình thực hiện HĐMBĐ\nTrình tự thực hiện:\nTiếp nhận yêu cầu\nKhảo sát\nKý Biên bản chấm dứt HĐMBĐ cũ và Hợp đồng mua bán điện mới\nCách thức thực hiện:\n|Hình thức nộp|Thời hạn giải quyết|Phí, lệ phí|Mô tả|\n|--|--|--|-|\n|Trực tiếp|2 Ngày làm việc|Mức giá : Miễn phí|Với khách hàng mua điện sinh hoạt|\n|Trực tiếp|3 Ngày làm việc|Mức giá : Miễn Phí|Với khách hàng mua điện ngoài sinh hoạt|\n|Trực tuyến|2 Ngày làm việc|Mức giá : Miễn phí|Với khách hàng mua điện sinh hoạt|\n|Trực tuyến|3 Ngày làm việc|Mức giá : Miễn Phí|Với khách hàng mua điện ngoài sinh hoạt|\n|Dịch vụ bưu chính|2 Ngày làm việc|Mức giá : Miễn phí|Với khách hàng mua điện sinh hoạt|\n|Dịch vụ bưu chính|3 Ngày làm việc|Mức giá : Miễn Phí|Với khách hàng mua điện ngoài sinh hoạt|\n\nThành phần hồ sơ:\n\nBao gồm\n|Tên giấy tờ|Mẫu đơn, tờ khai|Số lượng|\n|--|--|-|\n|Giấy đề nghị|<a href=""https://csdl.dichvucong.gov.vn/web/jsp/download_file.jsp?ma=\'3fd8d08451306676\'"">02.PhieuDeNghiDichVuDienDungChung.docx</a>|Bản chính: 1Bản sao: 0|\n|Giấy tờ xác định chủ thể HĐMBĐ mới: là một trong các loại giấy tờ có tên của Tổ chức/cá nhân tại địa điểm mua điện sau: Hộ khẩu thường trú; Sổ tạm trú; Giấy chứng nhận quyền sở hữu nhà; Quyết định phân nhà; Hợp đồng mua bán nhà; Hợp đồng thuê nhà có thời hạn từ 01 năm trở lên và đồng ý của chủ sở hữu; Giấy chứng nhận quyền sử dụng đất; Hợp đồng ủy quyền quản lý và sử dụng nhà/đất; Hợp đồng thuê địa điểm và đồng ý của chủ sở hữu; Giấy chứng nhận đăng ký doanh nghiệp; Giấy chứng nhận đăng ký kinh doanh; Giấy chứng nhận đăng ký hộ kinh doanh; Giấy chứng nhận đăng ký hoạt động chi nhánh, văn phòng đại diện; Giấy phép đầu tư; Quyết định thành lập đơn vị.||Bản chính: 0Bản sao: 1|\n\nĐối tượng thực hiện:\nCông dân Việt Nam, Người nước ngoài, Doanh nghiệp, Doanh nghiệp có vốn đầu tư nước ngoài, Tổ chức (không bao gồm doanh nghiệp, HTX), Tổ chức nước ngoài, Hợp tác xã\nCơ quan thực hiện:\nTập đoàn Điện lực Việt Nam\nCơ quan có thẩm quyền:\nTập đoàn Điện lực Việt Nam\nĐịa chỉ tiếp nhận HS:\nKhông có thông tin\nCơ quan được ủy quyền:\nKhông có thông tin\nCơ quan phối hợp:\nKhông có thông tin\nKết quả thực hiện:\nHợp đồng mua bán điện, Biên bản chấm dứt HĐMBĐ\nCăn cứ pháp lý:\n|Số ký hiệu|Trích yếu|Ngày ban hành|Cơ quan ban hành|\n|--|--|--|-|\n|137/2013/NĐ-CP|Quy định chi tiết thi hành một số điều của Luật Điện lực và Luật sửa đổi, bổ sung một số điều của Luật Điện lực|21-10-2013|Chính phủ|\n|24/2012/QH13|Sửa đổi, bổ sung một số điều của Luật Điện lực|20-11-2012|Quốc Hội|\n|Luật số 28/2004/QH11|Luật Điện lực|03-12-2004|Quốc Hội|\n\nYêu cầu, điều kiện thực hiện:\nKhông có yêu cầu điều kiện\nTừ khóa:\nKhông có thông tin\nMô tả:\nKhông có thông tin', 'Chi tiết thủ tục hành chính:\nMã thủ tục:\n3.000002\nSố quyết định:\n505\nTên thủ tục:\nCấp điện mới từ lưới điện trung áp (cấp điện áp 6kV, 10kV, 15kV, 22kV, 35kV)\nCấp thực hiện:\nCấp Bộ, Cơ quan khác\nLoại thủ tục:\nLoại khác\nLĩnh vực:\nDịch vụ cung cấp điện mới\nTrình tự thực hiện:\nTiếp nhận yêu cầu\nKhảo sát hiện trường\nThỏa thuận đấu nối\nKý kết HĐMBĐ, nghiệm thu và đóng điện\nCách thức thực hiện:\n|Hình thức nộp|Thời hạn giải quyết|Phí, lệ phí|Mô tả|\n|--|--|--|-|\n|Trực tiếp|7 Ngày làm việc|||\n|Trực tuyến|7 Ngày làm việc|||\n\nThành phần hồ sơ:\n\nTrường hợp khách hàng mua buôn điện nông thôn\n|Tên giấy tờ|Mẫu đơn, tờ khai|Số lượng|\n|--|--|-|\n|Giấy đề nghị mua điện|<a href=""https://csdl.dichvucong.gov.vn/web/jsp/download_file.jsp?ma=\'3feb864dfdb7c754\'"">Giay de nghi mua dien.docx</a>|Bản chính: 1Bản sao: 0|\n|Giấy tờ tùy thân của cá nhân hoặc người đại diện hợp pháp của tổ chức; là một trong những loại giấy tờ sau: Giấy chứng minh nhân dân; Giấy chứng minh công an nhân dân; Giấy chứng minh sỹ quan quân đội nhân dân; Thẻ căn cước công dân; Hộ chiếu hoặc Giấy xác nhận nhân thân của công an phường, xã (có ảnh đóng dấu giáp lai).||Bản chính: 0Bản sao: 1|\n|Giấy tờ xác định chủ thể HĐMBĐ là một trong các loại giấy tờ có tên của Tổ chức/cá nhân tại địa điểm mua điện sau: Hộ khẩu thường trú; Sổ tạm trú; Giấy chứng nhận quyền sở hữu nhà; Quyết định phân nhà; Hợp đồng mua bán nhà; Hợp đồng thuê nhà có thời hạn từ 01 năm trở lên và đồng ý của chủ sở hữu; Giấy chứng nhận quyền sử dụng đất; Hợp đồng ủy quyền quản lý và sử dụng nhà/đất; Hợp đồng thuê địa điểm và đồng ý của chủ sở hữu; Giấy chứng nhận đăng ký doanh nghiệp; Giấy chứng nhận đăng ký kinh doanh; Giấy chứng nhận đăng ký hộ kinh doanh; Giấy chứng nhận đăng ký hoạt động chi nhánh, văn phòng đại diện; Giấy phép đầu tư; Quyết định thành lập đơn vị.||Bản chính: 0Bản sao: 1|\n|Thông tin đăng ký đấu nối|<a href=""https://csdl.dichvucong.gov.vn/web/jsp/download_file.jsp?ma=\'3fee7af2328068b2\'"">THÔNG TIN ĐĂNG KÝ ĐẤU NỐI.docx</a>|Bản chính: 1Bản sao: 0|\n|Giấy phép hoạt động Điện lực (trường hợp mua buôn điện có công suất lớn hơn 50kVA)||Bản chính: 0Bản sao: 1|\n\n\nTrường hợp khách hàng mua điện ngoài sinh hoạt\n|Tên giấy tờ|Mẫu đơn, tờ khai|Số lượng|\n|--|--|-|\n|Giấy đề nghị mua điện|<a href=""https://csdl.dichvucong.gov.vn/web/jsp/download_file.jsp?ma=\'3feb864dfdb7c754\'"">Giay de nghi mua dien.docx</a>|Bản chính: 1Bản sao: 0|\n|Giấy tờ tùy thân của cá nhân hoặc người đại diện hợp pháp của tổ chức; là một trong những loại giấy tờ sau: Giấy chứng minh nhân dân; Giấy chứng minh công an nhân dân; Giấy chứng minh sỹ quan quân đội nhân dân; Thẻ căn cước công dân; Hộ chiếu hoặc Giấy xác nhận nhân thân của công an phường, xã (có ảnh đóng dấu giáp lai).||Bản chính: 0Bản sao: 1|\n|Giấy tờ xác định chủ thể HĐMBĐ là một trong các loại giấy tờ có tên của Tổ chức/cá nhân tại địa điểm mua điện sau: Hộ khẩu thường trú; Sổ tạm trú; Giấy chứng nhận quyền sở hữu nhà; Quyết định phân nhà; Hợp đồng mua bán nhà; Hợp đồng thuê nhà có thời hạn từ 01 năm trở lên và đồng ý của chủ sở hữu; Giấy chứng nhận quyền sử dụng đất; Hợp đồng ủy quyền quản lý và sử dụng nhà/đất; Hợp đồng thuê địa điểm và đồng ý của chủ sở hữu; Giấy chứng nhận đăng ký doanh nghiệp; Giấy chứng nhận đăng ký kinh doanh; Giấy chứng nhận đăng ký hộ kinh doanh; Giấy chứng nhận đăng ký hoạt động chi nhánh, văn phòng đại diện; Giấy phép đầu tư; Quyết định thành lập đơn vị.||Bản chính: 0Bản sao: 1|\n|Giấy tờ xác định mục đích sử dụng điện là một trong những loại giấy tờ sau: Giấy chứng nhận đăng ký doanh nghiệp; Giấy chứng nhận đăng ký kinh doanh; Giấy chứng nhận đăng ký hộ kinh doanh; Giấy chứng nhận đăng ký hoạt động chi nhánh, văn phòng đại diện; Giấy phép đầu tư; Quyết định thành lập đơn vị; Biên bản khảo sát cấp điện của Điện lực/Công ty Điện lực; Thông tin của doanh nghiệp trên Cổng thông tin đăng ký doanh nghiệp quốc gia tại địa chỉ http://www.dangkykinhdoanh.gov.vn.||Bản chính: 0Bản sao: 1|\n|Thông tin đăng ký đấu nối|<a href=""https://csdl.dichvucong.gov.vn/web/jsp/download_file.jsp?ma=\'3fed66e7939fc74c\'"">THÔNG TIN ĐĂNG KÝ ĐẤU NỐI.docx</a>|Bản chính: 1Bản sao: 0|\n\n\nTrường hợp khách hàng mua điện sinh hoạt\n|Tên giấy tờ|Mẫu đơn, tờ khai|Số lượng|\n|--|--|-|\n|Giấy đề nghị mua điện|<a href=""https://csdl.dichvucong.gov.vn/web/jsp/download_file.jsp?ma=\'3feb864dfdb7c754\'"">Giay de nghi mua dien.docx</a>|Bản chính: 1Bản sao: 0|\n|Giấy tờ tùy thân của cá nhân hoặc người đại diện hợp pháp của tổ chức; là một trong những loại giấy tờ sau: Giấy chứng minh nhân dân; Giấy chứng minh công an nhân dân; Giấy chứng minh sỹ quan quân đội nhân dân; Thẻ căn cước công dân; Hộ chiếu hoặc Giấy xác nhận nhân thân của công an phường, xã (có ảnh đóng dấu giáp lai).||Bản chính: 0Bản sao: 1|\n|Giấy tờ xác định chủ thể HĐMBĐ là một trong các loại giấy tờ có tên của Tổ chức/cá nhân tại địa điểm mua điện sau: Hộ khẩu thường trú; Sổ tạm trú; Giấy chứng nhận quyền sở hữu nhà; Quyết định phân nhà; Hợp đồng mua bán nhà; Hợp đồng thuê nhà có thời hạn từ 01 năm trở lên và đồng ý của chủ sở hữu; Giấy chứng nhận quyền sử dụng đất; Hợp đồng ủy quyền quản lý và sử dụng nhà/đất; Hợp đồng thuê địa điểm và đồng ý của chủ sở hữu; Giấy chứng nhận đăng ký doanh nghiệp; Giấy chứng nhận đăng ký kinh doanh; Giấy chứng nhận đăng ký hộ kinh doanh; Giấy chứng nhận đăng ký hoạt động chi nhánh, văn phòng đại diện; Giấy phép đầu tư; Quyết định thành lập đơn vị.||Bản chính: 0Bản sao: 1|\n|Thông tin đăng ký đấu nối|<a href=""https://csdl.dichvucong.gov.vn/web/jsp/download_file.jsp?ma=\'3fd64edcea3ed172\'"">THÔNG TIN ĐĂNG KÝ ĐẤU NỐI.docx</a>|Bản chính: 1Bản sao: 0|\n\nĐối tượng thực hiện:\nCông dân Việt Nam, Người nước ngoài, Doanh nghiệp, Doanh nghiệp có vốn đầu tư nước ngoài, Tổ chức (không bao gồm doanh nghiệp, HTX), Tổ chức nước ngoài, Hợp tác xã\nCơ quan thực hiện:\nTập đoàn Điện lực Việt Nam\nCơ quan có thẩm quyền:\nTập đoàn Điện lực Việt Nam\nĐịa chỉ tiếp nhận HS:\nhttp://dichvucong.gov.vn; http://evn.com.vn; http://www.npc.com.vn; https://www.cpc.vn; https://evnspc.vn; http://evnhanoi.vn; http://www.hcmpc.com.vn\nCơ quan được ủy quyền:\nKhông có thông tin\nCơ quan phối hợp:\nKhông có thông tin\nKết quả thực hiện:\nHợp đồng mua bán điện, Thỏa thuận đấu nối\nCăn cứ pháp lý:\n|Số ký hiệu|Trích yếu|Ngày ban hành|Cơ quan ban hành|\n|--|--|--|-|\n|137/2013/NĐ-CP|Quy định chi tiết thi hành một số điều của Luật Điện lực và Luật sửa đổi, bổ sung một số điều của Luật Điện lực|21-10-2013|Chính phủ|\n\nYêu cầu, điều kiện thực hiện:\nKhông có yêu cầu điều kiện\nTừ khóa:\nKhông có thông tin\nMô tả:\nKhông có thông tin']","Công dân Việt Nam, Người nước ngoài, Doanh nghiệp, Doanh nghiệp có vốn đầu tư nước ngoài, Tổ chức (không bao gồm doanh nghiệp, HTX), Tổ chức nước ngoài, Hợp tác xã","| Đối tượng |
|---|---|
| Công dân Việt Nam |
| Người nước ngoài |
| Doanh nghiệp |
| Doanh nghiệp có vốn đầu tư nước ngoài |
| Tổ chức (không bao gồm doanh nghiệp, HTX) |
| Tổ chức nước ngoài |
| Hợp tác xã |",1.0,1.0,1.0,1.0
14,Cơ quan thực hiện thủ tục cấp giấy chứng nhận tên định danh là gì?,"['Chi tiết thủ tục hành chính:\nMã thủ tục:\n1.008813\nSố quyết định:\n1545/QĐ-BTTTT\nTên thủ tục:\nCấp giấy chứng nhận tên định danh\nCấp thực hiện:\nCấp Bộ\nLoại thủ tục:\nTTHC được luật giao quy định chi tiết\nLĩnh vực:\nCông nghệ thông tin, điện tử\nTrình tự thực hiện:\n- Tổ chức, cá nhân hoàn thiện hồ sơ đăng ký cấp tên định danh (theo quy định tại Điều 24 Nghị định số 91/2020/NĐ-CP);\n- Tổ chức, cá nhân nộp Hồ sơ đến Bộ Thông tin và Truyền thông (Cục An toàn thông tin).\n- Sau khi hồ sơ được tiếp nhận, trong thời hạn một (01) ngày làm việc Bộ Thông tin và Truyền thông (Cục An toàn thông tin) xem xét tính hợp lệ của hồ sơ và quyết định một trong các trường hợp sau:\n+ Cấp tên định danh cho tổ chức, cá nhân và thông báo cho tổ chức, cá nhân biết thông qua thư điện tử hoặc tin nhắn;\n+ Không cấp tên định danh cho tổ chức, cá nhân đối với trường hợp hồ sơ chưa đầy đủ hoặc cần làm rõ, tổ chức, cá nhân bổ sung, giải trình, hoàn thiện hồ sơ và nộp lại hồ sơ theo quy định tại Điều 25 Nghị định số 91/2020/NĐ-CP và thông báo lý do cho tổ chức, cá nhân thông qua thư điện tử hoặc tin nhắn.\nCách thức thực hiện:\n|Hình thức nộp|Thời hạn giải quyết|Phí, lệ phí|Mô tả|\n|--|--|--|-|\n|Trực tiếp|01 Ngày làm việc|Lệ phí : 200000 Đồng (Theo quy định của Bộ Tài chính)|01 ngày kể từ ngày nhận đủ hồ sơ theo quy định|\n|Trực tuyến|01 Ngày làm việc|Lệ phí : 200000 Đồng (Theo quy định của Bộ Tài chính)|01 ngày kể từ ngày nhận đủ hồ sơ theo quy định|\n|Dịch vụ bưu chính|01 Ngày làm việc|Lệ phí : 200000 Đồng (Theo quy định của Bộ Tài chính)|01 ngày kể từ ngày nhận đủ hồ sơ theo quy định|\n\nThành phần hồ sơ:\n\nHồ sơ cấp Giấy chứng nhận tên định danh\n|Tên giấy tờ|Mẫu đơn, tờ khai|Số lượng|\n|--|--|-|\n|Bản khai Cấp tên định danh|<a href=""https://csdl.dichvucong.gov.vn/web/jsp/download_file.jsp?ma=\'3f933d2c89c33b00\'"">Bản khai đăng ký tên định danh.docx</a>|Bản chính: 1Bản sao:|\n|Bản sao có chứng thực Quyết định thành lập của tổ chức hoặc giấy chứng nhận đăng ký doanh nghiệp||Bản chính: Bản sao: 1|\n|Bản sao có chứng thực chứng minh nhân dân hoặc căn cước công dân hoặc hộ chiếu||Bản chính: Bản sao: 1|\n|Các giấy tờ khác có liên quan tới quyền sở hữu trí tuệ, đăng ký thương hiệu|<a href=""https://csdl.dichvucong.gov.vn/web/jsp/download_file.jsp?ma=\'3feb81c27c28e87a\'"">Giấy ủy quyền.docx</a>|Bản chính: Bản sao: 1|\n\nĐối tượng thực hiện:\nCông dân Việt Nam, Doanh nghiệp, Tổ chức (không bao gồm doanh nghiệp, HTX), Hợp tác xã\nCơ quan thực hiện:\nCục An toàn thông tin\nCơ quan có thẩm quyền:\nBộ Thông tin và Truyền thông\nĐịa chỉ tiếp nhận HS:\nCục An toàn thông tin, Tầng 8, Tòa nhà Cục Tần số Vô tuyến điện, 115 Trần Duy Hưng, Trung Hòa, Cầu giấy, Hà Nội\nCơ quan được ủy quyền:\nKhông có thông tin\nCơ quan phối hợp:\nKhông có thông tin\nKết quả thực hiện:\nGiấy chứng nhận tên định danh\nCăn cứ pháp lý:\n|Số ký hiệu|Trích yếu|Ngày ban hành|Cơ quan ban hành|\n|--|--|--|-|\n|91/2020/NĐ-CP|Nghị định 91/2020/NĐ-CP|14-08-2020||\n\nYêu cầu, điều kiện thực hiện:\nKhông có\nTừ khóa:\nKhông có thông tin\nMô tả:\nKhông có thông tin', 'Chi tiết thủ tục hành chính:\nMã thủ tục:\n2.000076\nSố quyết định:\n3191/QĐ-BCA\nTên thủ tục:\nĐăng ký sang tên, di chuyển xe tại Phòng Cảnh sát giao thông (thực hiện tại cấp tỉnh)\nCấp thực hiện:\nCấp Tỉnh\nLoại thủ tục:\nTTHC không được luật giao cho địa phương quy định hoặc quy định chi tiết\nLĩnh vực:\nĐăng ký, quản lý phương tiện giao thông đường bộ\nTrình tự thực hiện:\n+ Khi chuyển quyền sở hữu xe, chủ xe phải giữ lại chứng nhận đăng ký xe, biển số xe (không giao cho tổ chức, cá nhân nhận chuyển quyền sở hữu xe) và nộp cho cơ quan đăng ký xe chứng nhận đăng ký xe, biển số xe để làm thủ tục thu hồi; trong thời hạn 30 ngày, kể từ ngày làm giấy tờ chuyển quyền sở hữu xe, chủ xe phải làm thủ tục thu hồi, trường hợp quá thời hạn trên mà chủ xe không làm thủ tục thu hồi hoặc giao chứng nhận đăng ký xe, biển số xe cho tổ chức, cá nhân nhận chuyển quyền sở hữu xe làm thủ tục thu hồi thì trước khi giải quyết cơ quan đăng ký xe ra quyết định xử phạt đối với chủ xe về hành vi không làm thủ tục thu hồi theo quy định; \nKhi chuyển trụ sở, nơi cư trú từ tỉnh, thành phố trực thuộc Trung ương này sang tỉnh, thành phố trực thuộc Trung ương khác (di chuyển nguyên chủ), chủ xe phải làm thủ tục thu hồi tại cơ quan đang quản lý hồ sơ xe đó. \n+ Tổ chức, cá nhân nhận chuyển quyền sở hữu xe, chủ xe (đối với trường hợp di chuyển nguyên chủ) làm thủ tục đăng ký sang tên, di chuyển xe tại cơ quan đăng ký xe theo quy định.\nBước 1: Chủ xe kê khai giấy khai thu hồi đăng ký, biển số xe trên cổng dịch vụ công; cung cấp mã hồ sơ đăng ký xe trực tuyến; nộp hồ sơ thu hồi quy định tại khoản 1 Điều 14 Thông tư số 24//2023/TT-BCA và nhận giấy hẹn trả kết quả đăng ký xe theo quy định;\nBước 2: Sau khi kiểm tra hồ sơ xe hợp lệ, cơ quan đăng ký xe cấp chứng nhận thu hồi đăng ký, biển số xe theo quy định (có dán bản chà số máy, số khung và đóng dấu giáp lai của cơ quan đăng ký xe trên bản chà số máy, số khung xe): 01 bản trả cho chủ xe; 01 bản lưu hồ sơ xe; trường hợp mất chứng nhận đăng ký xe thì thực hiện xác minh theo quy định.\nBước 3: Tổ chức, cá nhân nhận chuyển quyền sở hữu xe, chủ xe (đối với trường hợp di chuyển nguyên chủ): Kê khai giấy khai đăng ký xe theo quy định tại Điều 9 Thông tư số 24/2023/TT-BCA; đưa xe đến để kiểm tra, cung cấp mã hồ sơ đăng ký xe trực tuyến và nộp hồ sơ quy định tại khoản 2 Điều 14 Thông tư số 24/2023/TT-BCA;\nBước 4: Sau khi kiểm tra hồ sơ xe, thực tế xe đảm bảo hợp lệ thì được cơ quan đăng ký xe cấp biển số theo quy định tại khoản 2 Điều 12 Thông tư số 24/2023/TT-BCA; cáp giấy hẹn trả kết quả đăng ký và xác định mức thu lệ phí đăng ký xe;\nBước 5: Chủ xe nộp lệ phí đăng ký xe trên cổng dịch vụ công Bộ Công an và nhận biển số xe (trường hợp được cấp biển số theo quy định tại điểm a khoản 2 Điều 12 Thông tư số 24/2023/TT-BCA); trường hợp chủ xe có nhu cầu nhận trả kết quả đăng ký xe qua dịch vụ bưu chính công ích thì đăng ký với đơn vị dịch vụ bưu chính công ích;\nBước 6: Chủ xe nhận chứng nhận đăng ký xe, biển số xe (trường hợp được cấp biển số theo quy định tại điểm b khoản 2 Điều 12, Điều 28 Thông tư số 24/2023/TT-BCA) tại cơ quan đăng ký xe hoặc từ đơn vị dịch vụ bưu chính công ích.\nTrường hợp đăng ký xe di chuyển nguyên chủ thì được giữ nguyên biển số định danh (biển 05 số); trường hợp biển số cũ là biển 3 hoặc 4 số thì cấp đổi sang biển số định danh theo quy định tại Thông tư số 24/2023/TT-BCA.\nTổ chức, cá nhân đã nhận chuyển quyền sở hữu xe kèm theo biển số xe trúng đấu giá, không được tiếp tục chuyển quyền sở hữu xe kèm theo biển số xe trúng đấu giá cho tổ chức, cá nhân khác; được chuyển quyền sở hữu xe theo quy định của pháp luật.\nCách thức thực hiện:\n|Hình thức nộp|Thời hạn giải quyết|Phí, lệ phí|Mô tả|\n|--|--|--|-|\n|Trực tiếp|02 Ngày làm việc|Lệ phí : Thu theo Thông tư số 229/2016/TT-BTC ngày 11/11/2016 của Bộ Tài chính quy định mức thu, chế độ thu, nộp, quản lý lệ phí đăng ký, cấp biển số phương tiện giao thông cơ giới đường bộ.  Lệ phí : Đồng Thu theo Thông tư số 60/2023/TT-BTC ngày 07/9/2023 của Bộ Tài chính quy định mức thu, chế độ thu, nộp, quản lý lệ phí đăng ký, cấp biển số phương tiện giao thông cơ giới đường bộ (có hiệu lực từ ngày 22/10/2023)|+ Cấp chứng nhận thu hồi đăng ký, biển số xe: Không quá 02 ngày làm việc (trường hợp cấp chứng nhận thu hồi đăng ký, biển số), kể từ ngày nhận đủ hồ sơ hợp lệ. + Cấp chứng nhận đăng ký xe: Không quá 02 ngày làm việc, kể từ ngày nhận đủ hồ sơ hợp lệ + Cấp biển số định danh lần đầu: Cấp ngay sau khi tiếp nhận hồ sơ đăng ký xe hợp lệ. + Cấp lại biển số định danh: Không quá 07 ngày làm việc, kể từ ngày nhận đủ hồ sơ hợp lệ. + Thời gian trả kết quả đăng ký xe theo quy định được tính từ ngày nhận đủ hồ sơ hợp lệ và hệ thống đăng ký, quản lý xe đã nhận được kết quả xác thực về việc hoàn thành nộp lệ phí đăng ký xe từ cổng dịch vụ công. + Trường hợp mất chứng nhận đăng ký xe khi làm thủ tục thu hồi thì thời hạn xác minh là 30 ngày.|\n|Trực tuyến|02 Ngày làm việc|Lệ phí : Đồng Thu theo Thông tư số 229/2016/TT-BTC ngày 11/11/2016 của Bộ Tài chính quy định mức thu, chế độ thu, nộp, quản lý lệ phí đăng ký, cấp biển số phương tiện giao thông cơ giới đường bộ.  Lệ phí : Đồng Thu theo Thông tư số 60/2023/TT-BTC ngày 07/9/2023 của Bộ Tài chính quy định mức thu, chế độ thu, nộp, quản lý lệ phí đăng ký, cấp biển số phương tiện giao thông cơ giới đường bộ (có hiệu lực từ ngày 22/10/2023)|+ Cấp chứng nhận thu hồi đăng ký, biển số xe: Không quá 02 ngày làm việc (trường hợp cấp chứng nhận thu hồi đăng ký, biển số), kể từ ngày nhận đủ hồ sơ hợp lệ. + Cấp chứng nhận đăng ký xe: Không quá 02 ngày làm việc, kể từ ngày nhận đủ hồ sơ hợp lệ + Cấp biển số định danh lần đầu: Cấp ngay sau khi tiếp nhận hồ sơ đăng ký xe hợp lệ. + Cấp lại biển số định danh: Không quá 07 ngày làm việc, kể từ ngày nhận đủ hồ sơ hợp lệ. + Thời gian trả kết quả đăng ký xe theo quy định được tính từ ngày nhận đủ hồ sơ hợp lệ và hệ thống đăng ký, quản lý xe đã nhận được kết quả xác thực về việc hoàn thành nộp lệ phí đăng ký xe từ cổng dịch vụ công. + Trường hợp mất chứng nhận đăng ký xe khi làm thủ tục thu hồi thì thời hạn xác minh là 30 ngày.|\n|Dịch vụ bưu chính|02 Ngày làm việc||+ Trả kết quả qua dịch vụ bưu chính.|\n\nThành phần hồ sơ:\n\nBao gồm\n|Tên giấy tờ|Mẫu đơn, tờ khai|Số lượng|\n|--|--|-|\n|Giấy khai đăng ký xe (Mẫu số 01 ban hành kèm theo Thông tư số 58/2020/TT-BCA)|<a href=""https://csdl.dichvucong.gov.vn/web/jsp/download_file.jsp?ma=\'3fd5e0f72270996c\'"">Mẫu số 1 Giay khai đăng ký xe.doc</a>|Bản chính: 1Bản sao: 0|\n|Giấy tờ lệ phí trước bạ.||Bản chính: 1Bản sao: 0|\n|Giấy tờ chuyển quyền sở hữu xe.||Bản chính: 1Bản sao: 0|\n|Giấy tờ của chủ xe theo quy định||Bản chính: 1Bản sao: 0|\n|Giấy chứng nhận thu hồi đăng ký, biển số xe (nếu có).||Bản chính: 1Bản sao: 0|\n|Khi cơ sở dữ liệu cơ quan đăng ký xe kết nối với cơ sở dữ liệu của các Bộ, ngành thì các giấy tờ nêu trên được thay thế bằng dữ liệu điện tử là căn cứ để cấp đăng ký, biển số xe.||Bản chính: 1Bản sao: 0|\n\nĐối tượng thực hiện:\nCông dân Việt Nam, Người Việt Nam định cư ở nước ngoài, Người nước ngoài, Cán bộ, công chức, viên chức, Doanh nghiệp, Doanh nghiệp có vốn đầu tư nước ngoài, Tổ chức (không bao gồm doanh nghiệp, HTX), Tổ chức nước ngoài, Hợp tác xã\nCơ quan thực hiện:\nPhòng Cảnh sát giao thông\nCơ quan có thẩm quyền:\nPhòng Cảnh sát giao thông\nĐịa chỉ tiếp nhận HS:\nTrụ sở Phòng Cảnh sát giao thông Công an tỉnh, thành phố trực thuộc Trung ương hoặc các điểm đăng ký xe của Phòng; Cổng Dịch công quốc gia; Cổng Dịch vụ công Bộ Công an\nCơ quan được ủy quyền:\nKhông có thông tin\nCơ quan phối hợp:\nKhông có thông tin\nKết quả thực hiện:\nGiấy chứng nhận đăng ký xe, Biển số xe\nCăn cứ pháp lý:\n|Số ký hiệu|Trích yếu|Ngày ban hành|Cơ quan ban hành|\n|--|--|--|-|\n|23/2008/QH12|Giao thông đường bộ|13-11-2008|Quốc Hội|\n|Thông tư số 229/2016/TT-BTC|Quy định mức thu, chế độ thu, nộp, quản lý lệ phí đăng ký, cấp biển số phương tiện giao thông cơ giới đường bộ|11-11-2016||\n|24/2023/TT-BCA|Thông tư số 24/2023/TT-BCA ngày 01/07/2023 của Bộ trưởng Bộ Công an quy định về cấp, thu hồi đăng ký, biển số xe cơ giới|01-07-2023|Bộ trưởng Bộ Công an|\n|60/2023/TT-BTC|Thông tư số 60/2023/TT-BTC ngày 07/9/2023 của Bộ Tài chính quy định mức thu, chế độ thu, nộp, quản lý lệ phí đăng ký, cấp biển số phương tiện giao thông cơ giới đường bộ|07-09-2023|Bộ Tài chính|\n\nYêu cầu, điều kiện thực hiện:\nkhông\nTừ khóa:\nĐăng ký sang tên, di chuyển xe tại Phòng Cảnh sát giao thông\nMô tả:\nKhông có thông tin', 'Chi tiết thủ tục hành chính:\nMã thủ tục:\n1.003877\nSố quyết định:\n3873/QĐ-BTNMT\nTên thủ tục:\nThủ tục đăng ký biến động về sử dụng đất, tài sản gắn liền với đất do thay đổi thông tin về người được cấp Giấy chứng nhận (đổi tên hoặc giấy tờ pháp nhân, giấy tờ nhân thân, địa chỉ); giảm diện tích thửa đất do sạt lở tự nhiên; thay đổi về hạn chế quyền sử dụng đất; thay đổi về nghĩa vụ tài chính; thay đổi về tài sản gắn liền với đất so với nội dung đã đăng ký, cấp Giấy chứng nhận\nCấp thực hiện:\nCấp Huyện\nLoại thủ tục:\nTTHC được luật giao quy định chi tiết\nLĩnh vực:\nĐất đai\nTrình tự thực hiện:\nTrực tiếp:\na) Người sử dụng đất nộp hồ sơ tại Văn phòng đăng ký quyền sử dụng đất thuộc Phòng Tài nguyên và Môi trường hoặc cơ quan tiếp nhận hồ sơ theo quy định của Ủy ban nhân dân tỉnh, thành phố trực thuộc Trung ương.\nHộ gia đình, cá nhân, cộng đồng dân cư nộp hồ sơ tại Ủy ban nhân dân cấp xã nếu có nhu cầu.\nTrường hợp nhận hồ sơ chưa đầy đủ, chưa hợp lệ thì trong thời gian tối đa 03 ngày, cơ quan tiếp nhận, xử lý hồ sơ phải thông báo và hướng dẫn người nộp hồ sơ bổ sung, hoàn chỉnh hồ sơ theo quy định.\nTrường hợp người sử dụng đất có nhu cầu chuyển mục đích sử dụng đất kết hợp với đăng ký biến động về các nội dung của thủ tục này thì thực hiện thủ tục này đồng thời với thủ tục chuyển mục đích sử dụng đất.\nb) Cơ quan tiếp nhận hồ sơ ghi đầy đủ thông tin vào Sổ tiếp nhận hồ sơ và trả kết quả, trao Phiếu tiếp nhận hồ sơ và trả kết quả cho người nộp hồ sơ.\nTrường hợp nộp hồ sơ tại Ủy ban nhân dân cấp xã thì trong thời hạn 03 ngày làm việc kể từ ngày nhận đủ hồ sơ, Ủy ban nhân dân cấp xã phải chuyển hồ sơ đến Văn phòng đăng ký quyền sử dụng đất.\nc) Văn phòng đăng ký quyền sử dụng đất có trách nhiệm kiểm tra hồ sơ, nếu đủ điều kiện thực hiện các quyền theo quy định thì thực hiện các công việc sau đây:\n- Trích đo địa chính thửa đất đối với trường hợp có thay đổi về diện tích thửa đất, tài sản gắn liền với đất hoặc trường hợp đã cấp Giấy chứng nhận nhưng chưa có bản đồ địa chính, chưa trích đo địa chính thửa đất;\n- Trường hợp đăng ký thay đổi diện tích xây dựng, diện tích sử dụng, tầng cao, kết cấu, cấp (hạng) nhà hoặc công trình xây dựng mà không phù hợp với giấy phép xây dựng hoặc không có giấy phép xây dựng đối với trường hợp phải xin phép thì gửi phiếu lấy ý kiến của cơ quan quản lý, cấp phép xây dựng theo quy định của pháp luật về xây dựng;\n- Gửi thông tin địa chính cho cơ quan thuế để xác định và thông báo thu nghĩa vụ tài chính đối với trường hợp phải nộp tiền sử dụng đất, tiền thuê đất theo quy định của pháp luật;\n- Xác nhận thay đổi vào Giấy chứng nhận đã cấp hoặc lập hồ sơ trình cơ quan có thẩm quyền cấp Giấy chứng nhận quyền sử dụng đất, quyền sở hữu nhà ở và tài sản khác gắn liền với đất đối với trường hợp phải cấp lại Giấy chứng nhận theo quy định của Bộ Tài nguyên và Môi trường; thông báo cho người sử dụng đất ký hoặc ký lại hợp đồng thuê đất với cơ quan tài nguyên và môi trường đối với trường hợp phải thuê đất;\n- Chỉnh lý, cập nhật biến động vào hồ sơ địa chính, cơ sở dữ liệu đất đai.\nd) Văn phòng đăng ký quyền sử dụng đất trao Giấy chứng nhận cho người được cấp hoặc gửi Ủy ban nhân dân cấp xã để trao đối với trường hợp nộp hồ sơ tại cấp xã.\nThực hiện thủ tục trên môi trường điện tử:\nCơ quan tiếp nhận, giải quyết hồ sơ có trách nhiệm thực hiện các trình tự, thủ tục hành chính về đất đai theo quy định của pháp luật về đất đai; trường hợp cần phải kiểm tra, xác minh làm rõ hoặc do nguyên nhân khác mà không trả kết quả giải quyết hồ sơ theo đúng quy định về thời gian giải quyết thủ tục hành chính về đất đai thì cơ quan tiếp nhận hồ sơ, giải quyết thủ tục gửi thông báo bằng văn bản hoặc qua Cổng dịch vụ công hoặc qua tin nhắn SMS cho người yêu cầu, trong đó nêu rõ lý do.\nNgười sử dụng đất, chủ sở hữu tài sản gắn liền với đất có trách nhiệm hoàn thành nghĩa vụ tài chính theo quy định của pháp luật bằng hình thức trực tiếp hoặc trực tuyến thông qua chức năng thanh toán của Cổng dịch vụ công.\nCơ quan tiếp nhận hoặc cơ quan giải quyết hồ sơ thông báo cho người yêu cầu thực hiện thủ tục hành chính nộp bản chính Giấy chứng nhận đã cấp, các giấy tờ theo quy định sau khi người sử dụng đất hoàn thành nghĩa vụ tài chính.\nViệc trả kết quả giải quyết thủ tục hành chính được thực hiện tại cơ quan tiếp nhận hồ sơ hoặc qua dịch vụ bưu chính công ích hoặc tại địa điểm theo yêu cầu đối với trường hợp tiếp nhận hồ sơ và trả kết quả giải quyết thủ tục đăng ký đất đai, tài sản khác gắn liền với đất.\nCách thức thực hiện:\n|Hình thức nộp|Thời hạn giải quyết|Phí, lệ phí|Mô tả|\n|--|--|--|-|\n|Trực tiếp|10 Ngày làm việc|Lệ phí : Đồng Thực hiện theo quy định của Luật Phí, lệ phí.|Cách thức thực hiện: Người sử dụng đất nộp hồ sơ tại Văn phòng đăng ký quyền sử dụng đất thuộc Phòng Tài nguyên và Môi trường hoặc cơ quan tiếp nhận hồ sơ theo quy định của Ủy ban nhân dân cấp tỉnh. Hộ gia đình, cá nhân, cộng đồng dân cư nộp hồ sơ tại Ủy ban nhân dân cấp xã nếu có nhu cầu. Thời hạn giải quyết: Do Ủy ban nhân dân cấp tỉnh quy định nhưng không quá 10 ngày kể từ ngày nhận được hồ sơ hợp lệ. Thời gian này không tính thời gian các ngày nghỉ, ngày lễ theo quy định của pháp luật; không tính thời gian tiếp nhận hồ sơ tại xã, thời gian thực hiện nghĩa vụ tài chính của người sử dụng đất; không tính thời gian xem xét xử lý đối với trường hợp sử dụng đất có vi phạm pháp luật, thời gian trưng cầu giám định. Đối với các xã miền núi, hải đảo, vùng sâu, vùng xa, vùng có điều kiện kinh tế - xã hội khó khăn, vùng có điều kiện kinh tế - xã hội đặc biệt khó khăn thì thời gian thực hiện được tăng thêm 10 ngày. Kết quả giải quyết thủ tục hành chính phải trả cho người sử dụng đất, chủ sở hữu tài sản gắn liền với đất trong thời hạn không quá 03 ngày làm việc kể từ ngày có kết quả giải quyết.|\n\nThành phần hồ sơ:\n\n(*) Trường hợp xác nhận thay đổi thông tin về số Giấy chứng minh nhân dân, số thẻ Căn cước công dân, địa chỉ trên Giấy chứng nhận đã cấp theo nhu cầu của người sử dụng đất, chủ sở hữu tài sản gắn liền với đất, gồm có:\n|Tên giấy tờ|Mẫu đơn, tờ khai|Số lượng|\n|--|--|-|\n|a) Đơn đăng ký biến động đất đai, tài sản gắn liền với đất theo Mẫu số 09/ĐK;|<a href=""https://csdl.dichvucong.gov.vn/web/jsp/download_file.jsp?ma=\'3fca097995cb2bac\'"">mau so 09.doc</a>|Bản chính: 1Bản sao: 0|\n|b) Bản gốc Giấy chứng nhận đã cấp;||Bản chính: 1Bản sao: 0|\n|c) Bản sao Giấy CMND/thẻ căn cước công dân/số định danh cá nhân, hộ chiếu mới hoặc Giấy chứng minh quân đội mới hoặc thẻ Căn cước công dân mới hoặc sổ hộ khẩu, giấy tờ khác chứng minh thay đổi nhân thân đối với trường hợp thay đổi thông tin về nhân thân của người có tên trên Giấy chứng nhận; Trường hợp dữ liệu quốc gia về dân cư được chia sẻ và kết nối với dữ liệu của các ngành, các lĩnh vực (trong đó có lĩnh vực đất đai) thì cơ quan tiếp nhận hồ sơ sử dụng dữ liệu từ cơ sở dữ liệu quốc gia về dân cư mà không yêu cầu người nộp hồ sơ phải nộp bản sao CMND/thẻ căn cước công dân/số định danh cá nhân, hộ chiếu hoặc Giấy chứng minh quân đội hoặc sổ hộ khẩu hoặc giấy tờ khác để chứng minh nhân thân.||Bản chính: 0Bản sao: 1|\n\n\n(*) Trường hợp đăng ký biến động về sử dụng đất, tài sản gắn liền với đất do người sử dụng đất, chủ sở hữu tài sản gắn liền với đất được đổi tên; giảm diện tích thửa đất do sạt lở tự nhiên; thay đổi về hạn chế quyền sử dụng đất; thay đổi về nghĩa vụ tài chính; thay đổi về tài sản gắn liền với đất so với nội dung đã đăng ký, cấp Giấy chứng nhận gồm có:\n|Tên giấy tờ|Mẫu đơn, tờ khai|Số lượng|\n|--|--|-|\n|1. Đơn đăng ký biến động đất đai, tài sản gắn liền với đất theo Mẫu số 09/ĐK;|<a href=""https://csdl.dichvucong.gov.vn/web/jsp/download_file.jsp?ma=\'3fe7518ba157a40a\'"">mau so 09.doc</a>|Bản chính: 1Bản sao: 0|\n|2. Bản gốc Giấy chứng nhậnđã cấp;||Bản chính: 1Bản sao: 0|\n|3. Một trong các giấy tờ liên quan đến nội dung biến động:||Bản chính: Bản sao:|\n|- Văn bản công nhận của cơ quan nhà nước có thẩm quyền theo quy định của pháp luật đối với trường hợp cá nhân hoặc người đại diện hộ gia đình thay đổi họ, tên;||Bản chính: 1Bản sao: 0|\n|- Văn bản thỏa thuận của cộng đồng dân cư được Ủy ban nhân dân cấp xã xác nhận đối với trường hợp cộng đồng dân cư đổi tên;||Bản chính: 1Bản sao: 0|\n|- Văn bản xác nhận của Ủy ban nhân dân cấp xã về tình trạng sạt lở tự nhiên đối với trường hợp giảm diện tích thửa đất, tài sản gắn liền với đất do sạt lở tự nhiên;||Bản chính: 1Bản sao: 0|\n|- Chứng từ về việc nộp nghĩa vụ tài chính đối với trường hợp Giấy chứng nhận đã cấp có ghi nợ hoặc chậm nộp nghĩa vụ tài chính, trừ trường hợp người sử dụng đất được miễn giảm hoặc không phải nộp do thay đổi quy định của pháp luật;||Bản chính: 1Bản sao: 0|\n|- Quyết định của cơ quan nhà nước có thẩm quyền về việc thay đổi hạn chế về quyềnsử dụng đất, quyền sở hữu tài sản gắn liền với đất ghi trên Giấy chứng nhận đối với trường hợp có hạn chế theo quyết định giao đất, cho thuê đất, công nhận quyền sử dụng đất; trường hợp có thay đổi hạn chế theo văn bản chuyển quyền sử dụng đất thì phải có văn bản chấp thuận thay đổi hạn chế của người có quyền lợi liên quan, được Ủy ban nhân dân cấp xã xác nhận;||Bản chính: 1Bản sao: 0|\n|- Bản sao một trong các giấy tờ về quyền sở hữu tài sản gắn liền với đất thể hiện nội dung thay đổi đối với trường hợp thay đổi thông tin về tài sản gắn liền với đất đã ghi trên Giấy chứng nhận.||Bản chính: 0Bản sao: 1|\n|- Văn bản thỏa thuận của hộ gia đình được Ủy ban nhân dân cấp xã xác nhận đối với trường hợp thay đổi người đại diện là thành viên trong hộ gia đình mà không phải là chủ hộ; trường hợp thay đổi người đại diện hộ gia đình là chủ hộ thì cơ quan giải quyết thủ tục có trách nhiệm khai thác, sử dụng thông tin trong Cơ sở dữ liệu quốc gia về dân cư theo quy định tại Điều 14 Nghị định số 104/2022/NĐ-CP ngày 21 tháng 12 năm 2022 của Chính phủ sửa đổi, bổ sung một số điều của các nghị định liên quan đến việc nộp, xuất trình sổ hộ khẩu, sổ tạm trú giấy khi thực hiện thủ tục hành chính, cung cấp dịch vụ công.||Bản chính: 1Bản sao: 0|']",Cục An toàn thông tin,Tôi không biết trả lời câu hỏi này.,0.0,0.0,0.0,0.0
15,"Cách thức thực hiện thủ tục chứng nhận lãnh sự, hợp pháp hóa lãnh sự giấy tờ, tài liệu tại các cơ quan ở trong nước?","['Đối tượng thực hiện:\nCông dân Việt Nam, Người Việt Nam định cư ở nước ngoài, Người nước ngoài\nCơ quan thực hiện:\nCục Lãnh sự - Bộ Ngoại giao, Sở Ngoại vụ Thành phố Hồ Chí Minh - Bộ Ngoại giao\nCơ quan có thẩm quyền:\nCục Lãnh sự - Bộ Ngoại giao, Sở Ngoại vụ Thành phố Hồ Chí Minh - Bộ Ngoại giao\nĐịa chỉ tiếp nhận HS:\nKhông có thông tin\nCơ quan được ủy quyền:\nKhông có thông tin\nCơ quan phối hợp:\nKhông có thông tin\nKết quả thực hiện:\nCấp Tem (hoặc dấu) chứng nhận/hợp pháp hóa lãnh sự trên giấy tờ, tài liệu.\nCăn cứ pháp lý:\n|Số ký hiệu|Trích yếu|Ngày ban hành|Cơ quan ban hành|\n|--|--|--|-|\n|111/2011/NĐ-CP|Nghị định 111/2011/NĐ-CP|05-12-2011|Chính phủ|\n|01/2012/TT-BNG|Thông tư 01/2012/TT-BNG|20-03-2012|Bộ Ngoại giao|\n|157/2016/TT-BTC|Thông tư 157/2016/TT-BTC|24-10-2016|Bộ Tài chính|\n|36/2004/TT-BTC|Thông tư 36/2004/TT-BTC|26-04-2004|Bộ Tài chính|\n\nYêu cầu, điều kiện thực hiện:\n1. Các giấy tờ, tài liệu được miễn chứng nhận lãnh sự, hợp pháp hóa lãnh sự:\n- Giấy tờ, tài liệu được miễn chứng nhận lãnh sự, hợp pháp hóa lãnh sự theo điều ước quốc tế mà Việt Nam và nước ngoài liên quan đều là thành viên, hoặc theo nguyên tắc có đi có lại.\n- Giấy tờ, tài liệu được chuyển giao trực tiếp hoặc qua đường ngoại giao giữa cơ quan có thẩm quyền của Việt Nam và cơ quan có thẩm quyền của nước ngoài.\n- Giấy tờ, tài liệu được miễn chứng nhận lãnh sự, hợp pháp hóa lãnh sự theo quy định của pháp luật Việt Nam.\n- Giấy tờ, tài liệu mà cơ quan tiếp nhận của Việt Nam hoặc của nước ngoài không yêu cầu phải hợp pháp hóa lãnh sự, chứng nhận lãnh sự phù hợp với quy định pháp luật tương ứng của Việt Nam hoặc của nước ngoài.\n2. Các giấy tờ, tài liệu không được chứng nhận lãnh sự, hợp pháp hóa lãnh sự:\n- Giấy tờ, tài liệu bị sửa chữa, tẩy xóa nhưng không được đính chính theo quy định pháp luật.\n- Giấy tờ, tài liệu trong hồ sơ đề nghị chứng nhận lãnh sự, hợp pháp hóa lãnh sự có các chi tiết trong bản thân giấy tờ, tài liệu đó mâu thuẫn với nhau hoặc mâu thuẫn với giấy tờ, tài liệu khác trong hồ sơ đề nghị chứng nhận lãnh sự, hợp pháp hóa lãnh sự.\n- Giấy tờ, tài liệu giả mạo hoặc được cấp, chứng nhận sai thẩm quyền theo quy định pháp luật.\n- Giấy tờ, tài liệu đồng thời có con dấu và chữ ký không được đóng trực tiếp và ký trực tiếp trên giấy tờ, tài liệu. Con dấu, chữ ký sao chụp dưới mọi hình thức đều không được coi là con dấu gốc, chữ ký gốc.\n- Giấy tờ, tài liệu có nội dung vi phạm quyền và lợi ích của Nhà nước Việt Nam, không phù hợp với chủ trương, chính sách của Nhà nước Việt Nam hoặc các trường hợp khác có thể gây bất lợi cho Nhà nước Việt Nam.\n3. Yêu cầu cụ thể đối với các giấy tờ, tài liệu đề nghị chứng nhận lãnh sự:\n     a. Là giấy tờ, tài liệu của Việt Nam để được công nhận và sử dụng ở nước ngoài.\n     b. Giấy tờ, tài liệu có thể đề nghị được chứng nhận lãnh sự là giấy tờ, tài liệu được lập, công chứng, chứng thực, chứng nhận bởi:\n     - Các cơ quan thuộc Quốc hội, Chủ tịch nước, Chính phủ, Toà án, Viện Kiểm sát; các cơ quan hành chính nhà nước Trung ương và địa phương.\n     - Cơ quan Trung ương của Đảng Cộng sản Việt Nam, Ủy ban Trung ương Mặt trận Tổ quốc Việt Nam, Tổng Liên đoàn Lao động Việt Nam, Hội Liên hiệp Phụ nữ Việt Nam, Trung ương Đoàn Thanh niên Cộng sản Hồ Chí Minh, Hội Nông dân Việt Nam, Hội Cựu chiến binh Việt Nam, Liên hiệp các tổ chức Hữu nghị Việt Nam, Liên hiệp các Hội Văn học nghệ thuật Việt Nam, Liên hiệp các Hội Khoa học và Kỹ thuật Việt Nam, Liên minh Hợp tác xã Việt Nam, Phòng Thương mại và Công nghiệp Việt Nam;\n     - Các tổ chức hành nghề công chứng của Việt Nam;\n     - Giấy tờ, tài liệu do cơ quan, tổ chức khác cấp, chứng nhận theo quy định của pháp luật bao gồm:\n+ Văn bằng, chứng chỉ giáo dục, đào tạo;\n+ Chứng nhận y tế;\n+ Phiếu lý lịch tư pháp;\n+ Giấy tờ, tài liệu khác có thể được chứng nhận lãnh sự theo quy định của pháp luật.\n     c. Mẫu con dấu, mẫu chữ ký và chức danh của các cơ quan và người có thẩm quyền nêu tại điểm 10.3.b phải được giới thiệu trước cho Bộ Ngoại giao.\n4. Yêu cầu cụ thể đối với giấy tờ, tài liệu đề nghị hợp pháp hóa lãnh sự:\n     - Là giấy tờ, tài liệu của nước ngoài để được công nhận và sử dụng ở Việt Nam.\n     - Được cơ quan đại diện ngoại giao, cơ quan lãnh sự hoặc cơ quan khác được ủy quyền thực hiện chức năng lãnh sự của nước ngoài cấp, chứng nhận.\n     - Mẫu con dấu, mẫu chữ ký và chức danh của các cơ quan và người có thẩm quyền của nước ngoài phải được giới thiệu trước cho Bộ Ngoại giao.\n1. Các giấy tờ, tài liệu được miễn chứng nhận lãnh sự, hợp pháp hóa lãnh sự:\n- Giấy tờ, tài liệu được miễn chứng nhận lãnh sự, hợp pháp hóa lãnh sự theo điều ước quốc tế mà Việt Nam và nước ngoài liên quan đều là thành viên, hoặc theo nguyên tắc có đi có lại.\n- Giấy tờ, tài liệu được chuyển giao trực tiếp hoặc qua đường ngoại giao giữa cơ quan có thẩm quyền của Việt Nam và cơ quan có thẩm quyền của nước ngoài.\n- Giấy tờ, tài liệu được miễn chứng nhận lãnh sự, hợp pháp hóa lãnh sự theo quy định của pháp luật Việt Nam.\n- Giấy tờ, tài liệu mà cơ quan tiếp nhận của Việt Nam hoặc của nước ngoài không yêu cầu phải hợp pháp hóa lãnh sự, chứng nhận lãnh sự phù hợp với quy định pháp luật tương ứng của Việt Nam hoặc của nước ngoài.\n2. Các giấy tờ, tài liệu không được chứng nhận lãnh sự, hợp pháp hóa lãnh sự:\n- Giấy tờ, tài liệu bị sửa chữa, tẩy xóa nhưng không được đính chính theo quy định pháp luật.\n- Giấy tờ, tài liệu trong hồ sơ đề nghị chứng nhận lãnh sự, hợp pháp hóa lãnh sự có các chi tiết trong bản thân giấy tờ, tài liệu đó mâu thuẫn với nhau hoặc mâu thuẫn với giấy tờ, tài liệu khác trong hồ sơ đề nghị chứng nhận lãnh sự, hợp pháp hóa lãnh sự.\n- Giấy tờ, tài liệu giả mạo hoặc được cấp, chứng nhận sai thẩm quyền theo quy định pháp luật.\n- Giấy tờ, tài liệu đồng thời có con dấu và chữ ký không được đóng trực tiếp và ký trực tiếp trên giấy tờ, tài liệu. Con dấu, chữ ký sao chụp dưới mọi hình thức đều không được coi là con dấu gốc, chữ ký gốc.\n- Giấy tờ, tài liệu có nội dung vi phạm quyền và lợi ích của Nhà nước Việt Nam, không phù hợp với chủ trương, chính sách của Nhà nước Việt Nam hoặc các trường hợp khác có thể gây bất lợi cho Nhà nước Việt Nam.\n3. Yêu cầu cụ thể đối với các giấy tờ, tài liệu đề nghị chứng nhận lãnh sự:\n     a. Là giấy tờ, tài liệu của Việt Nam để được công nhận và sử dụng ở nước ngoài.\n     b. Giấy tờ, tài liệu có thể đề nghị được chứng nhận lãnh sự là giấy tờ, tài liệu được lập, công chứng, chứng thực, chứng nhận bởi:\n     - Các cơ quan thuộc Quốc hội, Chủ tịch nước, Chính phủ, Toà án, Viện Kiểm sát; các cơ quan hành chính nhà nước Trung ương và địa phương.\n     - Cơ quan Trung ương của Đảng Cộng sản Việt Nam, Ủy ban Trung ương Mặt trận Tổ quốc Việt Nam, Tổng Liên đoàn Lao động Việt Nam, Hội Liên hiệp Phụ nữ Việt Nam, Trung ương Đoàn Thanh niên Cộng sản Hồ Chí Minh, Hội Nông dân Việt Nam, Hội Cựu chiến binh Việt Nam, Liên hiệp các tổ chức Hữu nghị Việt Nam, Liên hiệp các Hội Văn học nghệ thuật Việt Nam, Liên hiệp các Hội Khoa học và Kỹ thuật Việt Nam, Liên minh Hợp tác xã Việt Nam, Phòng Thương mại và Công nghiệp Việt Nam;\n     - Các tổ chức hành nghề công chứng của Việt Nam;\n     - Giấy tờ, tài liệu do cơ quan, tổ chức khác cấp, chứng nhận theo quy định của pháp luật bao gồm:\n+ Văn bằng, chứng chỉ giáo dục, đào tạo;\n+ Chứng nhận y tế;\n+ Phiếu lý lịch tư pháp;\n+ Giấy tờ, tài liệu khác có thể được chứng nhận lãnh sự theo quy định của pháp luật.\n     c. Mẫu con dấu, mẫu chữ ký và chức danh của các cơ quan và người có thẩm quyền nêu tại điểm 10.3.b phải được giới thiệu trước cho Bộ Ngoại giao.\n4. Yêu cầu cụ thể đối với giấy tờ, tài liệu đề nghị hợp pháp hóa lãnh sự:\n     - Là giấy tờ, tài liệu của nước ngoài để được công nhận và sử dụng ở Việt Nam.\n     - Được cơ quan đại diện ngoại giao, cơ quan lãnh sự hoặc cơ quan khác được ủy quyền thực hiện chức năng lãnh sự của nước ngoài cấp, chứng nhận.\n     - Mẫu con dấu, mẫu chữ ký và chức danh của các cơ quan và người có thẩm quyền của nước ngoài phải được giới thiệu trước cho Bộ Ngoại giao.\nTừ khóa:\nKhông có thông tin\nMô tả:\nKhông có thông tin', 'Chi tiết thủ tục hành chính:\nMã thủ tục:\n1.001308\nSố quyết định:\n1061/QĐ-BNG\nTên thủ tục:\nThủ tục chứng nhận lãnh sự, hợp pháp hóa lãnh sự giấy tờ, tài liệu tại các cơ quan ở trong nước\nCấp thực hiện:\nCấp Bộ, Cấp Tỉnh\nLoại thủ tục:\nTTHC được luật giao quy định chi tiết\nLĩnh vực:\nChứng nhận lãnh sự, hợp pháp hóa lãnh sự\nTrình tự thực hiện:\n1. Nộp hồ sơ:\n\na) Tại Cục Lãnh sự (Bộ Ngoại giao):\n\nĐịa chỉ: 40 Trần Phú, Ba Đình, Hà Nội\n\nThời gian nộp hồ sơ và nhận kết quả: Từ thứ Hai đến thứ Sáu và sáng thứ Bẩy, trừ các ngày lễ, Tết.\n\n b) Tại Sở Ngoại vụ Thành phố Hồ Chí Minh (Bộ Ngoại giao).\n\nĐịa chỉ: số 184 bis đường Pasteur, phường Bến Nghé, quận 1, TPHCM.\n\nThời gian nộp hồ sơ và nhận kết trả: các ngày làm việc trong tuần và sáng thứ Bẩy, trừ Chủ Nhật và các ngày lễ, Tết.\n\nc) Tại trụ sở của các cơ quan Ngoại vụ địa phương được Bộ Ngoại giao ủy quyền tiếp nhận hồ sơ chứng nhận lãnh sự, hợp pháp hóa lãnh sự (tên cơ quan Ngoại vụ địa phương, địa chỉ, thời gian nhận và trả kết quả của các cơ quan này đề nghị xem tại Cổng thông tin điện tử về công tác lãnh sự - Bộ Ngoại giao: lanhsuvietnam.gov.vn).\n2. Cục Lãnh sự, Sở Ngoại vụ Thành phố Hồ Chí Minh, xem xét giải quyết.\n3. Nhận kết quả trực tiếp tại trụ sở cơ quan theo giấy biên nhận hồ sơ hoặc hồ sơ được gửi trả qua đường bưu điện cho đương sự.\nCách thức thực hiện:\n|Hình thức nộp|Thời hạn giải quyết|Phí, lệ phí|Mô tả|\n|--|--|--|-|\n|Trực tiếp|1 Ngày|Lệ phí : 30000 Đồng Chứng nhận lãnh sự  Lệ phí : 30000 Đồng Hợp pháp hóa lãnh sự Hợp pháp hóa lãnh sự  <a href=""https://csdl.dichvucong.gov.vn/web/jsp/download_file.jsp?ma=\'3fb6c75cfac45310\'"">VanBanGoc_157_2016_TT-BTC.pdf</a>|01 ngày làm việc kể từ ngày cơ quan có thẩm quyền giải quyết nhận đủ hồ sơ hợp lệ. Trường hợp hồ sơ có số lượng từ 10 giấy tờ, tài liệu trở lên thì thời hạn giải quyết có thể dài hơn nhưng không quá 05 ngày làm việc. Trường hợp cần kiểm tra tính xác thực của con dấu, chữ ký, chức danh trên giấy tờ, tài liệu đề nghị được chứng nhận lãnh sự thì ngay sau khi nhận hồ sơ, Bộ Ngoại giao có văn bản đề nghị cơ quan, tổ chức có thẩm quyền lập, công chứng, chứng thực, chứng nhận giấy tờ, tài liệu đó hoặc cơ quan, tổ chức cấp trên xác minh. Trong thời hạn 05 ngày làm việc kể từ ngày nhận được đề nghị, cơ quan, tổ chức có trách nhiệm trả lời bằng văn bản cho Bộ Ngoại giao. Ngay sau khi nhận được trả lời, Bộ Ngoại giao giải quyết và thông báo kết quả cho người đề nghị chứng nhận lãnh sự. Trường hợp chữ ký, con dấu và chức danh của cơ quan và người có thẩm quyền của nước ngoài (quy định tại tên thành phần hồ sơ 3) trong hồ sơ đề nghị được hợp pháp hóa lãnh sự chưa được chính thức thông báo hoặc cần kiểm tra tính xác thực, Bộ Ngoại giao đề nghị cơ quan này xác minh. Ngay sau khi nhận được kết quả xác minh, Bộ Ngoại giao giải quyết hồ sơ và trả kết quả cho đương sự.|\n|Dịch vụ bưu chính|1 Ngày|Lệ phí : 30000 Đồng Hợp pháp hóa lãnh sự  <a href=""https://csdl.dichvucong.gov.vn/web/jsp/download_file.jsp?ma=\'3fd7e3bdaf524082\'"">VanBanGoc_157_2016_TT-BTC.pdf</a> Lệ phí : 30000 Đồng Chứng nhận lãnh sự  <a href=""https://csdl.dichvucong.gov.vn/web/jsp/download_file.jsp?ma=\'3fd80df0cdbc02a4\'"">VanBanGoc_157_2016_TT-BTC.pdf</a>|01 ngày làm việc kể từ ngày cơ quan có thẩm quyền giải quyết nhận đủ hồ sơ hợp lệ. Trường hợp hồ sơ có số lượng từ 10 giấy tờ, tài liệu trở lên thì thời hạn giải quyết có thể dài hơn nhưng không quá 05 ngày làm việc. Trường hợp cần kiểm tra tính xác thực của con dấu, chữ ký, chức danh trên giấy tờ, tài liệu đề nghị được chứng nhận lãnh sự thì ngay sau khi nhận hồ sơ, Bộ Ngoại giao có văn bản đề nghị cơ quan, tổ chức có thẩm quyền lập, công chứng, chứng thực, chứng nhận giấy tờ, tài liệu đó hoặc cơ quan, tổ chức cấp trên xác minh. Trong thời hạn 05 ngày làm việc kể từ ngày nhận được đề nghị, cơ quan, tổ chức có trách nhiệm trả lời bằng văn bản cho Bộ Ngoại giao. Ngay sau khi nhận được trả lời, Bộ Ngoại giao giải quyết và thông báo kết quả cho người đề nghị chứng nhận lãnh sự. Trường hợp chữ ký, con dấu và chức danh của cơ quan và người có thẩm quyền của nước ngoài (quy định tại tên thành phần hồ sơ 3) trong hồ sơ đề nghị được hợp pháp hóa lãnh sự chưa được chính thức thông báo hoặc cần kiểm tra tính xác thực, Bộ Ngoại giao đề nghị cơ quan này xác minh. Ngay sau khi nhận được kết quả xác minh, Bộ Ngoại giao giải quyết hồ sơ và trả kết quả cho đương sự.|\n\nThành phần hồ sơ:\n\nĐối với việc chứng nhận lãnh sự giấy tờ, tài liệu của Việt Nam để được công nhận và sử dụng ở nước ngoài\n|Tên giấy tờ|Mẫu đơn, tờ khai|Số lượng|\n|--|--|-|\n|Tờ khai chứng nhận/hợp pháp hoá lãnh sự theo mẫu số LS/HPH-2012/TK|<a href=""https://csdl.dichvucong.gov.vn/web/jsp/download_file.jsp?ma=\'3fdd707287736200\'"">To_Khai_HPH.pdf</a>|Bản chính: 1Bản sao: 0|\n|Xuất trình bản chính giấy tờ tùy thân (chứng minh nhân dân, hộ chiếu hoặc giấy tờ có giá trị thay thế hộ chiếu) đối với trường hợp nộp hồ sơ trực tiếp; hoặc 01 bản chụp giấy tờ tùy thân (chứng minh nhân dân, hộ chiếu hoặc giấy tờ có giá trị thay thế hộ chiếu) đối với trường hợp nộp hồ sơ qua đường bưu điện. Giấy tờ này không cần phải chứng thực||Bản chính: 1Bản sao: 0|\n|Giấy tờ, tài liệu đề nghị được chứng nhận lãnh sự||Bản chính: 1Bản sao: 0|\n|Bản chụp giấy tờ, tài liệu đề nghị được chứng nhận lãnh sự||Bản chính: 0Bản sao: 1|\n|Phong bì có dán tem và ghi rõ địa chỉ người nhận (nếu hồ sơ gửi qua đường bưu điện và yêu cầu trả kết quả qua đường bưu điện)||Bản chính: 1Bản sao: 0|\n\n\nĐối với việc hợp pháp hóa lãnh sự giấy tờ, tài liệu của nước ngoài để được công nhận và sử dụng ở Việt Nam\n|Tên giấy tờ|Mẫu đơn, tờ khai|Số lượng|\n|--|--|-|\n|Tờ khai chứng nhận/hợp pháp hoá lãnh sự theo mẫu số LS/HPH-2012/TK|<a href=""https://csdl.dichvucong.gov.vn/web/jsp/download_file.jsp?ma=\'3f88d59a7e9cd800\'"">Mẫu LS.doc</a>|Bản chính: 1Bản sao: 0|\n|Bản chính giấy tờ tùy thân (chứng minh nhân dân, hộ chiếu hoặc giấy tờ có giá trị thay thế hộ chiếu) đối với trường hợp nộp hồ sơ trực tiếp; hoặc 01 bản chụp giấy tờ tùy thân (chứng minh nhân dân, hộ chiếu hoặc giấy tờ có giá trị thay thế hộ chiếu) đối với trường hợp nộp hồ sơ qua đường bưu điện. Giấy tờ này không cần phải chứng thực||Bản chính: 1Bản sao: 0|\n|Giấy tờ, tài liệu đề nghị được hợp pháp hóa lãnh sự (đã được cơ quan đại diện ngoại giao, cơ quan lãnh sự hoặc cơ quan khác được ủy quyền thực hiện chức năng lãnh sự của nước ngoài chứng nhận)||Bản chính: 1Bản sao: 0|\n|Bản chụp giấy tờ, tài liệu đề nghị được hợp pháp hóa lãnh sự||Bản chính: 0Bản sao: 1|\n|Bản dịch giấy tờ, tài liệu đề nghị được hợp pháp hóa lãnh sự sang tiếng Việt hoặc tiếng Anh (nếu giấy tờ, tài liệu đó không được lập bằng các thứ tiếng này). Bản dịch không phải chứng thực. Người nộp hồ sơ phải chịu trách nhiệm về tính chính xác của bản dịch||Bản chính: 1Bản sao: 0|\n|Bản chụp bản dịch giấy tờ, tài liệu||Bản chính: 1Bản sao: 0|\n|Phong bì có dán tem và ghi rõ địa chỉ người nhận (nếu hồ sơ gửi qua đường bưu điện và yêu cầu trả kết quả qua đường bưu điện)||Bản chính: 1Bản sao: 0|\n\nĐối tượng thực hiện:\nCông dân Việt Nam, Người Việt Nam định cư ở nước ngoài, Người nước ngoài\nCơ quan thực hiện:\nCục Lãnh sự - Bộ Ngoại giao, Sở Ngoại vụ Thành phố Hồ Chí Minh - Bộ Ngoại giao\nCơ quan có thẩm quyền:\nCục Lãnh sự - Bộ Ngoại giao, Sở Ngoại vụ Thành phố Hồ Chí Minh - Bộ Ngoại giao\nĐịa chỉ tiếp nhận HS:\nKhông có thông tin\nCơ quan được ủy quyền:\nKhông có thông tin\nCơ quan phối hợp:\nKhông có thông tin\nKết quả thực hiện:\nCấp Tem (hoặc dấu) chứng nhận/hợp pháp hóa lãnh sự trên giấy tờ, tài liệu.\nCăn cứ pháp lý:\n|Số ký hiệu|Trích yếu|Ngày ban hành|Cơ quan ban hành|\n|--|--|--|-|\n|111/2011/NĐ-CP|Nghị định 111/2011/NĐ-CP|05-12-2011|Chính phủ|\n|01/2012/TT-BNG|Thông tư 01/2012/TT-BNG|20-03-2012|Bộ Ngoại giao|\n|157/2016/TT-BTC|Thông tư 157/2016/TT-BTC|24-10-2016|Bộ Tài chính|\n|36/2004/TT-BTC|Thông tư 36/2004/TT-BTC|26-04-2004|Bộ Tài chính|', 'Chi tiết thủ tục hành chính:\nMã thủ tục:\n3.000163\nSố quyết định:\n01/QĐCB\nTên thủ tục:\nNộp đơn khởi kiện, tài liệu, chứng cứ và nhận các văn bản, thông báo tố tụng\nCấp thực hiện:\nCấp Bộ, Cấp Tỉnh, Cấp Huyện\nLoại thủ tục:\nLoại khác\nLĩnh vực:\nTòa án\nTrình tự thực hiện:\nBước 1. Cá nhân, tổ chức nộp đơn khởi kiện, tài liệu chứng cứ và nhận các văn bản, thông báo tố tụng. \nTrường hợp thực hiện trực tuyến, Cá nhân, tổ chức đăng nhập Cổng Dịch vụ công Quốc gia/Cổng Dịch vụ công của Tòa án nhân dân, lựa chọn và tiến hành thực hiện nộp trực tuyến hoặc đăng ký nhận thông báo, văn bản tố tụng.\nBước 2. Cơ quan Tòa án thông báo kết quả giải quyết đơn khởi kiện. Nếu đơn đủ điều kiện thụ lý thì cơ quan Tòa án ra thông báo nộp tiền tạm ứng án phí đối với đơn khởi kiện. Căn cứ thông báo, cá nhân, tổ chức đến Cơ quan Thi hành án nộp tiền tạm ứng án phí, lệ phí tòa án.\nTrường hợp thực hiện trực tuyến, căn cứ trên thông báo tống đạt hoặc tin nhắn SMS (nếu có) về việc Tòa án gửi thông báo nộp tiền tạm ứng án phí, cá nhân, tổ chức chọn mục thanh toán trực tuyến án phí và thực hiện thanh toán trực tuyến.\nBước 3. Cá nhân, tổ chức nộp biên lai thu tiền tạm ứng đến Cơ quan Tòa án. Cơ quan Tòa án tiến hành thụ lý vụ án.\nTrường hợp thực hiện trực tuyến, hệ thống thanh toán trực tuyến sẽ tự động chuyển biên lai thu tạm ứng án phí, lệ phí Tòa án đến Cơ quan Tòa án để thụ lý vụ án và có thông báo đến cá nhân, tổ chức.\nBước 4. Nhận tài liệu, thông báo văn bản tố tụng trực tuyến trên hệ thống hoặc theo địa chỉ đã đăng ký.\nCách thức thực hiện:\n|Hình thức nộp|Thời hạn giải quyết|Phí, lệ phí|Mô tả|\n|--|--|--|-|\n|Trực tiếp|Theo quy định của Bộ luật Tố tụng dân sự, Bộ Luật tố tụng hành chính|||\n|Trực tuyến|Theo quy định của Bộ luật Tố tụng dân sự, Bộ Luật tố tụng hành chính|||\n\nThành phần hồ sơ:\n\nGiấy tờ phải nộp\n|Tên giấy tờ|Mẫu đơn, tờ khai|Số lượng|\n|--|--|-|\n|Đơn khởi kiện||Bản chính: 1Bản sao:|\n|Tài liệu, chứng cứ kèm theo (nếu có)||Bản chính: Bản sao: 1|\n\n\nBao gồm\n|Tên giấy tờ|Mẫu đơn, tờ khai|Số lượng|\n|--|--|-|\n|Tài liệu, chứng cứ kèm theo (nếu có)||Bản chính: 1Bản sao: 1|\n\nĐối tượng thực hiện:\nCông dân Việt Nam, Doanh nghiệp, Tổ chức nước ngoài\nCơ quan thực hiện:\nTòa án nhân dân tối cao, Tòa án nhân dân cấp cao, Tòa án nhân dân tỉnh, thành phố trực thuộc trung ương, Tòa án nhân dân cấp huyện, quận, thị xã, thành phố thuộc tỉnh và tương đương\nCơ quan có thẩm quyền:\nKhông có thông tin\nĐịa chỉ tiếp nhận HS:\nKhông có thông tin\nCơ quan được ủy quyền:\nKhông có thông tin\nCơ quan phối hợp:\nKhông có thông tin\nKết quả thực hiện:\nĐơn khởi kiện được thụ lý\nCăn cứ pháp lý:\n|Số ký hiệu|Trích yếu|Ngày ban hành|Cơ quan ban hành|\n|--|--|--|-|\n|21/2014/L-CTN|Lệnh 21/2014/L-CTN|04-12-2014||\n|02/2014/TTLT-TANDTC-VKSNDTC-BTP-BTC|Thông tư liên tịch 02/2014/TTLT-TANDTC-VKSNDTC-BTP-BTC|28-03-2014||\n|110/2015/QH13|Nghị quyết 110/2015/QH13|27-11-2015||\n|56/2010/QH12|Nghị quyết 56/2010/QH12|24-11-2010||\n\nYêu cầu, điều kiện thực hiện:\nKhông có thông tin\nTừ khóa:\nKhông có thông tin\nMô tả:\nKhông có thông tin']","| Hình thức nộp | Thời hạn giải quyết | Phí, lệ phí | Mô tả |
| Trực tiếp      | 1 Ngày              | Lệ phí : 30000 Đồng Chứng nhận lãnh sự<br>Lệ phí : 30000 Đồng Hợp pháp hóa lãnh sự | [VanBanGoc_157_2016_TT-BTC.pdf](link) <br> 01 ngày làm việc kể từ ngày cơ quan có thẩm quyền giải quyết nhận đủ hồ sơ hợp lệ. Trường hợp hồ sơ có số lượng từ 10 giấy tờ, tài liệu trở lên thì thời hạn giải quyết có thể dài hơn nhưng không quá 05 ngày làm việc. Trường hợp cần kiểm tra tính xác thực của con dấu, chữ ký, chức danh trên giấy tờ, tài liệu đề nghị được chứng nhận lãnh sự thì ngay sau khi nhận hồ sơ, Bộ Ngoại giao có văn bản đề nghị cơ quan, tổ chức có thẩm quyền lập, công chứng, chứng thực, chứng nhận giấy tờ, tài liệu đó hoặc cơ quan, tổ chức cấp trên xác minh. Trong thời hạn 05 ngày làm việc kể từ ngày nhận được đề nghị, cơ quan, tổ chức có trách nhiệm trả lời bằng văn bản cho Bộ Ngoại giao. Ngay sau khi nhận được trả lời, Bộ Ngoại giao giải quyết và thông báo kết quả cho người đề nghị chứng nhận lãnh sự. Trường hợp chữ ký, con dấu và chức danh của cơ quan và người có thẩm quyền của nước ngoài (quy định tại tên thành phần hồ sơ 3) trong hồ sơ đề nghị được hợp pháp hóa lãnh sự chưa được chính thức thông báo hoặc cần kiểm tra tính xác thực, Bộ Ngoại giao đề nghị cơ quan này xác minh. Ngay sau khi nhận được kết quả xác minh, Bộ Ngoại giao giải quyết hồ sơ và trả kết quả cho đương sự. |
| Dịch vụ bưu chính | 1 Ngày | Lệ phí : 30000 Đồng Hợp pháp hóa lãnh sự<br>Lệ phí : 30000 Đồng Chứng nhận lãnh sự | [VanBanGoc_157_2016_TT-BTC.pdf](link) <br> 01 ngày làm việc kể từ ngày cơ quan có thẩm quyền giải quyết nhận đủ hồ sơ hợp lệ. Trường hợp hồ sơ có số lượng từ 10 giấy tờ, tài liệu trở lên thì thời hạn giải quyết có thể dài hơn nhưng không quá 05 ngày làm việc. Trường hợp cần kiểm tra tính xác thực của con dấu, chữ ký, chức danh trên giấy tờ, tài liệu đề nghị được chứng nhận lãnh sự thì ngay sau khi nhận hồ sơ, Bộ Ngoại giao có văn bản đề nghị cơ quan, tổ chức có thẩm quyền lập, công chứng, chứng thực, chứng nhận giấy tờ, tài liệu đó hoặc cơ quan, tổ chức cấp trên xác minh. Trong thời hạn 05 ngày làm việc kể từ ngày nhận được đề nghị, cơ quan, tổ chức có trách nhiệm trả lời bằng văn bản cho Bộ Ngoại giao. Ngay sau khi nhận được trả lời, Bộ Ngoại giao giải quyết và thông báo kết quả cho người đề nghị chứng nhận lãnh sự. Trường hợp chữ ký, con dấu và chức danh của cơ quan và người có thẩm quyền của nước ngoài (quy định tại tên thành phần hồ sơ 3) trong hồ sơ đề nghị được hợp pháp hóa lãnh sự chưa được chính thức thông báo hoặc cần kiểm tra tính xác thực, Bộ Ngoại giao đề nghị cơ quan này xác minh. Ngay sau khi nhận được kết quả xác minh, Bộ Ngoại giao giải quyết hồ sơ và trả kết quả cho đương sự. |","|Hình thức nộp|Thời hạn giải quyết|Phí, lệ phí|Mô tả|
|--|--|--|-|
|Trực tiếp|1 Ngày|Lệ phí : 30000 Đồng Chứng nhận lãnh sự  Lệ phí : 30000 Đồng Hợp pháp hóa lãnh sự Hợp pháp hóa lãnh sự  [VanBanGoc_157_2016_TT-BTC.pdf](https://csdl.dichvucong.gov.vn/web/jsp/download_file.jsp?ma='3fb6c75cfac45310')|01 ngày làm việc kể từ ngày cơ quan có thẩm quyền giải quyết nhận đủ hồ sơ hợp lệ. Trường hợp hồ sơ có số lượng từ 10 giấy tờ, tài liệu trở lên thì thời hạn giải quyết có thể dài hơn nhưng không quá 05 ngày làm việc. Trường hợp cần kiểm tra tính xác thực của con dấu, chữ ký, chức danh trên giấy tờ, tài liệu đề nghị được chứng nhận lãnh sự thì ngay sau khi nhận hồ sơ, Bộ Ngoại giao có văn bản đề nghị cơ quan, tổ chức có thẩm quyền lập, công chứng, chứng thực, chứng nhận giấy tờ, tài liệu đó hoặc cơ quan, tổ chức cấp trên xác minh. Trong thời hạn 05 ngày làm việc kể từ ngày nhận được đề nghị, cơ quan, tổ chức có trách nhiệm trả lời bằng văn bản cho Bộ Ngoại giao. Ngay sau khi nhận được trả lời, Bộ Ngoại giao giải quyết và thông báo kết quả cho người đề nghị chứng nhận lãnh sự. Trường hợp chữ ký, con dấu và chức danh của cơ quan và người có thẩm quyền của nước ngoài (quy định tại tên thành phần hồ sơ 3) trong hồ sơ đề nghị được hợp pháp hóa lãnh sự chưa được chính thức thông báo hoặc cần kiểm tra tính xác thực, Bộ Ngoại giao đề nghị cơ quan này xác minh. Ngay sau khi nhận được kết quả xác minh, Bộ Ngoại giao giải quyết hồ sơ và trả kết quả cho đương sự.|
|Dịch vụ bưu chính|1 Ngày|Lệ phí : 30000 Đồng Hợp pháp hóa lãnh sự  [VanBanGoc_157_2016_TT-BTC.pdf](https://csdl.dichvucong.gov.vn/web/jsp/download_file.jsp?ma='3fd7e3bdaf524082') Lệ phí : 30000 Đồng Chứng nhận lãnh sự  [VanBanGoc_157_2016_TT-BTC.pdf](https://csdl.dichvucong.gov.vn/web/jsp/download_file.jsp?ma='3fd80df0cdbc02a4')|01 ngày làm việc kể từ ngày cơ quan có thẩm quyền giải quyết nhận đủ hồ sơ hợp lệ. Trường hợp hồ sơ có số lượng từ 10 giấy tờ, tài liệu trở lên thì thời hạn giải quyết có thể dài hơn nhưng không quá 05 ngày làm việc. Trường hợp cần kiểm tra tính xác thực của con dấu, chữ ký, chức danh trên giấy tờ, tài liệu đề nghị được chứng nhận lãnh sự thì ngay sau khi nhận hồ sơ, Bộ Ngoại giao có văn bản đề nghị cơ quan, tổ chức có thẩm quyền lập, công chứng, chứng thực, chứng nhận giấy tờ, tài liệu đó hoặc cơ quan, tổ chức cấp trên xác minh. Trong thời hạn 05 ngày làm việc kể từ ngày nhận được đề nghị, cơ quan, tổ chức có trách nhiệm trả lời bằng văn bản cho Bộ Ngoại giao. Ngay sau khi nhận được trả lời, Bộ Ngoại giao giải quyết và thông báo kết quả cho người đề nghị chứng nhận lãnh sự. Trường hợp chữ ký, con dấu và chức danh của cơ quan và người có thẩm quyền của nước ngoài (quy định tại tên thành phần hồ sơ 3) trong hồ sơ đề nghị được hợp pháp hóa lãnh sự chưa được chính thức thông báo hoặc cần kiểm tra tính xác thực, Bộ Ngoại giao đề nghị cơ quan này xác minh. Ngay sau khi nhận được kết quả xác minh, Bộ Ngoại giao giải quyết hồ sơ và trả kết quả cho đương sự.|",1.0,0.8,0.0,0.8
16,Cơ quan phối hợp của thủ tục gia hạn hợp đồng mua bán điện là gì?,"['Chi tiết thủ tục hành chính:\nMã thủ tục:\n3.000101\nSố quyết định:\n505\nTên thủ tục:\nGia hạn hợp đồng mua bán điện\nCấp thực hiện:\nCấp Bộ, Cơ quan khác\nLoại thủ tục:\nLoại khác\nLĩnh vực:\nDịch vụ trong quá trình thực hiện HĐMBĐ\nTrình tự thực hiện:\nTiếp nhận yêu cầu\nKý Phụ lục Hợp đồng mua bán điện hoặc Biên bản chấm dứt HĐMBĐ cũ và Hợp đồng mua bán điện mới\nCách thức thực hiện:\n|Hình thức nộp|Thời hạn giải quyết|Phí, lệ phí|Mô tả|\n|--|--|--|-|\n|Trực tiếp|1 Ngày làm việc|Mức giá : Miên phí||\n|Trực tuyến|1 Ngày làm việc|Mức giá : Miên phí||\n|Dịch vụ bưu chính|1 Ngày làm việc|Mức giá : Miên phí||\n\nThành phần hồ sơ:\n\nBao gồm\n|Tên giấy tờ|Mẫu đơn, tờ khai|Số lượng|\n|--|--|-|\n|Giấy đề nghị|<a href=""https://csdl.dichvucong.gov.vn/web/jsp/download_file.jsp?ma=\'3fedcde9076b2fb2\'"">02.PhieuDeNghiDichVuDienDungChung.docx</a>|Bản chính: 1Bản sao: 0|\n\nĐối tượng thực hiện:\nCông dân Việt Nam, Người nước ngoài, Doanh nghiệp, Doanh nghiệp có vốn đầu tư nước ngoài, Tổ chức (không bao gồm doanh nghiệp, HTX), Tổ chức nước ngoài, Hợp tác xã\nCơ quan thực hiện:\nTập đoàn Điện lực Việt Nam\nCơ quan có thẩm quyền:\nTập đoàn Điện lực Việt Nam\nĐịa chỉ tiếp nhận HS:\nKhông có thông tin\nCơ quan được ủy quyền:\nKhông có thông tin\nCơ quan phối hợp:\nKhông có thông tin\nKết quả thực hiện:\nHợp đồng mua bán điện, Biên bản chấm dứt HĐMBĐ, Phụ lục hợp đồng mua bán điện 25, Phụ lục hợp đồng mua bán điện 24\nCăn cứ pháp lý:\n|Số ký hiệu|Trích yếu|Ngày ban hành|Cơ quan ban hành|\n|--|--|--|-|\n|137/2013/NĐ-CP|Quy định chi tiết thi hành một số điều của Luật Điện lực và Luật sửa đổi, bổ sung một số điều của Luật Điện lực|21-10-2013|Chính phủ|\n|24/2012/QH13|Sửa đổi, bổ sung một số điều của Luật Điện lực|20-11-2012|Quốc Hội|\n|Luật số 28/2004/QH11|Luật Điện lực|03-12-2004|Quốc Hội|\n\nYêu cầu, điều kiện thực hiện:\nKhông có yêu cầu điều kiện\nTừ khóa:\nKhông có thông tin\nMô tả:\nKhông có thông tin', 'Chi tiết thủ tục hành chính:\nMã thủ tục:\n3.000099\nSố quyết định:\n505\nTên thủ tục:\nThay đổi chủ thể hợp đồng mua bán điện\nCấp thực hiện:\nCấp Bộ, Cơ quan khác\nLoại thủ tục:\nLoại khác\nLĩnh vực:\nDịch vụ trong quá trình thực hiện HĐMBĐ\nTrình tự thực hiện:\nTiếp nhận yêu cầu\nKhảo sát\nKý Biên bản chấm dứt HĐMBĐ cũ và Hợp đồng mua bán điện mới\nCách thức thực hiện:\n|Hình thức nộp|Thời hạn giải quyết|Phí, lệ phí|Mô tả|\n|--|--|--|-|\n|Trực tiếp|2 Ngày làm việc|Mức giá : Miễn phí|Với khách hàng mua điện sinh hoạt|\n|Trực tiếp|3 Ngày làm việc|Mức giá : Miễn Phí|Với khách hàng mua điện ngoài sinh hoạt|\n|Trực tuyến|2 Ngày làm việc|Mức giá : Miễn phí|Với khách hàng mua điện sinh hoạt|\n|Trực tuyến|3 Ngày làm việc|Mức giá : Miễn Phí|Với khách hàng mua điện ngoài sinh hoạt|\n|Dịch vụ bưu chính|2 Ngày làm việc|Mức giá : Miễn phí|Với khách hàng mua điện sinh hoạt|\n|Dịch vụ bưu chính|3 Ngày làm việc|Mức giá : Miễn Phí|Với khách hàng mua điện ngoài sinh hoạt|\n\nThành phần hồ sơ:\n\nBao gồm\n|Tên giấy tờ|Mẫu đơn, tờ khai|Số lượng|\n|--|--|-|\n|Giấy đề nghị|<a href=""https://csdl.dichvucong.gov.vn/web/jsp/download_file.jsp?ma=\'3fd8d08451306676\'"">02.PhieuDeNghiDichVuDienDungChung.docx</a>|Bản chính: 1Bản sao: 0|\n|Giấy tờ xác định chủ thể HĐMBĐ mới: là một trong các loại giấy tờ có tên của Tổ chức/cá nhân tại địa điểm mua điện sau: Hộ khẩu thường trú; Sổ tạm trú; Giấy chứng nhận quyền sở hữu nhà; Quyết định phân nhà; Hợp đồng mua bán nhà; Hợp đồng thuê nhà có thời hạn từ 01 năm trở lên và đồng ý của chủ sở hữu; Giấy chứng nhận quyền sử dụng đất; Hợp đồng ủy quyền quản lý và sử dụng nhà/đất; Hợp đồng thuê địa điểm và đồng ý của chủ sở hữu; Giấy chứng nhận đăng ký doanh nghiệp; Giấy chứng nhận đăng ký kinh doanh; Giấy chứng nhận đăng ký hộ kinh doanh; Giấy chứng nhận đăng ký hoạt động chi nhánh, văn phòng đại diện; Giấy phép đầu tư; Quyết định thành lập đơn vị.||Bản chính: 0Bản sao: 1|\n\nĐối tượng thực hiện:\nCông dân Việt Nam, Người nước ngoài, Doanh nghiệp, Doanh nghiệp có vốn đầu tư nước ngoài, Tổ chức (không bao gồm doanh nghiệp, HTX), Tổ chức nước ngoài, Hợp tác xã\nCơ quan thực hiện:\nTập đoàn Điện lực Việt Nam\nCơ quan có thẩm quyền:\nTập đoàn Điện lực Việt Nam\nĐịa chỉ tiếp nhận HS:\nKhông có thông tin\nCơ quan được ủy quyền:\nKhông có thông tin\nCơ quan phối hợp:\nKhông có thông tin\nKết quả thực hiện:\nHợp đồng mua bán điện, Biên bản chấm dứt HĐMBĐ\nCăn cứ pháp lý:\n|Số ký hiệu|Trích yếu|Ngày ban hành|Cơ quan ban hành|\n|--|--|--|-|\n|137/2013/NĐ-CP|Quy định chi tiết thi hành một số điều của Luật Điện lực và Luật sửa đổi, bổ sung một số điều của Luật Điện lực|21-10-2013|Chính phủ|\n|24/2012/QH13|Sửa đổi, bổ sung một số điều của Luật Điện lực|20-11-2012|Quốc Hội|\n|Luật số 28/2004/QH11|Luật Điện lực|03-12-2004|Quốc Hội|\n\nYêu cầu, điều kiện thực hiện:\nKhông có yêu cầu điều kiện\nTừ khóa:\nKhông có thông tin\nMô tả:\nKhông có thông tin', 'Chi tiết thủ tục hành chính:\nMã thủ tục:\n3.000102\nSố quyết định:\n505\nTên thủ tục:\nChấm dứt hợp đồng mua bán điện\nCấp thực hiện:\nCấp Bộ, Cơ quan khác\nLoại thủ tục:\nLoại khác\nLĩnh vực:\nDịch vụ trong quá trình thực hiện HĐMBĐ\nTrình tự thực hiện:\nTiếp nhận yêu cầu\nChốt chỉ số\nKý Biên bản chấm dứt HĐMBĐ\nCách thức thực hiện:\n|Hình thức nộp|Thời hạn giải quyết|Phí, lệ phí|Mô tả|\n|--|--|--|-|\n|Trực tiếp|2 Ngày làm việc|Mức giá : Miễn phí||\n|Trực tuyến|2 Ngày làm việc|Mức giá : Miễn phí||\n|Dịch vụ bưu chính|2 Ngày làm việc|Mức giá : Miễn phí||\n\nThành phần hồ sơ:\n\nBao gồm\n|Tên giấy tờ|Mẫu đơn, tờ khai|Số lượng|\n|--|--|-|\n|Giấy đề nghị|<a href=""https://csdl.dichvucong.gov.vn/web/jsp/download_file.jsp?ma=\'3fbc532eb2e6b888\'"">02.PhieuDeNghiDichVuDienDungChung.docx</a>|Bản chính: 1Bản sao: 0|\n\nĐối tượng thực hiện:\nCông dân Việt Nam, Người nước ngoài, Doanh nghiệp, Doanh nghiệp có vốn đầu tư nước ngoài, Tổ chức (không bao gồm doanh nghiệp, HTX), Tổ chức nước ngoài, Hợp tác xã\nCơ quan thực hiện:\nTập đoàn Điện lực Việt Nam\nCơ quan có thẩm quyền:\nTập đoàn Điện lực Việt Nam\nĐịa chỉ tiếp nhận HS:\nKhông có thông tin\nCơ quan được ủy quyền:\nKhông có thông tin\nCơ quan phối hợp:\nKhông có thông tin\nKết quả thực hiện:\nBiên bản chấm dứt HĐMBĐ\nCăn cứ pháp lý:\n|Số ký hiệu|Trích yếu|Ngày ban hành|Cơ quan ban hành|\n|--|--|--|-|\n|137/2013/NĐ-CP|Quy định chi tiết thi hành một số điều của Luật Điện lực và Luật sửa đổi, bổ sung một số điều của Luật Điện lực|21-10-2013|Chính phủ|\n|24/2012/QH13|Sửa đổi, bổ sung một số điều của Luật Điện lực|20-11-2012|Quốc Hội|\n|Luật số 28/2004/QH11|Luật Điện lực|03-12-2004|Quốc Hội|\n\nYêu cầu, điều kiện thực hiện:\nKhông có yêu cầu điều kiện\nTừ khóa:\nKhông có thông tin\nMô tả:\nKhông có thông tin']",Không có thông tin,Tôi không biết trả lời câu hỏi này.,0.0,0.0,0.0,0.0
17,Kết quả thực hiện của thủ tục cấp giấy chứng nhận tên định danh là gì?,"['Chi tiết thủ tục hành chính:\nMã thủ tục:\n1.008813\nSố quyết định:\n1545/QĐ-BTTTT\nTên thủ tục:\nCấp giấy chứng nhận tên định danh\nCấp thực hiện:\nCấp Bộ\nLoại thủ tục:\nTTHC được luật giao quy định chi tiết\nLĩnh vực:\nCông nghệ thông tin, điện tử\nTrình tự thực hiện:\n- Tổ chức, cá nhân hoàn thiện hồ sơ đăng ký cấp tên định danh (theo quy định tại Điều 24 Nghị định số 91/2020/NĐ-CP);\n- Tổ chức, cá nhân nộp Hồ sơ đến Bộ Thông tin và Truyền thông (Cục An toàn thông tin).\n- Sau khi hồ sơ được tiếp nhận, trong thời hạn một (01) ngày làm việc Bộ Thông tin và Truyền thông (Cục An toàn thông tin) xem xét tính hợp lệ của hồ sơ và quyết định một trong các trường hợp sau:\n+ Cấp tên định danh cho tổ chức, cá nhân và thông báo cho tổ chức, cá nhân biết thông qua thư điện tử hoặc tin nhắn;\n+ Không cấp tên định danh cho tổ chức, cá nhân đối với trường hợp hồ sơ chưa đầy đủ hoặc cần làm rõ, tổ chức, cá nhân bổ sung, giải trình, hoàn thiện hồ sơ và nộp lại hồ sơ theo quy định tại Điều 25 Nghị định số 91/2020/NĐ-CP và thông báo lý do cho tổ chức, cá nhân thông qua thư điện tử hoặc tin nhắn.\nCách thức thực hiện:\n|Hình thức nộp|Thời hạn giải quyết|Phí, lệ phí|Mô tả|\n|--|--|--|-|\n|Trực tiếp|01 Ngày làm việc|Lệ phí : 200000 Đồng (Theo quy định của Bộ Tài chính)|01 ngày kể từ ngày nhận đủ hồ sơ theo quy định|\n|Trực tuyến|01 Ngày làm việc|Lệ phí : 200000 Đồng (Theo quy định của Bộ Tài chính)|01 ngày kể từ ngày nhận đủ hồ sơ theo quy định|\n|Dịch vụ bưu chính|01 Ngày làm việc|Lệ phí : 200000 Đồng (Theo quy định của Bộ Tài chính)|01 ngày kể từ ngày nhận đủ hồ sơ theo quy định|\n\nThành phần hồ sơ:\n\nHồ sơ cấp Giấy chứng nhận tên định danh\n|Tên giấy tờ|Mẫu đơn, tờ khai|Số lượng|\n|--|--|-|\n|Bản khai Cấp tên định danh|<a href=""https://csdl.dichvucong.gov.vn/web/jsp/download_file.jsp?ma=\'3f933d2c89c33b00\'"">Bản khai đăng ký tên định danh.docx</a>|Bản chính: 1Bản sao:|\n|Bản sao có chứng thực Quyết định thành lập của tổ chức hoặc giấy chứng nhận đăng ký doanh nghiệp||Bản chính: Bản sao: 1|\n|Bản sao có chứng thực chứng minh nhân dân hoặc căn cước công dân hoặc hộ chiếu||Bản chính: Bản sao: 1|\n|Các giấy tờ khác có liên quan tới quyền sở hữu trí tuệ, đăng ký thương hiệu|<a href=""https://csdl.dichvucong.gov.vn/web/jsp/download_file.jsp?ma=\'3feb81c27c28e87a\'"">Giấy ủy quyền.docx</a>|Bản chính: Bản sao: 1|\n\nĐối tượng thực hiện:\nCông dân Việt Nam, Doanh nghiệp, Tổ chức (không bao gồm doanh nghiệp, HTX), Hợp tác xã\nCơ quan thực hiện:\nCục An toàn thông tin\nCơ quan có thẩm quyền:\nBộ Thông tin và Truyền thông\nĐịa chỉ tiếp nhận HS:\nCục An toàn thông tin, Tầng 8, Tòa nhà Cục Tần số Vô tuyến điện, 115 Trần Duy Hưng, Trung Hòa, Cầu giấy, Hà Nội\nCơ quan được ủy quyền:\nKhông có thông tin\nCơ quan phối hợp:\nKhông có thông tin\nKết quả thực hiện:\nGiấy chứng nhận tên định danh\nCăn cứ pháp lý:\n|Số ký hiệu|Trích yếu|Ngày ban hành|Cơ quan ban hành|\n|--|--|--|-|\n|91/2020/NĐ-CP|Nghị định 91/2020/NĐ-CP|14-08-2020||\n\nYêu cầu, điều kiện thực hiện:\nKhông có\nTừ khóa:\nKhông có thông tin\nMô tả:\nKhông có thông tin', 'Chi tiết thủ tục hành chính:\nMã thủ tục:\n2.000076\nSố quyết định:\n3191/QĐ-BCA\nTên thủ tục:\nĐăng ký sang tên, di chuyển xe tại Phòng Cảnh sát giao thông (thực hiện tại cấp tỉnh)\nCấp thực hiện:\nCấp Tỉnh\nLoại thủ tục:\nTTHC không được luật giao cho địa phương quy định hoặc quy định chi tiết\nLĩnh vực:\nĐăng ký, quản lý phương tiện giao thông đường bộ\nTrình tự thực hiện:\n+ Khi chuyển quyền sở hữu xe, chủ xe phải giữ lại chứng nhận đăng ký xe, biển số xe (không giao cho tổ chức, cá nhân nhận chuyển quyền sở hữu xe) và nộp cho cơ quan đăng ký xe chứng nhận đăng ký xe, biển số xe để làm thủ tục thu hồi; trong thời hạn 30 ngày, kể từ ngày làm giấy tờ chuyển quyền sở hữu xe, chủ xe phải làm thủ tục thu hồi, trường hợp quá thời hạn trên mà chủ xe không làm thủ tục thu hồi hoặc giao chứng nhận đăng ký xe, biển số xe cho tổ chức, cá nhân nhận chuyển quyền sở hữu xe làm thủ tục thu hồi thì trước khi giải quyết cơ quan đăng ký xe ra quyết định xử phạt đối với chủ xe về hành vi không làm thủ tục thu hồi theo quy định; \nKhi chuyển trụ sở, nơi cư trú từ tỉnh, thành phố trực thuộc Trung ương này sang tỉnh, thành phố trực thuộc Trung ương khác (di chuyển nguyên chủ), chủ xe phải làm thủ tục thu hồi tại cơ quan đang quản lý hồ sơ xe đó. \n+ Tổ chức, cá nhân nhận chuyển quyền sở hữu xe, chủ xe (đối với trường hợp di chuyển nguyên chủ) làm thủ tục đăng ký sang tên, di chuyển xe tại cơ quan đăng ký xe theo quy định.\nBước 1: Chủ xe kê khai giấy khai thu hồi đăng ký, biển số xe trên cổng dịch vụ công; cung cấp mã hồ sơ đăng ký xe trực tuyến; nộp hồ sơ thu hồi quy định tại khoản 1 Điều 14 Thông tư số 24//2023/TT-BCA và nhận giấy hẹn trả kết quả đăng ký xe theo quy định;\nBước 2: Sau khi kiểm tra hồ sơ xe hợp lệ, cơ quan đăng ký xe cấp chứng nhận thu hồi đăng ký, biển số xe theo quy định (có dán bản chà số máy, số khung và đóng dấu giáp lai của cơ quan đăng ký xe trên bản chà số máy, số khung xe): 01 bản trả cho chủ xe; 01 bản lưu hồ sơ xe; trường hợp mất chứng nhận đăng ký xe thì thực hiện xác minh theo quy định.\nBước 3: Tổ chức, cá nhân nhận chuyển quyền sở hữu xe, chủ xe (đối với trường hợp di chuyển nguyên chủ): Kê khai giấy khai đăng ký xe theo quy định tại Điều 9 Thông tư số 24/2023/TT-BCA; đưa xe đến để kiểm tra, cung cấp mã hồ sơ đăng ký xe trực tuyến và nộp hồ sơ quy định tại khoản 2 Điều 14 Thông tư số 24/2023/TT-BCA;\nBước 4: Sau khi kiểm tra hồ sơ xe, thực tế xe đảm bảo hợp lệ thì được cơ quan đăng ký xe cấp biển số theo quy định tại khoản 2 Điều 12 Thông tư số 24/2023/TT-BCA; cáp giấy hẹn trả kết quả đăng ký và xác định mức thu lệ phí đăng ký xe;\nBước 5: Chủ xe nộp lệ phí đăng ký xe trên cổng dịch vụ công Bộ Công an và nhận biển số xe (trường hợp được cấp biển số theo quy định tại điểm a khoản 2 Điều 12 Thông tư số 24/2023/TT-BCA); trường hợp chủ xe có nhu cầu nhận trả kết quả đăng ký xe qua dịch vụ bưu chính công ích thì đăng ký với đơn vị dịch vụ bưu chính công ích;\nBước 6: Chủ xe nhận chứng nhận đăng ký xe, biển số xe (trường hợp được cấp biển số theo quy định tại điểm b khoản 2 Điều 12, Điều 28 Thông tư số 24/2023/TT-BCA) tại cơ quan đăng ký xe hoặc từ đơn vị dịch vụ bưu chính công ích.\nTrường hợp đăng ký xe di chuyển nguyên chủ thì được giữ nguyên biển số định danh (biển 05 số); trường hợp biển số cũ là biển 3 hoặc 4 số thì cấp đổi sang biển số định danh theo quy định tại Thông tư số 24/2023/TT-BCA.\nTổ chức, cá nhân đã nhận chuyển quyền sở hữu xe kèm theo biển số xe trúng đấu giá, không được tiếp tục chuyển quyền sở hữu xe kèm theo biển số xe trúng đấu giá cho tổ chức, cá nhân khác; được chuyển quyền sở hữu xe theo quy định của pháp luật.\nCách thức thực hiện:\n|Hình thức nộp|Thời hạn giải quyết|Phí, lệ phí|Mô tả|\n|--|--|--|-|\n|Trực tiếp|02 Ngày làm việc|Lệ phí : Thu theo Thông tư số 229/2016/TT-BTC ngày 11/11/2016 của Bộ Tài chính quy định mức thu, chế độ thu, nộp, quản lý lệ phí đăng ký, cấp biển số phương tiện giao thông cơ giới đường bộ.  Lệ phí : Đồng Thu theo Thông tư số 60/2023/TT-BTC ngày 07/9/2023 của Bộ Tài chính quy định mức thu, chế độ thu, nộp, quản lý lệ phí đăng ký, cấp biển số phương tiện giao thông cơ giới đường bộ (có hiệu lực từ ngày 22/10/2023)|+ Cấp chứng nhận thu hồi đăng ký, biển số xe: Không quá 02 ngày làm việc (trường hợp cấp chứng nhận thu hồi đăng ký, biển số), kể từ ngày nhận đủ hồ sơ hợp lệ. + Cấp chứng nhận đăng ký xe: Không quá 02 ngày làm việc, kể từ ngày nhận đủ hồ sơ hợp lệ + Cấp biển số định danh lần đầu: Cấp ngay sau khi tiếp nhận hồ sơ đăng ký xe hợp lệ. + Cấp lại biển số định danh: Không quá 07 ngày làm việc, kể từ ngày nhận đủ hồ sơ hợp lệ. + Thời gian trả kết quả đăng ký xe theo quy định được tính từ ngày nhận đủ hồ sơ hợp lệ và hệ thống đăng ký, quản lý xe đã nhận được kết quả xác thực về việc hoàn thành nộp lệ phí đăng ký xe từ cổng dịch vụ công. + Trường hợp mất chứng nhận đăng ký xe khi làm thủ tục thu hồi thì thời hạn xác minh là 30 ngày.|\n|Trực tuyến|02 Ngày làm việc|Lệ phí : Đồng Thu theo Thông tư số 229/2016/TT-BTC ngày 11/11/2016 của Bộ Tài chính quy định mức thu, chế độ thu, nộp, quản lý lệ phí đăng ký, cấp biển số phương tiện giao thông cơ giới đường bộ.  Lệ phí : Đồng Thu theo Thông tư số 60/2023/TT-BTC ngày 07/9/2023 của Bộ Tài chính quy định mức thu, chế độ thu, nộp, quản lý lệ phí đăng ký, cấp biển số phương tiện giao thông cơ giới đường bộ (có hiệu lực từ ngày 22/10/2023)|+ Cấp chứng nhận thu hồi đăng ký, biển số xe: Không quá 02 ngày làm việc (trường hợp cấp chứng nhận thu hồi đăng ký, biển số), kể từ ngày nhận đủ hồ sơ hợp lệ. + Cấp chứng nhận đăng ký xe: Không quá 02 ngày làm việc, kể từ ngày nhận đủ hồ sơ hợp lệ + Cấp biển số định danh lần đầu: Cấp ngay sau khi tiếp nhận hồ sơ đăng ký xe hợp lệ. + Cấp lại biển số định danh: Không quá 07 ngày làm việc, kể từ ngày nhận đủ hồ sơ hợp lệ. + Thời gian trả kết quả đăng ký xe theo quy định được tính từ ngày nhận đủ hồ sơ hợp lệ và hệ thống đăng ký, quản lý xe đã nhận được kết quả xác thực về việc hoàn thành nộp lệ phí đăng ký xe từ cổng dịch vụ công. + Trường hợp mất chứng nhận đăng ký xe khi làm thủ tục thu hồi thì thời hạn xác minh là 30 ngày.|\n|Dịch vụ bưu chính|02 Ngày làm việc||+ Trả kết quả qua dịch vụ bưu chính.|\n\nThành phần hồ sơ:\n\nBao gồm\n|Tên giấy tờ|Mẫu đơn, tờ khai|Số lượng|\n|--|--|-|\n|Giấy khai đăng ký xe (Mẫu số 01 ban hành kèm theo Thông tư số 58/2020/TT-BCA)|<a href=""https://csdl.dichvucong.gov.vn/web/jsp/download_file.jsp?ma=\'3fd5e0f72270996c\'"">Mẫu số 1 Giay khai đăng ký xe.doc</a>|Bản chính: 1Bản sao: 0|\n|Giấy tờ lệ phí trước bạ.||Bản chính: 1Bản sao: 0|\n|Giấy tờ chuyển quyền sở hữu xe.||Bản chính: 1Bản sao: 0|\n|Giấy tờ của chủ xe theo quy định||Bản chính: 1Bản sao: 0|\n|Giấy chứng nhận thu hồi đăng ký, biển số xe (nếu có).||Bản chính: 1Bản sao: 0|\n|Khi cơ sở dữ liệu cơ quan đăng ký xe kết nối với cơ sở dữ liệu của các Bộ, ngành thì các giấy tờ nêu trên được thay thế bằng dữ liệu điện tử là căn cứ để cấp đăng ký, biển số xe.||Bản chính: 1Bản sao: 0|\n\nĐối tượng thực hiện:\nCông dân Việt Nam, Người Việt Nam định cư ở nước ngoài, Người nước ngoài, Cán bộ, công chức, viên chức, Doanh nghiệp, Doanh nghiệp có vốn đầu tư nước ngoài, Tổ chức (không bao gồm doanh nghiệp, HTX), Tổ chức nước ngoài, Hợp tác xã\nCơ quan thực hiện:\nPhòng Cảnh sát giao thông\nCơ quan có thẩm quyền:\nPhòng Cảnh sát giao thông\nĐịa chỉ tiếp nhận HS:\nTrụ sở Phòng Cảnh sát giao thông Công an tỉnh, thành phố trực thuộc Trung ương hoặc các điểm đăng ký xe của Phòng; Cổng Dịch công quốc gia; Cổng Dịch vụ công Bộ Công an\nCơ quan được ủy quyền:\nKhông có thông tin\nCơ quan phối hợp:\nKhông có thông tin\nKết quả thực hiện:\nGiấy chứng nhận đăng ký xe, Biển số xe\nCăn cứ pháp lý:\n|Số ký hiệu|Trích yếu|Ngày ban hành|Cơ quan ban hành|\n|--|--|--|-|\n|23/2008/QH12|Giao thông đường bộ|13-11-2008|Quốc Hội|\n|Thông tư số 229/2016/TT-BTC|Quy định mức thu, chế độ thu, nộp, quản lý lệ phí đăng ký, cấp biển số phương tiện giao thông cơ giới đường bộ|11-11-2016||\n|24/2023/TT-BCA|Thông tư số 24/2023/TT-BCA ngày 01/07/2023 của Bộ trưởng Bộ Công an quy định về cấp, thu hồi đăng ký, biển số xe cơ giới|01-07-2023|Bộ trưởng Bộ Công an|\n|60/2023/TT-BTC|Thông tư số 60/2023/TT-BTC ngày 07/9/2023 của Bộ Tài chính quy định mức thu, chế độ thu, nộp, quản lý lệ phí đăng ký, cấp biển số phương tiện giao thông cơ giới đường bộ|07-09-2023|Bộ Tài chính|\n\nYêu cầu, điều kiện thực hiện:\nkhông\nTừ khóa:\nĐăng ký sang tên, di chuyển xe tại Phòng Cảnh sát giao thông\nMô tả:\nKhông có thông tin', 'Chi tiết thủ tục hành chính:\nMã thủ tục:\n1.003877\nSố quyết định:\n3873/QĐ-BTNMT\nTên thủ tục:\nThủ tục đăng ký biến động về sử dụng đất, tài sản gắn liền với đất do thay đổi thông tin về người được cấp Giấy chứng nhận (đổi tên hoặc giấy tờ pháp nhân, giấy tờ nhân thân, địa chỉ); giảm diện tích thửa đất do sạt lở tự nhiên; thay đổi về hạn chế quyền sử dụng đất; thay đổi về nghĩa vụ tài chính; thay đổi về tài sản gắn liền với đất so với nội dung đã đăng ký, cấp Giấy chứng nhận\nCấp thực hiện:\nCấp Huyện\nLoại thủ tục:\nTTHC được luật giao quy định chi tiết\nLĩnh vực:\nĐất đai\nTrình tự thực hiện:\nTrực tiếp:\na) Người sử dụng đất nộp hồ sơ tại Văn phòng đăng ký quyền sử dụng đất thuộc Phòng Tài nguyên và Môi trường hoặc cơ quan tiếp nhận hồ sơ theo quy định của Ủy ban nhân dân tỉnh, thành phố trực thuộc Trung ương.\nHộ gia đình, cá nhân, cộng đồng dân cư nộp hồ sơ tại Ủy ban nhân dân cấp xã nếu có nhu cầu.\nTrường hợp nhận hồ sơ chưa đầy đủ, chưa hợp lệ thì trong thời gian tối đa 03 ngày, cơ quan tiếp nhận, xử lý hồ sơ phải thông báo và hướng dẫn người nộp hồ sơ bổ sung, hoàn chỉnh hồ sơ theo quy định.\nTrường hợp người sử dụng đất có nhu cầu chuyển mục đích sử dụng đất kết hợp với đăng ký biến động về các nội dung của thủ tục này thì thực hiện thủ tục này đồng thời với thủ tục chuyển mục đích sử dụng đất.\nb) Cơ quan tiếp nhận hồ sơ ghi đầy đủ thông tin vào Sổ tiếp nhận hồ sơ và trả kết quả, trao Phiếu tiếp nhận hồ sơ và trả kết quả cho người nộp hồ sơ.\nTrường hợp nộp hồ sơ tại Ủy ban nhân dân cấp xã thì trong thời hạn 03 ngày làm việc kể từ ngày nhận đủ hồ sơ, Ủy ban nhân dân cấp xã phải chuyển hồ sơ đến Văn phòng đăng ký quyền sử dụng đất.\nc) Văn phòng đăng ký quyền sử dụng đất có trách nhiệm kiểm tra hồ sơ, nếu đủ điều kiện thực hiện các quyền theo quy định thì thực hiện các công việc sau đây:\n- Trích đo địa chính thửa đất đối với trường hợp có thay đổi về diện tích thửa đất, tài sản gắn liền với đất hoặc trường hợp đã cấp Giấy chứng nhận nhưng chưa có bản đồ địa chính, chưa trích đo địa chính thửa đất;\n- Trường hợp đăng ký thay đổi diện tích xây dựng, diện tích sử dụng, tầng cao, kết cấu, cấp (hạng) nhà hoặc công trình xây dựng mà không phù hợp với giấy phép xây dựng hoặc không có giấy phép xây dựng đối với trường hợp phải xin phép thì gửi phiếu lấy ý kiến của cơ quan quản lý, cấp phép xây dựng theo quy định của pháp luật về xây dựng;\n- Gửi thông tin địa chính cho cơ quan thuế để xác định và thông báo thu nghĩa vụ tài chính đối với trường hợp phải nộp tiền sử dụng đất, tiền thuê đất theo quy định của pháp luật;\n- Xác nhận thay đổi vào Giấy chứng nhận đã cấp hoặc lập hồ sơ trình cơ quan có thẩm quyền cấp Giấy chứng nhận quyền sử dụng đất, quyền sở hữu nhà ở và tài sản khác gắn liền với đất đối với trường hợp phải cấp lại Giấy chứng nhận theo quy định của Bộ Tài nguyên và Môi trường; thông báo cho người sử dụng đất ký hoặc ký lại hợp đồng thuê đất với cơ quan tài nguyên và môi trường đối với trường hợp phải thuê đất;\n- Chỉnh lý, cập nhật biến động vào hồ sơ địa chính, cơ sở dữ liệu đất đai.\nd) Văn phòng đăng ký quyền sử dụng đất trao Giấy chứng nhận cho người được cấp hoặc gửi Ủy ban nhân dân cấp xã để trao đối với trường hợp nộp hồ sơ tại cấp xã.\nThực hiện thủ tục trên môi trường điện tử:\nCơ quan tiếp nhận, giải quyết hồ sơ có trách nhiệm thực hiện các trình tự, thủ tục hành chính về đất đai theo quy định của pháp luật về đất đai; trường hợp cần phải kiểm tra, xác minh làm rõ hoặc do nguyên nhân khác mà không trả kết quả giải quyết hồ sơ theo đúng quy định về thời gian giải quyết thủ tục hành chính về đất đai thì cơ quan tiếp nhận hồ sơ, giải quyết thủ tục gửi thông báo bằng văn bản hoặc qua Cổng dịch vụ công hoặc qua tin nhắn SMS cho người yêu cầu, trong đó nêu rõ lý do.\nNgười sử dụng đất, chủ sở hữu tài sản gắn liền với đất có trách nhiệm hoàn thành nghĩa vụ tài chính theo quy định của pháp luật bằng hình thức trực tiếp hoặc trực tuyến thông qua chức năng thanh toán của Cổng dịch vụ công.\nCơ quan tiếp nhận hoặc cơ quan giải quyết hồ sơ thông báo cho người yêu cầu thực hiện thủ tục hành chính nộp bản chính Giấy chứng nhận đã cấp, các giấy tờ theo quy định sau khi người sử dụng đất hoàn thành nghĩa vụ tài chính.\nViệc trả kết quả giải quyết thủ tục hành chính được thực hiện tại cơ quan tiếp nhận hồ sơ hoặc qua dịch vụ bưu chính công ích hoặc tại địa điểm theo yêu cầu đối với trường hợp tiếp nhận hồ sơ và trả kết quả giải quyết thủ tục đăng ký đất đai, tài sản khác gắn liền với đất.\nCách thức thực hiện:\n|Hình thức nộp|Thời hạn giải quyết|Phí, lệ phí|Mô tả|\n|--|--|--|-|\n|Trực tiếp|10 Ngày làm việc|Lệ phí : Đồng Thực hiện theo quy định của Luật Phí, lệ phí.|Cách thức thực hiện: Người sử dụng đất nộp hồ sơ tại Văn phòng đăng ký quyền sử dụng đất thuộc Phòng Tài nguyên và Môi trường hoặc cơ quan tiếp nhận hồ sơ theo quy định của Ủy ban nhân dân cấp tỉnh. Hộ gia đình, cá nhân, cộng đồng dân cư nộp hồ sơ tại Ủy ban nhân dân cấp xã nếu có nhu cầu. Thời hạn giải quyết: Do Ủy ban nhân dân cấp tỉnh quy định nhưng không quá 10 ngày kể từ ngày nhận được hồ sơ hợp lệ. Thời gian này không tính thời gian các ngày nghỉ, ngày lễ theo quy định của pháp luật; không tính thời gian tiếp nhận hồ sơ tại xã, thời gian thực hiện nghĩa vụ tài chính của người sử dụng đất; không tính thời gian xem xét xử lý đối với trường hợp sử dụng đất có vi phạm pháp luật, thời gian trưng cầu giám định. Đối với các xã miền núi, hải đảo, vùng sâu, vùng xa, vùng có điều kiện kinh tế - xã hội khó khăn, vùng có điều kiện kinh tế - xã hội đặc biệt khó khăn thì thời gian thực hiện được tăng thêm 10 ngày. Kết quả giải quyết thủ tục hành chính phải trả cho người sử dụng đất, chủ sở hữu tài sản gắn liền với đất trong thời hạn không quá 03 ngày làm việc kể từ ngày có kết quả giải quyết.|\n\nThành phần hồ sơ:\n\n(*) Trường hợp xác nhận thay đổi thông tin về số Giấy chứng minh nhân dân, số thẻ Căn cước công dân, địa chỉ trên Giấy chứng nhận đã cấp theo nhu cầu của người sử dụng đất, chủ sở hữu tài sản gắn liền với đất, gồm có:\n|Tên giấy tờ|Mẫu đơn, tờ khai|Số lượng|\n|--|--|-|\n|a) Đơn đăng ký biến động đất đai, tài sản gắn liền với đất theo Mẫu số 09/ĐK;|<a href=""https://csdl.dichvucong.gov.vn/web/jsp/download_file.jsp?ma=\'3fca097995cb2bac\'"">mau so 09.doc</a>|Bản chính: 1Bản sao: 0|\n|b) Bản gốc Giấy chứng nhận đã cấp;||Bản chính: 1Bản sao: 0|\n|c) Bản sao Giấy CMND/thẻ căn cước công dân/số định danh cá nhân, hộ chiếu mới hoặc Giấy chứng minh quân đội mới hoặc thẻ Căn cước công dân mới hoặc sổ hộ khẩu, giấy tờ khác chứng minh thay đổi nhân thân đối với trường hợp thay đổi thông tin về nhân thân của người có tên trên Giấy chứng nhận; Trường hợp dữ liệu quốc gia về dân cư được chia sẻ và kết nối với dữ liệu của các ngành, các lĩnh vực (trong đó có lĩnh vực đất đai) thì cơ quan tiếp nhận hồ sơ sử dụng dữ liệu từ cơ sở dữ liệu quốc gia về dân cư mà không yêu cầu người nộp hồ sơ phải nộp bản sao CMND/thẻ căn cước công dân/số định danh cá nhân, hộ chiếu hoặc Giấy chứng minh quân đội hoặc sổ hộ khẩu hoặc giấy tờ khác để chứng minh nhân thân.||Bản chính: 0Bản sao: 1|\n\n\n(*) Trường hợp đăng ký biến động về sử dụng đất, tài sản gắn liền với đất do người sử dụng đất, chủ sở hữu tài sản gắn liền với đất được đổi tên; giảm diện tích thửa đất do sạt lở tự nhiên; thay đổi về hạn chế quyền sử dụng đất; thay đổi về nghĩa vụ tài chính; thay đổi về tài sản gắn liền với đất so với nội dung đã đăng ký, cấp Giấy chứng nhận gồm có:\n|Tên giấy tờ|Mẫu đơn, tờ khai|Số lượng|\n|--|--|-|\n|1. Đơn đăng ký biến động đất đai, tài sản gắn liền với đất theo Mẫu số 09/ĐK;|<a href=""https://csdl.dichvucong.gov.vn/web/jsp/download_file.jsp?ma=\'3fe7518ba157a40a\'"">mau so 09.doc</a>|Bản chính: 1Bản sao: 0|\n|2. Bản gốc Giấy chứng nhậnđã cấp;||Bản chính: 1Bản sao: 0|\n|3. Một trong các giấy tờ liên quan đến nội dung biến động:||Bản chính: Bản sao:|\n|- Văn bản công nhận của cơ quan nhà nước có thẩm quyền theo quy định của pháp luật đối với trường hợp cá nhân hoặc người đại diện hộ gia đình thay đổi họ, tên;||Bản chính: 1Bản sao: 0|\n|- Văn bản thỏa thuận của cộng đồng dân cư được Ủy ban nhân dân cấp xã xác nhận đối với trường hợp cộng đồng dân cư đổi tên;||Bản chính: 1Bản sao: 0|\n|- Văn bản xác nhận của Ủy ban nhân dân cấp xã về tình trạng sạt lở tự nhiên đối với trường hợp giảm diện tích thửa đất, tài sản gắn liền với đất do sạt lở tự nhiên;||Bản chính: 1Bản sao: 0|\n|- Chứng từ về việc nộp nghĩa vụ tài chính đối với trường hợp Giấy chứng nhận đã cấp có ghi nợ hoặc chậm nộp nghĩa vụ tài chính, trừ trường hợp người sử dụng đất được miễn giảm hoặc không phải nộp do thay đổi quy định của pháp luật;||Bản chính: 1Bản sao: 0|\n|- Quyết định của cơ quan nhà nước có thẩm quyền về việc thay đổi hạn chế về quyềnsử dụng đất, quyền sở hữu tài sản gắn liền với đất ghi trên Giấy chứng nhận đối với trường hợp có hạn chế theo quyết định giao đất, cho thuê đất, công nhận quyền sử dụng đất; trường hợp có thay đổi hạn chế theo văn bản chuyển quyền sử dụng đất thì phải có văn bản chấp thuận thay đổi hạn chế của người có quyền lợi liên quan, được Ủy ban nhân dân cấp xã xác nhận;||Bản chính: 1Bản sao: 0|\n|- Bản sao một trong các giấy tờ về quyền sở hữu tài sản gắn liền với đất thể hiện nội dung thay đổi đối với trường hợp thay đổi thông tin về tài sản gắn liền với đất đã ghi trên Giấy chứng nhận.||Bản chính: 0Bản sao: 1|\n|- Văn bản thỏa thuận của hộ gia đình được Ủy ban nhân dân cấp xã xác nhận đối với trường hợp thay đổi người đại diện là thành viên trong hộ gia đình mà không phải là chủ hộ; trường hợp thay đổi người đại diện hộ gia đình là chủ hộ thì cơ quan giải quyết thủ tục có trách nhiệm khai thác, sử dụng thông tin trong Cơ sở dữ liệu quốc gia về dân cư theo quy định tại Điều 14 Nghị định số 104/2022/NĐ-CP ngày 21 tháng 12 năm 2022 của Chính phủ sửa đổi, bổ sung một số điều của các nghị định liên quan đến việc nộp, xuất trình sổ hộ khẩu, sổ tạm trú giấy khi thực hiện thủ tục hành chính, cung cấp dịch vụ công.||Bản chính: 1Bản sao: 0|']",Giấy chứng nhận tên định danh,Tôi không biết trả lời câu hỏi này.,0.0,0.0,0.0,0.0
18,Cơ quan có thẩm quyền của thủ tục mua bán điện được gia hạn trong trường hợp nào?,"['Chi tiết thủ tục hành chính:\nMã thủ tục:\n3.000101\nSố quyết định:\n505\nTên thủ tục:\nGia hạn hợp đồng mua bán điện\nCấp thực hiện:\nCấp Bộ, Cơ quan khác\nLoại thủ tục:\nLoại khác\nLĩnh vực:\nDịch vụ trong quá trình thực hiện HĐMBĐ\nTrình tự thực hiện:\nTiếp nhận yêu cầu\nKý Phụ lục Hợp đồng mua bán điện hoặc Biên bản chấm dứt HĐMBĐ cũ và Hợp đồng mua bán điện mới\nCách thức thực hiện:\n|Hình thức nộp|Thời hạn giải quyết|Phí, lệ phí|Mô tả|\n|--|--|--|-|\n|Trực tiếp|1 Ngày làm việc|Mức giá : Miên phí||\n|Trực tuyến|1 Ngày làm việc|Mức giá : Miên phí||\n|Dịch vụ bưu chính|1 Ngày làm việc|Mức giá : Miên phí||\n\nThành phần hồ sơ:\n\nBao gồm\n|Tên giấy tờ|Mẫu đơn, tờ khai|Số lượng|\n|--|--|-|\n|Giấy đề nghị|<a href=""https://csdl.dichvucong.gov.vn/web/jsp/download_file.jsp?ma=\'3fedcde9076b2fb2\'"">02.PhieuDeNghiDichVuDienDungChung.docx</a>|Bản chính: 1Bản sao: 0|\n\nĐối tượng thực hiện:\nCông dân Việt Nam, Người nước ngoài, Doanh nghiệp, Doanh nghiệp có vốn đầu tư nước ngoài, Tổ chức (không bao gồm doanh nghiệp, HTX), Tổ chức nước ngoài, Hợp tác xã\nCơ quan thực hiện:\nTập đoàn Điện lực Việt Nam\nCơ quan có thẩm quyền:\nTập đoàn Điện lực Việt Nam\nĐịa chỉ tiếp nhận HS:\nKhông có thông tin\nCơ quan được ủy quyền:\nKhông có thông tin\nCơ quan phối hợp:\nKhông có thông tin\nKết quả thực hiện:\nHợp đồng mua bán điện, Biên bản chấm dứt HĐMBĐ, Phụ lục hợp đồng mua bán điện 25, Phụ lục hợp đồng mua bán điện 24\nCăn cứ pháp lý:\n|Số ký hiệu|Trích yếu|Ngày ban hành|Cơ quan ban hành|\n|--|--|--|-|\n|137/2013/NĐ-CP|Quy định chi tiết thi hành một số điều của Luật Điện lực và Luật sửa đổi, bổ sung một số điều của Luật Điện lực|21-10-2013|Chính phủ|\n|24/2012/QH13|Sửa đổi, bổ sung một số điều của Luật Điện lực|20-11-2012|Quốc Hội|\n|Luật số 28/2004/QH11|Luật Điện lực|03-12-2004|Quốc Hội|\n\nYêu cầu, điều kiện thực hiện:\nKhông có yêu cầu điều kiện\nTừ khóa:\nKhông có thông tin\nMô tả:\nKhông có thông tin', 'Chi tiết thủ tục hành chính:\nMã thủ tục:\n3.000100\nSố quyết định:\n505\nTên thủ tục:\nThay đổi thông tin đã đăng ký\nCấp thực hiện:\nCấp Bộ, Cơ quan khác\nLoại thủ tục:\nLoại khác\nLĩnh vực:\nDịch vụ trong quá trình thực hiện HĐMBĐ\nTrình tự thực hiện:\nTiếp nhận yêu cầu\nKý Phụ lục Hợp đồng mua bán điện\nCách thức thực hiện:\n|Hình thức nộp|Thời hạn giải quyết|Phí, lệ phí|Mô tả|\n|--|--|--|-|\n|Trực tiếp|2 Ngày làm việc|Mức giá : Miễn phí||\n|Trực tuyến|2 Ngày làm việc|Mức giá : Miễn phí||\n|Dịch vụ bưu chính|2 Ngày làm việc|Mức giá : Miễn phí||\n\nThành phần hồ sơ:\n\nBao gồm\n|Tên giấy tờ|Mẫu đơn, tờ khai|Số lượng|\n|--|--|-|\n|Giấy đề nghị|<a href=""https://csdl.dichvucong.gov.vn/web/jsp/download_file.jsp?ma=\'3fe19e2808a8d5ee\'"">02.PhieuDeNghiDichVuDienDungChung.docx</a>|Bản chính: 1Bản sao: 0|\n\nĐối tượng thực hiện:\nCông dân Việt Nam, Người nước ngoài, Doanh nghiệp, Doanh nghiệp có vốn đầu tư nước ngoài, Tổ chức (không bao gồm doanh nghiệp, HTX), Tổ chức nước ngoài, Hợp tác xã\nCơ quan thực hiện:\nTập đoàn Điện lực Việt Nam\nCơ quan có thẩm quyền:\nTập đoàn Điện lực Việt Nam\nĐịa chỉ tiếp nhận HS:\nKhông có thông tin\nCơ quan được ủy quyền:\nKhông có thông tin\nCơ quan phối hợp:\nKhông có thông tin\nKết quả thực hiện:\nPhụ lục Hợp đồng mua bán điện 22, Phụ lục Hợp đồng mua bán điện 23\nCăn cứ pháp lý:\n|Số ký hiệu|Trích yếu|Ngày ban hành|Cơ quan ban hành|\n|--|--|--|-|\n|137/2013/NĐ-CP|Quy định chi tiết thi hành một số điều của Luật Điện lực và Luật sửa đổi, bổ sung một số điều của Luật Điện lực|21-10-2013|Chính phủ|\n|24/2012/QH13|Sửa đổi, bổ sung một số điều của Luật Điện lực|20-11-2012|Quốc Hội|\n|Luật số 28/2004/QH11|Luật Điện lực|03-12-2004|Quốc Hội|\n\nYêu cầu, điều kiện thực hiện:\nKhông có yêu cầu điều kiện\nTừ khóa:\nKhông có thông tin\nMô tả:\nKhông có thông tin', 'Chi tiết thủ tục hành chính:\nMã thủ tục:\n3.000099\nSố quyết định:\n505\nTên thủ tục:\nThay đổi chủ thể hợp đồng mua bán điện\nCấp thực hiện:\nCấp Bộ, Cơ quan khác\nLoại thủ tục:\nLoại khác\nLĩnh vực:\nDịch vụ trong quá trình thực hiện HĐMBĐ\nTrình tự thực hiện:\nTiếp nhận yêu cầu\nKhảo sát\nKý Biên bản chấm dứt HĐMBĐ cũ và Hợp đồng mua bán điện mới\nCách thức thực hiện:\n|Hình thức nộp|Thời hạn giải quyết|Phí, lệ phí|Mô tả|\n|--|--|--|-|\n|Trực tiếp|2 Ngày làm việc|Mức giá : Miễn phí|Với khách hàng mua điện sinh hoạt|\n|Trực tiếp|3 Ngày làm việc|Mức giá : Miễn Phí|Với khách hàng mua điện ngoài sinh hoạt|\n|Trực tuyến|2 Ngày làm việc|Mức giá : Miễn phí|Với khách hàng mua điện sinh hoạt|\n|Trực tuyến|3 Ngày làm việc|Mức giá : Miễn Phí|Với khách hàng mua điện ngoài sinh hoạt|\n|Dịch vụ bưu chính|2 Ngày làm việc|Mức giá : Miễn phí|Với khách hàng mua điện sinh hoạt|\n|Dịch vụ bưu chính|3 Ngày làm việc|Mức giá : Miễn Phí|Với khách hàng mua điện ngoài sinh hoạt|\n\nThành phần hồ sơ:\n\nBao gồm\n|Tên giấy tờ|Mẫu đơn, tờ khai|Số lượng|\n|--|--|-|\n|Giấy đề nghị|<a href=""https://csdl.dichvucong.gov.vn/web/jsp/download_file.jsp?ma=\'3fd8d08451306676\'"">02.PhieuDeNghiDichVuDienDungChung.docx</a>|Bản chính: 1Bản sao: 0|\n|Giấy tờ xác định chủ thể HĐMBĐ mới: là một trong các loại giấy tờ có tên của Tổ chức/cá nhân tại địa điểm mua điện sau: Hộ khẩu thường trú; Sổ tạm trú; Giấy chứng nhận quyền sở hữu nhà; Quyết định phân nhà; Hợp đồng mua bán nhà; Hợp đồng thuê nhà có thời hạn từ 01 năm trở lên và đồng ý của chủ sở hữu; Giấy chứng nhận quyền sử dụng đất; Hợp đồng ủy quyền quản lý và sử dụng nhà/đất; Hợp đồng thuê địa điểm và đồng ý của chủ sở hữu; Giấy chứng nhận đăng ký doanh nghiệp; Giấy chứng nhận đăng ký kinh doanh; Giấy chứng nhận đăng ký hộ kinh doanh; Giấy chứng nhận đăng ký hoạt động chi nhánh, văn phòng đại diện; Giấy phép đầu tư; Quyết định thành lập đơn vị.||Bản chính: 0Bản sao: 1|\n\nĐối tượng thực hiện:\nCông dân Việt Nam, Người nước ngoài, Doanh nghiệp, Doanh nghiệp có vốn đầu tư nước ngoài, Tổ chức (không bao gồm doanh nghiệp, HTX), Tổ chức nước ngoài, Hợp tác xã\nCơ quan thực hiện:\nTập đoàn Điện lực Việt Nam\nCơ quan có thẩm quyền:\nTập đoàn Điện lực Việt Nam\nĐịa chỉ tiếp nhận HS:\nKhông có thông tin\nCơ quan được ủy quyền:\nKhông có thông tin\nCơ quan phối hợp:\nKhông có thông tin\nKết quả thực hiện:\nHợp đồng mua bán điện, Biên bản chấm dứt HĐMBĐ\nCăn cứ pháp lý:\n|Số ký hiệu|Trích yếu|Ngày ban hành|Cơ quan ban hành|\n|--|--|--|-|\n|137/2013/NĐ-CP|Quy định chi tiết thi hành một số điều của Luật Điện lực và Luật sửa đổi, bổ sung một số điều của Luật Điện lực|21-10-2013|Chính phủ|\n|24/2012/QH13|Sửa đổi, bổ sung một số điều của Luật Điện lực|20-11-2012|Quốc Hội|\n|Luật số 28/2004/QH11|Luật Điện lực|03-12-2004|Quốc Hội|\n\nYêu cầu, điều kiện thực hiện:\nKhông có yêu cầu điều kiện\nTừ khóa:\nKhông có thông tin\nMô tả:\nKhông có thông tin']",Tập đoàn Điện lực Việt Nam,Tôi không biết trả lời câu hỏi này.,0.0,0.0,0.0,0.0
19,Cơ quan thực hiện thủ tục cấp giấy chứng nhận tên định danh là gì?,"['Chi tiết thủ tục hành chính:\nMã thủ tục:\n1.008813\nSố quyết định:\n1545/QĐ-BTTTT\nTên thủ tục:\nCấp giấy chứng nhận tên định danh\nCấp thực hiện:\nCấp Bộ\nLoại thủ tục:\nTTHC được luật giao quy định chi tiết\nLĩnh vực:\nCông nghệ thông tin, điện tử\nTrình tự thực hiện:\n- Tổ chức, cá nhân hoàn thiện hồ sơ đăng ký cấp tên định danh (theo quy định tại Điều 24 Nghị định số 91/2020/NĐ-CP);\n- Tổ chức, cá nhân nộp Hồ sơ đến Bộ Thông tin và Truyền thông (Cục An toàn thông tin).\n- Sau khi hồ sơ được tiếp nhận, trong thời hạn một (01) ngày làm việc Bộ Thông tin và Truyền thông (Cục An toàn thông tin) xem xét tính hợp lệ của hồ sơ và quyết định một trong các trường hợp sau:\n+ Cấp tên định danh cho tổ chức, cá nhân và thông báo cho tổ chức, cá nhân biết thông qua thư điện tử hoặc tin nhắn;\n+ Không cấp tên định danh cho tổ chức, cá nhân đối với trường hợp hồ sơ chưa đầy đủ hoặc cần làm rõ, tổ chức, cá nhân bổ sung, giải trình, hoàn thiện hồ sơ và nộp lại hồ sơ theo quy định tại Điều 25 Nghị định số 91/2020/NĐ-CP và thông báo lý do cho tổ chức, cá nhân thông qua thư điện tử hoặc tin nhắn.\nCách thức thực hiện:\n|Hình thức nộp|Thời hạn giải quyết|Phí, lệ phí|Mô tả|\n|--|--|--|-|\n|Trực tiếp|01 Ngày làm việc|Lệ phí : 200000 Đồng (Theo quy định của Bộ Tài chính)|01 ngày kể từ ngày nhận đủ hồ sơ theo quy định|\n|Trực tuyến|01 Ngày làm việc|Lệ phí : 200000 Đồng (Theo quy định của Bộ Tài chính)|01 ngày kể từ ngày nhận đủ hồ sơ theo quy định|\n|Dịch vụ bưu chính|01 Ngày làm việc|Lệ phí : 200000 Đồng (Theo quy định của Bộ Tài chính)|01 ngày kể từ ngày nhận đủ hồ sơ theo quy định|\n\nThành phần hồ sơ:\n\nHồ sơ cấp Giấy chứng nhận tên định danh\n|Tên giấy tờ|Mẫu đơn, tờ khai|Số lượng|\n|--|--|-|\n|Bản khai Cấp tên định danh|<a href=""https://csdl.dichvucong.gov.vn/web/jsp/download_file.jsp?ma=\'3f933d2c89c33b00\'"">Bản khai đăng ký tên định danh.docx</a>|Bản chính: 1Bản sao:|\n|Bản sao có chứng thực Quyết định thành lập của tổ chức hoặc giấy chứng nhận đăng ký doanh nghiệp||Bản chính: Bản sao: 1|\n|Bản sao có chứng thực chứng minh nhân dân hoặc căn cước công dân hoặc hộ chiếu||Bản chính: Bản sao: 1|\n|Các giấy tờ khác có liên quan tới quyền sở hữu trí tuệ, đăng ký thương hiệu|<a href=""https://csdl.dichvucong.gov.vn/web/jsp/download_file.jsp?ma=\'3feb81c27c28e87a\'"">Giấy ủy quyền.docx</a>|Bản chính: Bản sao: 1|\n\nĐối tượng thực hiện:\nCông dân Việt Nam, Doanh nghiệp, Tổ chức (không bao gồm doanh nghiệp, HTX), Hợp tác xã\nCơ quan thực hiện:\nCục An toàn thông tin\nCơ quan có thẩm quyền:\nBộ Thông tin và Truyền thông\nĐịa chỉ tiếp nhận HS:\nCục An toàn thông tin, Tầng 8, Tòa nhà Cục Tần số Vô tuyến điện, 115 Trần Duy Hưng, Trung Hòa, Cầu giấy, Hà Nội\nCơ quan được ủy quyền:\nKhông có thông tin\nCơ quan phối hợp:\nKhông có thông tin\nKết quả thực hiện:\nGiấy chứng nhận tên định danh\nCăn cứ pháp lý:\n|Số ký hiệu|Trích yếu|Ngày ban hành|Cơ quan ban hành|\n|--|--|--|-|\n|91/2020/NĐ-CP|Nghị định 91/2020/NĐ-CP|14-08-2020||\n\nYêu cầu, điều kiện thực hiện:\nKhông có\nTừ khóa:\nKhông có thông tin\nMô tả:\nKhông có thông tin', 'Chi tiết thủ tục hành chính:\nMã thủ tục:\n2.000076\nSố quyết định:\n3191/QĐ-BCA\nTên thủ tục:\nĐăng ký sang tên, di chuyển xe tại Phòng Cảnh sát giao thông (thực hiện tại cấp tỉnh)\nCấp thực hiện:\nCấp Tỉnh\nLoại thủ tục:\nTTHC không được luật giao cho địa phương quy định hoặc quy định chi tiết\nLĩnh vực:\nĐăng ký, quản lý phương tiện giao thông đường bộ\nTrình tự thực hiện:\n+ Khi chuyển quyền sở hữu xe, chủ xe phải giữ lại chứng nhận đăng ký xe, biển số xe (không giao cho tổ chức, cá nhân nhận chuyển quyền sở hữu xe) và nộp cho cơ quan đăng ký xe chứng nhận đăng ký xe, biển số xe để làm thủ tục thu hồi; trong thời hạn 30 ngày, kể từ ngày làm giấy tờ chuyển quyền sở hữu xe, chủ xe phải làm thủ tục thu hồi, trường hợp quá thời hạn trên mà chủ xe không làm thủ tục thu hồi hoặc giao chứng nhận đăng ký xe, biển số xe cho tổ chức, cá nhân nhận chuyển quyền sở hữu xe làm thủ tục thu hồi thì trước khi giải quyết cơ quan đăng ký xe ra quyết định xử phạt đối với chủ xe về hành vi không làm thủ tục thu hồi theo quy định; \nKhi chuyển trụ sở, nơi cư trú từ tỉnh, thành phố trực thuộc Trung ương này sang tỉnh, thành phố trực thuộc Trung ương khác (di chuyển nguyên chủ), chủ xe phải làm thủ tục thu hồi tại cơ quan đang quản lý hồ sơ xe đó. \n+ Tổ chức, cá nhân nhận chuyển quyền sở hữu xe, chủ xe (đối với trường hợp di chuyển nguyên chủ) làm thủ tục đăng ký sang tên, di chuyển xe tại cơ quan đăng ký xe theo quy định.\nBước 1: Chủ xe kê khai giấy khai thu hồi đăng ký, biển số xe trên cổng dịch vụ công; cung cấp mã hồ sơ đăng ký xe trực tuyến; nộp hồ sơ thu hồi quy định tại khoản 1 Điều 14 Thông tư số 24//2023/TT-BCA và nhận giấy hẹn trả kết quả đăng ký xe theo quy định;\nBước 2: Sau khi kiểm tra hồ sơ xe hợp lệ, cơ quan đăng ký xe cấp chứng nhận thu hồi đăng ký, biển số xe theo quy định (có dán bản chà số máy, số khung và đóng dấu giáp lai của cơ quan đăng ký xe trên bản chà số máy, số khung xe): 01 bản trả cho chủ xe; 01 bản lưu hồ sơ xe; trường hợp mất chứng nhận đăng ký xe thì thực hiện xác minh theo quy định.\nBước 3: Tổ chức, cá nhân nhận chuyển quyền sở hữu xe, chủ xe (đối với trường hợp di chuyển nguyên chủ): Kê khai giấy khai đăng ký xe theo quy định tại Điều 9 Thông tư số 24/2023/TT-BCA; đưa xe đến để kiểm tra, cung cấp mã hồ sơ đăng ký xe trực tuyến và nộp hồ sơ quy định tại khoản 2 Điều 14 Thông tư số 24/2023/TT-BCA;\nBước 4: Sau khi kiểm tra hồ sơ xe, thực tế xe đảm bảo hợp lệ thì được cơ quan đăng ký xe cấp biển số theo quy định tại khoản 2 Điều 12 Thông tư số 24/2023/TT-BCA; cáp giấy hẹn trả kết quả đăng ký và xác định mức thu lệ phí đăng ký xe;\nBước 5: Chủ xe nộp lệ phí đăng ký xe trên cổng dịch vụ công Bộ Công an và nhận biển số xe (trường hợp được cấp biển số theo quy định tại điểm a khoản 2 Điều 12 Thông tư số 24/2023/TT-BCA); trường hợp chủ xe có nhu cầu nhận trả kết quả đăng ký xe qua dịch vụ bưu chính công ích thì đăng ký với đơn vị dịch vụ bưu chính công ích;\nBước 6: Chủ xe nhận chứng nhận đăng ký xe, biển số xe (trường hợp được cấp biển số theo quy định tại điểm b khoản 2 Điều 12, Điều 28 Thông tư số 24/2023/TT-BCA) tại cơ quan đăng ký xe hoặc từ đơn vị dịch vụ bưu chính công ích.\nTrường hợp đăng ký xe di chuyển nguyên chủ thì được giữ nguyên biển số định danh (biển 05 số); trường hợp biển số cũ là biển 3 hoặc 4 số thì cấp đổi sang biển số định danh theo quy định tại Thông tư số 24/2023/TT-BCA.\nTổ chức, cá nhân đã nhận chuyển quyền sở hữu xe kèm theo biển số xe trúng đấu giá, không được tiếp tục chuyển quyền sở hữu xe kèm theo biển số xe trúng đấu giá cho tổ chức, cá nhân khác; được chuyển quyền sở hữu xe theo quy định của pháp luật.\nCách thức thực hiện:\n|Hình thức nộp|Thời hạn giải quyết|Phí, lệ phí|Mô tả|\n|--|--|--|-|\n|Trực tiếp|02 Ngày làm việc|Lệ phí : Thu theo Thông tư số 229/2016/TT-BTC ngày 11/11/2016 của Bộ Tài chính quy định mức thu, chế độ thu, nộp, quản lý lệ phí đăng ký, cấp biển số phương tiện giao thông cơ giới đường bộ.  Lệ phí : Đồng Thu theo Thông tư số 60/2023/TT-BTC ngày 07/9/2023 của Bộ Tài chính quy định mức thu, chế độ thu, nộp, quản lý lệ phí đăng ký, cấp biển số phương tiện giao thông cơ giới đường bộ (có hiệu lực từ ngày 22/10/2023)|+ Cấp chứng nhận thu hồi đăng ký, biển số xe: Không quá 02 ngày làm việc (trường hợp cấp chứng nhận thu hồi đăng ký, biển số), kể từ ngày nhận đủ hồ sơ hợp lệ. + Cấp chứng nhận đăng ký xe: Không quá 02 ngày làm việc, kể từ ngày nhận đủ hồ sơ hợp lệ + Cấp biển số định danh lần đầu: Cấp ngay sau khi tiếp nhận hồ sơ đăng ký xe hợp lệ. + Cấp lại biển số định danh: Không quá 07 ngày làm việc, kể từ ngày nhận đủ hồ sơ hợp lệ. + Thời gian trả kết quả đăng ký xe theo quy định được tính từ ngày nhận đủ hồ sơ hợp lệ và hệ thống đăng ký, quản lý xe đã nhận được kết quả xác thực về việc hoàn thành nộp lệ phí đăng ký xe từ cổng dịch vụ công. + Trường hợp mất chứng nhận đăng ký xe khi làm thủ tục thu hồi thì thời hạn xác minh là 30 ngày.|\n|Trực tuyến|02 Ngày làm việc|Lệ phí : Đồng Thu theo Thông tư số 229/2016/TT-BTC ngày 11/11/2016 của Bộ Tài chính quy định mức thu, chế độ thu, nộp, quản lý lệ phí đăng ký, cấp biển số phương tiện giao thông cơ giới đường bộ.  Lệ phí : Đồng Thu theo Thông tư số 60/2023/TT-BTC ngày 07/9/2023 của Bộ Tài chính quy định mức thu, chế độ thu, nộp, quản lý lệ phí đăng ký, cấp biển số phương tiện giao thông cơ giới đường bộ (có hiệu lực từ ngày 22/10/2023)|+ Cấp chứng nhận thu hồi đăng ký, biển số xe: Không quá 02 ngày làm việc (trường hợp cấp chứng nhận thu hồi đăng ký, biển số), kể từ ngày nhận đủ hồ sơ hợp lệ. + Cấp chứng nhận đăng ký xe: Không quá 02 ngày làm việc, kể từ ngày nhận đủ hồ sơ hợp lệ + Cấp biển số định danh lần đầu: Cấp ngay sau khi tiếp nhận hồ sơ đăng ký xe hợp lệ. + Cấp lại biển số định danh: Không quá 07 ngày làm việc, kể từ ngày nhận đủ hồ sơ hợp lệ. + Thời gian trả kết quả đăng ký xe theo quy định được tính từ ngày nhận đủ hồ sơ hợp lệ và hệ thống đăng ký, quản lý xe đã nhận được kết quả xác thực về việc hoàn thành nộp lệ phí đăng ký xe từ cổng dịch vụ công. + Trường hợp mất chứng nhận đăng ký xe khi làm thủ tục thu hồi thì thời hạn xác minh là 30 ngày.|\n|Dịch vụ bưu chính|02 Ngày làm việc||+ Trả kết quả qua dịch vụ bưu chính.|\n\nThành phần hồ sơ:\n\nBao gồm\n|Tên giấy tờ|Mẫu đơn, tờ khai|Số lượng|\n|--|--|-|\n|Giấy khai đăng ký xe (Mẫu số 01 ban hành kèm theo Thông tư số 58/2020/TT-BCA)|<a href=""https://csdl.dichvucong.gov.vn/web/jsp/download_file.jsp?ma=\'3fd5e0f72270996c\'"">Mẫu số 1 Giay khai đăng ký xe.doc</a>|Bản chính: 1Bản sao: 0|\n|Giấy tờ lệ phí trước bạ.||Bản chính: 1Bản sao: 0|\n|Giấy tờ chuyển quyền sở hữu xe.||Bản chính: 1Bản sao: 0|\n|Giấy tờ của chủ xe theo quy định||Bản chính: 1Bản sao: 0|\n|Giấy chứng nhận thu hồi đăng ký, biển số xe (nếu có).||Bản chính: 1Bản sao: 0|\n|Khi cơ sở dữ liệu cơ quan đăng ký xe kết nối với cơ sở dữ liệu của các Bộ, ngành thì các giấy tờ nêu trên được thay thế bằng dữ liệu điện tử là căn cứ để cấp đăng ký, biển số xe.||Bản chính: 1Bản sao: 0|\n\nĐối tượng thực hiện:\nCông dân Việt Nam, Người Việt Nam định cư ở nước ngoài, Người nước ngoài, Cán bộ, công chức, viên chức, Doanh nghiệp, Doanh nghiệp có vốn đầu tư nước ngoài, Tổ chức (không bao gồm doanh nghiệp, HTX), Tổ chức nước ngoài, Hợp tác xã\nCơ quan thực hiện:\nPhòng Cảnh sát giao thông\nCơ quan có thẩm quyền:\nPhòng Cảnh sát giao thông\nĐịa chỉ tiếp nhận HS:\nTrụ sở Phòng Cảnh sát giao thông Công an tỉnh, thành phố trực thuộc Trung ương hoặc các điểm đăng ký xe của Phòng; Cổng Dịch công quốc gia; Cổng Dịch vụ công Bộ Công an\nCơ quan được ủy quyền:\nKhông có thông tin\nCơ quan phối hợp:\nKhông có thông tin\nKết quả thực hiện:\nGiấy chứng nhận đăng ký xe, Biển số xe\nCăn cứ pháp lý:\n|Số ký hiệu|Trích yếu|Ngày ban hành|Cơ quan ban hành|\n|--|--|--|-|\n|23/2008/QH12|Giao thông đường bộ|13-11-2008|Quốc Hội|\n|Thông tư số 229/2016/TT-BTC|Quy định mức thu, chế độ thu, nộp, quản lý lệ phí đăng ký, cấp biển số phương tiện giao thông cơ giới đường bộ|11-11-2016||\n|24/2023/TT-BCA|Thông tư số 24/2023/TT-BCA ngày 01/07/2023 của Bộ trưởng Bộ Công an quy định về cấp, thu hồi đăng ký, biển số xe cơ giới|01-07-2023|Bộ trưởng Bộ Công an|\n|60/2023/TT-BTC|Thông tư số 60/2023/TT-BTC ngày 07/9/2023 của Bộ Tài chính quy định mức thu, chế độ thu, nộp, quản lý lệ phí đăng ký, cấp biển số phương tiện giao thông cơ giới đường bộ|07-09-2023|Bộ Tài chính|\n\nYêu cầu, điều kiện thực hiện:\nkhông\nTừ khóa:\nĐăng ký sang tên, di chuyển xe tại Phòng Cảnh sát giao thông\nMô tả:\nKhông có thông tin', 'Chi tiết thủ tục hành chính:\nMã thủ tục:\n1.003877\nSố quyết định:\n3873/QĐ-BTNMT\nTên thủ tục:\nThủ tục đăng ký biến động về sử dụng đất, tài sản gắn liền với đất do thay đổi thông tin về người được cấp Giấy chứng nhận (đổi tên hoặc giấy tờ pháp nhân, giấy tờ nhân thân, địa chỉ); giảm diện tích thửa đất do sạt lở tự nhiên; thay đổi về hạn chế quyền sử dụng đất; thay đổi về nghĩa vụ tài chính; thay đổi về tài sản gắn liền với đất so với nội dung đã đăng ký, cấp Giấy chứng nhận\nCấp thực hiện:\nCấp Huyện\nLoại thủ tục:\nTTHC được luật giao quy định chi tiết\nLĩnh vực:\nĐất đai\nTrình tự thực hiện:\nTrực tiếp:\na) Người sử dụng đất nộp hồ sơ tại Văn phòng đăng ký quyền sử dụng đất thuộc Phòng Tài nguyên và Môi trường hoặc cơ quan tiếp nhận hồ sơ theo quy định của Ủy ban nhân dân tỉnh, thành phố trực thuộc Trung ương.\nHộ gia đình, cá nhân, cộng đồng dân cư nộp hồ sơ tại Ủy ban nhân dân cấp xã nếu có nhu cầu.\nTrường hợp nhận hồ sơ chưa đầy đủ, chưa hợp lệ thì trong thời gian tối đa 03 ngày, cơ quan tiếp nhận, xử lý hồ sơ phải thông báo và hướng dẫn người nộp hồ sơ bổ sung, hoàn chỉnh hồ sơ theo quy định.\nTrường hợp người sử dụng đất có nhu cầu chuyển mục đích sử dụng đất kết hợp với đăng ký biến động về các nội dung của thủ tục này thì thực hiện thủ tục này đồng thời với thủ tục chuyển mục đích sử dụng đất.\nb) Cơ quan tiếp nhận hồ sơ ghi đầy đủ thông tin vào Sổ tiếp nhận hồ sơ và trả kết quả, trao Phiếu tiếp nhận hồ sơ và trả kết quả cho người nộp hồ sơ.\nTrường hợp nộp hồ sơ tại Ủy ban nhân dân cấp xã thì trong thời hạn 03 ngày làm việc kể từ ngày nhận đủ hồ sơ, Ủy ban nhân dân cấp xã phải chuyển hồ sơ đến Văn phòng đăng ký quyền sử dụng đất.\nc) Văn phòng đăng ký quyền sử dụng đất có trách nhiệm kiểm tra hồ sơ, nếu đủ điều kiện thực hiện các quyền theo quy định thì thực hiện các công việc sau đây:\n- Trích đo địa chính thửa đất đối với trường hợp có thay đổi về diện tích thửa đất, tài sản gắn liền với đất hoặc trường hợp đã cấp Giấy chứng nhận nhưng chưa có bản đồ địa chính, chưa trích đo địa chính thửa đất;\n- Trường hợp đăng ký thay đổi diện tích xây dựng, diện tích sử dụng, tầng cao, kết cấu, cấp (hạng) nhà hoặc công trình xây dựng mà không phù hợp với giấy phép xây dựng hoặc không có giấy phép xây dựng đối với trường hợp phải xin phép thì gửi phiếu lấy ý kiến của cơ quan quản lý, cấp phép xây dựng theo quy định của pháp luật về xây dựng;\n- Gửi thông tin địa chính cho cơ quan thuế để xác định và thông báo thu nghĩa vụ tài chính đối với trường hợp phải nộp tiền sử dụng đất, tiền thuê đất theo quy định của pháp luật;\n- Xác nhận thay đổi vào Giấy chứng nhận đã cấp hoặc lập hồ sơ trình cơ quan có thẩm quyền cấp Giấy chứng nhận quyền sử dụng đất, quyền sở hữu nhà ở và tài sản khác gắn liền với đất đối với trường hợp phải cấp lại Giấy chứng nhận theo quy định của Bộ Tài nguyên và Môi trường; thông báo cho người sử dụng đất ký hoặc ký lại hợp đồng thuê đất với cơ quan tài nguyên và môi trường đối với trường hợp phải thuê đất;\n- Chỉnh lý, cập nhật biến động vào hồ sơ địa chính, cơ sở dữ liệu đất đai.\nd) Văn phòng đăng ký quyền sử dụng đất trao Giấy chứng nhận cho người được cấp hoặc gửi Ủy ban nhân dân cấp xã để trao đối với trường hợp nộp hồ sơ tại cấp xã.\nThực hiện thủ tục trên môi trường điện tử:\nCơ quan tiếp nhận, giải quyết hồ sơ có trách nhiệm thực hiện các trình tự, thủ tục hành chính về đất đai theo quy định của pháp luật về đất đai; trường hợp cần phải kiểm tra, xác minh làm rõ hoặc do nguyên nhân khác mà không trả kết quả giải quyết hồ sơ theo đúng quy định về thời gian giải quyết thủ tục hành chính về đất đai thì cơ quan tiếp nhận hồ sơ, giải quyết thủ tục gửi thông báo bằng văn bản hoặc qua Cổng dịch vụ công hoặc qua tin nhắn SMS cho người yêu cầu, trong đó nêu rõ lý do.\nNgười sử dụng đất, chủ sở hữu tài sản gắn liền với đất có trách nhiệm hoàn thành nghĩa vụ tài chính theo quy định của pháp luật bằng hình thức trực tiếp hoặc trực tuyến thông qua chức năng thanh toán của Cổng dịch vụ công.\nCơ quan tiếp nhận hoặc cơ quan giải quyết hồ sơ thông báo cho người yêu cầu thực hiện thủ tục hành chính nộp bản chính Giấy chứng nhận đã cấp, các giấy tờ theo quy định sau khi người sử dụng đất hoàn thành nghĩa vụ tài chính.\nViệc trả kết quả giải quyết thủ tục hành chính được thực hiện tại cơ quan tiếp nhận hồ sơ hoặc qua dịch vụ bưu chính công ích hoặc tại địa điểm theo yêu cầu đối với trường hợp tiếp nhận hồ sơ và trả kết quả giải quyết thủ tục đăng ký đất đai, tài sản khác gắn liền với đất.\nCách thức thực hiện:\n|Hình thức nộp|Thời hạn giải quyết|Phí, lệ phí|Mô tả|\n|--|--|--|-|\n|Trực tiếp|10 Ngày làm việc|Lệ phí : Đồng Thực hiện theo quy định của Luật Phí, lệ phí.|Cách thức thực hiện: Người sử dụng đất nộp hồ sơ tại Văn phòng đăng ký quyền sử dụng đất thuộc Phòng Tài nguyên và Môi trường hoặc cơ quan tiếp nhận hồ sơ theo quy định của Ủy ban nhân dân cấp tỉnh. Hộ gia đình, cá nhân, cộng đồng dân cư nộp hồ sơ tại Ủy ban nhân dân cấp xã nếu có nhu cầu. Thời hạn giải quyết: Do Ủy ban nhân dân cấp tỉnh quy định nhưng không quá 10 ngày kể từ ngày nhận được hồ sơ hợp lệ. Thời gian này không tính thời gian các ngày nghỉ, ngày lễ theo quy định của pháp luật; không tính thời gian tiếp nhận hồ sơ tại xã, thời gian thực hiện nghĩa vụ tài chính của người sử dụng đất; không tính thời gian xem xét xử lý đối với trường hợp sử dụng đất có vi phạm pháp luật, thời gian trưng cầu giám định. Đối với các xã miền núi, hải đảo, vùng sâu, vùng xa, vùng có điều kiện kinh tế - xã hội khó khăn, vùng có điều kiện kinh tế - xã hội đặc biệt khó khăn thì thời gian thực hiện được tăng thêm 10 ngày. Kết quả giải quyết thủ tục hành chính phải trả cho người sử dụng đất, chủ sở hữu tài sản gắn liền với đất trong thời hạn không quá 03 ngày làm việc kể từ ngày có kết quả giải quyết.|\n\nThành phần hồ sơ:\n\n(*) Trường hợp xác nhận thay đổi thông tin về số Giấy chứng minh nhân dân, số thẻ Căn cước công dân, địa chỉ trên Giấy chứng nhận đã cấp theo nhu cầu của người sử dụng đất, chủ sở hữu tài sản gắn liền với đất, gồm có:\n|Tên giấy tờ|Mẫu đơn, tờ khai|Số lượng|\n|--|--|-|\n|a) Đơn đăng ký biến động đất đai, tài sản gắn liền với đất theo Mẫu số 09/ĐK;|<a href=""https://csdl.dichvucong.gov.vn/web/jsp/download_file.jsp?ma=\'3fca097995cb2bac\'"">mau so 09.doc</a>|Bản chính: 1Bản sao: 0|\n|b) Bản gốc Giấy chứng nhận đã cấp;||Bản chính: 1Bản sao: 0|\n|c) Bản sao Giấy CMND/thẻ căn cước công dân/số định danh cá nhân, hộ chiếu mới hoặc Giấy chứng minh quân đội mới hoặc thẻ Căn cước công dân mới hoặc sổ hộ khẩu, giấy tờ khác chứng minh thay đổi nhân thân đối với trường hợp thay đổi thông tin về nhân thân của người có tên trên Giấy chứng nhận; Trường hợp dữ liệu quốc gia về dân cư được chia sẻ và kết nối với dữ liệu của các ngành, các lĩnh vực (trong đó có lĩnh vực đất đai) thì cơ quan tiếp nhận hồ sơ sử dụng dữ liệu từ cơ sở dữ liệu quốc gia về dân cư mà không yêu cầu người nộp hồ sơ phải nộp bản sao CMND/thẻ căn cước công dân/số định danh cá nhân, hộ chiếu hoặc Giấy chứng minh quân đội hoặc sổ hộ khẩu hoặc giấy tờ khác để chứng minh nhân thân.||Bản chính: 0Bản sao: 1|\n\n\n(*) Trường hợp đăng ký biến động về sử dụng đất, tài sản gắn liền với đất do người sử dụng đất, chủ sở hữu tài sản gắn liền với đất được đổi tên; giảm diện tích thửa đất do sạt lở tự nhiên; thay đổi về hạn chế quyền sử dụng đất; thay đổi về nghĩa vụ tài chính; thay đổi về tài sản gắn liền với đất so với nội dung đã đăng ký, cấp Giấy chứng nhận gồm có:\n|Tên giấy tờ|Mẫu đơn, tờ khai|Số lượng|\n|--|--|-|\n|1. Đơn đăng ký biến động đất đai, tài sản gắn liền với đất theo Mẫu số 09/ĐK;|<a href=""https://csdl.dichvucong.gov.vn/web/jsp/download_file.jsp?ma=\'3fe7518ba157a40a\'"">mau so 09.doc</a>|Bản chính: 1Bản sao: 0|\n|2. Bản gốc Giấy chứng nhậnđã cấp;||Bản chính: 1Bản sao: 0|\n|3. Một trong các giấy tờ liên quan đến nội dung biến động:||Bản chính: Bản sao:|\n|- Văn bản công nhận của cơ quan nhà nước có thẩm quyền theo quy định của pháp luật đối với trường hợp cá nhân hoặc người đại diện hộ gia đình thay đổi họ, tên;||Bản chính: 1Bản sao: 0|\n|- Văn bản thỏa thuận của cộng đồng dân cư được Ủy ban nhân dân cấp xã xác nhận đối với trường hợp cộng đồng dân cư đổi tên;||Bản chính: 1Bản sao: 0|\n|- Văn bản xác nhận của Ủy ban nhân dân cấp xã về tình trạng sạt lở tự nhiên đối với trường hợp giảm diện tích thửa đất, tài sản gắn liền với đất do sạt lở tự nhiên;||Bản chính: 1Bản sao: 0|\n|- Chứng từ về việc nộp nghĩa vụ tài chính đối với trường hợp Giấy chứng nhận đã cấp có ghi nợ hoặc chậm nộp nghĩa vụ tài chính, trừ trường hợp người sử dụng đất được miễn giảm hoặc không phải nộp do thay đổi quy định của pháp luật;||Bản chính: 1Bản sao: 0|\n|- Quyết định của cơ quan nhà nước có thẩm quyền về việc thay đổi hạn chế về quyềnsử dụng đất, quyền sở hữu tài sản gắn liền với đất ghi trên Giấy chứng nhận đối với trường hợp có hạn chế theo quyết định giao đất, cho thuê đất, công nhận quyền sử dụng đất; trường hợp có thay đổi hạn chế theo văn bản chuyển quyền sử dụng đất thì phải có văn bản chấp thuận thay đổi hạn chế của người có quyền lợi liên quan, được Ủy ban nhân dân cấp xã xác nhận;||Bản chính: 1Bản sao: 0|\n|- Bản sao một trong các giấy tờ về quyền sở hữu tài sản gắn liền với đất thể hiện nội dung thay đổi đối với trường hợp thay đổi thông tin về tài sản gắn liền với đất đã ghi trên Giấy chứng nhận.||Bản chính: 0Bản sao: 1|\n|- Văn bản thỏa thuận của hộ gia đình được Ủy ban nhân dân cấp xã xác nhận đối với trường hợp thay đổi người đại diện là thành viên trong hộ gia đình mà không phải là chủ hộ; trường hợp thay đổi người đại diện hộ gia đình là chủ hộ thì cơ quan giải quyết thủ tục có trách nhiệm khai thác, sử dụng thông tin trong Cơ sở dữ liệu quốc gia về dân cư theo quy định tại Điều 14 Nghị định số 104/2022/NĐ-CP ngày 21 tháng 12 năm 2022 của Chính phủ sửa đổi, bổ sung một số điều của các nghị định liên quan đến việc nộp, xuất trình sổ hộ khẩu, sổ tạm trú giấy khi thực hiện thủ tục hành chính, cung cấp dịch vụ công.||Bản chính: 1Bản sao: 0|']",Cục An toàn thông tin,Tôi không biết trả lời câu hỏi này.,0.0,0.0,0.0,0.0
